show_id,type,title,director,cast,country,date_added,release_year,rating,duration,listed_in,description
s3035,TV Show,Giri / Haji,,"Takehiro Hira, Kelly Macdonald, Yosuke Kubozuka, Will Sharpe, Aoi Okuyama, Masahiro Motoki, Yuko Nakamura, Mitsuko Oka, Anna Sawai, Charlie Creed-Miles",United Kingdom,"January 10, 2020",2019,TV-MA,1 Season,"British TV Shows, Crime TV Shows, International TV Shows",Family duty sends a lawman to London to look for his mob-assassin brother as a yakuza war threatens to engulf Tokyo. Trust is even tougher to find.
s3046,TV Show,Dracula,,"Claes Bang, Dolly Wells, John Heffernan",United Kingdom,"January 4, 2020",2020,TV-14,1 Season,"British TV Shows, International TV Shows, TV Dramas",The Count Dracula legend transforms with new tales that flesh out the vampire's gory crimes – and bring his vulnerability into the light.
s3295,TV Show,Greatest Events of WWII in Colour,,,United Kingdom,"November 8, 2019",2019,TV-14,1 Season,"British TV Shows, Docuseries, International TV Shows","From the attack on Pearl Harbor to D-Day, the most pivotal events of World War II come to life in this vivid docuseries featuring colorized footage."
s3307,TV Show,The End of the F***ing World,,"Jessica Barden, Alex Lawther, Steve Oram, Christine Bottomley, Navin Chowdhry, Wunmi Mosaku, Gemma Whelan, Jonathan Aris, Eileen Davies",United Kingdom,"November 5, 2019",2019,TV-MA,2 Seasons,"British TV Shows, International TV Shows, TV Comedies",A budding teen psychopath and a rebel hungry for adventure embark on a star-crossed road trip in this darkly comic series based on a graphic novel.
s3311,TV Show,Meet the Adebanjos,,"Wale Ojo, Yetunde Oduwole, Andrea Aboagye, Daniel Davids, Moji Bamtefa, Jordan Coulson",United Kingdom,"November 4, 2019",2016,TV-PG,3 Seasons,"British TV Shows, International TV Shows, TV Comedies","In South London, tradition clashes with culture as a Nigerian father tries to instill his old-fashioned African values into his modern British family."
s3401,TV Show,Interior Design Masters,,,United Kingdom,"October 18, 2019",2019,TV-PG,1 Season,"British TV Shows, International TV Shows, Reality TV",Aspiring interior designers transform a variety of spaces from dowdy to delightful as they vie for a life-changing contract with a top London hotel.
s3402,TV Show,Little Baby Bum: Nursery Rhyme Friends,,"Chloe Marsden, Aaron Marsden, María Esnoz",United Kingdom,"October 18, 2019",2019,TV-Y,2 Seasons,"British TV Shows, Kids' TV","Twinkle, Mia, Jacus and the rest of the Nursery Rhyme Friends perform catchy tunes for the little ones."
s3450,TV Show,Creeped Out,,"Victoria Diamond, William Romain, Sydney Wade, Jennifer James, Daniel Ryan, Robert Styles, Rhys Gannon, Maeve Larkin, Margaret Jackman, Katie Proctor, Jonathan Blake, Maximus Evans, Anya Lawrence, Tiffany Elefano, Diya Kittur, Berkley Silverman, Malen Clarkson, Jason Done, Rosina Carbone, Boris Burnell Anderson, Macey Howarth, Rebecca Hanssen, William Haresceugh, Chris Jack, Zita Sattar, Acushla-Tara Kupe, Tillie Amartey, Isabella Pinto, Bella Band, Lola Ogunyemi, Elizabeth Bower, Gianluca Gallucci, Jacob Henshaw, Amelia Curtis, Romy Weltman, Justin Paul Kelly, Jordan Poole, Thamela Mpumlwana, Jake Sim, Leah Choudhry, Daniel Ogbeide-John, Emma Gregory, Rachel Leskovac, Andonis Anthony, Kyle Breitkopf, Julian Richings, Kathryn Emily Douglas","United Kingdom, Canada","October 4, 2019",2019,TV-PG,2 Seasons,"British TV Shows, Kids' TV, TV Thrillers","A masked figure known as ""The Curious"" collects tales of dark magic, otherworldly encounters and twisted technology in this kids anthology series."
s3453,TV Show,Peaky Blinders,,"Cillian Murphy, Sam Neill, Helen McCrory, Paul Anderson, Iddo Goldberg, Annabelle Wallis, Sophie Rundle, Tom Hardy, Joe Cole, Ned Dennehy, Andy Nyman, Charlie Creed-Miles, Charlotte Riley, David Dawson, Jeffrey Postlethwaite, Matthew Postlethwaite, Ian Peck, Tony Pitts, Aidan Gillen, Adrien Brody, Charlie Murphy, Aimee-Ffion Edwards",United Kingdom,"October 4, 2019",2019,TV-MA,5 Seasons,"British TV Shows, Crime TV Shows, International TV Shows","A notorious gang in 1919 Birmingham, England, is led by the fierce Tommy Shelby, a crime boss set on moving up in the world no matter the cost."
s3503,TV Show,Criminal: Germany,,"Eva Meckbach, Sylvester Groth, Florence Kasumba, Peter Kurth, Christian Berkel, Nina Hoss, Christian Kuchenbuch, Jonathan Berlin, Deniz Arora",Germany,"September 20, 2019",2019,TV-MA,1 Season,"British TV Shows, Crime TV Shows, International TV Shows","In the interview room, detectives go head-to-head with suspects and try to get to the truth – even if it means breaking the rules and risking it all."
s3504,TV Show,Criminal: Spain,Mariano Barroso,"Emma Suárez, Jorge Bosch, Álvaro Cervantes, Carmen Machi, Inma Cuesta, Eduard Fernández, María Morales, José Ángel Egido, Daniel Chamorro, Javi Coll, Carlos Manuel Díaz, Nuria Mencía, Milo Taboada",Spain,"September 20, 2019",2019,TV-MA,1 Season,"British TV Shows, Crime TV Shows, International TV Shows","Psychological games abound between detectives and suspects in a tense interrogation room, where the search for answers sometimes comes at a moral cost."
s3525,TV Show,Top Boy,,"Ashley Walters, Kane Robinson, Micheal Ward, Shone Romulus, Simbiatu Ajikawo, Lisa Dwan, David Omoregie, Jasmine Jobson, Hope Ikpoku Jr., Araloyin Oshunremi, Keiyon Cook",,"September 13, 2019",2019,TV-MA,1 Season,"British TV Shows, Crime TV Shows, International TV Shows","Two seasoned drug dealers return to the gritty streets of London, but their pursuit of money and power is threatened by a young and ruthless hustler."
s3544,TV Show,Serial Killer with Piers Morgan,,Piers Morgan,United Kingdom,"September 1, 2019",2018,TV-14,1 Season,"British TV Shows, Crime TV Shows, Docuseries","Through intense prison interviews, Piers Morgan revisits the crimes of three convicted serial killers and learns more about their motives."
s3547,TV Show,Luo Bao Bei,,"Hana Burnett, Natalia-Jade Jonathan, Leo Tang, Gok Wan, Ching-He Huang, Pik Sen Lim, David Yip","China, United Kingdom","August 31, 2019",2018,TV-Y,1 Season,"British TV Shows, Kids' TV","A bright and spirited seven-year-old girl uses her vivid, dreamlike imagination to navigate everyday adventures alongside her real and imaginary BFFs."
s3559,TV Show,Million Pound Menu,,,United Kingdom,"August 27, 2019",2019,TV-MA,2 Seasons,"British TV Shows, International TV Shows, Reality TV",Next-gen restaurateurs get the chance to open their own pop-up eateries to impress the paying public – and a panel of discerning U.K. investors.
s3643,TV Show,Another Life,,"Katee Sackhoff, Justin Chatwin, Samuel Anderson, Blu Hunt, AJ Rivera, Jake Abel, Alex Ozerov, Alexander Eling, Lina Renna, Selma Blair",United States,"July 25, 2019",2019,TV-MA,1 Season,"British TV Shows, International TV Shows, TV Action & Adventure","After a massive alien artifact lands on Earth, Niko Breckinridge leads an interstellar mission to track down its source and make first contact."
s3681,TV Show,Free Rein,,"Jaylen Barron, Manpreet Bambra, Celine Buckens, Freddy Carter, Caroline Ford, Natalie Gumede, Bruce Herbelin-Earle, Noah Huntley, Kerry Ingram, Paul Luebke, Geoffrey McGivern, Navia Ziraili Robinson, Milo Twomey, Carla Woodcock",United States,"July 6, 2019",2019,TV-G,3 Seasons,"British TV Shows, Kids' TV, TV Dramas","A 15-year-old from LA spends the summer at her mom's childhood home on an island off the coast of England, where she bonds with a mysterious horse."
s3751,TV Show,Leila,,"Huma Qureshi, Siddharth, Rahul Khanna, Arif Zakaria, Seema Biswas, Sanjay Suri, Akash Khurana, Ashwath Bhatt, Anupam Bhattacharya, Adarsh Gourav",India,"June 14, 2019",2019,TV-MA,1 Season,"British TV Shows, International TV Shows, TV Dramas","In a near-future world where an oppressive regime segregates society, one woman skirts the system to search for the daughter taken from her years ago."
s3775,TV Show,Black Mirror,,"Jesse Plemons, Cristin Milioti, Jimmi Simpson, Rosemarie DeWitt, Douglas Hodge, Andrea Riseborough, Brenna Harding, Owen Teague, Andrew Gower, Kiran Sonia Sawar, Georgina Campbell, Joe Cole, Maxine Peake, Jake Davies, Clint Dyer, Letitia Wright, Babs Olusanmokun, Bryce Dallas Howard, Alice Eve, Michael Kelly, Cherry Jones, Gugu Mbatha-Raw, Mackenzie Davis, Wyatt Russell, Benedict Wong, Kelly Macdonald, Faye Marsay, Madeline Brewer, Hannah John-Kamen, Malachi Kirby, Alex Lawther, Jerome Flynn, James Norton, Rory Kinnear, Lindsay Duncan, Daniel Kaluuya, Jessica Brown Findlay, Rupert Everett, Toby Kebbell, Jodie Whittaker, Hayley Atwell, Domhnall Gleeson, Lenora Crichlow, Michael Smiley, Daniel Rigby, Chloe Pirrie, Jason Flemyng, Jon Hamm, Oona Chaplin, Rafe Spall",United Kingdom,"June 5, 2019",2019,TV-MA,5 Seasons,"British TV Shows, International TV Shows, TV Dramas","This sci-fi anthology series explores a twisted, high-tech near-future where humanity's greatest innovations and darkest instincts collide."
s3818,TV Show,White Gold,,"Ed Westwick, James Buckley, Joe Thomas, Lauren O'Rourke, Linzey Cocker, Nigel Lindsay, Lloyd Hutchinson, Lee Ross",United Kingdom,"May 17, 2019",2019,TV-MA,2 Seasons,"British TV Shows, International TV Shows, TV Comedies","In 1980s Essex, cocky salesman Vincent Swan and his unscrupulous team will do anything to get the sale – including throwing honesty out the window."
s3822,TV Show,Dennis and Gnasher Unleashed,,"Freddie Fox, Kathryn Drysdale, Rasmus Hardiker, Joanna Ruiz, Ryan Sampson, Kelly Marie Stewart",United Kingdom,"May 15, 2019",2017,TV-Y,1 Season,"British TV Shows, Kids' TV, TV Comedies","Fearless Dennis, his loyal dog Gnasher and best friends Rubi, JJ and Pieface quench their thirst for adventure by wreaking havoc all over Beanotown."
s3937,TV Show,Derek,,"Ricky Gervais, Kerry Godliman, Karl Pilkington, David Earl, Kay Noone, Tim Barlow, Arthur Nightingale, Sheila Collings, Margaret Towner, Barry Martin, Prem Modgil, Blanche Williams, Ninette Finch, Brett Goldstein, Ruth Bratt, Holli Dempsey",United Kingdom,"April 5, 2019",2015,TV-MA,3 Seasons,"British TV Shows, International TV Shows, TV Comedies",Ricky Gervais created and stars in this heartwarming comedy-drama series as a loyal English nursing home caretaker who sees only the good in everyone.
s3962,TV Show,Pablo,,"Jake Williamson, Rachael Dickson, Sumita Majumdar, Michael White, Tony Finnegan, Scott Mulligan, Rosie King",United Kingdom,"March 30, 2019",2017,TV-Y,1 Season,"British TV Shows, Kids' TV","Equipped with crayons and his creativity, a boy with autism draws an imaginary world where his animal pals help him tackle real-life situations."
s3970,TV Show,Traitors,,"Emma Appleton, Michael Stuhlbarg, Luke Treadaway, Keeley Hawes, Brandon P. Bell, Matt Lauria, Jamie Blackley, David Hargreaves, Sam Hoare, Simon Kunz, Greg McHugh, Stephen Campbell Moore, Cara Horgan",United Kingdom,"March 29, 2019",2019,TV-MA,1 Season,"British TV Shows, International TV Shows, TV Dramas","As World War II ends, a young English woman agrees to help an enigmatic American agent root out Russian infiltration of the British government."
s4015,TV Show,Robozuna,,"Taylor Clarke-Hill, Tom Clarke-Hill, Larissa Murray, Brianna Price, Michael Obiora, Morwenna Banks, Rufus Jones, Duncan Wisbey, Danny John-Jules, Ali A",United Kingdom,"March 15, 2019",2018,TV-Y7,2 Seasons,"British TV Shows, Kids' TV",A boy and his homemade robot enter the toughest competition in the universe while attempting to free their oppressed home from an evil empire.
s4017,TV Show,Turn Up Charlie,,"Idris Elba, Piper Perabo, JJ Feild, Frankie Hervey, Guz Khan",United Kingdom,"March 15, 2019",2019,TV-MA,1 Season,"British TV Shows, International TV Shows, TV Comedies",A down-and-out DJ plots to rebuild his music career while working as a nanny for his famous best friend's wild 11-year-old daughter.
s4090,TV Show,The Big Family Cooking Showdown,,"Zoe Ball, Nadiya Hussain, Giorgio Locatelli, Rosemary Shrager",United Kingdom,"February 22, 2019",2018,TV-PG,2 Seasons,"British TV Shows, International TV Shows, Reality TV","In this unscripted series, families passionate about food serve up their most delicious dishes for the chance to be crowned Britain's best home cooks."
s4130,TV Show,Safe,,"Michael C. Hall, Amanda Abbington, Marc Warren, Hannah Arterton, Audrey Fleurot, Nigel Lindsay",United Kingdom,"February 5, 2019",2018,TV-MA,1 Season,"British TV Shows, Crime TV Shows, International TV Shows","After his teenage daughter goes missing, a widowed surgeon in an affluent neighborhood begins unearthing dark secrets about the people closest to him."
s4167,TV Show,Black Earth Rising,,"Michaela Coel, John Goodman, Abena Ayivor, Noma Dumezweni, Ronald Guttman, Danny Sapani, Harriet Walter, Tyrone Huggins, Emmanuel Imani, Lucian Msamati, Tamara Tunie",United Kingdom,"January 25, 2019",2018,TV-MA,1 Season,"British TV Shows, International TV Shows, TV Dramas","Adopted by a human rights attorney after the Rwandan genocide, legal investigator Kate Ashby confronts her past when she takes on war crimes cases."
s4184,TV Show,The World's Most Extraordinary Homes,,"Piers Taylor, Caroline Quentin",United Kingdom,"January 18, 2019",2019,TV-G,3 Seasons,"British TV Shows, Docuseries, International TV Shows",Award-winning architect Piers Taylor and actress/property enthusiast Caroline Quentin travel the world to tour unconventional homes in extreme places.
s4203,TV Show,Horrid Henry,,"Lizzie Waterworth, Joanna Ruiz, Emma Tate, Sue Elliot Nicholls, Tamsin Heatley, Wayne Forester, Aidan Cook, Stephanie Anne Mills, David Holt",United Kingdom,"January 11, 2019",2019,TV-Y7,2 Seasons,"British TV Shows, Kids' TV, TV Comedies","To his family's frustration, Henry is skilled at making trouble, from babysitting pets in his bedroom to starting a shark panic at the swimming pool."
s4263,TV Show,Watership Down,Noam Murro,"James McAvoy, Nicholas Hoult, John Boyega, Ben Kingsley, Tom Wilkinson, Gemma Arterton, Peter Capaldi, Olivia Colman, Mackenzie Crook, Anne-Marie Duff, Taron Egerton, James Faulkner, Freddie Fox, Lee Ingleby, Miles Jupp, Daniel Kaluuya, Rory Kinnear, Craig Parkinson, Rosamund Pike, Daniel Rigby, Jason Watkins","United Kingdom, Ireland, United States","December 23, 2018",2018,TV-PG,1 Season,"British TV Shows, International TV Shows, TV Action & Adventure",A warren of rabbits battles many threats on their daring journey to find a new home in this adaptation of the classic novel by Richard Adams.
s4265,TV Show,People Just Do Nothing,,"Allan Mustafa, Hugo Chegwin, Asim Chaudhry, Lily Brazier, Olivia Jasmine Edwards, Dan Sylvester, Steve Stamp, Ruth Bratt, George Keywood, Maria Louis",United Kingdom,"December 22, 2018",2018,TV-MA,5 Seasons,"British TV Shows, TV Comedies",Spinning old-school beats is just another day at the office for the naive DJs of a pirate radio station who juggle family life with their passion.
s4297,TV Show,Flowers,,"Olivia Colman, Julian Barratt, Daniel Rigby, Sophia Di Martino, Leila Hoffman, Will Sharpe, Harriet Walter",United Kingdom,"December 15, 2018",2018,TV-MA,2 Seasons,"British TV Shows, International TV Shows, TV Comedies","Between a troubled marriage, a senile granny and twin siblings constantly in rivalry, a crumbling household struggles to barely keep it together."
s4306,TV Show,Inside the Real Narcos,,Jason Fox,,"December 14, 2018",2018,TV-MA,1 Season,"British TV Shows, Crime TV Shows, Docuseries","Exposing a rarely seen perspective on the drug wars, ex-Special Forces commando Jason Fox interviews dangerous traffickers and cartel members."
s4368,TV Show,Sick Note,,"Rupert Grint, Nick Frost, Don Johnson, Lindsay Lohan, Pippa Bennett-Warner, Marama Corlett, Karl Theobald, Belinda Stewart-Wilson, Camilla Beeput, Dustin Demri-Burns, Tolu Ogunmefun",United Kingdom,"November 23, 2018",2018,TV-MA,2 Seasons,"British TV Shows, International TV Shows, TV Comedies","After slacker Daniel Glass is misdiagnosed with cancer, his lies lead him into an absurd web of fraud, blackmail, suspicion and misadventure."
s4462,TV Show,The Great British Baking Show: The Beginnings,,"Paul Hollywood, Mary Berry, Mel Giedroyc, Sue Perkins",,"November 1, 2018",2012,TV-PG,1 Season,"British TV Shows, Reality TV",A dozen amateur bakers amiably compete for the coveted title of Britain's best as they whip up tasty treats for judges Mary Berry and Paul Hollywood.
s4502,TV Show,Wanderlust,,"Toni Collette, Steven Mackintosh, Zawe Ashton, Joe Hurst, Emma D'Arcy, Celeste Dring, William Ash, Royce Pierreson, Jeremy Swift, Anastasia Hille, Isis Hainsworth, Sophie Okonedo",United Kingdom,"October 19, 2018",2018,TV-MA,1 Season,"British TV Shows, International TV Shows, Romantic TV Shows","Unable to revive their fading sex life after many years of marriage, a therapist and her husband decide to start dating other people."
s4509,TV Show,Stunt Science,,,United Kingdom,"October 15, 2018",2018,TV-MA,1 Season,"British TV Shows, International TV Shows, Reality TV","When it comes to daring stunts and outrageous pranks, we often wonder: What were they thinking? This high-octane series tries to find some answers."
s4543,TV Show,Monty Python Best Bits (mostly),,"Hugh Bonneville, Graham Chapman, John Cleese, Terry Gilliam, Eric Idle, Terry Jones, Michael Palin",United Kingdom,"October 2, 2018",2014,TV-MA,1 Season,"British TV Shows, Docuseries, TV Comedies","Prominent comedians pay tribute to Monty Python's best work in this five-part series, along with selected clips of sketches."
s4550,TV Show,Monty Python's Almost the Truth,,"Graham Chapman, Eric Idle, John Cleese, Michael Palin, Terry Gilliam, Terry Jones",United Kingdom,"October 2, 2018",2009,TV-MA,1 Season,"British TV Shows, Docuseries","The legacy of comedy group Monty Python, whose irreverent brand of humor has tickled the ribs of millions, is explored in this documentary."
s4552,TV Show,Monty Python's Flying Circus,,"John Cleese, Graham Chapman, Terry Jones, Eric Idle, Michael Palin, Terry Gilliam",United Kingdom,"October 2, 2018",1974,TV-14,4 Seasons,"British TV Shows, Classic & Cult TV, International TV Shows","The Monty Python players make their mark with a winning mix of wit, ingenuity and brilliant timing – and a penchant for mockery and cross-dressing."
s4554,TV Show,Monty Python's Personal Best,,"John Cleese, Terry Gilliam, Terry Jones, Graham Chapman, Michael Palin, Eric Idle","United States, United Kingdom","October 2, 2018",2005,TV-MA,1 Season,"British TV Shows, TV Comedies",Original members of the iconic Monty Python comedy troupe pick their all-time favorite sketches from their groundbreaking television series.
s4609,TV Show,Three Wives One Husband,,,United Kingdom,"October 1, 2018",2018,TV-14,1 Season,"British TV Shows, International TV Shows, Reality TV","A film crew captures a year in the life of modern polygamist families at Rockland Ranch, a community for fundamentalist Mormons in the Utah desert."
s4690,TV Show,The Innocents,,"Sorcha Groundsell, Percelle Ascott, Guy Pearce, Sam Hazeldine, Nadine Marshall, Jóhannes Haukur Jóhannesson, Laura Birn, Ingunn Beate Øyen, Arthur Hughes, Trond Fausa, Lise Risom Olsen, Philip Wright",United Kingdom,"August 24, 2018",2018,TV-MA,1 Season,"British TV Shows, International TV Shows, Romantic TV Shows",Runaway teen lovers June and Harry find themselves swept up in a dangerous and confusing new world when June begins to display mysterious abilities.
s4759,TV Show,Amazing Interiors,,,United Kingdom,"July 20, 2018",2018,TV-PG,1 Season,"British TV Shows, International TV Shows, Reality TV","Meet eccentric homeowners whose seemingly ordinary spaces are full of surprises, from a backyard roller coaster to an indoor aquarium."
s4778,TV Show,Baby Ballroom,,"Warren Bullock, Jane Bullock",United Kingdom,"July 10, 2018",2018,TV-MA,2 Seasons,"British TV Shows, International TV Shows, Reality TV","Step into the cutthroat world of kids' ballroom dancing, where ambitious instructors, proud parents and pint-sized performers waltz to win."
s4808,TV Show,Churchill’s Secret Agents: The New Recruits,,,United Kingdom,"June 29, 2018",2018,TV-MA,1 Season,"British TV Shows, International TV Shows, Reality TV","In this history-steeped reality series, 14 contestants undergo the same rigorous four-day selection process as Britain's top-secret World War II spies."
s4810,TV Show,Kiss Me First,,"Tallulah Haddon, Simona Brown, Matthew Beard, Matthew Aubrey","United Kingdom, United States","June 29, 2018",2018,TV-MA,1 Season,"British TV Shows, Crime TV Shows, International TV Shows",A lonely young woman hooked on a virtual reality game befriends a party girl who leads her into a world of new thrills and dark secrets.
s4942,TV Show,Troy,,"Louis Hunter, Bella Dayne, Frances O'Connor, David Threlfall, Chloe Pirrie, Tom Weston-Jones, Alfred Enoch, Jonas Armstrong","United Kingdom, South Africa, Australia, United States","April 6, 2018",2018,TV-MA,1 Season,"British TV Shows, International TV Shows, Romantic TV Shows","Searching for the woman promised to him by Aphrodite, herdsman Paris learns his true identity and falls for Helen of Sparta, igniting the Trojan War."
s4952,TV Show,Loaded,,"Jim Howick, Samuel Anderson, Jonny Sweet, Nick Helm, Mary McCormack, Aimee-Ffion Edwards, Lolly Adefope",United Kingdom,"April 1, 2018",2017,TV-MA,1 Season,"British TV Shows, International TV Shows, TV Comedies",Four friends become overnight millionaires after selling their video game start-up. But their newfound status tests their friendship and resolve.
s4958,TV Show,Doctor Foster,,"Suranne Jones, Bertie Carvel, Clare-Hope Ashitey, Cheryl Campbell, Jodie Comer, Victoria Hamilton, Martha Howe-Douglas, Adam James, Thusitha Jayasundera, Sara Stewart, Neil Stuke, Tom Taylor, Robert Pugh, Shazia Nicholls, Cian Barry, Megan Roberts, Charlie Cunniffe, Navin Chowdhry",United Kingdom,"March 31, 2018",2017,TV-MA,2 Seasons,"British TV Shows, International TV Shows, Romantic TV Shows","When she suspects her husband is cheating on her, Dr. Gemma Foster starts an investigation that leads her down a dark path of obsession."
s4969,TV Show,James Acaster: Repertoire,Dan Lucchesi,James Acaster,United Kingdom,"March 27, 2018",2018,TV-14,1 Season,"British TV Shows, International TV Shows, Stand-Up Comedy & Talk Shows","Offbeat comic James Acaster covers the strange, the mundane and everything in between in this collection of four wide-ranging stand-up specials."
s4974,TV Show,Requiem,,"Lydia Wilson, Joel Fry, Brendan Coyle, James Frecheville, Claire Rushbrook, Joanna Scanlan, Pippa Haywood, Tara Fitzgerald, Richard Harrington, Sian Reese-Williams",United Kingdom,"March 23, 2018",2018,TV-MA,1 Season,"British TV Shows, International TV Shows, TV Dramas","In the wake of a sudden tragedy, a London cellist unearths secrets that link her mother to the disappearance of a young girl in a small Welsh town."
s4993,TV Show,Collateral,,"Carey Mulligan, John Simm, Nicola Walker, Billie Piper, Nathaniel Martello-White, Jeany Spark, Hayley Squires, Ben Miles, Saskia Reeves, Ahd","United Kingdom, United States","March 9, 2018",2018,TV-MA,1 Season,"British TV Shows, Crime TV Shows, International TV Shows","Investigating the murder of a pizza delivery man, a London detective uncovers a tangled conspiracy involving drug dealers, smugglers and spies."
s5031,TV Show,Hitler's Circle of Evil,,"Alisdair Simpson, Henrik Jørgensen, James Lowe, Blake Scott, Peter Turnbull",United Kingdom,"February 22, 2018",2017,TV-14,1 Season,"British TV Shows, Docuseries, International TV Shows","Surviving power struggles, betrayals and plots, Hitler's inner circle of Nazi leaders seizes control of Germany and designs its disastrous future."
s5033,TV Show,The Frankenstein Chronicles,,"Sean Bean, Tom Ward, Richie Campbell, Vanessa Kirby, Ed Stoppard, Ryan Sampson, Robbie Gee, Anna Maxwell Martin, Elliot Cowan, Charlie Creed-Miles, Eloise Smyth, Samuel West",United Kingdom,"February 20, 2018",2017,TV-MA,2 Seasons,"British TV Shows, Crime TV Shows, International TV Shows","A detective tracks what seems to be a killer with a taste for dismemberment in 1827 London, but the case leads in a far more terrifying direction."
s5058,TV Show,Retribution,,"Georgina Campbell, Joe Dempsie, Adrian Edmondson, Steve Evets, Laura Fraser, Julie Graham, John Lynch, Gary Lewis, Juliet Stevenson, Joanna Vanderham",United Kingdom,"January 30, 2018",2016,TV-MA,1 Season,"British TV Shows, Crime TV Shows, International TV Shows",A dark web of secrets and lies emerges when a newlywed couple is killed and detectives question their feuding families.
s5098,TV Show,Lovesick,,"Johnny Flynn, Antonia Thomas, Daniel Ings, Hannah Britland, Joshua McGuire, Richard Thomson, Jessica Ellerby",United Kingdom,"January 1, 2018",2018,TV-MA,3 Seasons,"British TV Shows, International TV Shows, Romantic TV Shows","In his quest for true love, Dylan found chlamydia. Joined by friends Evie and Luke, he relives past encounters as he notifies all his former partners."
s5112,TV Show,Myths & Monsters,Daniel Kontur,Nicholas Day,United Kingdom,"December 23, 2017",2017,TV-PG,1 Season,"British TV Shows, Docuseries",This documentary series takes us to the mythic landscapes of Europe to explore some of most enduring legends produced by European culture.
s5150,TV Show,Man Down,,"Greg Davies, Roisin Conaty, Jeany Spark, Gwyneth Powell, Isy Suttie, Michael Wozniak, Elliot Levey, Ruth Bratt, Deirdre Mullins, Steven Berkoff, Stella Gonet, Rik Mayall, Ashley McGuire, Stephanie Cole",United Kingdom,"November 30, 2017",2017,TV-MA,4 Seasons,"British TV Shows, International TV Shows, TV Comedies","A childish idiot trapped in an adult's body, schoolteacher Dan hates his job, hates his girlfriend-less life and has good reason to fear his dad."
