show_id,type,title,director,cast,country,date_added,release_year,rating,duration,listed_in,description
s7354,TV Show,Love Your Garden,,"Alan Titchmarsh, David Domoney, Frances Tophill, Katie Rushworth",United Kingdom,"July 26, 2019",2013,TV-G,1 Season,"British TV Shows, International TV Shows, Reality TV",Famed horticulturist Alan Titchmarsh hosts this uplifting show in which he and his team travel the U.K. planting dream gardens for deserving citizens.
s7419,TV Show,Mary Portas: Secret Shopper,,Mary Portas,United Kingdom,"July 26, 2019",2016,TV-14,1 Season,"British TV Shows, International TV Shows, Reality TV",Retail consultant Mary Portas collaborates with Britain's most complained-about stores to help them better serve fed-up customers.
s7436,TV Show,Mega Food,,,United Kingdom,"July 12, 2019",2013,TV-G,1 Season,"British TV Shows, Docuseries, International TV Shows","Visiting the busiest kitchens in the world, this reality series focuses on large-scale food production – and the people who make it happen."
s7484,TV Show,Money for Nothing,,,,"July 12, 2019",2015,TV-PG,1 Season,"British TV Shows, International TV Shows, Reality TV","Aided by designers and craftspeople, entrepreneur Sarah Moore rescues items bound for the garbage dump and turns them into valuable, unique objects."
s7486,TV Show,Monkey Planet,,George McGavin,United Kingdom,"March 31, 2017",2014,TV-PG,1 Season,"British TV Shows, Docuseries, Science & Nature TV","Join zoologist Dr. George McGavin for a fascinating, up-close look at the habits and behaviors of primates, our closest animal relatives."
s7505,TV Show,Monty Don's French Gardens,Rachel Bell,,United Kingdom,"July 26, 2019",2013,TV-G,1 Season,"British TV Shows, Docuseries, International TV Shows","TV personality Monty Don visits France’s most famous gardens to dig up the influence of power, culture and passion on their conceptions and designs."
s7506,TV Show,Monty Don's Italian Gardens,,Monty Don,United Kingdom,"July 26, 2019",2011,TV-G,1 Season,"British TV Shows, Docuseries, International TV Shows","From horticultural hideaways to luxurious botanical displays, TV personality Monty Don explores the history behind Italy’s most extraordinary gardens."
s7539,TV Show,My Hotter Half,,Melvin Odoom,United Kingdom,"July 22, 2019",2017,TV-PG,1 Season,"British TV Shows, International TV Shows, Reality TV","Couples compete to see who can take the sexiest selfie, with the loser getting a much-needed makeover."
s7548,TV Show,My Tattoo Addiction,,Julian Barratt,United Kingdom,"February 1, 2019",2013,TV-MA,1 Season,"British TV Shows, Docuseries",Ink junkies dig skin deep and share personal stories about their collection of body art.
s7572,TV Show,Nature's Great Events (2009),,David Attenborough,"United States, United Kingdom","October 10, 2015",2009,TV-PG,1 Season,"British TV Shows, Docuseries, Science & Nature TV","This series looks at how seasonal changes cause shifting weather patterns and ocean currents, creating the conditions for spectacular wildlife events."
s7573,TV Show,Nature's Great Events: Diaries,,David Attenborough,"United States, United Kingdom","April 22, 2015",2009,TV-PG,1 Season,"British TV Shows, Docuseries, Science & Nature TV",Look behind the scenes of this wildlife documentary series that examines how animals around the world adapt to chaotic natural phenomena.
s7574,TV Show,Nature's Great Race,,Liz Bonnin,United Kingdom,"October 1, 2017",2016,TV-PG,1 Season,"British TV Shows, Docuseries, Science & Nature TV","Epic footage captures three of the world's most significant land migrations, following elephants, caribou and zebras on their treacherous journeys."
s7575,TV Show,Nature's Weirdest Events,,Chris Packham,United Kingdom," September 1, 2019",2015,TV-PG,3 Seasons,"British TV Shows, Docuseries, Science & Nature TV","Host Chris Packham examines bizarre natural phenomena from around the globe, from strange creatures to geographical oddities."
s7587,TV Show,"Nightmare Tenants, Slum Landlords",,Wendi Peters,," July 12, 2019",2016,TV-MA,2 Seasons,"British TV Shows, International TV Shows, Reality TV",The ongoing housing crisis in Britain has led to an increased number of nasty conflicts between fed-up landlords and exasperated tenants.
s7598,TV Show,North & South,,"Daniela Denby-Ashe, Richard Armitage, Tim Pigott-Smith, Sinéad Cusack, Lesley Manville, Brendan Coyle, Anna Maxwell Martin, Jo Joyner, Pauline Quirke, Kay Lyon",United Kingdom,"March 31, 2017",2004,NR,1 Season,"British TV Shows, Romantic TV Shows, TV Dramas","When her father moves his family to an industrial mill town, the parson's daughter, Margaret Hale, struggles to adapt to her harsh new surroundings."
s7630,TV Show,Nurses Who Kill,,,United Kingdom,"August 1, 2017",2016,TV-14,1 Season,"British TV Shows, Crime TV Shows, Docuseries","Top medical, criminal and psychological experts analyze the motives and methods of nurses who use their positions to kill rather than heal."
s7672,TV Show,Operation Gold Rush,,"Dan Snow, Felicity Ashton, Kevin Fong, Alisdair Simpson",United Kingdom,"February 1, 2019",2016,TV-14,1 Season,"British TV Shows, Reality TV",A team of modern-day adventurers follows the footsteps of the money-hungry explorers who trekked the Klondike in search of Canadian gold.
s7675,TV Show,Operation Ouch!,,"Chris van Tulleken, Xand van Tulleken",United Kingdom,"August 1, 2020",2012,TV-PG,1 Season,"British TV Shows, Kids' TV, TV Comedies",Drs. Chris and Xand van Tulleken take an entertaining approach to educate children about medicine and biology through experiments and hospital visits.
s7748,TV Show,Planet Earth II,,David Attenborough,United Kingdom,"December 25, 2017",2016,TV-G,1 Season,"British TV Shows, Docuseries, Science & Nature TV","In this sequel to the Emmy-winning ""Planet Earth"" series, viewers are treated to rich and intimate views of the natural diversity of our planet."
s7749,TV Show,Planet Earth: The Complete Collection,Alastair Fothergill,David Attenborough,United Kingdom,"April 22, 2015",2006,TV-PG,1 Season,"British TV Shows, Docuseries, International TV Shows",This landmark series transports nature lovers from the Himalayan Mountains to the depths of the ocean and everywhere in between.
s7851,TV Show,Reggie Yates Outside Man,,Reggie Yates,United Kingdom," December 15, 2017",2017,TV-MA,2 Seasons,"British TV Shows, Docuseries, International TV Shows","Award-winning filmmaker Reggie Yates travels around the world tackling big issues such as gun violence, racism, gay rights and addiction."
s7865,TV Show,Revolting Rhymes,"Jani Lachauer, Jakob Schuh","Rob Brydon, Bertie Carvel, Gemma Chan, Dominic West, Isaac Hempstead Wright, Bel Powley, Tamsin Greig, Rose Leslie, David Walliams",United Kingdom,"February 1, 2018",2017,TV-PG,1 Season,"British TV Shows, Kids' TV",Popular fairy tales take on a darkly comic edge in these short animated films based on a book by Roald Dahl and illustrator Quentin Blake.
s7871,TV Show,Ripper Street,,"Matthew Macfadyen, Jerome Flynn, Adam Rothenberg, David Wilmot, MyAnna Buring, David Dawson, Amanda Hale, Charlene McKenna, Jonathan Barnwell, Clive Russell","United Kingdom, Ireland","September 8, 2017",2017,TV-MA,5 Seasons,"British TV Shows, Crime TV Shows, TV Dramas","It's been six months since the last Jack the Ripper killing, and East London is hopeful that his reign of terror might have run its course."
s8003,TV Show,Sherlock,,"Benedict Cumberbatch, Martin Freeman, Una Stubbs, Rupert Graves, Mark Gatiss, Andrew Scott","United Kingdom, United States","May 15, 2017",2017,TV-14,4 Seasons,"British TV Shows, Crime TV Shows, International TV Shows","In this updated take on Sir Arthur Conan Doyle's beloved mystery tales, the eccentric sleuth prowls the streets of modern London in search of clues."
s8130,TV Show,SuperNature: Wild Flyers,,,United Kingdom,"March 1, 2017",2016,TV-PG,1 Season,"British TV Shows, Docuseries, Science & Nature TV",This series examines the aerodynamics of flight and the evolutionary processes that have enabled certain species to survive by taking to the skies.
s8209,TV Show,The Bible's Buried Secrets,,Francesca Stavrakopoulou,United Kingdom,"February 1, 2019",2011,TV-14,1 Season,"British TV Shows, Docuseries, Science & Nature TV","Host Francesca Stavrakopoulou travels across the Middle East, offering extraordinary insights into the stories of the Old Testament."
s8210,TV Show,The Big Catch,,Ben Fogle,United Kingdom,"February 1, 2019",2015,TV-PG,1 Season,"British TV Shows, Reality TV","In a global competition, eight fishing enthusiasts battle extreme conditions and dangerous waters to be crowned the ultimate angler."
s8215,TV Show,The Blue Planet: A Natural History of the Oceans,Alastair Fothergill,David Attenborough,United Kingdom,"October 10, 2015",2001,TV-G,1 Season,"British TV Shows, Docuseries, International TV Shows","David Attenborough narrates this definitive exploration of the marine world, from the familiar to the unknown, revealing the sea and its communities."
s8217,TV Show,The Bomb Squad,,Christopher Eccleston,United Kingdom,"February 1, 2019",2011,TV-MA,1 Season,"British TV Shows, Docuseries",This documentary follows British bomb disposal teams in Afghanistan and the dangers they face in their methodical lives on the front lines of war.
s8251,TV Show,The Code,,Marcus du Sautoy,United Kingdom,"February 1, 2018",2011,TV-PG,1 Season,"British TV Shows, Docuseries, International TV Shows","In this three-part documentary series, host Marcus du Sautoy examines the mathematical code underlying all of life on Earth and the universe itself."
s8294,TV Show,The Fear,Michael Samuels,"Peter Mullan, Anastasia Hille, Harry Lloyd, Paul Nicholls, Demosthenes Chrysan, Dragos Bucur, Shaban Arifi, Julia Ragnarsson, Danny Sapani, Nigel Lindsay, Osy Ikhile, Sidney Kean, Lisa McAllister, Catherine Winter, Amarildo Kola, Julius Peter Wells",United Kingdom,"March 31, 2017",2012,TV-MA,1 Season,"British TV Shows, Crime TV Shows, TV Dramas","Richie Beckett is an aging Brighton crime boss who's struggling with the onset of dementia, just as a rival gang is trying to take over his territory."
s8303,TV Show,The Five,Mark Tonderai,"Tom Cullen, O.T. Fagbenle, Lee Ingleby, Sarah Solemani, Hannah Arterton, Geraldine James, Michael Maloney, Rade Serbedzija, Jonathan Kerrigan, Don Warrington, Sophia La Porta",United Kingdom,"September 15, 2017",2016,TV-MA,1 Season,"British TV Shows, Crime TV Shows, TV Dramas","Twenty years after 5-year-old Jesse disappears near his home, his DNA turns up at the scene of a woman's murder, baffling his family and the police."
s8316,TV Show,The Furchester Hotel,,"Sarah Burgess, Ryan Dillon, Louise Gold, David Rudman, Andrew Spooner, Mak Wilson","United Kingdom, United States"," February 1, 2017",2015,TV-Y,2 Seasons,"British TV Shows, Kids' TV","Elmo hops across the pond to help his extended monster family solve problems at their ""almost"" world-class establishment, the Furchester Hotel."
s8332,TV Show,The Great British Baking Show: Masterclass,,"Mary Berry, Paul Hollywood",United Kingdom,"December 1, 2018",2018,TV-PG,4 Seasons,"British TV Shows, Reality TV",Hosts Mary Berry and Paul Hollywood leave the tent and go into the kitchen to put their professional spin on baking techniques used in the show.
s8335,TV Show,The Great Train Robbery,,"Luke Evans, Jim Broadbent, Paul Anderson, Martin Compston, Neil Maskell, Jack Roth, George Costigan, Robert Glenister, Nick Moran, Tim Pigott-Smith, James Fox, James Wilby, Jack Gordon, Nicholas Murchie, Del Synnott, Richard Hope, John Salthouse",United Kingdom,"March 31, 2017",2013,NR,1 Season,"British TV Shows, Crime TV Shows, International TV Shows","This two-part tale delivers the true story of the Great Train Robbery of 1963, the biggest one in England's history."
s8354,TV Show,The Hunt,,David Attenborough,United Kingdom,"May 14, 2017",2015,TV-PG,1 Season,"British TV Shows, Docuseries, Science & Nature TV","Witness some of the most riveting showdowns in the animal kingdom as cameras capture leopards, polar bears and other predators targeting their prey."
s8358,TV Show,The Inbetweeners,,"Simon Bird, James Buckley, Blake Harrison, Joe Thomas, Greg Davies, Emily Head, Martin Trenaman, Belinda Stewart-Wilson, Robin Weaver, Henry Lloyd-Hughes",United Kingdom," January 1, 2018",2010,TV-MA,3 Seasons,"British TV Shows, TV Comedies",This rib-tickling series follows four English lads as they try – and fail spectacularly – to navigate the wretched no-man's land of adolescence.
s8367,TV Show,The Investigator: A British Crime Story,,"Mark Williams-Thomas, Rick Warden, Frances Millar, Tanya Winsor, Alice Harding, David Bannerman, Danielle Bird, Eve Perry, Polly Lewis, Billy James Machin",United Kingdom,"March 5, 2020",2018,TV-MA,2 Seasons,"British TV Shows, Crime TV Shows, Docuseries","After 40 years of inconclusive evidence, renowned criminologist Mark Williams-Thomas re-examines a string of mysterious murders."
s8412,TV Show,The Making of Frozen Planet,,David Attenborough,"United Kingdom, United States, Spain, Germany, Greece, Canada","January 28, 2016",2012,TV-PG,1 Season,"British TV Shows, Docuseries, Science & Nature TV",Documentary crew members brave Earth's most frigid regions to capture the majesty and mystery found in the chillier side of the animal kingdom.
s8432,TV Show,The Murder Detectives,,,United Kingdom,"March 31, 2017",2015,TV-MA,1 Season,"British TV Shows, Crime TV Shows, Docuseries","This series tracks the ups and downs of an 18-month investigation into the 2014 stabbing murder of teenager Nicholas Robinson in Bristol, England."
s8477,TV Show,The Real Football Factories,,Danny Dyer,United Kingdom,"December 29, 2017",2006,TV-MA,1 Season,"British TV Shows, Docuseries, International TV Shows",Examine the troubling history of football hooliganism and hear from real hooligans about their bitter rivalries and rowdiest brawls.
s8600,TV Show,Toast of London,Michael Cumming,"Matt Berry, Robert Bathurst, Doon Mackichan, Shazad Latif, Tim Downie, Harry Peacock, Tracy Ann Oberman",United Kingdom,"September 1, 2017",2015,TV-MA,3 Seasons,"British TV Shows, Classic & Cult TV, TV Comedies","After a divorce and fatal career move, a classically trained British stage actor navigates single life with his odd roommate and takes on horrid jobs."
s8605,TV Show,Top 10 Secrets and Mysteries,,,"United Kingdom, United States, Czech Republic","March 15, 2019",2018,TV-14,1 Season,"British TV Shows, Docuseries, Science & Nature TV","This series investigates mysteries that persistently elude scientific explanation, such as mythical creatures, UFOs, sacred sites and more."
s8647,TV Show,Twirlywoos,,Linda Bassett,United Kingdom,"May 15, 2020",2018,TV-Y,2 Seasons,"British TV Shows, Kids' TV","The colorful and curious family of Twirlywoos bounces around their boat and visits new places, turning learning into adventures wherever they land."
s8713,TV Show,Weird Wonders of the World,,Chris Packham,United Kingdom," March 31, 2017",2016,TV-PG,2 Seasons,"British TV Shows, Docuseries, Science & Nature TV","From animal oddities and bizarre science to medical marvels, scientists and experts examine some of the world's strangest mysteries and phenomena."
s8741,TV Show,Wild Alaska,,Dougray Scott,United Kingdom,"March 31, 2017",2015,TV-PG,1 Season,"British TV Shows, Docuseries, Science & Nature TV","The natural bounty of Alaska sustains its diverse species through extreme weather conditions in three seasons, each with its rewards and challenges."
s8742,TV Show,Wild Arabia,,Alexander Siddig,United Kingdom,"March 31, 2017",2013,TV-PG,1 Season,"British TV Shows, Docuseries, Science & Nature TV",The widely varied geology and dramatic landscapes in the continental crossroads of Arabia harbors a rich history and an abundance of wildlife.
s8759,TV Show,World's Busiest Cities,,"Anita Rani, Ade Adepitan, Dan Snow",United Kingdom,"February 1, 2019",2017,TV-PG,1 Season,"British TV Shows, Docuseries","From Moscow to Mexico City, three BBC journalists delve into the inner workings of some of the most burgeoning metropolises on Earth."
