show_id,type,title,director,cast,country,date_added,release_year,rating,duration,listed_in,description
s5151,TV Show,Broadchurch,,"David Tennant, Olivia Colman, Andrew Buchan, Jodie Whittaker, Arthur Darvill, Jonathan Bailey, Carolyn Pickles, Adam Wilson, Charlotte Beaumont, Simone McAullay, Tanya Franks, Pauline Quirke, Phoebe Waller-Bridge, Marianne Jean-Baptiste, Charlotte Rampling, Eve Myles, James D'Arcy, Susan Brown, Vicky McClure, Will Mellor, David Bradley",United Kingdom,"November 27, 2017",2017,TV-MA,3 Seasons,"British TV Shows, Crime TV Shows, International TV Shows","After a young boy is murdered in the small seaside town of Broadchurch, local detectives Ellie Miller and Alec Hardy are assigned the mysterious case."
s5207,TV Show,W1A,,"Hugh Bonneville, Monica Dolan, Jessica Hynes, Rufus Jones, Sarah Parish, Nina Sosanya, Jason Watkins, Hugh Skinner, David Westhead, Jonathan Bailey, Ophelia Lovibond, David Tennant",United Kingdom,"October 24, 2017",2017,TV-MA,3 Seasons,"British TV Shows, TV Comedies","The new Head of Values at the BBC deals with redefining the company's purpose, events like the arrival of Prince Charles and issues with new programs."
s5252,TV Show,The Royal House of Windsor,,,United Kingdom,"September 30, 2017",2017,TV-MA,1 Season,"British TV Shows, Docuseries, International TV Shows","Drawing on newly available info, this show traces how the British royal family has survived the last 100 years of power struggles, politics and more."
s5258,TV Show,Paul Hollywood's Big Continental Road Trip,,Paul Hollywood,United Kingdom,"September 29, 2017",2017,TV-14,1 Season,"British TV Shows, Docuseries, International TV Shows","Gear up for a fast-paced journey as celebrity chef and avid auto enthusiast Paul Hollywood takes in the cars and culture of France, Italy and Germany."
s5364,TV Show,The IT Crowd,,"Chris O'Dowd, Richard Ayoade, Katherine Parkinson, Matt Berry",United Kingdom,"August 1, 2017",2013,TV-MA,5 Seasons,"British TV Shows, Classic & Cult TV, International TV Shows","Aided by a tech-illiterate manager, a pair of basement-dwelling dweebs makes the most of life in IT at a corporation run by a cloddish new owner."
s5366,TV Show,Vexed,,"Toby Stephens, Miranda Raison, Lucy Punch, Nick Dunning, Rory Kinnear, Ronny Jhutti, Roger Griffiths, Patrick Baladi",United Kingdom,"August 1, 2017",2012,TV-MA,2 Seasons,"British TV Shows, Crime TV Shows, International TV Shows",Charming slacker DI Jack Armstrong and driven professional DI Kate Bishop try to solve crimes together without driving each other crazy.
s5367,TV Show,World War II in Colour,,Robert Powell,United Kingdom,"August 1, 2017",2009,TV-MA,1 Season,"British TV Shows, Docuseries, International TV Shows",Footage of the most dramatic moments from World War II is restored in color and high definition for this historical documentary series.
s5398,TV Show,Learning Songs by Little Baby Bum: Nursery Rhyme Friends,,"Chloe Marsden, Aaron Marsden, María Esnoz",United Kingdom,"July 1, 2017",2015,TV-Y,1 Season,"British TV Shows, Kids' TV","Simple songs mix with colorful animation to teach youngsters about concepts such as animals, vehicles, numbers, colors and more."
s5445,TV Show,Crashing,,"Phoebe Waller-Bridge, Jonathan Bailey, Adrian Scarborough, Damien Molony, Louise Ford, Julie Dray, Amit Shah",United Kingdom,"June 2, 2017",2016,TV-MA,1 Season,"British TV Shows, International TV Shows, Romantic TV Shows","In exchange for low rent, a hodgepodge group of 20-something tenants set up residence as property guards in a disused hospital, where hilarity ensues."
s5556,TV Show,Hoff the Record,Gordon Anderson,"David Hasselhoff, Asim Chaudhry, Fergus Craig, Mark Quartley, Ella Smith, Brett Goldstein",United Kingdom,"March 31, 2017",2016,TV-MA,2 Seasons,"British TV Shows, TV Comedies","TV star David Hasselhoff hopes to reboot his career in the U.K., but both his comeback plans and his personal life keep going off the rails."
s5559,TV Show,Bottersnikes & Gumbles,,"Jason Callender, Kathryn Drysdale, Akiya Henry, Jeff Rawle, Richard Grieve, Simone Craddock, Alex Babic, Miriam Margolyes","United States, United Kingdom, Australia","March 24, 2017",2017,TV-Y7,2 Seasons,"British TV Shows, Kids' TV",The fun-loving Gumbles bounce and play while staying away from the foul-smelling Bottersnikes who live in a nearby junkyard.
s5663,TV Show,Crazyhead,,"Cara Theobold, Susan Wokoma, Riann Steele, Arinzé Kene, Lewis Reeves, Tony Curran",United Kingdom,"December 16, 2016",2016,TV-MA,1 Season,"British TV Shows, International TV Shows, TV Comedies",Bowling alley worker Amy and nonconformist Raquel kick some serious demon butt while also facing their inner demons as they navigate their early 20s.
s5675,TV Show,Merlin,James Hawes,"Colin Morgan, Bradley James, Katie McGrath, Angel Coulby, Richard Wilson, Anthony Head, John Hurt, Nathaniel Parker",United Kingdom,"December 15, 2016",2012,TV-PG,5 Seasons,"British TV Shows, International TV Shows, TV Action & Adventure","This family-oriented retelling of the King Arthur legend finds Merlin arriving in Camelot, where he hones his magic skills with the help of his uncle."
s5717,TV Show,Paranoid,,"Indira Varma, Robert Glenister, Dino Fetscher, Neil Stuke, Christiane Paul, Lesley Sharp, Kevin Doyle",United Kingdom,"November 17, 2016",2016,TV-MA,1 Season,"British TV Shows, Crime TV Shows, International TV Shows","When a woman is brutally murdered on a playground, a group of detectives find themselves drawn into a dark conspiracy as they search for the killer."
s5724,TV Show,Danger Mouse,,"Alexander Armstrong, Kevin Eldon, Stephen Fry, Ed Gaughan, Shauna Macdonald, Dave Lamb, Morwenna Banks",United Kingdom,"November 9, 2016",2016,TV-Y7,2 Seasons,"British TV Shows, Kids' TV",The world's greatest super-spy returns to save the world with the help of hapless hamster Penfold and a collection of state-of-the-art gadgetry.
s5802,TV Show,Conspiracy,,Mark Bazeley,United Kingdom,"September 1, 2016",2015,TV-14,1 Season,"British TV Shows, Docuseries","Skeptics and others discuss widely held conspiracy theories involving aliens, government cover-ups, secret assassinations and other intrigues."
s5803,TV Show,Dead Set,,"Jaime Winstone, Andy Nyman, Kevin Eldon, Davina McCall, Warren Brown, Riz Ahmed, Beth Cordingly, Kathleen McDermott, Raj Ghatak",United Kingdom,"September 1, 2016",2008,TV-MA,1 Season,"British TV Shows, TV Horror, TV Thrillers","While the housemates in the Big Brother house remain oblivious, fast-moving hordes of the undead decimate the studio compound."
s5807,TV Show,Witches: A Century of Murder,,Suzannah Lipscomb,United Kingdom,"September 1, 2016",2015,TV-14,1 Season,"British TV Shows, Crime TV Shows, Docuseries","Historian Suzannah Lipscomb investigates the witch hunts that plagued Britain in the 17th century, examining common myths about their origin."
s5812,TV Show,Behind Enemy Lines,,,United States,"August 15, 2016",2001,TV-14,1 Season,"British TV Shows, Docuseries","After dire setbacks in 1940, Winston Churchill commissions a new kind of fighting force: commandos trained to use stealth and audacious tactics."
s5813,TV Show,Caught on Camera,,Nick Wallis,United Kingdom,"August 15, 2016",2015,TV-MA,3 Seasons,"British TV Shows, Crime TV Shows, Docuseries","Nick Wallis presents crimes caught on CCTV, cell phones and other devices and reveals how investigators use the recordings to solve tough cases."
s5823,TV Show,Cocaine,,,United Kingdom,"August 1, 2016",2005,TV-14,1 Season,"British TV Shows, Crime TV Shows, Docuseries","Three films chronicle the cocaine trade's sweeping impact on the citizens of Peru, Brazil and Colombia, from poor farmers to powerful drug lords."
s5824,TV Show,Edge of the Universe,,,United Kingdom,"August 1, 2016",2008,TV-G,1 Season,"British TV Shows, Docuseries, Science & Nature TV","Leading astronomers reveal the latest discoveries about death-trap planets, asteroids, comets and other wonders of the cosmos."
s5909,TV Show,Danger Mouse: Classic Collection,,"David Jason, Terry Scott, Edward Kelsey, Brian Trueman",United Kingdom,"June 15, 2015",1992,TV-Y,10 Seasons,"British TV Shows, Kids' TV, TV Comedies","Follow the adventures of superspy Danger Mouse and his bumbling sidekick, Penfold, as they jet around the world foiling their enemies' evil plots."
s5985,TV Show,100% Hotter,,"Daniel Palmer, Melissa Sophia, Karen Williams, Grace Woodward",United Kingdom,"November 1, 2019",2017,TV-14,1 Season,"British TV Shows, International TV Shows, Reality TV","A stylist, a hair designer and a makeup artist team up to give Britain's biggest fashion disasters some much-needed makeunders."
s6027,TV Show,9 Months That Made You,,Demetri Goritsas,United States,"March 1, 2017",2016,TV-PG,1 Season,"British TV Shows, Docuseries, Science & Nature TV","Witness the wonders of human gestation through cutting-edge CGI, and learn how those nine months inside the womb can affect all aspects of one's life."
s6067,TV Show,A Young Doctor's Notebook and Other Stories,,"Daniel Radcliffe, Jon Hamm, Adam Godley, Christopher Godwin, Rosie Cavaliero, Vicki Pepperdine, Margaret Clunie, Tim Steed, Shaun Pye",United Kingdom,,2013,TV-MA,2 Seasons,"British TV Shows, TV Comedies, TV Dramas","Set during the Russian Revolution, this comic miniseries is based on a doctor's memories of his early career working in an out-of-the-way village."
s6095,TV Show,Africa,,David Attenborough,United Kingdom,"April 28, 2016",2013,TV-PG,1 Season,"British TV Shows, Docuseries, International TV Shows","This five-part nature series chronicles fascinating stories of survival on the African continent, home to the most diverse animal life on the planet."
s6101,TV Show,Age Gap Love,,Fay Ripley,United Kingdom,"July 12, 2019",2017,TV-MA,1 Season,"British TV Shows, Reality TV, Romantic TV Shows","Despite the social backlash and challenges that come with intergenerational romance, these couples choose to stick together through thick and thin."
s6106,TV Show,Ainsley Eats the Streets,,Ainsley Harriott,United Kingdom,"July 12, 2019",2014,TV-PG,1 Season,"British TV Shows, Docuseries, International TV Shows",Celebrity chef Ainsley Harriott embarks on a journey around the world to explore the relationship between local street foods and cultural identity.
s6214,TV Show,Bad Education,,"Jack Whitehall, Mathew Horne, Sarah Solemani, Michelle Gomez, Nikki Runeckles, Kae Alexander, Layton Williams, Ethan Lawrence, Charlie Wernham, Jack Binstead, Jack Bence, Harry Enfield",United Kingdom," December 15, 2018",2014,TV-MA,3 Seasons,"British TV Shows, TV Comedies","A history teacher at the posh Abbey Grove, Alfie Wickers is something truly special: He's his school's, if not England's, single worst educator."
s6254,TV Show,Battlefield Recovery,,,United Kingdom,"August 1, 2016",2016,TV-PG,1 Season,"British TV Shows, Docuseries, Reality TV",A four-man team heads to Latvia and Poland to unearth rare World War II artifacts and shed new light on the bloody battles of the Eastern Front.
s6305,TV Show,"Big Dreams, Small Spaces",,Monty Don,United Kingdom," July 26, 2019",2017,TV-G,3 Seasons,"British TV Shows, International TV Shows, Reality TV",Writer and presenter Monty Don helps England's budding horticulturists plant and grow the gardens of their dreams.
s6342,TV Show,Blue Planet II,,David Attenborough,United Kingdom,"December 3, 2018",2017,TV-G,1 Season,"British TV Shows, Docuseries, Science & Nature TV","This sequel to the award-winning nature series ""Blue Planet"" dives beneath Earth's oceans to reveal the dazzling vistas and amazing creatures there."
s6362,TV Show,Borderline,,"David Avery, Jackie Clune, David Elms, Liz Kingsman, Jamie Michie",United Kingdom," December 2, 2017",2017,TV-14,2 Seasons,"British TV Shows, TV Comedies",A team of inept border agents tackles immigration issues at the fictional Northend Airport in this improvised mockumentary series.
s6365,TV Show,Botched Up Bodies,,"Charlie Brooks, Sue Johnston",United Kingdom,"October 2, 2019",2013,TV-MA,1 Season,"British TV Shows, Docuseries, International TV Shows","From lifting saggy skin to repairing shoddy breast enhancements, plastic surgeons tackle extreme fixer-uppers."
s6394,TV Show,Burnistoun,,"Iain Connell, Robert Florence, Kirsty Strain, Richard Rankin, Allan Miller, Louise Stewart",United Kingdom," October 1, 2019",2012,TV-MA,2 Seasons,"British TV Shows, TV Comedies","This sketch series focuses on the eccentric characters in a small Scottish town, including bumbling cops, ""DJ Jesus"" and a disgruntled serial killer."
s6399,TV Show,Cabins in the Wild with Dick Strawbridge,,"Dick Strawbridge, William Hardie",United Kingdom,"September 15, 2018",2017,TV-PG,1 Season,"British TV Shows, International TV Shows, Reality TV","Engineer Dick Strawbridge and craftsman Will Hardie tour eight unique cabins built for a pop-up hotel in Wales, and construct No. 9 on their own."
s6460,TV Show,Chewin' the Fat,,"Ford Kiernan, Greg Hemphill, Karen Dunbar, Mark Cox, Paul Riley",United Kingdom,"October 1, 2016",1999,TV-14,1 Season,"British TV Shows, TV Comedies","Petty criminals, dodgy decorators, full-bore Glaswegians and oddball documentary presenters converge in this sketch show that parodies Scottish life."
s6461,TV Show,Chewing Gum,,"Michaela Coel, John Macmillan, Robert Lonsdale, Danielle Walters, Kadiff Kirwan, Susan Wokoma, Shola Adewusi, Sarah Hoare, Abby Rakic-Platt, Maggie Steed, Olisa Odele",United Kingdom," April 4, 2017",2017,TV-MA,2 Seasons,"British TV Shows, International TV Shows, Romantic TV Shows","The virginal Tracey, who was raised in a strictly religious Tower Hamlets flat, is ready to realize her potential. And the first step is having sex."
s6488,TV Show,City in the Sky,,,United Kingdom,"October 1, 2017",2016,TV-PG,1 Season,"British TV Shows, Docuseries, Science & Nature TV","This series explores the magnitude and scale of modern air travel, and the challenges faced by those responsible for its smooth functioning."
s6491,TV Show,Civilizations,,,United Kingdom,"October 1, 2018",2018,TV-14,1 Season,"British TV Shows, Docuseries","Expanding Kenneth Clark's 1969 ""Civilisation"" series for a new generation, this reboot explores the art of cultures around the world, throughout time."
s6499,TV Show,Click for Murder,,Donal MacIntyre,United Kingdom,"September 17, 2017",2017,TV-14,1 Season,"British TV Shows, Crime TV Shows, Docuseries",Crime journalist Donal MacIntyre reveals how deadly the internet can be as he dissects the technological methods behind heinous acts.
s6550,TV Show,Dad's Army,,"Arthur Lowe, John Le Mesurier, Clive Dunn, John Laurie, Arnold Ridley, Ian Lavender, James Beck, Bill Pertwee",United Kingdom," March 31, 2018",1977,TV-PG,10 Seasons,"British TV Shows, Classic & Cult TV, TV Comedies",This beloved sitcom follows the unlikely heroes of the volunteer British Home Guard as they prepare for German invasion in World War II.
s6561,TV Show,Dangerous Roads,,"Adrian Dunbar, Sue Perkins, Charley Boorman, Rhod Gilbert, Greg Davies, Ben Fogle, Hugh Dennis, Ed Byrne, Andy Parsons, Liza Tarbuck, David Baddiel",United Kingdom," February 1, 2019",2012,TV-MA,2 Seasons,"British TV Shows, Docuseries","Using various 4x4 vehicles, celebrities steer their way across some of the most infamous roads and trickiest terrains on earth."
s6619,TV Show,Diva Brides,,,,"October 2, 2019",2017,TV-MA,1 Season,"British TV Shows, Reality TV","In this reality series, brides-to-be stop at nothing to have their dream weddings despite meager funds, fallouts with friends or even absent grooms."
s6660,TV Show,Earth's Natural Wonders,,Olivia Colman,United Kingdom,"March 1, 2017",2015,TV-PG,1 Season,"British TV Shows, Docuseries, Science & Nature TV",Earth's most sublime landscapes can also be the most forbidding. Discover how inhabitants survive and flourish in our planet's harshest environments.
s6661,TV Show,Earth's Natural Wonders: Life at the Extremes,,Corey Johnson,,"October 1, 2018",2018,TV-14,1 Season,"British TV Shows, Docuseries, Science & Nature TV","From the Arctic to the Outback, humans battle the elements and use their ingenuity to survive in the most extreme environments in the world."
s6696,TV Show,Encounters with Evil,,Richard Lintern,United Kingdom,"July 12, 2019",2016,TV-14,1 Season,"British TV Shows, Crime TV Shows, Docuseries","This documentary series tries to get at the root of some of the most heinous crimes ever committed by deranged, cold-blooded criminals."
s6715,TV Show,Everyday Miracles,,Mark Miodownik,United Kingdom,"August 1, 2017",2014,TV-PG,1 Season,"British TV Shows, Docuseries, International TV Shows",Materials scientist Mark Miodownik takes us into the world of everyday objects that make our lives more comfortable than those of our ancestors.
s6725,TV Show,Extras,,"Ricky Gervais, Stephen Merchant, Ashley Jensen, Shaun Williamson, Shaun Pye","United Kingdom, United States","March 31, 2017",2006,TV-MA,2 Seasons,"British TV Shows, TV Comedies","Grasping hungrily for stardom, bit actor Andy Millman and his pal Maggie spend their days chasing after work as film and TV extras."
s6733,TV Show,Fake or Fortune?,,"Fiona Bruce, Philip Mould, Bendor Grosvenor",United Kingdom,"July 26, 2019",2015,TV-G,1 Season,"British TV Shows, Crime TV Shows, Docuseries",Fiona Bruce and Philip Mould use investigative skills and scientific techniques to determine if paintings are real or just impressive forgeries.
s6743,TV Show,Father Brown,Ian Barber,"Mark Williams, Sorcha Cusack, Nancy Carroll, Alex Price, Hugo Speer, Tom Chambers, Keith Osborn",United Kingdom," March 31, 2018",2017,TV-14,6 Seasons,"British TV Shows, Crime TV Shows, TV Dramas","A modest, compassionate priest doubles as an effective crime solver in this series based on the short stories by G.K. Chesterton."
s6786,TV Show,Forces of Nature,,,United Kingdom,"March 1, 2017",2016,TV-PG,1 Season,"British TV Shows, Docuseries, Science & Nature TV","This dynamic series spans the globe to explain the complex natural forces that govern the planet, from shape and color to motion and the elements."
s6811,TV Show,Frozen Planet,Alastair Fothergill,David Attenborough,"United Kingdom, United States, Spain, Germany, Greece, Canada","January 28, 2016",2011,TV-PG,1 Season,"British TV Shows, Docuseries, International TV Shows",Go on a journey through the Arctic and Antarctic with this visually stunning program that explores these wildernesses and their inhabitants.
s6835,TV Show,Genius of the Ancient World,,Bettany Hughes,United Kingdom,"August 1, 2017",2015,TV-PG,1 Season,"British TV Shows, Docuseries, International TV Shows","Historian Bettany Hughes travels to India, Greece and China to explore the lives and times of Buddha, Socrates and Confucius."
s6836,TV Show,Genius of the Modern World,,Bettany Hughes,United Kingdom,"August 1, 2017",2016,TV-PG,1 Season,"British TV Shows, Docuseries, International TV Shows","Historian Bettany Hughes explores the intellectual landscapes that helped shape the work of Karl Marx, Friedrich Nietzsche and Sigmund Freud."
s6890,TV Show,Grand Designs,,Kevin McCloud,United Kingdom,"August 1, 2019",2017,TV-14,2 Seasons,"British TV Shows, International TV Shows, Reality TV","Host Kevin McCloud presents people who take self-building houses to a new level, following every step of their ambitious plans from beginning to end."
s6895,TV Show,Great Interior Design Challenge,,"Tom Dyckhoff, Daniel Hopwood, Sophie Robinson",United Kingdom," December 1, 2018",2016,TV-PG,2 Seasons,"British TV Shows, International TV Shows, Reality TV","In this reality series, amateur interior designers on tight budgets test their mettle transforming rooms with speed and style."
s6923,TV Show,Happy Valley,,"Sarah Lancashire, Siobhan Finneran, Charlie Murphy, James Norton, George Costigan, Karl Davies, Shane Zaza, Steve Pemberton, Joe Armstrong, Adam Long, Rick Warden, Rhys Connah, Katherine Kelly",United Kingdom," March 16, 2016",2016,TV-MA,2 Seasons,"British TV Shows, Crime TV Shows, International TV Shows","Yorkshire police sergeant Catherine Cawood pursues the man who assaulted her late daughter, unaware he is now part of a secret kidnapping plot."
s6931,TV Show,Harold Shipman - Driven to Kill,,Harold Shipman,United Kingdom,"February 1, 2019",2014,TV-14,1 Season,"British TV Shows, Crime TV Shows, Docuseries","Interviews and dramatic reconstructions illuminate the twisted motivations and brazen crimes of serial killer and respected physician, Harold Shipman."
s6972,TV Show,Hinterland,,"Richard Harrington, Mali Harries, Hannah Daniel, Alex Harries, Aneirin Hughes, Daniel Rochford",United Kingdom,"August 1, 2017",2016,TV-14,3 Seasons,"British TV Shows, Crime TV Shows, International TV Shows","Forsaking London for the rustic landscapes of Wales, a police detective with a troubled soul finds himself in a place with secrets as dark as his own."
s6977,TV Show,History's Greatest Hoaxes,,,Australia,"July 12, 2019",2016,TV-PG,1 Season,"British TV Shows, Docuseries","Using previously unseen footage, this documentary series offers new insights into some of the biggest scams and forgeries in human history."
s6999,TV Show,Horror Homes,,Jill Halfpenny,United Kingdom,"October 2, 2019",2016,TV-14,1 Season,"British TV Shows, Docuseries, International TV Shows","Dream homes turn into property nightmares when mold, maggots, natural disasters and other inconveniences move in."
s7018,TV Show,How to Live Mortgage Free with Sarah Beeny,,,,"September 15, 2018",2018,TV-MA,1 Season,"British TV Shows, International TV Shows, Reality TV",Real estate expert and TV presenter Sarah Beeny meets with clever property owners who share their colorful stories about living mortgage free.
s7029,TV Show,Hunters of the South Seas,,Will Millard,United Kingdom,"February 1, 2019",2015,TV-14,1 Season,"British TV Shows, Docuseries","In a far corner of the Pacific Ocean, people who live entirely at sea share insights into their incredible amphibious lifestyle."
s7070,TV Show,India: Nature's Wonderland,,"Liz Bonnin, Jon Gupta, Freida Pinto",United Kingdom,"March 1, 2017",2015,TV-PG,1 Season,"British TV Shows, Docuseries, Science & Nature TV",Wildlife biologist Liz Bonnin explores the natural wonders of India in this series that reveals the species and cultures unique to this ancient land.
s7081,TV Show,Inside The Freemasons,,,United Kingdom,"September 15, 2018",2017,TV-MA,1 Season,"British TV Shows, Docuseries, International TV Shows","Explore the history and future of the Freemasons, a fraternal order steeped in both secrecy and tradition."
s7141,TV Show,Jonathan Strange & Mr Norrell,Toby Haynes,"Eddie Marsan, Bertie Carvel, Marc Warren, Charlotte Riley, Alice Englert, Samuel West, Enzo Cilenti, Paul Kaye, Edward Hogg, Ariyon Bakare",United Kingdom,"August 25, 2016",2015,TV-14,1 Season,"British TV Shows, TV Dramas, TV Sci-Fi & Fantasy","In 1806, ambitious magician Norrell leads a revival of practical magic in England and ignites a fierce rivalry with bold young conjurer Strange."
s7210,TV Show,Kingdoms of the Sky,Steve Greenwood,,,"October 1, 2018",2018,TV-PG,1 Season,"British TV Shows, Docuseries, Science & Nature TV",Meet the astonishing animals and adventurous people living on some of the most spectacular – and formidable – mountain ranges in the world.
s7216,TV Show,Kitten Rescuers,,Jo Brand,United Kingdom,"October 2, 2019",2017,TV-14,1 Season,"British TV Shows, International TV Shows, Reality TV",Cat-crazy host Jo Brand follows vets and animal welfare officers who take on daring rescues to save furry felines subjected to different cat-astrophes.
s7267,TV Show,Land Girls,,"Becci Gemmell, Susan Cookson, Mark Benton, Mykola Allen, Sophie Ward, Jo Woodcock, Seline Hizli, Liam Boyle, Danny Webb, Nicholas Shaw, Carolyn Pickles, David Schofield, Summer Strallen, Christine Bottomley",United Kingdom,"August 1, 2017",2011,TV-14,3 Seasons,"British TV Shows, International TV Shows, TV Dramas","Follow the lives, loves, highs and lows of four members of the Women's Land Army who are working at the Hoxley Estate during WWII."
s7280,TV Show,Learning Time with Timmy,,Saskia Portway,United Kingdom,"May 15, 2020",2018,TV-Y,1 Season,"British TV Shows, Kids' TV",Colorful characters and edutaining activities help make learning English fun in this series geared toward youngsters.
s7301,TV Show,Life on Location,,David Attenborough,United States,"April 22, 2015",2009,TV-G,1 Season,"British TV Shows, Docuseries, Science & Nature TV","Members of the BBC's ""Life"" production crew go behind the scenes to explain just what it took to capture key sequences of the program."
s7302,TV Show,Life Story,,David Attenborough,United Kingdom,"June 20, 2016",2014,TV-14,1 Season,"British TV Shows, Docuseries, Science & Nature TV",This documentary series follows wild creatures in their native habitats as they navigate the perilous journey from birth to adulthood and beyond.
s7308,TV Show,Limmy's Show!,,"Brian Limond, Debbie Welsh, Tom Brogan, Raymond Mearns, Kirstin McLean",United Kingdom," October 1, 2019",2012,TV-MA,2 Seasons,"British TV Shows, TV Comedies","Scottish comic Brian ""Limmy"" Limond headlines this sketch series featuring him in various roles from a TV psychic to costumed adventurer ""Falconhoof."""
s7334,TV Show,London Spy,Jakob Verbruggen,"Ben Whishaw, Jim Broadbent, Edward Holcroft, Samantha Spiro, Charlotte Rampling, Lorraine Ashbourne, David Hayman, Clarke Peters, Adrian Lester, Harriet Walter",United Kingdom,"March 31, 2017",2015,TV-MA,1 Season,"British TV Shows, Crime TV Shows, International TV Shows","When his reclusive-banker lover disappears, a hard-partying young British hedonist plunges into the dangerous world of espionage to find the truth."
