show_id,type,title,director,cast,country,date_added,release_year,rating,duration,listed_in,description
s9,TV Show,The Great British Baking Show,Andy Devonshire,"Mel Giedroyc, Sue Perkins, Mary Berry, Paul Hollywood",United Kingdom,"September 24, 2021",2021,TV-14,9 Seasons,"British TV Shows, Reality TV","A talented batch of amateur bakers face off in a 10-week competition, whipping up their best dishes in the hopes of being named the U.K.'s best."
s15,TV Show,Crime Stories: India Detectives,,,,"September 22, 2021",2021,TV-MA,1 Season,"British TV Shows, Crime TV Shows, Docuseries",Cameras following Bengaluru police on the job offer a rare glimpse into the complex and challenging inner workings of four major crime investigations.
s33,TV Show,Sex Education,,"Asa Butterfield, Gillian Anderson, Ncuti Gatwa, Emma Mackey, Connor Swindells, Kedar Williams-Stirling, Alistair Petrie",United Kingdom,"September 17, 2021",2020,TV-MA,3 Seasons,"British TV Shows, International TV Shows, TV Comedies","Insecure Otis has all the answers when it comes to sex advice, thanks to his therapist mom. So rebel Maeve proposes a school sex-therapy clinic."
s73,TV Show,Jack Whitehall: Travels with My Father,,"Jack Whitehall, Michael Whitehall",United Kingdom,"September 14, 2021",2021,TV-MA,5 Seasons,"British TV Shows, Docuseries, International TV Shows","Jovial comic Jack Whitehall invites his stuffy father, Michael, to travel with him through Southeast Asia in an attempt to strengthen their bond."
s99,TV Show,Octonauts: Above & Beyond,,"Antonio Aakeel, Chipo Chung, Simon Foster, Teresa Gallagher, Simon Greenall, Kate Harbour, Paul Panting, Rob Rackstraw, William Vanderpuye, Helen Walsh, Keith Wickham, Andres Williams, Jo Wyatt",United Kingdom,"September 7, 2021",2021,TV-Y,1 Season,"British TV Shows, Kids' TV","The Octonauts expand their exploration beyond the sea — and onto land! With new rides and new friends, they'll protect any habitats and animals at risk."
s367,TV Show,Glow Up,,,United Kingdom,"July 30, 2021",2021,TV-14,3 Seasons,"British TV Shows, International TV Shows, Reality TV","In this competition show, aspiring makeup artists navigate colorful challenges to win a career-making opportunity in the beauty industry."
s370,TV Show,Myth & Mogul: John DeLorean,,,,"July 30, 2021",2021,TV-14,1 Season,"British TV Shows, Crime TV Shows, Docuseries","In the automotive world, John DeLorean rose from engineer to executive to icon. But under the hood of his self-created legend lies darkness and deceit."
s431,TV Show,Sexy Beasts,,,,"July 21, 2021",2021,TV-14,1 Season,"British TV Shows, International TV Shows, Reality TV","Hoping to say goodbye to superficial dating, real-life singles sport elaborate makeup and prosthetics to put true blind-date chemistry to the test."
s515,TV Show,Cuckoo,,"Andy Samberg, Taylor Lautner, Greg Davies, Helen Baxendale, Tamla Kari, Tyger Drew-Honey, Esther Smith",United Kingdom,"July 6, 2021",2019,TV-MA,5 Seasons,"British TV Shows, International TV Shows, TV Comedies","Rachel shocks her proper British parents when she marries an American hippie, but it's just the first in a series of surprises for the family."
s516,TV Show,Derry Girls,,"Saoirse-Monica Jackson, Nicola Coughlan, Louisa Harland, Jamie-Lee O'Donnell, Dylan Llewellyn, Tara Lynne O'Neill, Kathy Kiera Clarke, Tommy Tiernan, Ian McElhinney, Siobhan McSweeney",United Kingdom,"July 6, 2021",2019,TV-MA,2 Seasons,"British TV Shows, International TV Shows, TV Comedies","Amidst the political conflict of Northern Ireland in the 1990s, five high school students square off with the universal challenges of being a teenager."
s520,TV Show,I AM A KILLER,,,United Kingdom,"July 6, 2021",2020,TV-MA,2 Seasons,"British TV Shows, Crime TV Shows, Docuseries",Death row inmates convicted of capital murder give a firsthand account of their crimes in this documentary series.
s524,TV Show,Marcella,,"Anna Friel, Nicholas Pinnock, Sinéad Cusack, Nina Sosanya, Harry Lloyd, Laura Carmichael, Maeve Dermody, Ray Panthaki, Ian Puleston-Davies, Patrick Baladi, Florence Pugh, Jamie Bamber, Charlie Covell, Andrew Lancel, Jack Doolan, Tobias Santelmann, Stephen Lord, Ben Cura, Imogen Faires",United Kingdom,"July 6, 2021",2019,TV-MA,3 Seasons,"British TV Shows, Crime TV Shows, International TV Shows","Her marriage just ended and she's returning to work as a London detective after 12 years away. Is the serial killer she once investigated back, too?"
s539,TV Show,The A List,,"Lisa Ambalavanar, Ellie Duckles, Savannah Baker, Cian Barry, Eleanor Bennett, Jacob Dudman, Rosie Dwyer, Jack Kane, Max Lohan, Nneka Okoye, Micheal Ward, Georgina Sadler, Indianna Ryan",United Kingdom,"July 6, 2021",2021,TV-PG,2 Seasons,"British TV Shows, International TV Shows, TV Dramas","Romance, rivalry and radical mystery collide as a group of teens attend a remote island sleepaway camp in this suspenseful, supernatural drama."
s541,TV Show,The Worst Witch,,"Bella Ramsey, Clare Higgins, Meibh Campbell, Raquel Cassidy, Jenny Richardson, Miriam Petche, Tallulah Milligan, Wendy Craig, Shauna Shim","United Kingdom, Germany","July 6, 2021",2020,TV-G,4 Seasons,"British TV Shows, Kids' TV","After stumbling into a school for witches, a bumbling heroine comes to realize that she just might belong there. Based on Jill Murphy's beloved books."
s627,TV Show,Sophie: A Murder in West Cork,John Dower,,,"June 30, 2021",2021,TV-MA,1 Season,"British TV Shows, Crime TV Shows, Docuseries",A shocking murder in rural Ireland sets off an increasingly convoluted quest for justice that spans decades and cuts across national borders.
s682,TV Show,They've Gotta Have Us,Simon Frederick,"Debbie Allen, Harry Belafonte, John Boyega, Diahann Carroll, Ernest R. Dickerson, Laurence Fishburne, Nelson George, Whoopi Goldberg, Cuba Gooding Jr., LilRel Howery, Barry Jenkins, Kasi Lemmons, David Oyelowo, Robert Townsend, Jesse Williams",United Kingdom,"June 19, 2021",2018,TV-MA,1 Season,"British TV Shows, Docuseries","Powered by candid recollections from esteemed African-American entertainers, this docuseries traces the history of black cinema."
s790,TV Show,Downton Abbey,,"Hugh Bonneville, Jessica Brown Findlay, Samantha Bond, Laura Carmichael, Jim Carter, Raquel Cassidy, Brendan Coyle, Tom Cullen, Michelle Dockery, Kevin Doyle, Siobhan Finneran, Michael Fox, Joanne Froggatt, Matthew Goode, Harry Hadden-Paton, Thomas Howes, Lily James, Rob James-Collier, Rose Leslie, Phyllis Logan, Elizabeth McGovern, Sophie McShera, Lesley Nicol, Maggie Smith, Penelope Wilton",United Kingdom,"June 2, 2021",2015,TV-14,6 Seasons,"British TV Shows, International TV Shows, TV Dramas","Exposing the snobbery and machinations of a vanishing class system, this series chronicles events in the lives of the Crawley family and their servants."
s926,TV Show,Angelina Ballerina,,,,"May 1, 2021",2010,TV-Y,2 Seasons,"British TV Shows, Kids' TV","Angelina is crazy about ballet dancing, even though she's a young mouse, and studies hard with a famous teacher to become a prima ballerina."
s998,TV Show,Life in Color with David Attenborough,,David Attenborough,"Australia, United Kingdom","April 22, 2021",2021,TV-PG,1 Season,"British TV Shows, Docuseries, International TV Shows","Using innovative technology, this docuseries explores nature from a fresh perspective as animals use color to survive and thrive in the wild."
s1050,TV Show,Ricky Zoom,,"Max Fincham, Twinkle Jaiswal, Bradley Bissett, Dylan Naden, Adam Longworth, Ashton Frank, Edward Moloney, Esther Coles, Jess Robinson, Miranda Pointer, Osian Thompson, Simon Lipkin, Richard David-Caine","China, United Kingdom","April 15, 2021",2019,TV-Y,1 Season,"British TV Shows, Kids' TV",Race along with Ricky Zoom and his loyal Bike Buddies as they zip around their two-wheeled town of Wheelford on rescue missions and learn speedy stunts!
s1059,TV Show,Fate: The Winx Saga,,"Abigail Cowen, Hannah Van Der Westhuysen, Precious Mustapha, Eliot Salt, Elisha Applebaum, Danny Griffin, Sadie Soverall, Freddie Thorp, Rob James-Collier, Eve Best, Lesley Sharp","Italy, United Kingdom","April 14, 2021",2021,TV-MA,1 Season,"British TV Shows, International TV Shows, TV Dramas","Determined to master their enchanting powers, a group of teens navigate rivalry, romance and supernatural studies at Alfea, a magical boarding school."
s1126,TV Show,Murder Maps,,Nicholas Day,United Kingdom,"April 1, 2021",2017,TV-MA,2 Seasons,"British TV Shows, Crime TV Shows, Docuseries",Dramatic reenactments paired with archival sources artfully illustrate how police brought some of Britain's most infamous killers to justice.
s1130,TV Show,Secrets of Great British Castles,,Dan Jones,United Kingdom,"April 1, 2021",2016,TV-PG,2 Seasons,"British TV Shows, Docuseries, International TV Shows",Join historian Dan Jones on a journey back in time to the zenith of Britain's most iconic structures and their infamous inhabitants.
s1167,TV Show,The Irregulars,,"Mckell David, Thaddea Graham, Jojo Macari, Harrison Osterfield, Darci Shaw, Clarke Peters, Royce Pierreson, Henry Lloyd-Hughes",United Kingdom,"March 26, 2021",2021,TV-14,1 Season,"British TV Shows, Crime TV Shows, International TV Shows","A crew of misfits investigates a series of supernatural crimes in Victorian London for Dr. Watson and his shadowy associate, Sherlock Holmes."
s1207,TV Show,Zero Chill,,"Grace Beedie, Dakota Benjamin Taylor, Jade Ma, Jeremias Amoore, Leonardo Fontes, Anastasia Chocholatá, Sarah-Jane Potts, Doug Rao, Tanja Ribič, Oscar Skagerberg, Jerry Kwarteng",United Kingdom,"March 15, 2021",2021,TV-G,1 Season,"British TV Shows, Kids' TV, TV Dramas","Talented teen figure skater Kayla is forced to leave everything behind when her family follows her twin brother, Mac, to a prestigious hockey academy."
s1218,TV Show,The One,,"Hannah Ware, Zoë Tapper, Dimitri Leonidas, Amir El-Masry, Lois Chimimba, Eric Kofi-Abrefa, Pallavi Sharda, Jana Pérez, Diarmaid Murtagh, Gregg Chillin, Wilf Scolding, Stephen Campbell Moore, Simone Kirby, Albano Jerónimo, Eduardo Lloveras, Miguel Amorim",United Kingdom,"March 12, 2021",2021,TV-MA,1 Season,"British TV Shows, Crime TV Shows, International TV Shows","Love — and lies — spiral when a DNA researcher helps discover a way to find the perfect partner, and creates a bold new matchmaking service."
s1302,TV Show,Behind Her Eyes,,"Simona Brown, Eve Hewson, Tom Bateman, Robert Aramayo, Tyler Howitt, Georgie Glen",United Kingdom,"February 17, 2021",2021,TV-MA,1 Season,"British TV Shows, International TV Shows, TV Dramas",A single mother enters a world of twisted mind games when she begins an affair with her psychiatrist boss while secretly befriending his mysterious wife.
s1318,TV Show,Nadiya Bakes,,Nadiya Hussain,United Kingdom,"February 12, 2021",2021,TV-G,1 Season,"British TV Shows, International TV Shows, Reality TV","Delightful cakes and heavenly breads pop from the oven as Nadiya Hussain returns to baking, her happy place, and spotlights creative kindred spirits."
s1420,TV Show,Last Tango in Halifax,Juliet May,"Derek Jacobi, Anne Reid, Sarah Lancashire, Nicola Walker, Edward Ashley, Louis Greatorex, Josh Bolt",United Kingdom,"January 12, 2021",2020,TV-MA,4 Seasons,"British TV Shows, Romantic TV Shows, TV Dramas",Two widowed childhood sweethearts fall for each other all over again when they are reunited over the Internet after nearly 60 years.
s1428,TV Show,Inside the World’s Toughest Prisons,,Paul Connolly,United Kingdom,"January 8, 2021",2021,TV-MA,5 Seasons,"British TV Shows, Crime TV Shows, Docuseries","Investigative journalist Paul Connolly becomes a voluntary inmate in the world's most volatile prisons, where intimidation and brutality rule."
s1481,TV Show,Still Game,,"Ford Kiernan, Paul Riley, Jane McCarry, Greg Hemphill, Mark Cox, Gavin Mitchell, Sanjeev Kohli",United Kingdom,"December 30, 2020",2018,TV-14,9 Seasons,"British TV Shows, Classic & Cult TV, International TV Shows","Scottish pensioners Jack and Victor make the most of their golden years, getting themselves into all kinds of scrapes in their Glasgow suburb."
s1507,TV Show,Shaun the Sheep,,"John Sparkes, Justin Fletcher, Kate Harbour, Richard Webber, Jo Allen","United Kingdom, Finland, Germany, United States, Australia, Japan, France, Ireland","December 22, 2020",2016,TV-Y,2 Seasons,"British TV Shows, Kids' TV, TV Comedies","Join freewheeling Shaun for barnyard misadventures with his cousin Timmy, giant sheepdog Bitzer, jealous cat Pidsley and fellow sheep Shirley."
s1509,TV Show,Timmy Time,,"Kate Harbour, Justin Fletcher, Louis Jones",United Kingdom,"December 22, 2020",2010,TV-Y,1 Season,"British TV Shows, Kids' TV","This delightful animated series centers on impish lamb Timmy as he enters nursery school, where he learns about sharing, responsibility and fairness."
s1528,TV Show,Morphle,,,Netherlands,"December 17, 2020",2020,TV-Y,2 Seasons,"British TV Shows, Kids' TV","Little Mila turns playtime into a series of fun and educational adventures with her magical pet Morphle, who transforms into anything she dreams up!"
s1542,TV Show,The Ripper,"Ellena Wood, Jesse Vile",,United Kingdom,"December 16, 2020",2020,TV-MA,1 Season,"British TV Shows, Crime TV Shows, Docuseries","In the late 1970s, British police struggle to identify — let alone capture — the serial killer known throughout the world as the Yorkshire Ripper."
s1597,TV Show,The Great British Baking Show: Holidays,,"Paul Hollywood, Prue Leith, Sandi Toksvig, Noel Fielding",,"December 4, 2020",2020,TV-MA,3 Seasons,"British TV Shows, Reality TV","Deck the halls with sugar, butter and chocolate as competitors from past seasons bake sweet Yuletide treats for judges Paul Hollywood and Prue Leith."
s1604,TV Show,Alien Worlds,,,United Kingdom,"December 2, 2020",2020,TV-PG,1 Season,"British TV Shows, Docuseries, International TV Shows","Applying the laws of life on Earth to the rest of the galaxy, this series blends science fact and fiction to imagine alien life on other planets."
s1619,TV Show,Octonauts,,"Keith Wickham, Jo Wyatt, Ross Breen, Simon Greenall, Paul Panting, Rob Rackstraw, Teresa Gallagher, Shelley Longworth","United States, Ireland, United Kingdom, India","December 1, 2020",2015,TV-Y,4 Seasons,"British TV Shows, Kids' TV",A team of brave underwater explorers known as the Octonauts combs the world's oceans for aquatic creatures in desperate need of assistance.
s1629,TV Show,The Repair Shop,,,United Kingdom,"December 1, 2020",2018,TV-PG,1 Season,"British TV Shows, Reality TV",Expert artisans restore timeworn family heirlooms with touching sentimental value while also uncovering their uniquely rich histories.
s1699,TV Show,The Crown,,"Claire Foy, John Lithgow, Matt Smith, Vanessa Kirby, Jared Harris, Victoria Hamilton, Eileen Atkins, Jeremy Northam, Alex Jennings, Ben Miles, Pip Torrens, Will Keen, Harry Hadden-Paton, Daniel Ings, Greg Wise, Harriet Walter, Lia Williams, Matthew Goode, Anton Lesser","United Kingdom, United States","November 15, 2020",2020,TV-MA,4 Seasons,"British TV Shows, International TV Shows, TV Dramas",This drama follows the political rivalries and romance of Queen Elizabeth II's reign and the events that shaped the second half of the 20th century.
s1848,TV Show,Fireman Sam,,"Steven Kynman, David Carling, Tegwen Tucker, Su Douglas, Andrew Hodwitz, Dave Pender, Lily Cassano, Carter Treneer, Sarah Lynn Strange",United Kingdom,"October 15, 2020",2018,TV-Y,4 Seasons,"British TV Shows, Kids' TV","Sharing valuable lessons in fire safety for preschoolers, Fireman Sam and his animated crew from Pontypandy, Wales, are ready for any emergency."
s1886,TV Show,Bad Boy Billionaires: India,,,India,"October 5, 2020",2020,TV-14,1 Season,"British TV Shows, Docuseries, International TV Shows","This investigative docuseries explores the greed, fraud and corruption that built up — and ultimately brought down — India’s most infamous tycoons."
s1992,TV Show,Criminal: UK,,"Katherine Kelly, Lee Ingleby, Mark Stanley, Rochenda Sandall, Shubham Saraf, Nicholas Pinnock, David Tennant, Hayley Atwell, Youssef Kerkour, Clare-Hope Ashitey, Isabella Laughland","United Kingdom, France, Germany, Spain","September 16, 2020",2020,TV-MA,2 Seasons,"British TV Shows, Crime TV Shows, International TV Shows","Within the walls of an interrogation room and with time running out, London investigators go after three suspects, each accused of a grievous crime."
s1999,TV Show,Call the Midwife,Philippa Lowthorpe,"Vanessa Redgrave, Bryony Hannah, Helen George, Jenny Agutter, Pam Ferris, Laura Main, Judy Parfitt, Cliff Parisi, Stephen McGann, Ben Caplan, Miranda Hart, Jessica Raine, Max Macmillan, Victoria Yeates, Jack Ashton, Emerald Fennell, Linda Bassett",United Kingdom,"September 15, 2020",2020,TV-MA,9 Seasons,"British TV Shows, International TV Shows, TV Dramas",This period drama set in impoverished East London in the 1950s follows a newly qualified midwife and her colleagues at a nursing convent.
s2007,TV Show,Buddi,,"Greta Jameson, Ralf Jameson, Clementine Laikin, Felix Laikin","United Kingdom, China","September 11, 2020",2020,TV-Y,2 Seasons,"British TV Shows, Kids' TV","The Buddis bounce, spin, glide — and giggle! — through their magical world, learning new things and sharing the joy of friendship."
s2014,TV Show,The Duchess,,"Katherine Ryan, Rory Keenan, Katy Byrne, Doon Mackichan, Steen Raskopoulos, Michelle de Swarte, Sophie Fletcher",United Kingdom,"September 11, 2020",2020,TV-MA,1 Season,"British TV Shows, International TV Shows, TV Comedies","Katherine's a single mom juggling her career, her tween daughter, her relationship with her boyfriend — and pondering getting pregnant with her ex."
s2081,TV Show,Thomas and Friends,Greg Tiernan,"Michael Angelis, Ben Small, Keith Wickham, Kerry Shale",United Kingdom,"September 1, 2020",2020,TV-Y,2 Seasons,"British TV Shows, Classic & Cult TV, Kids' TV","This animated children's series follows the adventures of Thomas, a cheerful blue tank engine who lives on the island of Sodor."
s2086,TV Show,I AM A KILLER: RELEASED,,,"United Kingdom, United States","August 28, 2020",2020,TV-MA,1 Season,"British TV Shows, Crime TV Shows, Docuseries","In this crime docuseries spinoff, a convict is paroled 30 years after being sentenced to death for murder. Then he makes a stunning confession."
s2102,TV Show,Baewatch: Parental Guidance,,,,"August 22, 2020",2019,TV-MA,1 Season,"British TV Shows, Reality TV, Romantic TV Shows","Couples go on a romantic getaway to test their relationships, not knowing their families are calling the shots and cringing over their every move."
s2185,TV Show,Get Even,,"Kim Adis, Mia McKenna-Bruce, Bethany Antonia, Jessica Alexander",United Kingdom,"July 31, 2020",2020,TV-PG,1 Season,"British TV Shows, Crime TV Shows, International TV Shows","In a secret act of skillful revenge, four private school classmates team up and work together to expose a string of schoolwide injustices."
s2224,TV Show,Killer Women with Piers Morgan,,Piers Morgan,United Kingdom,"July 19, 2020",2017,TV-MA,1 Season,"British TV Shows, Crime TV Shows, Docuseries","Journalist Piers Morgan goes behind prison walls to speak with women convicted of shocking crimes, shedding light on what drove them to murder."
s2239,TV Show,Sunny Bunnies,,"Svetlana Tsimokhina, Dmitri Davidovich",Belarus,"July 15, 2020",2016,TV-Y,2 Seasons,"British TV Shows, Kids' TV, TV Comedies","Furry little bunnies hop through wild adventures as they find solutions, fun and sometimes mischief wherever there is light."
s2306,TV Show,21 Again,,Laura Morgan,United Kingdom,"July 1, 2020",2019,TV-MA,1 Season,"British TV Shows, Reality TV","In a social experiment, a group of daughters sends their mothers, disguised as 21-year-olds, into the world to experience life as a member of Gen Z."
s2344,TV Show,Crazy Delicious,,"Jayde Adams, Carla Hall, Heston Blumenthal, Niklas Ekstedt",United Kingdom,"June 24, 2020",2020,TV-PG,1 Season,"British TV Shows, International TV Shows, Reality TV","In this competition show, daring home chefs tempt the food gods with reinvented classics and fanciful feasts in their quest to win a golden apple."
s2477,TV Show,History 101,,,United Kingdom,"May 22, 2020",2020,TV-14,1 Season,"British TV Shows, Docuseries, International TV Shows","Infographics and archival footage deliver bite-size history lessons on scientific breakthroughs, social movements and world-changing discoveries."
s2515,TV Show,The Big Flower Fight,,"Natasia Demetriou, Vic Reeves, Kristen Griffith-Vanderyacht",United Kingdom,"May 18, 2020",2020,TV-PG,1 Season,"British TV Shows, International TV Shows, Reality TV","Ten pairs of florists, sculptors and garden designers face off in a friendly floral fight to see who can build the biggest, boldest garden sculptures."
s2531,TV Show,White Lines,,"Laura Haddock, Nuno Lopes, Marta Milans, Laurence Fox, Daniel Mays, Angela Griffin, Juan Diego Botto, Pedro Casablanc, Belén López, Barry Ward, Tom Rhys Harries","United Kingdom, Spain","May 15, 2020",2020,TV-MA,1 Season,"British TV Shows, Crime TV Shows, International TV Shows","Zoe Walker leaves her quiet life behind to investigate her brother's disappearance in Ibiza, where she quickly heads down a decadent and dangerous path."
s2610,TV Show,Nadiya’s Time to Eat,,Nadiya Hussain,United Kingdom,"April 29, 2020",2020,TV-G,1 Season,"British TV Shows, International TV Shows, Reality TV","On this cooking show, Nadiya Hussain serves up delicious shortcuts, vital ingredients and fast favorites — perfect for today's time-strapped families."
s2629,TV Show,The Last Kingdom,,"Alexander Dreymon, Emily Cox, David Dawson, Ian Hart, Rune Temte, Matthew Macfadyen, Rutger Hauer, Tobias Santelmann, Peter Gantzler, Adrian Bower, Joseph Millson, Henning Valin Jakobsen, Alexandre Willaume, Thomas W. Gabrielsson",United Kingdom,"April 26, 2020",2020,TV-MA,4 Seasons,"British TV Shows, International TV Shows, TV Action & Adventure","As Alfred the Great defends his kingdom from Norse invaders, Uhtred – born a Saxon but raised by Vikings – seeks to claim his ancestral birthright."
s2641,TV Show,After Life,,"Ricky Gervais, Tom Basden, Tony Way, Diane Morgan, Mandeep Dhillon, David Bradley, Ashley Jensen, Kerry Godliman",United Kingdom,"April 24, 2020",2020,TV-MA,2 Seasons,"British TV Shows, International TV Shows, TV Comedies","Struggling to come to terms with his wife's death, a writer for a newspaper adopts a gruff new persona in an effort to push away those trying to help."
s2658,TV Show,Win the Wilderness,,,United Kingdom,"April 22, 2020",2020,TV-14,1 Season,"British TV Shows, International TV Shows, Reality TV","Six couples compete to prove they've got the survival skills to win the deed to an extraordinary home deep in the vast, rugged wilderness of Alaska."
s2737,TV Show,Man Like Mobeen,,,United Kingdom,"April 1, 2020",2020,TV-MA,3 Seasons,"British TV Shows, International TV Shows, TV Comedies","Mobeen is trying to be a good friend, follow the faith and raise his teenage sister. Yet his past – and everyday life – complicates matters."
s2743,TV Show,Sunderland 'Til I Die,,,United Kingdom,"April 1, 2020",2020,TV-MA,2 Seasons,"British TV Shows, Docuseries, International TV Shows",This docuseries follows English soccer club Sunderland through the 2017-18 season as they try to bounce back after relegation from the Premier League.
s2747,TV Show,The Windsors,,"Harry Enfield, Haydn Gwynne, Hugh Skinner, Louise Ford, Richard Goulding, Matthew Cottle, Morgana Robinson, Celeste Dring, Katy Wix, Ellie White",United Kingdom,"April 1, 2020",2020,TV-MA,3 Seasons,"British TV Shows, International TV Shows, TV Comedies",The all-too-public trials and tribulations of England's royal family are reimagined as an over-the-top comedic soap opera.
s2794,TV Show,The English Game,,"Edward Holcroft, Kevin Guthrie, Charlotte Hope, Niamh Walsh, Craig Parkinson, James Harkness, Ben Batt, Gerard Kearns, Henry Lloyd-Hughes",United Kingdom,"March 20, 2020",2020,TV-14,1 Season,"British TV Shows, International TV Shows, TV Dramas",Two 19th-century footballers on opposite sides of a class divide navigate professional and personal turmoil to change the game — and England — forever.
s2795,TV Show,The Letter for the King,,"Amir Wilson, Ruby Ashbourne Serkis, Thaddea Graham, Islam Bouakkaz, Jonah Lees, Jack Barton, Nathanael Saleh, Emilie Cocquerel, Gijs Blom, Kemi-Bo Jacobs, David Wenham, Omid Djalili, Peter Ferdinando",United Kingdom,"March 20, 2020",2020,TV-PG,1 Season,"British TV Shows, International TV Shows, TV Action & Adventure","A young knight in training contends with ancient prophecies, magical powers and fickle companions as he sets out on an epic quest to save his kingdom."
s2808,TV Show,Shaun the Sheep: Adventures from Mossy Bottom,,"John Sparkes, Justin Fletcher, Marcus Brigstocke, Simon Greenall, Kate Harbour, Emma Tate, Andy Nyman, Richard Webber","United Kingdom, United States, Ireland","March 17, 2020",2020,TV-Y7,1 Season,"British TV Shows, Kids' TV, TV Comedies","Clever sheep Shaun, loyal dog Bitzer and the rest of the Mossy Bottom gang cook up oodles of fun and mischief on the farm."
s2980,TV Show,THE STRANGER,,"Richard Armitage, Siobhan Finneran, Jennifer Saunders, Shaun Dooley, Paul Kaye, Dervla Kirwan, Kadiff Kirwan, Hannah John-Kamen, Anthony Head, Stephen Rea, Jacob Dudman, Ella-Rae Smith, Brandon Fellows, Misha Handley",United Kingdom,"January 30, 2020",2020,TV-MA,1 Season,"British TV Shows, Crime TV Shows, International TV Shows","When a stranger makes a shocking claim about his wife, family man Adam Price becomes entangled in a mystery as he desperately searches for answers."
