show_id,type,title,director,cast,country,date_added,release_year,rating,duration,listed_in,description
s6993,Movie,Hoodwinked Too! Hood vs. Evil,Mike Disa,"Hayden Panettiere, Glenn Close, Patrick Warburton, Joan Cusack, David Ogden Stiers, Bill Hader, Amy Poehler, Andy Dick, Martin Short, Brad Garrett, Cheech Marin, Tommy Chong, Heidi Klum, Wayne Newton",United States,"November 3, 2018",2011,PG,86 min,"Children & Family Movies, Comedies","Fresh off a top-secret training, feisty heroine Little Red teams up with intrepid reporter Wolf to investigate the disappearance of Hansel and Gretel."
s6994,Movie,Hope Aur Hum,Sudip Bandyopadhyay,"Naseeruddin Shah, Kabir Sajid, Sonali Kulkarni, Amir Bashir, Naveen Kasturia, Neha Chauhan, Virti Vaghani",India,"September 1, 2018",2018,TV-14,95 min,"Children & Family Movies, Comedies, Dramas","A multigenerational household navigates daily life, evolving relationships and clashes between old and new mindsets in this light family drama."
s7009,Movie,Hotel Transylvania 3: Summer Vacation,Genndy Tartakovsky,"Adam Sandler, Selena Gomez, Kevin James, Kathryn Hahn, Andy Samberg, David Spade, Steve Buscemi, Fran Drescher, Molly Shannon, Mel Brooks, Keegan-Michael Key",United States,"January 24, 2019",2018,PG,97 min,"Children & Family Movies, Comedies","It's love at first sight for Dracula when he meets Ericka, the charming but mysterious captain of the monster cruise that Mavis plans for the family."
s7014,Movie,How the Grinch Stole Christmas,Ron Howard,"Jim Carrey, Taylor Momsen, Jeffrey Tambor, Christine Baranski, Bill Irwin, Molly Shannon, Clint Howard, Josh Ryan Evans, Mindy Sterling, Anthony Hopkins",United States,"June 1, 2017",2000,PG,105 min,"Children & Family Movies, Comedies",The Grinch decides to rob Whoville of Christmas – but a dash of kindness from little Cindy Lou Who and her family may be enough to melt his heart.
s7046,Movie,I Dream Of Dance,Maria Demeshkina Peek,,,"January 31, 2019",2017,TV-14,106 min,"Children & Family Movies, Documentaries",Experience the joy and sacrifice of one of the nation's premier dance companies as its members and instructors prepare for a prestigious competition.
s7056,Movie,Igor,Tony Leondis,"John Cusack, Steve Buscemi, Sean Hayes, Molly Shannon, Eddie Izzard, Jennifer Coolidge, Jay Leno","United States, France","September 1, 2019",2008,PG,87 min,Children & Family Movies,"Igor, the brilliant but deformed assistant to mad Dr. Glickenstein, dreams of winning the Evil Science Fair and the heart of village beauty Gretchen."
s7058,Movie,Imagine That,Karey Kirkpatrick,"Eddie Murphy, Thomas Haden Church, Yara Shahidi, Ronny Cox, Stephen Rannazzisi, Nicole Ari Parker, DeRay Davis, Vanessa Williams, Martin Sheen, Lauren Weedman, Timm Sharp, Bobb'e J. Thompson","United States, Germany","December 7, 2019",2009,PG,108 min,"Children & Family Movies, Comedies, Sci-Fi & Fantasy","Work problems are piling up for a businessman. But when he discovers a pathway to his daughter's imaginary world, he starts finding some solutions."
s7068,Movie,Incredibles 2 (Spanish Version),Brad Bird,"Víctor Trujillo, Consuelo Duval, Darío T. Pie, Leyla Rangel, Oliver Díaz Barba, Dulce Guerrero, Eli Fucile, Martin Hernandez",United States,"February 8, 2019",2018,PG,118 min,"Children & Family Movies, Comedies","When Elastigirl gets recruited for a high-profile crime-fighting mission, Mr. Incredible takes on his toughest assignment ever: full-time parenting."
s7071,Movie,Indiana Jones and the Kingdom of the Crystal Skull,Steven Spielberg,"Harrison Ford, Cate Blanchett, Karen Allen, Ray Winstone, John Hurt, Jim Broadbent, Igor Jijikine, Shia LaBeouf",United States,"January 1, 2019",2008,PG-13,123 min,"Action & Adventure, Children & Family Movies, Sci-Fi & Fantasy","Indiana Jones is drawn into a Russian plot to unearth the Crystal Skulls of Akator, Amazonian artifacts with supernatural powers."
s7072,Movie,Indiana Jones and the Last Crusade,Steven Spielberg,"Harrison Ford, Sean Connery, Denholm Elliott, Alison Doody, John Rhys-Davies, Julian Glover, River Phoenix, Michael Byrne, Kevork Malikyan, Robert Eddison",United States,"January 1, 2019",1989,PG-13,127 min,"Action & Adventure, Children & Family Movies, Classic Movies","Accompanied by his father, Indiana Jones sets off on his third adventure to explore the cradle of civilization on a perilous hunt for the Holy Grail."
s7073,Movie,Indiana Jones and the Raiders of the Lost Ark,Steven Spielberg,"Harrison Ford, Karen Allen, Paul Freeman, Ronald Lacey, John Rhys-Davies, Denholm Elliott, Alfred Molina, Wolf Kahler, Anthony Higgins, Vic Tablian",United States,"January 1, 2019",1981,PG,116 min,"Action & Adventure, Children & Family Movies, Classic Movies","When Indiana Jones is hired by the government to locate the legendary Ark of the Covenant, he finds himself up against the entire Nazi regime."
s7074,Movie,Indiana Jones and the Temple of Doom,Steven Spielberg,"Harrison Ford, Kate Capshaw, Amrish Puri, Roshan Seth, Philip Stone, Roy Chiao, Jonathan Ke Quan, David Yip, Ric Young, Chua Kah Joo",United States,"January 1, 2019",1984,PG,119 min,"Action & Adventure, Children & Family Movies, Classic Movies","Indiana Jones, his young sidekick and a spoiled songbird get more than they bargained for when they go to India in search of a missing magical stone."
s7079,Movie,Inkheart,Iain Softley,"Brendan Fraser, Paul Bettany, Helen Mirren, Jim Broadbent, Andy Serkis, Sienna Guillory, Eliza Bennett, Rafi Gavron, Lesley Sharp, Jamie Foreman","Germany, United Kingdom, United States","July 1, 2019",2008,PG,106 min,"Action & Adventure, Children & Family Movies, Sci-Fi & Fantasy","Unbeknownst to his 12-year-old daughter, a bookbinder has a secret ability to bring characters to life by reading their stories out loud."
s7098,Movie,Iron Man & Captain America: Heroes United,Leo Riley,"Adrian Pasdar, Roger Craig Smith, Fred Tatasciore, David Kaye, Clancy Brown, Liam O'Brien, Robin Atkin Downes, Dee Bradley Baker",United States,"October 12, 2014",2014,PG,71 min,"Children & Family Movies, Sci-Fi & Fantasy","While battling to keep the Red Skull and Taskmaster from unleashing a Hydra army, Iron Man and Captain America must learn to work together."
s7104,Movie,It Takes Two,Andy Tennant,"Kirstie Alley, Steve Guttenberg, Mary-Kate Olsen, Ashley Olsen, Philip Bosco, Jane Sibbett",United States,"November 20, 2019",1995,PG,101 min,"Children & Family Movies, Comedies","The Olsen twins put a cute new spin on Mark Twain's classic tale ""The Prince and the Pauper,"" playing identical 9-year-olds from very different backgrounds: orphaned Amanda and wealthy Alyssa."
s7109,Movie,최강전사 미니특공대 : 영웅의 탄생,Young Jun Lee,"Um Sang-hyun, Yang Jeong-hwa, Jeon Tae-yeol, Shin Yong-woo, Lee So-young, So-yeon",,"September 1, 2018",2018,TV-Y7,68 min,Children & Family Movies,"Miniforce, a special task force of elite rangers, takes on the Lizard Army to save Earth before it’s too late, in this prequel to the TV series."
s7111,Movie,Jack and the Cuckoo-Clock Heart,"Mathias Malzieu, Stéphane Berla","Orlando Seale, Samantha Barks, Harry Sadeghi, Stephane Cornicard, Jessie Buckley, Sophia Ellis, Barbara Scaff, Michelle Fairley, Richard Ridings, Howard Samuels","France, Belgium","February 8, 2017",2013,PG,93 min,"Children & Family Movies, Music & Musicals","Equipped with a mechanical heart and determined to stay out of death's shadow, young Jack understands that love could prove fatal."
s7146,Movie,Judy Moody and the Not Bummer Summer,John Schultz,"Jordana Beatty, Heather Graham, Parris Mosteller, Preston Bailey, Kristoffer Ryan Winters, Garrett Ryan, Jaleel White, Ashley Boettcher, Taylar Hender, Cameron Boyce, Jenica Bergere, Janet Varney",United States,"August 8, 2019",2011,PG,91 min,"Children & Family Movies, Comedies","In this family film, never-dull third-grader Judy Moody embarks on a summer adventure with her brother, Stink, and always-up-for-fun Aunt Opal."
s7165,Movie,Kahlil Gibran's The Prophet,"Roger Allers, Gaëtan Brizzi, Paul Brizzi, Joan C. Gratz, Mohammed Saeed Harib, Tomm Moore, Nina Paley, Bill Plympton, Joann Sfar, Michael Socha","Liam Neeson, Salma Hayek, John Krasinski, Frank Langella, Alfred Molina, John Rhys-Davies, Quvenzhané Wallis","United States, France, Canada, Lebanon, Qatar","October 1, 2017",2014,PG,85 min,"Children & Family Movies, Dramas",A troubled young girl and her mother find solace on a journey with a subversive poet whose words captivate their hearts and imaginations.
s7227,Movie,Krish Trish and Baltiboy,,"Damandeep Singh Baggan, Smita Malhotra, Baba Sehgal",,"September 8, 2017",2009,TV-Y7,58 min,Children & Family Movies,"A team of minstrels, including a monkey, cat and donkey, narrate folktales from the Indian regions of Rajasthan, Kerala and Punjab."
s7228,Movie,Krish Trish and Baltiboy: Battle of Wits,"Munjal Shroff, Tilak Shetty","Damandeep Singh Baggan, Smita Malhotra, Baba Sehgal, Deepak Chachra",,"September 8, 2017",2013,TV-Y7,62 min,Children & Family Movies,"An artisan is cheated of his payment, a lion of his throne and a brother of his inheritance in these three stories of deception and justice."
s7229,Movie,Krish Trish and Baltiboy: Best Friends Forever,"Munjal Shroff, Tilak Shetty","Damandeep Singh Baggan, Smita Malhotra, Deepak Chachra",,"September 8, 2017",2016,TV-Y,65 min,Children & Family Movies,"A cat, monkey and donkey team up to narrate folktales about friendship from Northeast India, and the Indian regions of Bihar and Rajasthan."
s7230,Movie,Krish Trish and Baltiboy: Comics of India,Tilak Shetty,"Damandeep Singh Baggan, Smita Malhotra, Baba Sehgal",,"September 8, 2017",2012,TV-Y7,61 min,Children & Family Movies,"In three comic-strip-style tales, a boy tries to sell wisdom, a demon is released from captivity, and a king assigns impossible tasks to his minister."
s7231,Movie,Krish Trish and Baltiboy: Face Your Fears,Tilak Shetty,"Tarun Ratnani, Smita Malhotra, Deepak Chachra",India,"November 17, 2017",2017,TV-Y7,65 min,Children & Family Movies,"In three tales about fear, a baby elephant gets captured by a circus, two boys enter a haunted house and a parrot faces his fear of flying."
s7232,Movie,Krish Trish and Baltiboy: Oversmartness Never Pays,Tilak Shetty,"Rishi Gambhir, Smita Malhotra, Deepak Chachra",,"September 8, 2017",2017,TV-Y7,65 min,Children & Family Movies,"A cat, monkey and donkey learn the consequences of cheating through stories from the Indian regions of Rajasthan, West Bengal and Maharashtra."
s7233,Movie,Krish Trish and Baltiboy: Part II,,"Damandeep Singh Baggan, Smita Malhotra, Baba Sehgal",,"September 8, 2017",2010,TV-Y7,58 min,Children & Family Movies,"Animal minstrels narrate stories about a monkey's friendship with a crocodile, two monkeys' foolishness and a villager's encounter with a demon."
s7234,Movie,Krish Trish and Baltiboy: The Greatest Trick,"Munjal Shroff, Tilak Shetty","Damandeep Singh Baggan, Smita Malhotra, Baba Sehgal",,"September 8, 2017",2013,TV-Y7,60 min,Children & Family Movies,"The consequences of trickery are explored in stories involving an inconsiderate husband, two greedy courtiers, and a kind man who loses everything."
s7241,Movie,Kung Fu Magoo,Andrés Couturier,"Dylan Sprouse, Cole Sprouse, Alyson Stoner, Tom Kenny, Chris Parnell, Rodger Bumpass, Maile Flanagan, Wally Wingert, Candi Milo, Jim Ward","Mexico, United States","August 1, 2018",2010,TV-Y7,79 min,"Children & Family Movies, Comedies","Shortsighted curmudgeon Mr. Magoo and his young nephew, Justin, fight such nefarious foes as kung fu villains, robot spiders and teenage mutants."
s7242,Movie,Kung Fu Panda: Holiday,Tim Johnson,"Jack Black, Angelina Jolie, Dustin Hoffman, Jackie Chan, Seth Rogen, Lucy Liu, David Cross, James Hong, Dan Fogler",United States,"December 1, 2012",2010,TV-PG,26 min,"Children & Family Movies, Comedies","As preparations for the Winter Feast build, Po is caught between his obligations as the Dragon Warrior and his family holiday traditions."
s7276,Movie,LeapFrog: Letter Factory,Roy Allen Smith,"Joey Camen, Marie Danielle, Mark Cacciatore, Dave Fennoy, Debi Derryberry",United States,"April 15, 2020",2003,TV-Y,37 min,Children & Family Movies,"In this entertaining installment of the wildly popular early-learning series, Professor Quigley, Leap, Lily and Tad arrive at the magical Letter Factory, where jumbles of sounds are miraculously shaped into letters."
s7279,Movie,"LeapFrog: Sing-along, Read-along",Ron Myrick,"Julie Maddalena, Cindy Robinson",,"April 15, 2020",2011,TV-Y,32 min,Children & Family Movies,"Using rhythm and rhymes, a funky band and a colorful cast of characters help make reading, sounding out vowels and building words easy and fun!"
s7283,Movie,Legend of the Guardians: The Owls of Ga'Hoole,Zack Snyder,"Helen Mirren, Geoffrey Rush, Jim Sturgess, Hugo Weaving, Emily Barclay, Abbie Cornish, Ryan Kwanten, Anthony LaPaglia, Miriam Margolyes, Sam Neill","United States, Australia","January 1, 2020",2010,PG,97 min,Children & Family Movies,"Soren, a barn owl kidnapped from his peaceful forest home, is brought to an orphanage where he must train to become a soldier."
s7291,Movie,LEGO Ninjago: Masters of Spinjitzu: Day of the Departed,,,"Denmark, China","February 1, 2019",2016,TV-Y7-FV,44 min,"Action & Adventure, Children & Family Movies",Cole finds himself trapped in Yang's temple after accidentally releasing a host of villainous spirits that the Ninja must defeat.
s7293,Movie,Leo the Lion,Mario Cambi,"Daniel Amerman, John Cygan, Matthew Mercer, Amanda Allan, Porter Hansen, Debi Derryberry, Mari Devon, Eileen Galindo, Cole Sand","United States, Italy","December 20, 2015",2013,TV-Y7-FV,78 min,"Children & Family Movies, Comedies","Eschewing the carnivorous ways of his fellow lions, maverick Leo follows a vegetarian diet – causing the other lions to shun him."
s7314,Movie,Little Lunch: The Halloween Horror Story,Tim Bartley,"Flynn Curry, Olivia Deeble, Madison Lu, Oisín O'Leary, Faith Seci, Joshua Sitch, Heidi Arena, Wayne Hope",Australia,"March 15, 2018",2016,TV-Y7,23 min,"Children & Family Movies, Comedies","When the class puts on a Halloween play about a boy who leaves behind his friends for a scary new place, it hits too close to home for one student."
s7315,Movie,Little Lunch: The Nightmare Before Graduation,Robyn Butler,"Flynn Curry, Olivia Deeble, Madison Lu, Oisín O'Leary, Faith Seci, Joshua Sitch, Heidi Arena, Wayne Hope",Australia,"March 15, 2018",2016,TV-Y7,25 min,"Children & Family Movies, Comedies",Mrs. Gonsha's students are excited about the end of primary school – until they discover that a classmate might not move on with them.
s7318,Movie,Little Singham aur Kaal ka Mahajaal,Prakash Satam,,,"December 1, 2018",2018,TV-Y7-FV,68 min,"Children & Family Movies, Comedies","When Kaal, the vilest demon on earth, threatens to destroy his village, child cop Little Singham must use his strength and smarts to fight back."
s7319,Movie,Little Singham Bandarpur Mein Hu Ha Hu,,"Anamaya Verma, Ganesh Divekar, Jigna Bharadhwaj, Jitendra Dasadiva, Manoj Pandey, Manish Bhuvan, Meena Nahta, Neshma Chemburkar, Saumya Daan, Sonal Kaushal",,"July 11, 2019",2019,TV-Y7,67 min,"Children & Family Movies, Comedies","Little Singham's sidekick monkey, Chikki, is stuck in the magical land of Bandarpur! Can the kid cop save his beloved pet before danger strikes?"
s7320,Movie,Little Singham in London,Prakash Satam,,,"April 22, 2019",2019,TV-Y7,66 min,"Children & Family Movies, Comedies","Little Singham is in London to meet the queen, but when the famed Kohinoor Diamond gets stolen, the kid cop goes on a wild, citywide hunt for the thief."
s7378,Movie,Magic Snowflake,Luc Vinciguerra,"Nathan Simony, Benoît Allemane, Vincent Grass, Jean-Claude Donda, Alexis Tomassian, Pascal Sellem, Evelyne Grandjean, Alice Révérend, Kylian Trouillard, Céline Melloul","France, Belgium","December 20, 2015",2013,TV-Y,73 min,Children & Family Movies,Young Nicolas agrees to do Santa's work for one year. But the stress of the job threatens the boy's sense of joy – and Christmas itself.
s7380,Movie,Magnus,Benjamin Ree,Magnus Carlsen,Norway,"February 22, 2017",2016,TV-PG,75 min,"Children & Family Movies, Documentaries, International Movies","This dramatic documentary explores the life and mind of Magnus Carlsen, the charismatic Norwegian prodigy who became world chess champion."
s7417,Movie,Mary and the Witch's Flower,Hiromasa Yonebayashi,"Ruby Barnhill, Kate Winslet, Jim Broadbent, Ewen Bremner, Lynda Baron, Louis Ashbourne Serkis, Morwenna Banks, Teresa Gallagher, Rasmus Hardiker",Japan,"July 17, 2018",2017,PG,103 min,"Anime Features, Children & Family Movies","Ordinary girl Mary picks an extraordinary flower and travels to Endor College, a school for magic. But its foremost teachers have a sinister plan."
s7418,Movie,Mary Poppins Returns,Rob Marshall,"Emily Blunt, Lin-Manuel Miranda, Ben Whishaw, Emily Mortimer, Pixie Davies, Nathanael Saleh, Joel Dawson, Julie Walters, Meryl Streep, Colin Firth, Dick Van Dyke","United States, United Kingdom","July 9, 2019",2018,PG,131 min,"Children & Family Movies, Music & Musicals","In 1930s London, Michael Banks and his three children get some help turning their topsy-turvy world around when his magical childhood nanny reappears."
s7453,Movie,Middle School: The Worst Years of My Life,Steve Carr,"Griffin Gluck, Lauren Graham, Rob Riggle, Thomas Barbusca, Andrew Daly, Adam Pally, Retta, Efren Ramirez, Isabela Moner, Alexa Nisenson, Jacob Hopkins","United States, Cambodia","March 3, 2019",2016,PG,92 min,"Children & Family Movies, Comedies","At Hills Village Middle School, budding cartoonist Rafe and best pal Leo challenge their uptight principal by breaking every rule in his handbook."
s7461,Movie,Miracle,Gavin O'Connor,"Kurt Russell, Patricia Clarkson, Noah Emmerich, Sean McCann, Kenneth Welsh, Eddie Cahill, Patrick O'Brien Demsey, Michael Mantenuto, Nathan West, Kenneth Mitchell, Sam Skoryna, Billy Schneider, Michael Kopsa, Beverley Breuer, Lisa Marie Caruk, Ryan Walter, Nate Miller, Joseph Cure, Scott Johnson, Eric Peter-Kaiser, Bobby Hanson","Canada, United States","June 1, 2018",2004,PG,136 min,"Children & Family Movies, Dramas, Sports Movies",U.S. hockey coach Herb Brooks unites a motley crew of college athletes and turns them into a force to be reckoned with at the 1980 Winter Olympics.
s7462,Movie,Mirror Mirror,Tarsem Singh,"Julia Roberts, Lily Collins, Armie Hammer, Nathan Lane, Mare Winningham, Michael Lerner, Sean Bean, Robert Emms, Danny Woodburn, Martin Klebba, Sebastian Saraceno, Jordan Prentice, Mark Povinelli, Joe Gnoffo, Ronald Lee Clark","United States, Canada","April 24, 2020",2012,PG,106 min,"Children & Family Movies, Comedies",This remake of the classic Grimm tale follows fair-skinned Snow White on a quest to regain her royal throne with help from a team of shady dwarves.
s7487,Movie,Monkey Up,Robert Vince,"Jonathan Mangum, Erin Allin O'Reilly, Kayden Magnuson, Danny Woodburn, Skylar Astin, John Ratzenberger, David Milchard",Canada,"March 19, 2016",2016,PG,83 min,"Children & Family Movies, Comedies",A talking monkey famous for his TV commercials dreams of breaking into real movies. But first he stumbles upon a brother and sister who need his help.
s7489,Movie,Monster Family,Holger Tappe,"Celia Imrie, Emily Watson, Catherine Tate, Jason Isaacs, Nick Frost, Jessica Brown Findlay","Germany, United Kingdom","April 4, 2018",2017,PG,93 min,Children & Family Movies,A family’s festive Halloween plans take a spooky turn when an evil witch's curse transforms the costumed clan into actual monsters.
s7490,Movie,Monster High 13 Wishes,Steve Sacks,"Erin Fitzgerald, Missi Hale, Marcus Griffin, Celeste Henderson, Evan Smith, Cindy Robinson, Julie Maddalena, Cam Clarke, Jonquil Goode",United States,"March 1, 2018",2013,TV-Y7,73 min,Children & Family Movies,"It's a new school year at Monster High, and the little sister of Clawdeen Wolf, Howleen, is determined to be more fangtastic than ever."
s7491,Movie,"Monster High: Boo York, Boo York",William Lau,"Karen Strassman, Celeste Henderson, Wendee Lee, TJ Smith, America Young, Rachel Staman, Laura Bailey",United States,"September 29, 2015",2015,TV-Y7,72 min,"Children & Family Movies, Music & Musicals",Cleo is invited to a gala in the big city celebrating a magical comet and brings her best friends along. But the sinister Nefera has other plans.
s7492,Movie,Monster High: Escape from Skull Shores,"Steve Ball, Andrew Duncan","Kate Higgins, Debi Derryberry, Salli Saffioti, Evan Smith, Laura Bailey, Audu Paden, Erin Fitzgerald, Cindy Robinson, Ogie Banks, Cam Clarke",United States,"January 1, 2018",2012,TV-Y7,46 min,Children & Family Movies,"A swanky cruise veers off course for Lagoona and her friends when they're left stranded on Skull Shores, an island with a notorious beast."
s7493,Movie,Monster High: Freaky Fusion,"William Lau, Sylvain Blais","Cam Clarke, Audu Paden, Laura Bailey, Cindy Robinson, Erin Fitzgerald, Kate Higgins, Salli Saffioti, Sue Swan, Haviland Stillwell, Paula Rhodes, America Young, Stephanie Sheh, Josey Montana McCoy",United States,"January 30, 2018",2014,TV-Y7,74 min,Children & Family Movies,"When Frankie Stein travels back in time, a teen scientist follows her home into the present and causes a lab accident that creates four new monsters."
s7494,Movie,Monster High: Friday Night Frights,Dustin McKenzie,"Laura Bailey, Ogie Banks, Cam Clarke, Debi Derryberry, Erin Fitzgerald, Kate Higgins, Julie Maddalena, Audu Paden, Cindy Robinson, Salli Saffioti, Evan Smith, America Young",United States,"January 1, 2018",2013,TV-Y7,46 min,Children & Family Movies,"In their bid to win the Skulltimate Roller Maze championship, Monster High loses its star players, Clawd and Deuce, to injury."
s7495,Movie,Monster High: Fright On!,"Victor Dal Chele, Alfred Gimeno","Kate Higgins, Debi Derryberry, Salli Saffioti, Laura Bailey, Yuri Lowenthal, Audu Paden, Cindy Robinson, Erin Fitzgerald, America Young, Ogie Banks",United States,"January 1, 2018",2011,TV-Y7,46 min,Children & Family Movies,"Big changes are afoot at Monster High when administrators announce a merger with two other schools, designed to bring all monsters together."
s7496,Movie,"Monster High: Frights, Camera, Action!",William Lau,"Sue Swan, Kate Higgins, Celeste Henderson, Marcus Griffin, America Young, Karen Strassman, James Horan, Erin Fitzgerald, Laura Bailey, Yeni Alvarez",United States,"January 1, 2018",2014,TV-Y7,74 min,Children & Family Movies,"Draculaura is whisked to Transylvania to be crowned vampire queen, but when she learns she's been duped, the search is on for the true royal heir."
s7497,Movie,Monster High: Ghouls Rule,"Mike Fetterly, Steve Sacks","Laura Bailey, Hank Banks, Cam Clarke, Erin Fitzgerald, Dee Dee Green, Kate Higgins, Andrew Duncan",United States,"March 1, 2018",2012,TV-Y7,71 min,Children & Family Movies,"After learning that monsters and ""Normies"" used to spend Halloween together, Frankie Stein and her pals rally both groups for a frightfully good time."
s7498,Movie,Monster High: Great Scarrier Reef,William Lau,"Larissa Galagher, Kate Higgins, Debi Derryberry, Salli Saffioti, America Young, Evan Smith, Lyndsy Kail, Rachel Staman, Cherami Leigh, Paula Rhodes, Erin Fitzgerald",United States,"October 1, 2017",2016,TV-Y7,72 min,Children & Family Movies,"At a Monster High party, Lagoona and pals are sucked into the reef, where she'll have to come to terms with her flaws and confront an old frenemy."
s7499,Movie,Monster High: Haunted,"Dan Fraga, William Lau",,United States,"March 24, 2018",2015,TV-Y7,76 min,Children & Family Movies,"Hearing that their old school is being haunted, Spectra Vondergeist and her pals head back to Monster High to get to the bottom of the scary spookery."
s7500,Movie,Monster High: New Ghoul at School,"Audu Paden, Eric Radomski","Kate Higgins, Salli Saffioti, Debi Derryberry, Laura Bailey, Yuri Lowenthal, Audu Paden, Troy Baker, Erin Fitzgerald",United States,"October 1, 2017",2010,TV-Y7,23 min,Children & Family Movies,"Insecure new student Frankie Stein struggles to fit in at Monster High, where ultra-cool ghoul Cleo De Nile and hunky monster Deuce rule the roost."
s7501,Movie,"Monster High: Scaris, City of Frights","Dustin McKenzie, Andrew Duncan, Audu Paden","Laura Bailey, Cam Clarke, Erin Fitzgerald, Dee Dee Green, Celeste Henderson, Kate Higgins, Jonathan Lipow, Julie Maddalena, Dustin McKenzie, Audu Paden",United States,"July 7, 2015",2013,TV-G,60 min,Children & Family Movies,"When Clawdeen gets a chance to study with a top fashion designer, she and her pals hop on a plane to Scaris, France, the city where screams come true."
s7502,Movie,Monster High: Why Do Ghouls Fall in Love?,"Dustin McKenzie, Steve Sacks","Laura Bailey, Ogie Banks, Cam Clarke, Debi Derryberry, Erin Fitzgerald, Kate Higgins, Jonathan Lipow, Audu Paden, Cindy Robinson, Salli Saffioti, Evan Smith, America Young",United States,"January 1, 2018",2013,TV-Y7,46 min,Children & Family Movies,Draculaura's ghoulfriends have some suspicions about one of her two persistent suitors – but can they stop him before he steals her un-beating heart?
s7514,Movie,Motu Patlu: King of Kings,Suhas Kadav,"Saurav Chakrabarty, Vinay Pathak",India,"July 6, 2017",2016,TV-Y7-FV,109 min,"Children & Family Movies, Comedies","Motu and Patlu want to help a circus lion get back to the jungle. On the way, the three become caught up in an exciting adventure in the forest."
s7526,Movie,Mune: Guardian of the Moon,"Alexandre Heboyan, Benoît Philippon","Joshua J. Ballard, Nicole Provost, Trevor Devall, Michael Dobson, Jonathan Love, Davey Grant",France,"January 26, 2018",2014,PG,85 min,Children & Family Movies,"When the old guardian of the moon retires, the mischievous Mune is chosen as his successor, but he worries he's not up to the job."
