show_id,type,title,director,cast,country,date_added,release_year,rating,duration,listed_in,description
s1557,Movie,A Trash Truck Christmas,Eddie Rosas,"Henry Keane, Glen Keane, Lucas Neff, Brian Baumgartner, Jackie Loeb, John DiMaggio",,"December 11, 2020",2020,TV-Y,28 min,Children & Family Movies,"When Santa crash-lands in the junkyard on Christmas Eve, Hank, Trash Truck and their animal friends all have a hand in rescuing the holiday for everyone."
s1558,Movie,Canvas,Frank E. Abney III,,United States,"December 11, 2020",2020,G,9 min,"Children & Family Movies, Dramas","After a heartbreaking loss, a grandfather struggling to reclaim his passion for painting finds the inspiration to create again."
s1577,Movie,Bobbleheads The Movie,Kirk Wise,"Jennifer Coolidge, Karen Fukuhara, Khary Payton, Julian Sands, Brenda Song, Luke Wilson, Cher",United States,"December 8, 2020",2020,PG,83 min,"Children & Family Movies, Comedies",A team of bobbleheads band together to defend their collector’s home when uninvited relatives barge in looking to steal from his prized collection.
s1581,Movie,Spirit Riding Free: Ride Along Adventure,"Beth Sleven, Allan Jacobsen, Kevin Wotton","Amber Frank, Bailey Gambertoglio, Sydney Park, Katey Sagal, Rachel Kimsey, Darcy Rose Byrnes, Duncan Joiner, Bella Aboulhosn, Kai Scott",United States,"December 8, 2020",2020,TV-Y7,79 min,Children & Family Movies,Join Lucky and her friends on an interactive mission to save Maricela’s beloved mare from greedy horse thieves who've taken her captive with a wild herd.
s1582,Movie,Super Monsters: Santa’s Super Monster Helpers,Steve Ball,"Elyse Maloway, Vincent Tong, Erin Mathews, Andrea Libman, Alessandro Juliani, Nicole Anthony, Diana Kaarina, Gigi Saul Guerrero, Rukiya Bernard, Asia Mattu, Elicia MacKenzie",,"December 8, 2020",2020,TV-Y,24 min,Children & Family Movies,"When Santa needs serious help prepping all of his presents, the Super Monsters lend a hand — and some monster magic — to get every gift out on time!"
s1589,Movie,Mighty Express: A Mighty Christmas,Clint Butler,"Jay Hatton, Zoe Hatz, Meesha Contreras, Dylan Schombing, Tyler Nathan, Leo Orgil, Michela Luci, Ian Ho, Evan Lefeuvre, Annick Obonsawin, Gracen Daly",Canada,"December 5, 2020",2020,TV-Y,26 min,Children & Family Movies,The Mighty Express welcomes a new train and speeds into a snowstorm to deliver Santa’s presents and save Christmas for all the kids in Tracksville.
s1592,Movie,Captain Underpants Mega Blissmas,"Erik Kling, Kevin Peaty","Nat Faxon, Jay Gragnani, Ramone Hamilton, Sean Astin, Dayci Brookshire, Jim Cummings, Jorge Diaz",United States,"December 4, 2020",2020,TV-Y7,46 min,"Children & Family Movies, Comedies",Christmas gets weird — really weird — after George and Harold go back in time to change up a few of their beloved holiday's traditions.
s1598,Movie,You Are My Home,Amanda Raymond,"Alyssa Milano, Angel Parker, Cristián de la Fuente, Eva Ariel Binder, Joel Steingold",United States,"December 4, 2020",2020,TV-PG,93 min,"Children & Family Movies, Dramas","After becoming separated from her family, a young girl finds herself in the care of a heartbroken woman who faces her own struggles."
s1601,Movie,Chico Bon Bon and the Very Berry Holiday,Darragh O'Connell,"Robbie Daymond, Dayci Brookshire, Anthony Tedesco, Andy Abbott, Emma Sloan Jacobs, Joanna Lewis, Matt Mercer, Ian Nikus",,"December 3, 2020",2020,TV-Y,25 min,Children & Family Movies,"The Fix-It Force makes a plan to hit every home as fast as they can, delivering Blunderberry Cakes before the town awakes to avoid a holiday disaster."
s1610,Movie,Angela's Christmas Wish,Damien O’Connor,"Lucy O'Connell, Brendan Mullins, Ruth Negga, Lola Metcalfe, Jared Harris, Moe Dunford, Oscar Butler, Shona Hamill, Pat Kinevane, Janet Moran, Anya O'Connor",United States,"December 1, 2020",2020,TV-Y,48 min,Children & Family Movies,"With her father working far away in Australia, a determined Angela makes a plan — and a heartfelt wish — to reunite her family in time for the holidays."
s1617,Movie,Monster House,Gil Kenan,"Mitchel Musso, Sam Lerner, Spencer Locke, Steve Buscemi, Kathleen Turner, Jason Lee, Jon Heder, Maggie Gyllenhaal, Catherine O'Hara, Fred Willard, Nick Cannon, Kevin James",United States,"December 1, 2020",2006,PG,91 min,"Children & Family Movies, Comedies","A trio of friends sets out to expose the terrors of a vacant neighborhood house, which appears to have a craving for people — and a life of its own."
s1633,Movie,Spookley and the Christmas Kittens,Bernie Denk,"Vlasta Vrana, Sonja Ball, Craig Francis, Richard C. Jones, Michael Perron, Terrence Scammell, Bruce Dinsmore, Jennifer Seguin, Daniel Brochu",United States,"November 30, 2020",2019,TV-Y,45 min,Children & Family Movies,"When a green cat and three stray kittens wind up at Holiday Hill Farm, Spookley the Square Pumpkin and his friends help the felines find their way home."
s1636,Movie,A Go! Go! Cory Carson Christmas,"Stanley Moore, Alex Woo","Alan C. Lim, Taron C. Hensley, Maisie Benson, Kerry Gudjohnsen, Paul Killam, Smith Foreman, Ann Kendrick, Ella Joy Ballesteros, Neena-Sinaii Simpo, Eli Morse",United States,"November 27, 2020",2020,TV-Y,22 min,Children & Family Movies,"When a familiar-looking stranger crashes in without a memory, Cory helps him remember the magic of Christmas to save the holiday for everyone."
s1637,Movie,Dance Dreams: Hot Chocolate Nutcracker,Oliver Bokelberg,Debbie Allen,United States,"November 27, 2020",2020,TV-PG,81 min,"Children & Family Movies, Documentaries","This documentary spotlights Debbie Allen's career and follows her group of dance students as they prepare for Allen's annual ""Hot Chocolate Nutcracker."""
s1652,Movie,The Christmas Chronicles: Part Two,Chris Columbus,"Kurt Russell, Goldie Hawn, Darby Camp, Jahzir Bruno, Julian Dennison, Judah Lewis, Kimberly Williams-Paisley, Tyrese Gibson",Canada,"November 25, 2020",2020,PG,115 min,"Children & Family Movies, Comedies","Unhappy over her mom’s new relationship, a now-teenage Kate runs away and lands at the North Pole, where a naughty elf is plotting to cancel Christmas."
s1656,Movie,Dragons: Rescue Riders: Huttsgalor Holiday,"Greg Rankin, TJ Sullivan","Noah Kaye Bentley, Brennley Brown, Zach Callison, Nicolas Cantu, Skai Jackson, Marsai Martin, Andre Robinson, Carlos Alazraqui, Roshon Fegan, Grey Griffin, Brad Grusnick, Sam Lavagnino, John C. McGinley, Roger Craig Smith",United States,"November 24, 2020",2020,TV-Y,46 min,"Children & Family Movies, Comedies",Snowfall marks the start of Odinyule — the Viking holiday of giving! But crazy weather might cancel the tradition unless the Rescue Riders can swoop in.
s1664,Movie,Dolly Parton’s Christmas on the Square,Debbie Allen,"Dolly Parton, Christine Baranski, Treat Williams, Jenifer Lewis, Josh Segarra, Jeanine Mason, Mary Lane Haskell",United States,"November 22, 2020",2020,TV-PG,99 min,"Children & Family Movies, Music & Musicals","Seasonal cheer comes to a screeching halt when a cold-hearted woman tries to sell her hometown's land. Can music, magic and memories change her mind?"
s1667,Movie,Alien Xmas,Stephen Chiodo,"Keythe Farley, Dee Bradley Baker, Kaliayh Rhambo, Michelle Deco, Barbara Goodson",United States,"November 20, 2020",2020,TV-Y,42 min,Children & Family Movies,"A young elf mistakes a tiny alien for a Christmas gift, not knowing her new plaything has plans to destroy Earth's gravity — and steal all the presents."
s1672,Movie,The App That Stole Christmas,Monica Floyd,"Jackie Long, Diane Marie Howard, Jaylin Hall, Miguel A. Núñez Jr., Ray J, JayQ The Legend, J. Anthony Brown, Kenny Rhodes, Amber Cosich",United States,"November 20, 2020",2020,TV-PG,64 min,"Children & Family Movies, Comedies","A tech entrepreneur's Christmas shopping app is a smashing success, but he starts to realize his invention might be ruining the holiday spirit."
s1682,Movie,The Princess Switch: Switched Again,Mike Rohl,"Vanessa Hudgens, Nick Sagar, Sam Palladio, Mia Lloyd, Lachlan Nieboer, Ricky Norwood, Florence Hall, Suanne Braun, Mark Fleischmann",United States,"November 19, 2020",2020,TV-G,97 min,"Children & Family Movies, Comedies, Dramas","When Margaret's Christmas coronation complicates her love life, her double Stacy steps in to save the day. But will a third look-alike ruin their plan?"
s1695,Movie,Cloudy with a Chance of Meatballs 2,"Cody Cameron, Kris Pearn","Bill Hader, Anna Faris, James Caan, Will Forte, Andy Samberg, Benjamin Bratt, Neil Patrick Harris, Terry Crews, Kristen Schaal",United States,"November 15, 2020",2013,PG,95 min,"Children & Family Movies, Comedies","Inventor Flint Lockwood battles mutant food beasts created by his notorious machine, including shrimpanzees, tacodiles and jellyfish sandwiches."
s1700,Movie,White Christmas,Michael Curtiz,"Bing Crosby, Danny Kaye, Rosemary Clooney, Vera-Ellen, Dean Jagger, Mary Wickes, John Brascia, Anne Whitfield, George Chakiris",United States,"November 15, 2020",1954,TV-G,120 min,"Children & Family Movies, Classic Movies, Comedies","Two war buddies fall for two sisters and follow the girls to a resort owned by their former commanding officer, who is in danger of losing the place."
s1703,Movie,Fukrey Boyzzz: Space Mein Fukrapanti,Avinash Walzade,"Viraaj Modgill, Jasleen Singh, Pooja Punjabi, Amit Deondi, Ketan Kava, Zeel Thakkar, Manish Bhavan, Viswanathan Sridhar",India,"November 13, 2020",2020,TV-Y7,75 min,"Children & Family Movies, Comedies","After a foreboding dream about aliens comes true, a fun-loving trio must prevent human intelligence from being stolen from planet Earth."
s1704,Movie,Jingle Jangle: A Christmas Journey,David E. Talbert,"Forest Whitaker, Keegan-Michael Key, Hugh Bonneville, Anika Noni Rose, Madalen Mills, Phylicia Rashad, Ricky Martin, Justin Cornwell, Sharon Rose, Lisa Davina Phillip, Kieron Dyer",United States,"November 13, 2020",2020,PG,124 min,"Children & Family Movies, Music & Musicals","Decades after his trusted apprentice betrayed him, a once-joyful toymaker finds new hope when his kind and curious granddaughter comes into his life."
s1737,Movie,Operation Christmas Drop,Martin Wood,"Kat Graham, Alexander Ludwig, Virginia Madsen, Janet Kidder, Jeff Joseph, Bethany Brown, Trezzo Mahoro, Rohan Campbell, Aliza Vellani, Aaron Douglas, Xavier de Guzman, Bruce Best",United States,"November 5, 2020",2020,TV-G,96 min,"Children & Family Movies, Comedies, Romantic Movies",A by-the-book political aide falls for a big-hearted Air Force pilot while looking to shut down his tropical base and its airborne Christmas tradition.
s1750,Movie,Christmas Break-In,Michael Kampa,"Danny Glover, Denise Richards, Cameron Seely, Sean O'Bryan, Katrina Begin, Jake Van Wagoner, Douglas Spain, Dawson Ehlke",United States,"November 1, 2020",2019,TV-PG,87 min,"Children & Family Movies, Comedies","Stranded at school before holiday break, a precocious girl gets into the spirit of saving when a trio of robbers trespass and hold the janitor hostage."
s1752,Movie,Elf Pets: A Fox Cub’s Christmas Tale,Chanda Bell,"Leslie Bellair, Brad Hyland, Brody Rose, Carol Aebersold",United States,"November 1, 2020",2020,TV-Y,28 min,Children & Family Movies,An elite team of elves – and their furry fox cub friends – help bring the Christmas spirit to a boy whose mom may not make it home for the holidays.
s1753,Movie,Elf Pets: Santa’s Reindeer Rescue,Chanda Bell,"Brad Hyland, Drew Barber, Ashley Roberts, Lowrey Brown, Kristyl Tift, Manny Mahen, Olivia Berkeley, Eleanor Rocha",United States,"November 1, 2020",2020,TV-Y,27 min,Children & Family Movies,"Determined to help Santa get ready for his merry rounds of gift-giving, a team of special elves wrangles in more reindeer and much-needed holiday magic."
s1754,Movie,Elliot the Littlest Reindeer,Jennifer Westcott,"Josh Hutcherson, Samantha Bee, Martin Short, Morena Baccarin, Jeff Dunham, John Cleese",Canada,"November 1, 2020",2018,PG,90 min,Children & Family Movies,"When Blitzen suddenly retires, a miniature horse determined to join Santa's reindeer team faces fierce competition in the North Pole tryouts."
s1762,Movie,Little Monsters,Richard Greenberg,"Fred Savage, Howie Mandel, Daniel Stern, Margaret Whitton, Rick Ducommun, Frank Whaley, Ben Savage, William Murray Weiss, Devin Ratray, Amber Barretto",United States,"November 1, 2020",1989,PG,102 min,"Children & Family Movies, Comedies","Brian knows there are creatures under his bed. When he faces his fears and confronts them, however, he makes some hilariously weird new friends."
s1802,Movie,Over the Moon,Glen Keane,"Cathy Ang, Phillipa Soo, Ken Jeong, Robert G. Chiu, John Cho, Sandra Oh, Ruthie Ann Miles, Margaret Cho, Kimiko Glenn, Artt Butler, Irene Tsu, Clem Cheung, Conrad Ricamora","China, United States","October 23, 2020",2020,PG,100 min,"Children & Family Movies, Music & Musicals","Fueled by memories of her mother, resourceful Fei Fei builds a rocket to the moon on a mission to prove the existence of a legendary moon goddess."
s1816,Movie,The Magic School Bus Rides Again The Frizz Connection,Richard Weston,"Kate McKinnon, Roman Lutterotti, Mikaela Blake, Gabby Clarke, Leke Maceda-Rustecki, Matthew Mucci, Birva Pandya, Lynsey Pham, Kaden Stephen",Canada,"October 20, 2020",2020,TV-Y,46 min,Children & Family Movies,"Lightning splits the Magic School Bus into three pieces, scattering the class across the globe with different versions of Ms. Frizzle aboard each bus!"
s1834,Movie,ParaNorman,"Sam Fell, Chris Butler","Kodi Smit-McPhee, Tucker Albrizzi, Anna Kendrick, Casey Affleck, Christopher Mintz-Plasse, Leslie Mann, Jeff Garlin, Elaine Stritch, Bernard Hill, Jodelle Ferland, Tempestt Bledsoe, Alex Borstein, John Goodman",United States,"October 18, 2020",2012,PG,93 min,"Children & Family Movies, Comedies","When an army of zombies invades a small town, it's up to an odd local boy with a knack for communicating with the dead to save the day."
s1845,Movie,A Babysitter's Guide to Monster Hunting,Rachel Talalay,"Tamara Smart, Oona Laurence, Tom Felton, Troy Leigh-Anne Johnson, Lynn Masako Cheng, Ty Consiglio, Ian Ho, Indya Moore, Alessio Scalzotto, Tamsen McDonough",United States,"October 15, 2020",2020,TV-PG,99 min,Children & Family Movies,"Recruited by a secret society of babysitters, a high schooler battles the Boogeyman and his monsters when they nab the boy she's watching on Halloween."
s1860,Movie,Octonauts & the Great Barrier Reef,Blair Simmons,"Simon Greenall, Rob Rackstraw, Jo Wyatt, Paul Buckley, Simon Foster, Teresa Gallagher, Richard Grieve, Michael Murphy, Paul Panting, Keith Wickham",United Kingdom,"October 13, 2020",2020,TV-Y,47 min,Children & Family Movies,"In this musical special, the Octonauts must find a way to hold back hungry swarms of coral-eating starfish to save a new friend’s fragile reef home."
s1872,Movie,Super Monsters: Dia de los Monsters,,,Canada,"October 9, 2020",2020,TV-Y,25 min,Children & Family Movies,"The Super Monsters celebrate Día de los Muertos in Vida’s hometown with her magical family, some new monster friends and a spook-tacular parade!"
s1884,Movie,StarBeam: Halloween Hero,Jon Izen,"Nahanni Mitchell, Dean Petriw, Terry Klassen, Sam Vincent, Rhona Rees, Laara Sadiq",Canada,"October 6, 2020",2020,TV-Y,33 min,Children & Family Movies,"Greedy Captain Fishbeard is stealing everybody's Halloween treats for himself, but StarBeam and Boost have some tricks up their sleeves to save the day!"
s1893,Movie,A Go! Go! Cory Carson Halloween,"Alex Woo, Stanley Moore","Alan C. Lim, Smith Foreman, Maisie Benson, Ann Kendrick, Kerry Gudjohnsen, Paul Killam, Stanley Moore, Tyler Hendrix, Ella Joy Ballesteros, Jimmy Olea",,"October 2, 2020",2020,TV-Y,22 min,Children & Family Movies,"Cory, Chrissy and Freddie are on the hunt for king-sized candy bars this Halloween! But are all the treats worth the trek to the spooky side of town?"
s1960,Movie,Enola Holmes,Harry Bradbeer,"Millie Bobby Brown, Henry Cavill, Sam Claflin, Helena Bonham Carter, Louis Partridge, Burn Gorman, Adeel Akhtar, Susan Wokoma, Frances de la Tour, Fiona Shaw",United Kingdom,"September 23, 2020",2020,PG-13,124 min,"Action & Adventure, Children & Family Movies, Dramas","While searching for her missing mother, intrepid teen Enola Holmes uses her sleuthing skills to outsmart big brother Sherlock and help a runaway lord."
s1986,Movie,Horrid Henry's Gross Day Out,Gary Andrews,"Lizzie Waterworth-Santo, Emma Tate, Sue Elliot Nicholls, Tamsin Heatley, Wayne Forester, Aidan Cook, Philip Pope",United Kingdom,"September 17, 2020",2020,TV-Y,61 min,"Children & Family Movies, Comedies","Worlds collide when Henry makes plans to spend Saturday on the sofa watching a ""Gross Class Zero"" marathon — and his favorite characters come to life!"
s2004,Movie,The Smurfs 2,Raja Gosnell,"Neil Patrick Harris, Brendan Gleeson, Jayma Mays, Hank Azaria, Katy Perry, Christina Ricci, Jonathan Winters, J.B. Smoove, George Lopez, Anton Yelchin, Fred Armisen, Jacob Tremblay, Alan Cumming","United States, France, Canada, Belgium","September 15, 2020",2013,PG,105 min,"Children & Family Movies, Comedies","Evil magician Gargamel continues his quest to tap the power of the Smurfs, creating a pair of his own ""Smurf-alikes"" called the Naughties."
s2005,Movie,Wish Upon a Unicorn,Steve Bencich,"Ryan Kiera Armstrong, Summer Fontana, Kevin J. O'Connor, Tait Blum, Jon Gries, Branscombe Richmond, Rick Overton, Jonathan Lajoie, Chloe Webb",,"September 15, 2020",2020,PG,93 min,Children & Family Movies,Sisters Mia and Emma move to their grandmother’s farm far from the city and save a magical unicorn from local cowboys seeking its powers for themselves.
s2008,Movie,Dad Wanted,Javier Colinas,"Natalia Coronado, Juan Pablo Medina, Silvia Navarro, Roberto Quijano, Victoria Viera, Arantxa Servín, Aleyda Gallardo, Joaquín Emanuel, Abril Michel, Omar Fierro, Luis Ernesto Franco, Patricia Reyes Spíndola, Rodrigo Murray, Luis Arrieta, Alberto Guerra, Moisés Arizmendi, David Fridman, Martha Claudia Moreno, Ela Velden, Gonzalo García Vivanco, Mauricio Argüelles, César Rodríguez",Mexico,"September 11, 2020",2020,TV-14,103 min,"Children & Family Movies, Comedies, Dramas",What does a thrill-seeker tween girl do when her mom forbids her to enter a BMX race? Cast an actor with nothing to lose to play her approving dad.
s2011,Movie,How to Train Your Dragon 2,Dean DeBlois,"Jay Baruchel, Cate Blanchett, Gerard Butler, Craig Ferguson, America Ferrera, Jonah Hill, Christopher Mintz-Plasse, T.J. Miller, Kristen Wiig, Djimon Hounsou, Kit Harington",United States,"September 11, 2020",2014,PG,102 min,Children & Family Movies,"Hiccup, Toothless and a mysterious dragon rider join forces to protect the island of Berk from a power-hungry warrior with a dragon army of his own."
s2012,Movie,Pets United,Reinhard Klooss,"Patrick Roche, Natalie Dormer, Eddie Marsan, Felix Auer, Jeff Burrell, Harvey Friedman, Marty Sander, Ian Odle, Bryan Larkin","Germany, China, United Kingdom","September 11, 2020",2020,TV-Y7,93 min,"Children & Family Movies, Comedies",A street-smart dog and a pampered cat join forces to lead a pack of unlikely heroes when their city is seized by its evil mayor — and his robot army.
s2021,Movie,Dhh,Manish Saini,"Naseeruddin Shah, Kahaan, Kuldeep Sodha",India,"September 10, 2020",2017,TV-G,127 min,"Children & Family Movies, Dramas, International Movies","Convinced only a miracle can save them from failing school exams, a trio of friends seek help from a magician. To their surprise, he gamely complies."
s2028,Movie,Satria Heroes: Revenge of the Darkness,"Kenzo Maihara, Amandha Wyanto","Christian Loho, Fernando Surya, Yayan Ruhian, Stella Cornelia, Yui Takano, Safira Ratu, Faris Fadjar Munggaran, Adhitya Alkatiri",Indonesia,"September 10, 2020",2017,TV-G,92 min,Children & Family Movies,"As he rebuilds society in a parallel universe, a superhero must return to Earth to help his equally powerful friend defend the planet from evil rivals."
s2039,Movie,My Octopus Teacher,"Pippa Ehrlich, James Reed",,South Africa,"September 7, 2020",2020,TV-G,86 min,"Children & Family Movies, Documentaries, International Movies","A filmmaker forges an unusual friendship with an octopus living in a South African kelp forest, learning as the animal shares the mysteries of her world."
s2057,Movie,Hotel for Dogs,Thor Freudenthal,"Emma Roberts, Jake T. Austin, Kyla Pratt, Lisa Kudrow, Kevin Dillon, Don Cheadle, Johnny Simmons, Troy Gentile, Eric Edelstein, Robinne Lee, Ajay Naidu","Germany, United States","September 2, 2020",2009,PG,101 min,"Children & Family Movies, Comedies","Placed in a foster home that doesn't allow pets, 16-year-old Andi and her younger brother Bruce turn an abandoned hotel into a home for their dog."
s2062,Movie,Barbie Princess Adventure,Conrad Helten,"America Young, Erica Lindbeck, Ritesh Rajan, Dave Fennoy, Stephanie Sheh, Cristina Milizia, Desirae Whitfield, Emma Galvin, Angelo Restaino, Eamon Brennan, Ogie Banks",Netherlands,"September 1, 2020",2020,TV-Y,72 min,"Children & Family Movies, Music & Musicals","Through music and magic, Barbie learns what it's like to be a modern princess when she trades places with a royal lookalike."
s2072,Movie,Puss in Boots,Chris Miller,"Antonio Banderas, Salma Hayek, Zach Galifianakis, Billy Bob Thornton, Amy Sedaris, Constance Marie, Guillermo del Toro, Mike Mitchell",United States,"September 1, 2020",2011,PG,92 min,"Children & Family Movies, Comedies",The fabled feline heads to the Land of Giants with friends Humpty Dumpty and Kitty Softpaws on a quest to nab its greatest treasure: the Golden Goose.
s2077,Movie,The Boss Baby: Get That Baby!,"Dan Forgione, Pete Jacobs, Matt Whitlock","JP Karliak, Pierce Gagnon, Alex Cazares, Kevin Michael Richardson, Flula Borg, Rhys Darby, Wendie Malick, Jake Green",United States,"September 1, 2020",2020,TV-Y7,115 min,"Children & Family Movies, Comedies",Think you've got what it takes to be the boss? This interactive special puts your skills to the test and matches you up with one of 16 jobs at Baby Corp.
s2080,Movie,The Smurfs,Raja Gosnell,"Hank Azaria, Neil Patrick Harris, Jayma Mays, Sofía Vergara, Tim Gunn, Jonathan Winters, Katy Perry, Alan Cumming, Fred Armisen, George Lopez, Anton Yelchin, Kenan Thompson, Jeff Foxworthy, John Oliver, Wolfgang Puck, B.J. Novak, Paul Reubens","United States, Belgium, Canada, France","September 1, 2020",2011,PG,103 min,"Children & Family Movies, Comedies","When evil Gargamel tries to capture them, the Smurfs flee their woodland home, pass through a magic portal and find themselves stranded in New York."
s2082,Movie,True: Friendship Day,"Mark Thornton, Todd Kauffman","Michela Luci, Jamie Watson, Eric Peterson, Anna Claire Bartlam, Nicolas Aqui, Cory Doran, Julie Lemieux, Derek McGrath",Canada,"September 1, 2020",2020,TV-Y,24 min,Children & Family Movies,"When a giant Grippity-Grab snags Grizelda’s friendship bracelet and turns her into a mermaid, True heads under the sea with magic wishes to save the day."
s2108,Movie,The Sleepover,Trish Sie,"Sadie Stanley, Maxwell Simkins, Ken Marino, Malin Akerman, Cree Cicchino, Lucas Jaye, Karla Souza, Enuka Okuma, Erik Griffin, Joe Manganiello",United States,"August 21, 2020",2020,TV-PG,104 min,"Action & Adventure, Children & Family Movies, Comedies",What do you do if your parents are kidnapped by a crew of international thieves? You begin a wild overnight adventure — complete with spy gear.
s2115,Movie,Little Singham: Kaal Ka Badla,Prakash Satam,"Anamaya Verma, Arushi Talwar, Ganesh Divekar, Jigna Bhardwaj, Krishna Dasadiya, Neshma Chemburkar, Manoj Pandey, Parminder Ghumman, Pranav Vaidya, Saumya Daan, Sonal Kaushal, Sumriddhi Shukla",,"August 19, 2020",2020,TV-Y7,70 min,"Children & Family Movies, Comedies","Little Singham’s biggest enemy, the demon Kaal, is back and badder than ever — but this time, will he succeed in destroying the world’s best kid cop?"
s2130,Movie,Fearless,Cory Edwards,"Yara Shahidi, Miles Robbins, Miguel J. Pimentel, Gabrielle Union, Jadakiss, Tom Kenny, Angie Martinez, Harland Williams, Fat Joe, Amari McCoy, Dwyane Wade",Canada,"August 14, 2020",2020,TV-Y7,92 min,"Children & Family Movies, Comedies",A teen gamer is forced to level up to full-time babysitter when his favorite video game drops three superpowered infants from space into his backyard.
s2132,Movie,Octonauts & the Caves of Sac Actun,Blair Simmons,"Teresa Gallagher, Simon Greenall, Keith Wickham, Rob Rackstraw, Michael Murphy, Jo Wyatt, Helen Walsh, Andres Williams, Paul Panting",United Kingdom,"August 14, 2020",2020,TV-Y,72 min,Children & Family Movies,"The Octonauts embark on an underwater adventure, navigating a set of challenging caves to help a small octopus friend return home to the Caribbean Sea."
s2143,Movie,Mr. Peabody & Sherman,Rob Minkoff,"Ty Burrell, Max Charles, Ariel Winter, Stephen Colbert, Leslie Mann, Stanley Tucci, Allison Janney, Mel Brooks, Patrick Warburton, Stephen Tobolowsky, Lake Bell",United States,"August 11, 2020",2014,PG,93 min,"Children & Family Movies, Comedies, Sci-Fi & Fantasy","Resurrected from the 1960s animated series ""Rocky and Bullwinkle,"" canine genius Mr. Peabody and young Sherman take a dizzying ride through time."
s2156,Movie,The Magic School Bus Rides Again Kids In Space,Richard Weston,"Kate McKinnon, Matthew Mucci, Mikaela Blake, Gabby Clarke, Roman Lutterotti, Leke Maceda-Rustecki, Birva Pandya, Lynsey Pham, Kaden Stephen",United States,"August 7, 2020",2020,TV-Y,46 min,Children & Family Movies,The Magic School Bus kids blast into orbit — and onto the International Space Station — only to find themselves on the run from a giant tardigrade!
