show_id,type,title,director,cast,country,date_added,release_year,rating,duration,listed_in,description
s7,Movie,My Little Pony: A New Generation,"Robert Cullen, José Luis Ucha","Vanessa Hudgens, Kimiko Glenn, James Marsden, Sofia Carson, Liza Koshy, Ken Jeong, Elizabeth Perkins, Jane Krakowski, Michael McKean, Phil LaMarr",,"September 24, 2021",2021,PG,91 min,Children & Family Movies,"Equestria's divided. But a bright-eyed hero believes Earth Ponies, Pegasi and Unicorns should be pals — and, hoof to heart, she’s determined to prove it."
s14,Movie,Confessions of an Invisible Girl,Bruno Garotti,"Klara Castanho, Lucca Picon, Júlia Gomes, Marcus Bessa, Kiria Malheiros, Fernanda Concon, Gabriel Lima, Caio Cabral, Leonardo Cidade, Jade Cardozo",,"September 22, 2021",2021,TV-PG,91 min,"Children & Family Movies, Comedies","When the clever but socially-awkward Tetê joins a new school, she'll do anything to fit in. But the queen bee among her classmates has other ideas."
s24,Movie,Go! Go! Cory Carson: Chrissy Takes the Wheel,"Alex Woo, Stanley Moore","Maisie Benson, Paul Killam, Kerry Gudjohnsen, AC Lim",,"September 21, 2021",2021,TV-Y,61 min,Children & Family Movies,"From arcade games to sled days and hiccup cures, Cory Carson’s curious little sister Chrissy speeds off on her own for fun and adventure all over town!"
s65,Movie,Nightbooks,David Yarovesky,"Winslow Fegley, Lidya Jewett, Krysten Ritter",,"September 15, 2021",2021,TV-PG,103 min,Children & Family Movies,Scary story fan Alex must tell a spine-tingling tale every night — or stay trapped with his new friend in a wicked witch's magical apartment forever.
s72,Movie,A StoryBots Space Adventure,David A. Vargas,"Evan Spiridellis, Erin Fitzgerald, Jeff Gill, Fred Tatasciore, Evan Michael Lee, Jared Isaacman, Sian Proctor, Chris Sembroski, Hayley Arceneaux",,"September 14, 2021",2021,TV-Y,13 min,Children & Family Movies,Join the StoryBots and the space travelers of the historic Inspiration4 mission as they search for answers to kids' questions about space.
s76,Movie,You vs. Wild: Out Cold,Ben Simms,"Bear Grylls, Jason Derek Prempeh",,"September 14, 2021",2021,TV-G,106 min,Children & Family Movies,"After a plane crash leaves Bear with amnesia, he must make choices to save the missing pilot and survive in this high-stakes interactive adventure."
s78,Movie,Little Singham - Black Shadow,Prakash Satam,"Sumriddhi Shukla, Jigna Bharadwaj, Sonal Kaushal, Neshma Chemburkar, Ganesh Divekar, Annamaya Verma, Anamay Verma, Manoj Pandey",,"September 11, 2021",2021,TV-Y7,48 min,"Children & Family Movies, Comedies",Kid cop Little Singham loses all his superpowers while trying to stop the demon Kaal’s new evil plans! Can his inner strength help him defeat the enemy?
s81,Movie,Firedrake the Silver Dragon,Tomer Eshed,"Thomas Brodie-Sangster, Felicity Jones, Freddie Highmore, Patrick Stewart, Meera Syal, Sanjeev Bhaskar, Nonso Anozie",,"September 10, 2021",2021,TV-Y7,93 min,Children & Family Movies,"When his home is threatened by humans, a young dragon summons the courage to seek a mythical paradise where dragons can live in peace and fly free."
s95,Movie,Show Dogs,Raja Gosnell,"Will Arnett, Ludacris, Natasha Lyonne, Stanley Tucci, Jordin Sparks, Gabriel Iglesias, Shaquille O'Neal, Omar Chaparro, Alan Cumming, Andy Beckwith, Delia Sheppard, Kerry Shale","United Kingdom, United States","September 8, 2021",2018,PG,90 min,"Children & Family Movies, Comedies",A rough and tough police dog must go undercover with an FBI agent as a prim and proper pet at a dog show to save a baby panda from an illegal sale.
s108,Movie,A Champion Heart,David de Vos,"Mandy Grace, David de Vos, Donna Rusch, Devan Key, Isabella Mancuso, Ariana Guido",United States,"September 4, 2021",2018,G,90 min,"Children & Family Movies, Dramas","When a grieving teen must work off her debt to a ranch, she cares for a wounded horse that teaches her more about healing than she expected."
s128,Movie,A Cinderella Story,Mark Rosman,"Hilary Duff, Chad Michael Murray, Jennifer Coolidge, Dan Byrd, Regina King, Julie Gonzalo, Lin Shaye, Madeline Zima, Andrea Avery, Mary Pat Gleason, Paul Rodriguez, Whip Hubley, Kevin Kilner, Erica Hubbard, Simon Helberg","United States, Canada","September 1, 2021",2004,PG,95 min,"Children & Family Movies, Comedies",Teen Sam meets the boy of her dreams at a dance before returning to toil in her stepmother's diner. Can her lost cell phone bring them together?
s131,Movie,Barbie Big City Big Dreams,Scott Pleydell-Pearce,"America Young, Amber May, Giselle Fernandez, Alejandro Saab, Dinora Walcott",,"September 1, 2021",2021,TV-Y,63 min,"Children & Family Movies, Music & Musicals","At a summer performing arts program in New York City, Barbie from Malibu meets Barbie from Brooklyn, and the two become fast friends."
s156,Movie,Labyrinth,Jim Henson,"David Bowie, Jennifer Connelly, Frank Oz, Kevin Clash, Anthony Asbury, Dave Goelz, Brian Henson, Ron Mueck, Karen Prell, Shari Weiser","United Kingdom, United States","September 1, 2021",1986,PG,101 min,"Action & Adventure, Children & Family Movies, Cult Movies","In Jim Henson's fantasy, teen Sarah embarks on a life-altering quest to rescue her little brother from the clutches of a treacherous goblin."
s168,Movie,Open Season 2,"Matthew O'Callaghan, Todd Wilderman","Joel McHale, Mike Epps, Jane Krakowski, Billy Connolly, Crispin Glover, Steve Schirripa, Georgia Engel, Diedrich Bader, Cody Cameron, Fred Stoller, Olivia Hack","United States, Canada","September 1, 2021",2008,PG,76 min,"Children & Family Movies, Comedies",Elliot the buck and his forest-dwelling cohorts must rescue their dachshund pal from some spoiled pets bent on returning him to domesticity.
s169,Movie,Osmosis Jones,"Bobby Farrelly, Peter Farrelly","Chris Rock, Laurence Fishburne, David Hyde Pierce, Brandy Norwood, William Shatner, Ron Howard, Kid Rock, Ben Stein",United States,"September 1, 2021",2001,PG,95 min,"Action & Adventure, Children & Family Movies, Comedies",Peter and Bobby Farrelly outdo themselves with this partially animated tale about an out-of-shape 40-year-old man who's the host to various organisms.
s232,Movie,The Water Man,David Oyelowo,"David Oyelowo, Rosario Dawson, Lonnie Chavis, Amiah Miller, Alfred Molina, Maria Bello",United States,"August 25, 2021",2021,PG,92 min,"Children & Family Movies, Dramas","Desperate to save his ailing mother, 11-year-old Gunner runs away from home on a quest to find a mythic figure rumored to have the power to cheat death."
s250,Movie,The Loud House Movie,Dave Needham,"Asher Bishop, David Tennant, Michelle Gomez, Jill Talley, Brian Stepanek, Catherine Taber, Liliana Mumy, Nika Futterman, Cristina Pucelli, Jessica DiCicco, Grey Griffin, Lara Jill Miller",,"August 20, 2021",2021,TV-Y7,88 min,"Children & Family Movies, Comedies, Music & Musicals","With his parents and all 10 sisters in tow, Lincoln Loud heads to Scotland and learns that royalty runs in the family in this global musical journey!"
s280,Movie,Monster Hunter: Legends of the Guild,Steven Yamamoto,"Ben Rausch, Erica Lindbeck, Dante Basco, Brando Eaton, Stephen Kramer Glickman, Caroline Caliston, G.K. Bowes, Dan McCoy","United States, Japan","August 12, 2021",2021,TV-PG,59 min,"Action & Adventure, Anime Features, Children & Family Movies","In a world where humans and fearsome monsters live in an uneasy balance, young hunter Aiden fights to save his village from destruction by a dragon."
s301,Movie,Vivo,"Kirk DeMicco, Brandon Jeffords","Lin-Manuel Miranda, Ynairaly Simo, Zoe Saldana, Juan de Marcos, Brian Tyree Henry, Gloria Estefan, Michael Rooker, Nicole Byer","Canada, United States","August 6, 2021",2021,PG,100 min,"Children & Family Movies, Music & Musicals",A music-loving kinkajou embarks on the journey of a lifetime to fulfill his destiny and deliver a love song for an old friend.
s326,Movie,Beethoven,Brian Levant,"Charles Grodin, Bonnie Hunt, Dean Jones, Oliver Platt, Stanley Tucci, Nicholle Tom, Christopher Castile, Sarah Rose Karr, David Duchovny, Patricia Heaton, O-Lan Jones, Nancy Fish",United States,"August 1, 2021",1992,PG,87 min,"Children & Family Movies, Comedies","A father reluctantly agrees to let his children keep a St. Bernard puppy, but the playful pooch soon turns into a full-grown engine of destruction."
s327,Movie,Beethoven's 2nd,Rod Daniel,"Charles Grodin, Bonnie Hunt, Nicholle Tom, Christopher Castile, Sarah Rose Karr, Debi Mazar, Chris Penn",United States,"August 1, 2021",1993,PG,88 min,"Children & Family Movies, Comedies","After St. Bernard Beethoven sires a brood with Missy, he and the Newton kids must intervene when Missy's owner tries to sell the puppies."
s331,Movie,Cloudy with a Chance of Meatballs,"Phil Lord, Christopher Miller","Bill Hader, Anna Faris, James Caan, Andy Samberg, Bruce Campbell, Mr. T, Bobb'e J. Thompson, Benjamin Bratt, Neil Patrick Harris, Al Roker","United States, Canada","August 1, 2021",2009,PG,90 min,"Children & Family Movies, Comedies, Sci-Fi & Fantasy","When inventor Flint Lockwood makes clouds rain food, the citizens of Chewandswallow can feed themselves. But a bowl of disaster is about to overflow."
s345,Movie,My Girl 2,Howard Zieff,"Anna Chlumsky, Austin O'Brien, Dan Aykroyd, Jamie Lee Curtis, Richard Masur, Christine Ebersole, Angeline Ball",United States,"August 1, 2021",1994,PG,99 min,"Children & Family Movies, Comedies, Dramas",A teen makes surprising discoveries when she talks to her dead mother's high school friends for an essay about someone she admires but has never met.
s346,Movie,Open Season: Scared Silly,David Feiss,"William Townsend, Donny Lucas, Melissa Sturm, Trevor Devall, Brian Drummond, Kathleen Barr, Garry Chalk, Lee Tockar, Shannon Chan-Kent, Michelle Murdocca, Lorne Cardinal, Peter Kelamis","United States, Canada","August 1, 2021",2015,PG,85 min,"Children & Family Movies, Comedies","When a spooky werewolf tale scares Boog out of joining the annual camping trip, his friends hatch a plan to cure him of his fear."
s348,Movie,Planet 51,Jorge Blanco,"Justin Long, Dwayne Johnson, Gary Oldman, Seann William Scott, Jessica Biel, John Cleese, Freddie Benedict","Spain, United Kingdom, United States","August 1, 2021",2009,PG,91 min,"Children & Family Movies, Comedies, Sci-Fi & Fantasy","After landing on a planet reminiscent of 1950s suburbia, a human astronaut tries to avoid capture, recover his spaceship and make it home safely."
s394,Movie,A Second Chance:  Rivals!,Clay Glen,"Emily Morris, Stella Shute, Eva Grados, India Colombi, Nina Pearce, Adam Tuominen, Carmel Johnson, Natasha Wanganeen, Elysia Markou, Alexander Lloyd, Amy Handley",Australia,"July 23, 2021",2021,PG,91 min,"Children & Family Movies, Sports Movies","Crushed when she doesn't qualify for the Olympics, a now-grown Maddy Cornell finds new purpose coaching young gymnasts going up against a rival team."
s406,Movie,Chhota Bheem - Dinosaur World,Sidheswar Shukla,"Sonal Kaushal, Rupa Bhimani, Julie Tejwani, Sabina Malik, Jigna Bharadwaj",,"July 22, 2021",2015,TV-Y,65 min,Children & Family Movies,"When a scientist has trouble caring for his secret baby dinosaur, he takes Bheem and friends back in time to return the pet to its natural habitat."
s407,Movie,Chhota Bheem - Neeli Pahaadi,Rajiv Chilaka,"Vatsal Dubey, Julie Tejwani, Rupa Bhimani, Jigna Bhardwaj, Rajesh Kava, Mousam, Swapnil",,"July 22, 2021",2013,TV-Y7,64 min,Children & Family Movies,"Things get spooky when Bheem and his buddies travel to the border of Dholakpur, known for its eerie history and rumored to be haunted."
s408,Movie,Chhota Bheem & Ganesh,Rajiv Chilaka,"Vatsal Dubey, Julie Tejwani, Rupa Bhimani, Jigna Bhardwaj, Rajesh Kava, Mousam, Swapnil",,"July 22, 2021",2009,TV-Y7,68 min,Children & Family Movies,"Bheem and Lord Ganesha join forces to save Dholakpur from fire-spitting dragons, who have also captured Ganesh’s mouse companion!"
s409,Movie,Chhota Bheem & Krishna: Mayanagari,Rajiv Chilaka,"Vatsal Dubey, Julie Tejwani, Rupa Bhimani, Jigna Bhardwaj, Rajesh Kava, Mousam, Swapnil",,"July 22, 2021",2011,TV-Y7,67 min,Children & Family Movies,Young lord Krishna has fallen for demoness Maayandri’s revenge plot against him! Can Bheem rescue him and thwart Maayandri’s other destructive plans?
s410,Movie,Chhota Bheem & Krishna: Pataliputra- City of the Dead,Rajiv Chilaka,"Vatsal Dubey, Julie Tejwani, Rupa Bhimani, Jigna Bhardwaj, Rajesh Kava, Arun Shekher, Sanchit Wartak",,"July 22, 2021",2010,TV-Y7,66 min,Children & Family Movies,Krishna needs Bheem’s help: The ruined city of Pataliputra has been cursed! Can the friends do what it takes to bring light back into this town?
s411,Movie,Chhota Bheem And The Broken Amulet,Rajiv Chilaka,"Vatsal Dubey, Julie Tejwani, Rupa Bhimani, Jigna Bhardwaj, Rajesh Kava, Mousam, Swapnil",India,"July 22, 2021",2013,TV-Y7,64 min,Children & Family Movies,"When a stranger tries to steal an amulet from the palace, Bheem learns the sad story behind the ornament and heads to Africa to defeat the real villain."
s412,Movie,Chhota Bheem And The Crown of Valhalla,Rajiv Chilaka,"Vatsal Dubey, Julie Tejwani, Rupa Bhimani, Jigna Bhardwaj, Rajesh Kava, Mousam, Swapnil",,"July 22, 2021",2013,TV-Y7,64 min,Children & Family Movies,"To save the kingdom of Valhalla from invasion by Vikings, Bheem is gathering his army of friends, who are ready to put up a formidable fight!"
s413,Movie,Chhota Bheem and the Incan Adventure,Rajiv Chilaka,"Vatsal Dubey, Julie Tejwani, Rupa Bhimani, Jigna Bhardwaj, Rajesh Kava, Mousam, Swapnil",,"July 22, 2021",2013,TV-Y7,65 min,Children & Family Movies,"When Dholakpur’s princess is kidnapped, Bheem is off to the land of the Incas to save her, but he’s in for an even bigger challenge upon his arrival."
s414,Movie,Chhota Bheem and The ShiNobi Secret,Rajiv Chilaka,"Vatsal Dubey, Julie Tejwani, Rupa Bhimani, Jigna Bhardwaj, Rajesh Kava, Mousam, Swapnil",,"July 22, 2021",2013,TV-Y7,64 min,Children & Family Movies,"After learning of a samurai village under threat by their own emperor, Bheem sets off for Japan to offer his help."
s415,Movie,Chhota Bheem Aur Hanuman,Rajiv Chilaka,"Vatsal Dubey, Julie Tejwani, Rupa Bhimani, Jigna Bhardwaj, Rajesh Kava, Mousam, Swapnil",,"July 22, 2021",2012,TV-Y7,68 min,Children & Family Movies,"When two evil entities kidnap a princess in a plot to build a new kingdom, Bheem takes them on with the help of the courageous monkey god Hanuman."
s416,Movie,Chhota Bheem aur Krishna,Rajiv Chilaka,"Vatsal Dubey, Julie Tejwani, Rupa Bhimani, Jigna Bhardwaj, Rajesh Kava, Arun Shekher, Sanchit Wartak",India,"July 22, 2021",2009,TV-Y7,68 min,Children & Family Movies,"Centuries after the end of a conqueror's rule, he is mysteriously back from the dead. It’s up to Bheem to save Dholakpur from being taken over!"
s417,Movie,Chhota Bheem aur Krishna vs Zimbara,Rajiv Chilaka,"Vatsal Dubey, Julie Tejwani, Rupa Bhimani, Jigna Bhardwaj, Rajesh Kava, Mousam, Swapnil",,"July 22, 2021",2013,TV-Y7,64 min,Children & Family Movies,"A demon of darkness is plotting world domination — but when Bheem and Krishna catch wind of his plans, they’ll stop at nothing to destroy him."
s418,Movie,Chhota Bheem in African Safari,Binayak Das,"Sonal Kaushal, Rupa Bhimani, Julie Tejwani, Sabina Malik, Jigna Bharadwaj, Rajesh Kava",,"July 22, 2021",2015,TV-Y7,62 min,Children & Family Movies,Bheem’s plans for an exciting African safari are interrupted when he finds that an evil ruler is using magical powers to cause drought through the land.
s419,Movie,Chhota Bheem Ka Roosi Romanch,"Arpan Sarkar, Shyamal Chaulia","Julie Tejwani, Sabina Malik, Jigna Bharadwaj, Rupa Bhimani, Lalit Agarwal, Rajesh Shukla, Disha, Rajesh Kava, Raju",,"July 22, 2021",2019,TV-Y,63 min,Children & Family Movies,"A faulty transportation machine lands Chhota Bheem and his friends in Russia, where they must save a princess from an evil, power-hungry magician."
s420,Movie,Chhota Bheem: Bheem vs Aliens,Rajiv Chilaka,"Vatsal Dubey, Julie Tejwani, Rupa Bhimani, Jigna Bhardwaj, Rajesh Kava, Mousam, Swapnil",,"July 22, 2021",2010,TV-Y7,69 min,"Children & Family Movies, Sports Movies",Space invaders have kidnapped Dholakpur’s king and princess! The only way Bheem can rescue them? Defeat the aliens in a cricket match.
s421,Movie,Chhota Bheem: Dholakpur to Kathmandu,Rajiv Chilaka,"Vatsal Dubey, Julie Tejwani, Rupa Bhimani, Jigna Bhardwaj, Rajesh Kava, Mousam, Swapnil",,"July 22, 2021",2012,TV-Y7,70 min,Children & Family Movies,Bheem’s holiday in Nepal takes an unexpected turn when he is called on to save a monkey cub from snow leopards and reunite him with his father.
s422,Movie,Chhota Bheem: Dus Pe Dus,"Rajiv Chilaka, Owll Mina","Vatsal Dubey, Julie Tejwani, Rupa Bhimani, Jigna Bhardwaj, Rajesh Kava, Mousam, Swapnil",,"July 22, 2021",2014,TV-Y7,63 min,Children & Family Movies,"After a precious temple stone is stolen under his watch, Bheem trains in a special martial art to prepare for a showdown with the thief."
s423,Movie,Chhota Bheem: Journey to Petra,Rajiv Chilaka,"Vatsal Dubey, Julie Tejwani, Rupa Bhimani, Jigna Bhardwaj, Rajesh Kava",,"July 22, 2021",2011,TV-Y7,68 min,Children & Family Movies,"The king has been away to meet an old friend, but when he sends for urgent help, Bheem finds himself on an action-packed rescue mission to Egypt!"
s424,Movie,Chhota Bheem: Master of Shaolin,Rajiv Chilaka,"Pooja Punabi, Mausam, Julie Tejwani, Rupa Bhimani, Jigna Bhardwaj, Rajesh Kava, Parigna Pandya",,"July 22, 2021",2011,TV-Y7,74 min,Children & Family Movies,"Summoned by a monk to help reclaim a temple from a dangerous leader, Bheem must master the Shaolin kung fu techniques if he wants a fighting chance!"
s425,Movie,Chhota Bheem: The Rise of Kirmada,Rajiv Chilaka,"Vatsal Dubey, Julie Tejwani, Rupa Bhimani, Jigna Bhardwaj, Rajesh Kava, Mousam, Swapnil",,"July 22, 2021",2012,TV-Y7,68 min,Children & Family Movies,Bheem and young lord Krishna team up to protect the world against the wicked and powerful Kirmada and his equally dangerous bat army.
s429,Movie,Words Bubble Up Like Soda Pop,Kyohei Ishiguro,"Somegoro Ichikawa, Hana Sugisaki, Megumi Han, Natsuki Hanae, Yuuichirou Umehara, Megumi Nakajima, Sumire Morohoshi, Hiroshi Kamiya, Maaya Sakamoto, Koichi Yamadera, Kikuko Inoue",,"July 22, 2021",2021,TV-G,87 min,"Anime Features, Children & Family Movies, International Movies","After meeting one bright, sunny day, a shy boy who expresses himself through haiku and a bubbly but self-conscious girl share a brief, magical summer."
s433,Movie,Trollhunters: Rise of the Titans,"Johane Matte, Andrew L. Schmidt, Francisco Ruiz Velasco","Emile Hirsch, Lexi Medrano, Charlie Saxton, Kelsey Grammer, Fred Tatasciore, Steven Yeun, Cole Sand, Amy Landecker, Jonathan Hyde, Thomas F. Wilson, Lauren Tom, Diego Luna, Tatiana Maslany, Nick Offerman, Nick Frost, Colin O'Donoghue, Alfred Molina, Piotr Michael, Kay Bess, Angel Lin, James Hong",,"July 21, 2021",2021,TV-Y7,106 min,Children & Family Movies,"Heroes from ""Trollhunters,"" ""3Below"" and ""Wizards"" join forces to fight a shadowy enemy threatening to take over their worlds — and reset Earth itself."
s461,Movie,Surf's Up,"Ash Brannon, Chris Buck","Shia LaBeouf, Jeff Bridges, Zooey Deschanel, Jon Heder, James Woods, Diedrich Bader, Mario Cantone, Kelly Slater, Rob Machado, Sal Masekela","United States, Canada","July 15, 2021",2007,PG,86 min,"Children & Family Movies, Comedies, Sports Movies",This Oscar-nominated animated comedy goes behind the scenes at the Penguin World Surfing Championship to get a close-up look at the inventors of surfing.
s472,Movie,Day of Destiny,"Akay Mason, Abosi Ogba","Olumide Oworu, Denola Grey, Gbemi Akinlade, Jide Kosoko, Ireti Doyle, Norbert Young, Toyin Abraham, Blossom Chukwujekwu, Broda Shaggi, Ini Dima-Okojie, Deyemi Okanlawon",,"July 13, 2021",2021,TV-PG,110 min,"Children & Family Movies, Dramas, International Movies","With their family facing financial woes, two teen brothers seize an opportunity to reverse their bad fortunes by traveling 20 years back in time."
s487,Movie,Ratchet and Clank,"Jericca Cleland, Kevin Munroe","Paul Giamatti, John Goodman, Bella Thorne, Rosario Dawson, Jim Ward, Armin Shimerman, Vincent Tong, Andrew Cownden, James Arnold Taylor, David Kaye, Sylvester Stallone","Hong Kong, Canada, United States","July 9, 2021",2016,PG,94 min,"Children & Family Movies, Comedies, Sci-Fi & Fantasy",Affable alien Ratchet longs to be a Galactic Ranger and might get the chance when rogue robot Clank tells him of evil Drek's plot to destroy a galaxy.
s569,Movie,Dennis the Menace,Nick Castle,"Walter Matthau, Mason Gamble, Joan Plowright, Christopher Lloyd, Lea Thompson, Robert Stanton, Paul Winfield",United States,"July 1, 2021",1993,PG,96 min,"Children & Family Movies, Comedies","The bane of George's life is a little boy named Dennis. But when a cunning thief attempts to rob George, Dennis may be the only one who can stop him."
s574,Movie,Kung Fu Panda,"John Stevenson, Mark Osborne","Jack Black, Dustin Hoffman, Angelina Jolie, Ian McShane, Seth Rogen, Lucy Liu, Jackie Chan, David Cross, Randall Duk Kim, James Hong","United States, China","July 1, 2021",2008,PG,94 min,"Children & Family Movies, Comedies","When a powerful villain comes after peace in his valley, a lazy panda rises to the challenge to realize his destiny and become a kung fu warrior."
s575,Movie,Kung Fu Panda 2,Jennifer Yuh Nelson,"Jack Black, Angelina Jolie, Dustin Hoffman, Gary Oldman, Seth Rogen, Lucy Liu, Jackie Chan, David Cross, James Hong, Michelle Yeoh","United States, China","July 1, 2021",2011,PG,93 min,"Children & Family Movies, Comedies","With his fists up and belly full, Po embarks on a perilous journey with the Furious Five to take on a frightful new enemy and save the art of kung fu."
s594,Movie,Snow Day,Chris Koch,"Chris Elliott, Mark Webber, Jean Smart, Schuyler Fisk, Iggy Pop, Pam Grier, John Schneider, Chevy Chase, Zena Grey, Josh Peck",United States,"July 1, 2021",2000,PG,89 min,"Children & Family Movies, Comedies","When a snow day shuts down the whole town, the Wheeler family cuts loose. Hal makes a play for the most popular girl in his school, 10-year-old Natalie takes on the dreaded snowplow man, and Dad gets into a showdown with a rival meteorologist."
s596,Movie,Stuart Little,Rob Minkoff,"Michael J. Fox, Jonathan Lipnicki, Geena Davis, Hugh Laurie, Nathan Lane","Germany, United States","July 1, 2021",1999,PG,85 min,"Children & Family Movies, Comedies","When his parents adopt a mouse instead of a little boy, George realizes brothers come in all shapes and sizes. But Snowbell the cat is not so welcoming."
s602,Movie,The Karate Kid,John G. Avildsen,"Ralph Macchio, Pat Morita, Elisabeth Shue, Martin Kove, Randee Heller, William Zabka, Ron Thomas, Rob Garrison",United States,"July 1, 2021",1984,PG,127 min,"Action & Adventure, Children & Family Movies, Classic Movies","When a bullied teen befriends an unassuming martial arts master, he’ll learn life lessons — and the right moves — to beat back his merciless rivals."
s603,Movie,The Karate Kid Part II,John G. Avildsen,"Ralph Macchio, Pat Morita, Nobu McCarthy, Tamlyn Tomita, Yuji Okumoto, Joey Miyashima, Marc Hayashi, Danny Kamekona, Tony O'Dell, Martin Kove, William Zabka",United States,"July 1, 2021",1986,PG,113 min,"Action & Adventure, Children & Family Movies, Dramas","Daniel and his martial-arts mentor, Mr. Miyagi, visit Okinawa where they battle a hostile new nemesis and a former foe looking to settle an old score."
s604,Movie,The Karate Kid Part III,John G. Avildsen,"Ralph Macchio, Pat Morita, Robyn Lively, Thomas Ian Griffith, Martin Kove, Sean Kanan, Jonathan Avildsen, Randee Heller, William Christopher Ford",United States,"July 1, 2021",1989,PG,112 min,"Children & Family Movies, Dramas",A returning adversary threatens the bond between karate champ Daniel and mentor Mr. Miyagi with an intricate plan for revenge and a brutal challenger.
s737,Movie,Skater Girl,Manjari Makijany,"Rachel Saanchita Gupta, Amy Maghera, Shafin Patel, Ambrish Saxena, Swati Das, Jonathan Readwin, Ankit Yadav, Anurag Arora, Vinayak Gupta, Vivek Yadav, Waheeda Rehman","United States, India","June 11, 2021",2021,PG,110 min,"Children & Family Movies, Dramas, International Movies","When a teen in rural India discovers a life-changing passion for skateboarding, she faces a rough road as she follows her dream to compete."
s740,Movie,Wish Dragon,Chris Appelhans,"Jimmy Wong, John Cho, Constance Wu, Will Yun Lee, Bobby Lee, Jimmy O. Yang, Ian Chen","China, United States, Canada","June 11, 2021",2021,PG,102 min,"Children & Family Movies, Comedies",Determined teen Din is longing to reconnect with his childhood best friend when he meets a wish-granting dragon who shows him the magic of possibilities.
s756,Movie,Kitty Love: An Homage to Cats,,Nicolette Kluijver,Netherlands,"June 5, 2021",2021,TV-G,61 min,"Children & Family Movies, Documentaries, International Movies","Famous feline Abatutu presents this charming celebration of cats, showcasing their finest and friskiest moments with a collection of home videos."
s812,Movie,Super Monsters: Once Upon a Rhyme,Steve Ball,"Elyse Maloway, Vincent Tong, Andrea Libman, Alessandro Juliani, Nicole Anthony, Erin Mathews, Diana Kaarina, Gigi Saul Guerrero, Asia Mattu, Rukiya Bernard, Ian James Corlett, Britt McKillip",,"June 2, 2021",2021,TV-Y,25 min,Children & Family Movies,"From Goldilocks to Hansel and Gretel, the Super Monsters reimagine classic fairy tales and favorite nursery rhymes with a musical, magical spin!"
