show_id,type,title,director,cast,country,date_added,release_year,rating,duration,listed_in,description
s3778,Movie,Silent,"Limbert Fabian, Brandon Oldenburg",,United States,"June 4, 2019",2014,TV-Y,3 min,"Children & Family Movies, Sci-Fi & Fantasy","""Silent"" is an animated short film created by Academy Award® winning Moonbot Studios. It celebrates how storytellers, inventors, and technology work together to create cinema magic."
s3819,Movie,Good Sam,Kate Melville,"Tiya Sircar, Chad Connell, Marco Grazzini, Jesse Camacho, Mark Camacho, Elana Dunkelman, Kelly Hope Taylor, Kenny Wong, Daniela Sandiford, Christina Tannous",United States,"May 16, 2019",2019,TV-PG,90 min,"Children & Family Movies, Dramas",A curious reporter finds love while pursuing the story of a mysterious figure who's leaving bags of cash for strangers around New York City.
s3821,Movie,PATRICK (2019),Mandie Fletcher,"Beattie Edmondson, Ed Skrein, Tom Bennett, Jennifer Saunders",United Kingdom,"May 16, 2019",2019,TV-PG,94 min,"Children & Family Movies, Comedies","When a schoolteacher inherits an adorable pug, she has to find a way to take care of it while dealing with her flatlining love life."
s3830,Movie,Malibu Rescue,Savage Steve Holland,"Ricardo Hurtado, Breanna Yde, Jackie R. Jacobson, Abby Donnelly, Alkoya Brunson, JT Neal, Ian Ziering, Bryana Salaz, Camaron Engels, Jeremy Howard, Jeff Meacham",United States,"May 13, 2019",2019,TV-G,70 min,"Children & Family Movies, Comedies","When a long list of shenanigans lands Tyler in hot water, he’s forced to suit up and spend his summer training for an elite junior lifeguard program."
s3910,Movie,Super Monsters Furever Friends,,"Elyse Maloway, Vincent Tong, Erin Mathews, Andrea Libman, Alessandro Juliani, Nicole Anthony, Diana Kaarina, Ian James Corlett, Britt McKillip",,"April 16, 2019",2019,TV-Y,59 min,Children & Family Movies,"On the first night of spring, the Super Monsters gather for food, fun and games in the park – and get to meet their adorable new pets!"
s4037,Movie,Walk. Ride. Rodeo.,Conor Allyn,"Spencer Locke, Missi Pyle, Sherri Shepherd, Bailey Chase, Alyvia Alyn Lind, Max Ehrich, Corbin Bleu, Kathleen Rose Perkins",United States,"March 8, 2019",2019,TV-PG,100 min,"Children & Family Movies, Dramas","In the wake of an accident that leaves her paralyzed, a champion rodeo rider vows to get back on her horse and compete again. Based on a true story."
s4059,Movie,Pants on Fire,Jonathan A. Rosenbaum,"Bradley Steven Perry, Joshua J. Ballard, Tyrel Jackson Williams, Brittney Wilson, Taylor Russell, Nicholas Coombe, Rachelle Gillis, Kevin O'Grady",Canada,"March 1, 2019",2014,TV-G,87 min,"Children & Family Movies, Comedies",Jealous girlfriends and aliens are just some of the things Jack lied about to become popular. Now the lies are coming to life and ruining everything.
s4061,Movie,Radio Rebel,Peter Howitt,"Debby Ryan, Sarena Parmar, Adam DiMarco, Merritt Patterson, Nancy Robertson",United States,"March 1, 2019",2012,TV-G,90 min,"Children & Family Movies, Comedies","Shy student Tara has a secret identity: She is smooth-talking Radio Rebel, a DJ who lends her voice to all kids, popular and unpopular alike."
s4063,Movie,The Boy Who Harnessed the Wind,Chiwetel Ejiofor,"Maxwell Simba, Chiwetel Ejiofor, Aïssa Maïga, Lily Banda, Lemogang Tsipa, Philbert Falakeza, Joseph Marcell, Noma Dumezweni","United Kingdom, Malawi","March 1, 2019",2019,TV-PG,114 min,"Children & Family Movies, Dramas, Independent Movies","Inspired by a science book, 13-year-old William Kamkwamba builds a wind turbine to save his Malawian village from famine. Based on a true story."
s4066,Movie,The Spiderwick Chronicles,Mark Waters,"Freddie Highmore, Mary-Louise Parker, Sarah Bolger, Joan Plowright, David Strathairn, Nick Nolte, Seth Rogen, Andrew McCarthy, Martin Short",United States,"March 1, 2019",2008,PG,97 min,Children & Family Movies,"When city-raised twins move to a tumbledown country mansion, it's quite an adjustment – especially after they uncover a magical fantasy world."
s4122,Movie,Kevin Hart's Guide to Black History,Tom Stern,"Kevin Hart, Saniyya Sidney, Lil Rel Howery, Eoghan Thomas Murphy, Tiffany Haddish, Al Shearer, Lonnie Chavis, Alphonso Mcauley, Nika Williams, Barry Brewer, Greg Germann, John Ennis, Jay Johnston",United States,"February 8, 2019",2019,TV-PG,63 min,"Children & Family Movies, Comedies",Kevin Hart highlights the fascinating contributions of black history’s unsung heroes in this entertaining – and educational – comedy special.
s4138,Movie,Free Rein: Valentine's Day,,"Jaylen Barron, Joe Ashman, Manpreet Bambra, Celine Buckens, Freddy Carter, Bruce Herbelin-Earle, Kerry Ingram, Charlotte Jordan, Geoffrey McGivern, Martin Bobb-Semple, Sadie Simm, Carla Woodcock",United States,"February 1, 2019",2019,TV-G,51 min,"Children & Family Movies, Dramas","Love is in the air as Zoe and friends go on a quest to find a fabled Maid's Stone. But when rivalry blinds them to danger, it's Raven to the rescue!"
s4140,Movie,LEGO Marvel Super Heroes: Black Panther,Michael D. Black,"James Mathis III, Keston John, Yvette Nicole Brown, Daisy Lightfoot, Isaac C. Singleton Jr., Trevor Devall, Liam O'Brien, Mick Wingert, Fred Tatasciore, Laura Bailey",United States,"February 1, 2019",2018,TV-Y7,22 min,Children & Family Movies,"When Thanos joins forces with villains Killmonger and Klaue to destroy Earth, Black Panther rushes to stop them from stealing Wakanda's vibranium."
s4141,Movie,LEGO Marvel Super Heroes: Guardians of the Galaxy,,,United States,"February 1, 2019",2017,TV-Y,22 min,Children & Family Movies,"The Guardians are on a mission to deliver the Build Stone to the Avengers before the Ravagers, Thanos and his underlings steal it from them."
s4146,Movie,True: Happy Hearts Day,,"Michela Luci, Jamie Watson, Eric Peterson, Cory Doran, Nicolas Aqui","United States, Canada","February 1, 2019",2019,TV-Y,24 min,Children & Family Movies,"True and Bartleby try to cheer up the Rainbow Kingdom’s loneliest citizen, but his gloomy mood is contagious! Can a trio of wishes turn things around?"
s4224,Movie,Pokémon the Movie: I Choose You!,Kunihiko Yuyama,"Ikue Otani, Sarah Natochenny, David Oliver Nelson, Mike Pollock, Kate Bristol, Suzy Myers, Rodger Parsons",Japan,"January 1, 2019",2017,TV-Y7,97 min,"Anime Features, Children & Family Movies","When Ash tries to pick his first Pokémon on his birthday, he ends up with a stubborn Pikachu and they embark on a journey to find the legendary Ho-Oh."
s4287,Movie,Prince of Peoria: A Christmas Moose Miracle,Jon Rosenbaum,"Gavin Lewis, Theodore Barnes, Shelby Simmons, Cynthia Kaye McWilliams",United States,"December 17, 2018",2018,TV-G,29 min,"Children & Family Movies, Comedies","Teddy's never missed the Festival of Lights, but the bowling alley’s been snowed in! Not to worry – Emil insists the Christmas moose will save the day."
s4290,Movie,Dragons: Dawn of the Dragon Racers,"Elaine Bogan, John Sanford","Jay Baruchel, America Ferrera, Zack Pearlman, Christopher Mintz-Plasse, T.J. Miller, Andree Vermeulen",United States,"December 16, 2018",2014,TV-PG,27 min,"Children & Family Movies, Comedies","The ""How to Train Your Dragon"" adventure continues when a hunt for lost sheep turns into a fierce, fun-filled competition."
s4296,Movie,F.R.E.D.I.,Sean Olson,"Kelly Hu, Angus Macfadyen, Candace Cameron Bure, Lucius Hoyos, Reid Miller, Tyler Christopher, Casimere Jollette, Christina Cox, Texas Battle, Harvey Guillen",United States,"December 15, 2018",2018,TV-PG,90 min,"Children & Family Movies, Sci-Fi & Fantasy","Venturing into the woods, high schooler James discovers an intelligent robot that he must save from the hands of a businessman with an evil scheme."
s4319,Movie,Free Rein: The Twelve Neighs of Christmas,Marek Losey,"Jaylen Barron, Billy Angel, Manpreet Bambra, Celine Buckens, Freddy Carter, Bruce Herbelin-Earle, Kerry Ingram, Charlotte Jordan, Geoff McGivern, Martin Bobb-Semple",,"December 7, 2018",2018,TV-G,58 min,"Children & Family Movies, Dramas","As Bright Fields preps for its Mistletoe Ball, a broken ornament leads Zoe to a family secret, while Gaby finds herself at the mercy of new boss Mia."
s4320,Movie,Mowgli: Legend of the Jungle,Andy Serkis,"Christian Bale, Cate Blanchett, Benedict Cumberbatch, Naomie Harris, Andy Serkis, Rohan Chand, Peter Mullan, Jack Reynor, Eddie Marsan, Tom Hollander, Louis Ashbourne Serkis, Matthew Rhys, Freida Pinto","United Kingdom, United States","December 7, 2018",2018,PG-13,105 min,"Action & Adventure, Children & Family Movies, Dramas",An orphaned boy raised by animals in the jungle seizes his destiny while confronting a dangerous enemy – and his own human origins.
s4324,Movie,Super Monsters and the Wish Star,Jacob Joice,"Elyse Maloway, Vincent Tong, Erin Mathews, Andrea Libman, Alessandro Juliani, Nicole Anthony, Diana Kaarina, Ian James Corlett, Britt McKillip, Kathleen Barr, Gigi Saul Guerrero",,"December 7, 2018",2018,TV-Y,28 min,Children & Family Movies,"Christmas wishes come true for Lobo, whose favorite cousin arrives for a surprise visit, and for Glorb, who wishes he could be everywhere at once!"
s4352,Movie,A Christmas Prince: The Royal Wedding,John Schultz,"Rose McIver, Ben Lamb, Alice Krige, Simon Dutton, Honor Kneafsey, Sarah Douglas, Theo Devaney, John Guerrasio, Andy Lucas, Raj Bajaj, Richard Ashton, Billy Angel, Tahirah Sharif, Joel McVeagh",United States,"November 30, 2018",2018,TV-PG,93 min,"Children & Family Movies, Dramas, Romantic Movies","A year after helping Richard secure the crown, Amber returns to Aldovia to plan their wedding. But her simple tastes clash with royal protocol."
s4353,Movie,Angela's Christmas,Damien O’Connor,"Lucy O'Connell, Ruth Negga, Brendan Mullins, Malachy McCourt, Vivian Drew, Anya O'Connor, Janet Moran, Brian Gleeson, Pat Kinevane","Ireland, Canada","November 30, 2018",2018,TV-Y,30 min,Children & Family Movies,A trip to church with her family on Christmas Eve gives young Angela an extraordinary idea. A heartwarming tale based on a story by Frank McCourt.
s4365,Movie,My Little Pony Friendship Is Magic: Best Gift Ever,"Denny Lu, Mike Myhre","Tara Strong, Andrea Libman, Ashleigh Ball, Cathy Weseluck, Tabitha St. Germain, John de Lancie, Sam Vincent, Garry Chalk",United States,"November 25, 2018",2018,TV-Y,44 min,Children & Family Movies,"The ponies get in the spirit of the holidays by drawing names for a gift exchange, then race around Equestria in search of the perfect presents."
s4370,Movie,The Christmas Chronicles,Clay Kaytis,"Kurt Russell, Darby Camp, Judah Lewis, Kimberly Williams-Paisley, Oliver Hudson, Lamorne Morris, Martin Roach",United States,"November 22, 2018",2018,TV-PG,104 min,"Children & Family Movies, Comedies","After accidentally crashing Santa's sleigh, a brother and sister pull an all-nighter to save Christmas with a savvy, straight-talking St. Nick."
s4374,Movie,Puppy Star Christmas,Robert Vince,"Kaitlyn Maher, Mackenzie Sol, Makenzie Moss, David DeLuise, George Newbern, Reggie De Leon, Diedrich Bader, Chloe Coleman, Oakley Bull, Dillon Fontana, vivienne Rutherford, Tyreese Burnett","United States, Canada","November 20, 2018",2018,PG,91 min,"Children & Family Movies, Comedies","A new pack of Pup Star pooches stumbles upon a rival team’s plan to ruin Christmas, then ends up at the North Pole to try and save the holiday spirit."
s4387,Movie,The Princess Switch,,"Vanessa Hudgens, Sam Palladio, Nick Sagar, Suanne Braun, Mark Fleischmann, Amy Griffiths, Sara Stewart, Pavel Douglas, Robin Soans, Calliope Taylor, Natali Yura, Alexa Adeosun",United States,"November 16, 2018",2018,TV-G,102 min,"Children & Family Movies, Dramas, Romantic Movies","When a down-to-earth Chicago baker and a soon-to-be princess discover they look like twins, they hatch a Christmastime plan to trade places."
s4467,Movie,Zokkomon,Satyajit Bhatkal,"Darsheel Safary, Anupam Kher, Manjari Fadnis, Tinnu Anand, Sheeba Chaddha, S.M. Zaheer, Aayam Mehta, Gargi Datar, Jai Vyas",India,"November 1, 2018",2011,PG,104 min,"Children & Family Movies, Dramas","When his cruel uncle abandons him, a young orphan learns to access the untapped superpowers that have been waiting within him all along."
s4493,Movie,Gnome Alone,Peter Lepeniotis,"Becky G., Josh Peck, Tara Strong, Olivia Holt, David Koechner, Jeff Dunham, Patrick Stump, Nash Grier, Madison De La Garza, George Lopez","United Kingdom, Canada, United States, Cayman Islands","October 19, 2018",2018,PG,86 min,"Children & Family Movies, Comedies","After moving into a new house with her mom, high schooler Chloe discovers a troupe of talking garden gnomes who need her help saving the world."
s4535,Movie,Super Monsters Save Halloween,,"Elyse Maloway, Vincent Tong, Erin Matthews, Andrea Libman, Alessandro Juliani, Nicole Anthony, Diana Kaarina, Ian James Corlett, Britt McKillip, Kathleen Barr",,"October 5, 2018",2018,TV-Y,25 min,Children & Family Movies,"The Super Monsters use their powers to get their neighbors in the Halloween spirit, then help a nervous friend see there's nothing to be afraid of."
s4558,Movie,A Witches' Ball,Justin G. Dyck,"Morgan Neundorf, Karen Slater, Loukia Ioannou, Will Ennis, Renee Stein, Keith Cooper, Paul Mason, Lisa Scenna, Ashley Rogan",Canada,"October 1, 2018",2017,PG,91 min,Children & Family Movies,"Beatrix can't wait to be inducted as a witch, but an unfortunate incident threatens to take her pending title away if she doesn't act fast."
s4590,Movie,My Little Pony Equestria Girls: Forgotten Friendship,Ishi Rudell,"Ashleigh Ball, Andrea Libman, Rebecca Shoichet, Tabitha St. Germain, Tara Strong, Nicole Oliver",United States,"October 1, 2018",2018,TV-Y,44 min,Children & Family Movies,School yearbook editor Sunset Shimmer has suddenly been erased from the memories of her best friends and must find out how to fix this.
s4591,Movie,My Little Pony Equestria Girls: Rollercoaster of Friendship,Ishi Rudell,"Ashleigh Ball, Andrea Libman, Rebecca Shoichet, Tabitha St. Germain, Tara Strong, Tegan Moss","United States, Canada","October 1, 2018",2018,TV-Y,44 min,Children & Family Movies,"Rarity gets a summer job at Equestria Land, making Applejack feel jealous. But when their friends start vanishing, they must work together to find them."
s4617,Movie,Big Miracle,Ken Kwapis,"Drew Barrymore, John Krasinski, Kristen Bell, Dermot Mulroney, Tim Blake Nelson, Vinessa Shaw, Ted Danson, Stephen Root, Rob Riggle, Michael Gaston","United States, United Kingdom","September 30, 2018",2012,PG,107 min,"Children & Family Movies, Dramas","After a reporter writes about whales trapped in the Arctic Circle, the U.S. and U.S.S.R. team up to rescue them in this tale inspired by true events."
s4657,Movie,Next Gen,"Kevin R. Adams, Joe Ksander","John Krasinski, Charlyne Yi, Jason Sudeikis, Michael Peña, David Cross, Constance Wu","China, Canada, United States","September 7, 2018",2018,TV-PG,106 min,"Children & Family Movies, Comedies, Sci-Fi & Fantasy","When lonely Mai forms an unlikely bond with a top-secret robot, they embark on an intense, action-packed adventure to foil the plot of a vicious villain."
s4721,Movie,Chillar Party,"Vikas Bahl, Nitesh Tiwari","Irfan Khan, Raju, Sanath Menon, Rohan Grover, Naman Jain, Aarav Khanna, Vishesh Tiwari, Chinmai Chandranshuh, Vedant Desai, Shriya Sharma, Divji Handa",India,"August 2, 2018",2011,TV-PG,127 min,"Children & Family Movies, Comedies, Dramas","Eight feisty boys befriend young drifter Fatka. When a mean politician threatens Fatka's way of life, the boys band together in honor of their pal."
s4738,Movie,The Blue Umbrella,Vishal Bhardwaj,"Pankaj Kapur, Shreya Sharma, Dolly Ahluwalia, Deepak Dobriyal, Rahul Kumar, Paramjit Singh Kakran, Piu Dutt, Samrat Mukherjee",India,"August 2, 2018",2005,TV-PG,90 min,"Children & Family Movies, Dramas, Independent Movies","A charming allegory based on a novella by Ruskin Bond, this visually stunning film from India explores themes of greed, loneliness, longing and loss."
s4761,Movie,Duck Duck Goose,Chris Jenkins,"Jim Gaffigan, Zendaya, Lance Lim, Greg Proops, Reggie Watts, Carl Reiner, Jennifer Grey, Stephen Fry, Diedrich Bader, Natasha Leggero, Craig Ferguson, Rick Overton","China, United States, United Kingdom","July 20, 2018",2018,PG,92 min,"Children & Family Movies, Comedies","As his flock's annual migration nears, a carefree goose is grounded with an injury and takes a pair of lost ducklings under his wing."
s4771,Movie,Going for Gold,Clay Glen,"Kelli Berglund, Emily Morris, Terry Rogers, Jess Kuss, Jo Stone, Elysia Markou, Daisy Anderson, Ruth Natalie Fallon, Henry Turczynowicz, Martha Lott",Australia,"July 15, 2018",2018,TV-G,88 min,"Children & Family Movies, Dramas, International Movies","After moving to Australia, an American teen convinces her new friends to form a cheer squad and take on their biggest rivals in competition."
s4785,Movie,White Fang,Alexandre Espigares,"Nick Offerman, Rashida Jones, Paul Giamatti, Eddie Spears, David Boat, Sean Kenin, Raquel Antonia, Daniel Hagen, Stephen Kramer Glickman, William Calvert, Jason Grasl, Armando Riesco","France, Luxembourg, United States","July 6, 2018",2018,TV-PG,88 min,"Children & Family Movies, Dramas",A loyal wolfdog's curiosity leads him on the adventure of a lifetime while serving a series of three distinctly different masters.
s4796,Movie,I Am Kalam,Nila Madhab Panda,"Gulshan Grover, Harsh Mayar, Pitobash, Hussan Saad, Beatrice Ordeix, Sanjay Chauhan",India,"July 1, 2018",2010,TV-PG,87 min,"Children & Family Movies, Comedies, Dramas",An intelligent boy born into poverty befriends the son of a once noble family and is inspired by the life of India's president to pursue an education.
s4874,Movie,Pup Star: World Tour,Robert Vince,"Jed Ress, Makenzie Moss, Denisse Ojeda, Reggie De Leon, David DeLuise, Kaitlyn Maher, Jorge Diaz, George Newbern, Diedrich Bader, Mackenzie Sol","Canada, Japan, United States","May 5, 2018",2018,G,87 min,"Children & Family Movies, Comedies, Music & Musicals","Talented pooches from around the world compete to be the next Pup Star, but behind-the-scenes schemes threaten to ruin the fun."
s4908,Movie,Candy Jar,Ben Shelton,"Christina Hendricks, Helen Hunt, Uzo Aduba, Sami Gayle, Jacob Latimore",United States,"April 27, 2018",2018,TV-14,93 min,"Children & Family Movies, Dramas, Romantic Movies",Dueling high school debate champs who are at odds on just about everything forge ahead with ambitious plans to get into the colleges of their dreams.
s4918,Movie,Fishtronaut: The Movie,"Célia Catunda, Kiko Mistrorigo, Rodrigo Eba","Fábio Lucindo, Celso Alves, Fernanda Bullara",Brazil,"April 25, 2018",2018,TV-Y,78 min,Children & Family Movies,"Fishtronaut, Marina and Zeek travel to the big city in search of Grandpa, only to find that everyone else has mysteriously vanished too."
s4978,Movie,Benji,Brandon Camp,"Gabriel Bateman, Darby Camp, Kiele Sanchez, Jerod Haynes, Gralen Bryant Banks, Angus Sampson, Will Rothhaar, Jim Gleason, Brady Permenter","United Arab Emirates, United States","March 16, 2018",2018,TV-PG,87 min,"Children & Family Movies, Dramas",A determined dog comes to the rescue and helps heal a broken family when a young boy and his sister stumble into some serious danger.
s4983,Movie,In This Corner of the World,Sunao Katabuchi,"Non, Yoshimasa Hosoya, Natsuki Inaba, Minori Omi, Daisuke Ono, Megumi Han, Nanase Iwai, Shigeru Ushiyama, Mayumi Shintani",Japan,"March 15, 2018",2016,PG-13,129 min,"Anime Features, Children & Family Movies, International Movies","Suzu marries into a family living outside of Hiroshima and quickly settles into her new life, until World War II challenges her ability to survive."
s4991,Movie,Stretch Armstrong: The Breakout,Victor Cook,"Scott Menville, Steven Yeun, Ogie Banks, Nazneen Contractor, Kate Mulgrew, Wil Wheaton, Keith David, Jon Heder, Yvette Nicole Brown, Clancy Brown, James Arnold Taylor, Grey Griffin, Miguel Ferrer, Kelly Hu, Walter Koenig, Vanessa Marshall, Will Friedle, Andrew Kishino",United States,"March 13, 2018",2018,TV-Y7,104 min,Children & Family Movies,"Villains are rampaging through Charter City and the Flex Fighters – Jake, Ricardo and Nathan – need your help to halt the chaos."
s5000,Movie,Expedition China,Ben Wallis,Maggie Q,,"March 4, 2018",2017,TV-G,78 min,"Children & Family Movies, Documentaries","Cinematographers visit the remote forests and mountains of China in hopes of capturing footage of pandas, monkeys, red-crowned cranes and more."
s5082,Movie,Rip Tide,Rhiannon Bannenberg,"Debby Ryan, Genevieve Hegney, Andrew Creer, Naomi Sequeira, Aaron Jeffery, Valerie Bader, Jeremy Lindsay Taylor, Danielle Carter, Marcus Graham, Kimie Tsukakoshi","Australia, United Arab Emirates","January 15, 2018",2017,TV-PG,87 min,"Children & Family Movies, Dramas, Sports Movies","Following an embarrassing viral video, a New York model decides to escape from her suffocating existence by visiting her faraway aunt in Australia."
s5107,Movie,Bibi & Tina: Tohuwabohu Total,Detlev Buck,"Lina Larissa Strahl, Lisa-Marie Koroll, Louis Held, Lea van Acken, Emilio Sakraya, Michael Maertens, Martin Seifert",Germany,"December 27, 2017",2017,TV-14,106 min,"Children & Family Movies, Music & Musicals",Teen witch Bibi and her pal Tina return to the screen to reconcile a runaway girl with her narrow-minded family and save Falkenstein Castle from chaos.
s5116,Movie,48 Christmas Wishes,"Marco Deufemia, Justin G. Dyck","Khiyla Aynne, Noah Dyer, Maya Franzoi, Clara Kushnir, Madeline Leon, Liam MacDonald, Matt Schichter, Ethan Yang, Adam Crew",Canada,"December 20, 2017",2017,TV-G,84 min,"Children & Family Movies, Comedies","When a small town's letters to Santa accidentally go up in smoke, two elves venture out of the North Pole to retrieve every missing wish."
s5134,Movie,Trolls Holiday Special,Joel Crawford,"Anna Kendrick, Justin Timberlake, Zooey Deschanel, Christopher Mintz-Plasse, James Corden, Ron Funches, Kunal Nayyar, Aino Jawo, Caroline Hjelt, Walt Dohrn",United States,"December 6, 2017",2017,TV-Y7,27 min,"Children & Family Movies, Comedies, Music & Musicals","When Queen Poppy realizes that Bridget and the Bergens don't have any holidays, she hatches a plan for Branch and the Snack Pack to help create one."
s5138,Movie,A StoryBots Christmas,"Evan Spiridellis, Jeff Gill","Edward Asner, Judy Greer, Erin Fitzgerald, Fred Tatasciore, Jeff Gill, Gregg Spiridellis, Evan Spiridellis, Jim Meskimen, Nate Theis",United States,"December 1, 2017",2017,TV-Y,26 min,"Children & Family Movies, Comedies","Bo thinks her holiday gift-giving isn't good enough, so she heads north to study under Santa Claus – only to find he's missing."
s5141,Movie,DreamWorks Home: For the Holidays,,"Rachel Crow, Mark Whitten, Kelly Clarkson, Ana Ortiz, Ben Schwartz, Ron Funches, Matt Jones",United States,"December 1, 2017",2017,TV-Y,46 min,"Children & Family Movies, Comedies, Music & Musicals","Oh takes it upon himself to introduce Christmas joy to his fellow Boovs. Unfortunately, his well-meaning mission nearly destroys the city."
s5143,Movie,Monster Island,Leopoldo Aguilar,"Joey Camen, Fiona Hardingham, Johnny Rose, Katie Leigh, Roger L. Jackson, Wally Wingert, Phillip Vasquez","India, Mexico","December 1, 2017",2017,TV-Y7,81 min,Children & Family Movies,"When a teenager discovers he's not really human, he ventures out to a remote island to explore his roots and confronts a series of wild challenges."
s5161,Movie,Beat Bugs: All Together Now,Josh Wakely,"Ashleigh Ball, Lili Beaudoin, Charles Demers, Rebecca Husain, Erin Mathews","Australia, Canada","November 21, 2017",2017,TV-Y,51 min,"Children & Family Movies, Music & Musicals","After winning a local talent show, the Beat Bugs journey to compete on ""The Bug Factor,"" a televised singing contest held in faraway Rocket Ship Park."
s5164,Movie,A Christmas Prince,Alex Zamm,"Rose McIver, Ben Lamb, Alice Krige, Honor Kneafsey",United States,"November 17, 2017",2017,TV-PG,92 min,"Children & Family Movies, Dramas, Romantic Movies",Christmas comes early for an aspiring young journalist when she's sent abroad to get the scoop on a dashing prince who's poised to be king.
s5190,Movie,Pettersson and Findus 2,Ali Samadi Ahadi,"Stefan Kurt, Marianne Sägebrecht, Max Herbrechter",Germany,"November 1, 2017",2016,TV-G,82 min,"Children & Family Movies, Comedies","Christmas is just around the corner, but Pettersson and Findus are worried the snowy weather (and lack of a tree) may keep them from celebrating."
s5200,Movie,Pup Star: Better 2Gether,Robert Vince,"Kaitlyn Maher, Obba Babatundé, Lombardo Boyar, Molly Burnett, Chris Coppola, Reggie De Leon, David DeLuise, Matty Finochio, Josh Flitter, Benjamin Flores Jr.",Canada,"October 28, 2017",2017,PG,93 min,"Children & Family Movies, Comedies",Returning Pup Star champ Tiny has her Yorkie paws full after an evil rival replaces her with street dog Scrappy during the national competition.
s5242,Movie,Ghost Patrol,Karen J. Lloyd,"Scott McNeil, Vincent Tong, Travis Turner, Shannon Chan-Kent, Lili Beaudoin",Canada,"October 1, 2017",2016,TV-Y7,47 min,"Children & Family Movies, Comedies",Two kids and their pet dog (aka the Ghost Patrol) get a call about an old manor and soon find they are investigating their first real haunted house.
s5270,Movie,Barbie Dolphin Magic,Conrad Helten,"Erica Lindbeck, Shannon Chan-Kent, Kazumi Evans, Claire Corlett, Ciana Swales, Adrian Petriw, Maryke Hendrikse, Paul Dobson, Garry Chalk","United States, Canada","September 18, 2017",2017,TV-Y,64 min,Children & Family Movies,"While visiting Ken and exploring a coral reef, Barbie and her sisters make an amazing discovery and meet a mysterious new friend."
