show_id,type,title,director,cast,country,date_added,release_year,rating,duration,listed_in,description
s4822,TV Show,Marvel's Luke Cage,,"Mike Colter, Alfre Woodard, Rosario Dawson, Simone Missick, Mahershala Ali, Erik LaRay Harvey, Theo Rossi, Frank Whaley, Frankie Faison, Sonia Braga, Ron Cephas Jones",United States,"June 22, 2018",2018,TV-MA,2 Seasons,"Crime TV Shows, TV Action & Adventure, TV Dramas","A hoodie-wearing, unbreakable ex-con fights to clear his name and save his neighborhood. He wasn't looking for a fight, but the people need a hero."
s4837,TV Show,The Staircase,,,France,"June 8, 2018",2018,TV-MA,1 Season,"Crime TV Shows, Docuseries, TV Mysteries","Accident or murder? After the mysterious death of his wife, author Michael Peterson watches his life go under the microscope."
s4842,TV Show,November 13: Attack on Paris,,,France,"June 1, 2018",2018,TV-MA,1 Season,"Crime TV Shows, Docuseries, International TV Shows","Survivors and first responders share personal stories of anguish, kindness and bravery that unfolded amid the Paris terror attacks of Nov. 13, 2015."
s4858,TV Show,Inspector Gadget,,"Ivan Sherry, Tara Strong, Martin Roach, Scott McCord, Lyon Smith, Derek McGrath","Canada, United States, France","May 18, 2018",2017,TV-Y7,4 Seasons,"Crime TV Shows, Kids' TV, TV Comedies","Inspector Gadget is back and must face his old enemy, the evil Dr. Claw, who has reactivated MAD, his global crime syndicate."
s4868,TV Show,Evil Genius,"Trey Borzillieri, Barbara Schroeder",,United States,"May 11, 2018",2018,TV-MA,1 Season,"Crime TV Shows, Docuseries, TV Mysteries",This baffling true crime story starts with the grisly death of a pizza man who robs a bank with a bomb around his neck – and gets weirder from there.
s4926,TV Show,The Chalet,,"Chloé Lambert, Philippe Dusseau, Emilie de Preissac, Marc Ruchmann, Blanche Veisberg, Eric Savin, Nicolas Gob, Catherine Vinatier, Thierry Godard",France,"April 17, 2018",2018,TV-MA,1 Season,"Crime TV Shows, International TV Shows, TV Dramas",Friends gathered at a remote chalet in the French Alps for a summer getaway are caught in a deadly trap as a dark secret from the past comes to light.
s4950,TV Show,Fallet,,"Lisa Henni, Adam Godley, Tomas von Brömssen, Lia Boysen, Christoffer Nordenrot, Stina Rautelin, Erik Madsen, Magnus Krepper, Meliz Karlge, Linda Nilarve, Björn Granath, Richenda Carey, Dag Malmberg",Sweden,"April 1, 2018",2017,TV-MA,1 Season,"Crime TV Shows, International TV Shows, TV Comedies",A Swedish detective and her timid British colleague's attempt to solve a gruesome murder case nets mixed results and miscommunication.
s4965,TV Show,Trailer Park Boys,,"Mike Smith, John Paul Tremblay, Robb Wells, John Dunsworth, Patrick Roach, Cory Bowles, Lucy Decoutere, Barrie Dunn, Sarah Dunsworth, Jeanna Harrison, Michael Jackson, Garry James, Tyrone Parsons, Shelley Thompson, Jonathan Torrens",Canada,"March 30, 2018",2018,TV-MA,12 Seasons,"Classic & Cult TV, Crime TV Shows, International TV Shows",Follow the booze-fueled misadventures of three longtime pals and petty serial criminals who run scams from their Nova Scotia trailer park.
s4981,TV Show,Wild Wild Country,,,United States,"March 16, 2018",2018,TV-MA,1 Season,"Crime TV Shows, Docuseries","When a controversial cult leader builds a utopian city in the Oregon desert, conflict with the locals escalates into a national scandal."
s4993,TV Show,Collateral,,"Carey Mulligan, John Simm, Nicola Walker, Billie Piper, Nathaniel Martello-White, Jeany Spark, Hayley Squires, Ben Miles, Saskia Reeves, Ahd","United Kingdom, United States","March 9, 2018",2018,TV-MA,1 Season,"British TV Shows, Crime TV Shows, International TV Shows","Investigating the murder of a pizza delivery man, a London detective uncovers a tangled conspiracy involving drug dealers, smugglers and spies."
s4995,TV Show,Bad Guys: Vile City,,"Joong-hoon Park, Jin-mo Joo, Yang Ik-june, Moo-Yul Kim, Ji Soo, Young-chang Song, Hong-Fa Kim, Tae-ho Ryu, Yu-seok Kim, Soo-young Park, Yoon-hee Lee",South Korea,"March 8, 2018",2018,TV-MA,1 Season,"Crime TV Shows, International TV Shows, Korean TV Shows","Ordered to take down a villainous business leader who controls the city, a prosecutor gathers a team of men who may not be so clean themselves."
s4998,TV Show,Borderliner,,"Tobias Santelmann, Ellen Dorrit Petersen, Benjamin Helstad, Frode Winther, Bjørn Skagestad, Eivind Sander, Thelma Farnes Ottersen, Todd Bishop Monrad Vistven, Ole Christoffer Ertvaag, Marina Popovic, Gine Cornelia Pedersen, Ana Gil de Melo Nascimento, Kim-Henning Nilsen, Morten Svartveit, Ellen Birgitte Winther, Even Pedersen","Norway, Germany, Sweden","March 6, 2018",2017,TV-MA,1 Season,"Crime TV Shows, International TV Shows, TV Dramas","To protect his family, a police detective covers up a murder case. But when his partner suspects foul play, he is trapped in a dangerous game on duty."
s5005,TV Show,21 Thunder,,"Stephanie Bennett, Emmanuel Kabongo, RJ Fetherstonhaugh, Andres Joseph, Kevin Claydon, Conrad Pla, Clark Backo, Ryan Pierce, Eileen Li, Susan Bain, Cristina Rosato, Jonathan Kim, Colm Feore",Canada,"March 1, 2018",2017,TV-MA,1 Season,"Crime TV Shows, International TV Shows, TV Dramas","Players and coaches for a Montreal soccer team chase dreams of stardom while their personal lives erupt with love, fear, passion and violence."
s5030,TV Show,Seven Seconds,,"Clare-Hope Ashitey, Regina King, Beau Knapp, Michael Mosley, David Lyons, Russell Hornsby, Raúl Castillo, Patrick Murney",United States,"February 23, 2018",2018,TV-MA,1 Season,"Crime TV Shows, TV Dramas",The death of a 15-year-old African American boy in Jersey City sets off a police cover-up and a search for the truth.
s5033,TV Show,The Frankenstein Chronicles,,"Sean Bean, Tom Ward, Richie Campbell, Vanessa Kirby, Ed Stoppard, Ryan Sampson, Robbie Gee, Anna Maxwell Martin, Elliot Cowan, Charlie Creed-Miles, Eloise Smyth, Samuel West",United Kingdom,"February 20, 2018",2017,TV-MA,2 Seasons,"British TV Shows, Crime TV Shows, International TV Shows","A detective tracks what seems to be a killer with a taste for dismemberment in 1827 London, but the case leads in a far more terrifying direction."
s5055,TV Show,Under Arrest,Dan Forrer,,United States,"February 1, 2018",2016,TV-MA,8 Seasons,"Crime TV Shows, Docuseries, International TV Shows","Cameras follow police officers as they solve crimes, assist the public and arrest lawbreakers in this reality series."
s5058,TV Show,Retribution,,"Georgina Campbell, Joe Dempsie, Adrian Edmondson, Steve Evets, Laura Fraser, Julie Graham, John Lynch, Gary Lewis, Juliet Stevenson, Joanna Vanderham",United Kingdom,"January 30, 2018",2016,TV-MA,1 Season,"British TV Shows, Crime TV Shows, International TV Shows",A dark web of secrets and lies emerges when a newlywed couple is killed and detectives question their feuding families.
s5100,TV Show,The Frozen Dead,,"Charles Berling, Julia Piaton, Pascal Greggory, Nina Meurisse, Lubna Azabal, Anne Le Ny, Robinson Stévenin, Robert Plagnol, Sophie Guillemin",France,"January 1, 2018",2017,TV-MA,1 Season,"Crime TV Shows, International TV Shows, TV Dramas",A grisly find atop a mountain in the French Pyrenees leads investigator Martin Servaz into a twisted dance with a serial killer in this icy thriller.
s5104,TV Show,La Mante,,"Carole Bouquet, Fred Testot, Pascal Demolon, Manon Azem, Frédérique Bel, Élodie Navarre, Jacques Weber",France,"December 29, 2017",2017,TV-MA,1 Season,"Crime TV Shows, International TV Shows, TV Dramas","Decades after her capture, a serial killer offers to help solve a string of copycat murders – but only if her son, now a cop, will work by her side."
s5119,TV Show,The Indian Detective,,"Russell Peters, Anupam Kher, Christina Cole, Mishqah Parthiephal, Hamza Haq, Meren Reddy, William Shatner","Canada, Germany, South Africa","December 19, 2017",2017,TV-14,1 Season,"Crime TV Shows, International TV Shows, TV Comedies","In this crime dramedy, a suspended Canadian cop visits his father in Mumbai and assists in investigating a huge criminal operation with links to home."
s5126,TV Show,Wormwood,,"Peter Sarsgaard, Molly Parker, Christian Camargo, Scott Shepherd, Tim Blake Nelson, Jimmi Simpson, Bob Balaban, Michael Chernus",United States,"December 15, 2017",2017,TV-14,1 Season,"Crime TV Shows, Docuseries","In this genre-bending tale, Errol Morris explores the mysterious death of a U.S. scientist entangled in a secret Cold War program known as MK-Ultra."
s5151,TV Show,Broadchurch,,"David Tennant, Olivia Colman, Andrew Buchan, Jodie Whittaker, Arthur Darvill, Jonathan Bailey, Carolyn Pickles, Adam Wilson, Charlotte Beaumont, Simone McAullay, Tanya Franks, Pauline Quirke, Phoebe Waller-Bridge, Marianne Jean-Baptiste, Charlotte Rampling, Eve Myles, James D'Arcy, Susan Brown, Vicky McClure, Will Mellor, David Bradley",United Kingdom,"November 27, 2017",2017,TV-MA,3 Seasons,"British TV Shows, Crime TV Shows, International TV Shows","After a young boy is murdered in the small seaside town of Broadchurch, local detectives Ellie Miller and Alec Hardy are assigned the mysterious case."
s5166,TV Show,Longmire,,"Robert Taylor, Katee Sackhoff, Lou Diamond Phillips, Bailey Chase, Cassidy Freeman, Adam Bartley, Louanne Stephens",United States,"November 17, 2017",2017,TV-MA,6 Seasons,"Crime TV Shows, TV Dramas",This contemporary crime thriller focuses on a Wyoming sheriff who's rebuilding his life and career following the death of his wife.
s5171,TV Show,The Method,,"Konstantin Khabenskiy, Paulina Andreeva, Alexander Tsekalo, Alexander Petrov, Ivan Dobronravov, Kirill Poluhin",Russia,"November 15, 2017",2015,TV-MA,1 Season,"Crime TV Shows, International TV Shows, TV Dramas",An ambitious young law enforcement graduate is thrilled when her idol takes her on as a trainee. But his methods aren't anything like she imagined.
s5186,TV Show,Alias Grace,,"Sarah Gadon, Edward Holcroft, Paul Gross, Anna Paquin, Rebecca Liddiard, Zachary Levi, Kerr Logan, David Cronenberg",Canada,"November 3, 2017",2017,TV-MA,1 Season,"Crime TV Shows, International TV Shows, TV Dramas","In 19th-century Canada, a psychiatrist weighs whether a murderess should be pardoned due to insanity. Based on Margaret Atwood's award-winning novel."
s5195,TV Show,The Truth,,"Tay Ping Hui, Joanne Peh, Shaun Chen, Rebecca Lim, Zhu Houren, Richard Low",,"November 1, 2017",2008,TV-14,1 Season,"Crime TV Shows, International TV Shows, TV Action & Adventure","A devious businessman covets his partner's priceless treasure map, while a related murder case calls into question some biological family ties."
s5211,TV Show,The Day I Met El Chapo,,Kate del Castillo,United States,"October 20, 2017",2017,TV-MA,1 Season,"Crime TV Shows, Docuseries, International TV Shows","Mexican superstar actress Kate del Castillo reveals the untold story of her encounter with El Chapo Guzmán, the world’s most-wanted drug lord."
s5279,TV Show,Apaches,,"Alberto Ammann, Eloy Azorín, Verónica Echegui, Lucía Jiménez, Claudia Traisac",Spain,"September 8, 2017",2016,TV-MA,1 Season,"Crime TV Shows, International TV Shows, Spanish-Language TV Shows",A young journalist is forced into a life of crime to save his father and family in this series based on the novel by Miguel Sáez Carral.
s5287,TV Show,Frequency,,"Peyton List, Riley Smith, Mekhi Phifer, Devin Kelley, Lenny Jacobson, Daniel Bonjour, Anthony Ruivivar",United States,"September 4, 2017",2016,TV-14,1 Season,"Crime TV Shows, TV Dramas, TV Mysteries","A detective seizes a precious opportunity to change the past when she finds she can communicate with her deceased, estranged father via a time warp."
s5306,TV Show,Narcos,,"Wagner Moura, Pedro Pascal, Boyd Holbrook, Damián Alcázar, Alberto Ammann, Francisco Denis, Pêpê Rapazote, Matias Varela, Michael Stahl-David, Matt Whelan, Arturo Castro, Javier Cámara, José María Yazpik, Eric Lange, Brett Cullen, Miguel Ángel Silvestre, Kerry Bishé, Paulina Gaitán, Cristina Umaña, Paulina García, Juan Sebastián Calero, Joanna Christie, Taliana Vargas, Andrea Londo, Manolo Cardona, Diego Cataño, Raúl Méndez, Bruno Bichir, Stephanie Sigman, Florencia Lozano, Juan Pablo Raba, Leynar Gomez, Konstantin Melikhov, Martina García, Maurice Compte, Mauricio Cujar, Jorge Monterrosa, Germán Jaramillo, Juan Pablo Shuk, Julián Díaz, Alejandro Buitrago, Federico Rivera","United States, Colombia, Mexico","September 1, 2017",2017,TV-MA,3 Seasons,"Crime TV Shows, TV Action & Adventure, TV Dramas",The true story of Colombia's infamously violent and powerful drug cartels fuels this gritty gangster drama series.
s5322,TV Show,Marvel's The Defenders,,"Charlie Cox, Krysten Ritter, Mike Colter, Finn Jones, Sigourney Weaver, Elodie Yung, Elden Henson, Jessica Henwick, Simone Missick, Rachael Taylor, Deborah Ann Woll, Rosario Dawson, Carrie-Anne Moss, Eka Darville, Scott Glenn",United States,"August 18, 2017",2017,TV-MA,1 Season,"Crime TV Shows, TV Action & Adventure, TV Dramas","Daredevil, Jessica Jones, Luke Cage and Iron Fist join forces to take on common enemies as a sinister conspiracy threatens New York City."
s5325,TV Show,20 Minutes,,"Tuba Büyüküstün, Ilker Aksum, Bülent Emin Yarar, İpek Bilgin, Müjde Uzman, Firat Çelik, Ayten Uncuoglu, Cihat Tamer",Turkey,"August 15, 2017",2013,TV-MA,1 Season,"Crime TV Shows, International TV Shows, TV Dramas","When his wife is convicted of murder, a horrified family man races to prove her innocence while a dogged investigator sets out to uncover the truth."
s5328,TV Show,Million Yen Women,,"Yojiro Noda, Rila Fukushima, Rena Matsui, Miwako Wagatsuma, Rena Takeda, Yuko Araki, Yuya Endo, Kaito Yoshimura, Moeka Hoshi, Juri Ihata, Mariko Tsutsui, Kanji Furutachi, Tetsuhiro Ikeda, Takashi Yamanaka, Tomoya Nakamura, Lily Franky",Japan,"August 15, 2017",2017,TV-MA,1 Season,"Crime TV Shows, International TV Shows, TV Dramas","Five beautiful but mysterious women move in with unsuccessful novelist Shin, who manages their odd household in exchange for a tidy monthly sum."
s5349,TV Show,Close Your Eyes Before It’s Dark,,"Bryan Shu-Hao Chang, Jian Man-shu, Yen Tsao, Sun Ke-fang, Allen Chen, Jake Hsu, Chu Sheng-ping, Blue Lan",Taiwan,"August 1, 2017",2016,TV-14,1 Season,"Crime TV Shows, International TV Shows, TV Dramas","While vacationing at a mountain cabin, a group of longtime friends uncovers an old scandal that could have deadly consequences."
s5351,TV Show,Fartsa,,"Alexander Petrov, Fillip Gorenshtein, Maksim Emelyanov, Aleksey Vesyolkin, Zoya Berber, Ieva Andrejevaite",Russia,"August 1, 2017",2015,TV-14,1 Season,"Crime TV Shows, International TV Shows, TV Dramas","As four Russian friends grow up in the early '60s, life, love and the curse of success threaten to derail their dreams."
s5353,TV Show,"Have You Ever Fallen in Love, Miss Jiang?",,"Lan Cheng-lung, Esther Yeh, He Yu-chen, Greg Han",,"August 1, 2017",2016,TV-14,1 Season,"Crime TV Shows, International TV Shows, TV Dramas",A new teacher finds herself in an unenviable situation after witnessing a troubling interaction between an administrator and a student.
s5356,TV Show,Locust,,"Pyotr Fyodorov, Paulina Andreeva, Dmitry Shevchenko, Aleksey Gorbunov, Evgeniya Dmitrieva, Maksim Pinsker",Russia,"August 1, 2017",2014,TV-MA,1 Season,"Crime TV Shows, International TV Shows, Romantic TV Shows","A torrid affair between a passionate lowborn poet and a wealthy Moscow heiress is engulfed by class difference, criminality and, eventually, murder."
s5361,TV Show,Surviving Escobar - Alias JJ,,"Juan Pablo Urrego, Amparo Grisales, Nicole Santamaría, Elkin Díaz, Francisco Javier Rueda, Ramsés Ramos, Lina Marcela Castrillón, Toto Vega, Camilo Sáenz, Mijail Mulkay, Natasha Klauss, Nelson Camayo",,"August 1, 2017",2017,TV-MA,1 Season,"Crime TV Shows, International TV Shows, Spanish-Language TV Shows","As the Medellín Cartel crumbles, Pablo Escobar's No. 1 hit man struggles to stay alive and gain respect in the prison hierarchy."
s5366,TV Show,Vexed,,"Toby Stephens, Miranda Raison, Lucy Punch, Nick Dunning, Rory Kinnear, Ronny Jhutti, Roger Griffiths, Patrick Baladi",United Kingdom,"August 1, 2017",2012,TV-MA,2 Seasons,"British TV Shows, Crime TV Shows, International TV Shows",Charming slacker DI Jack Armstrong and driven professional DI Kate Bishop try to solve crimes together without driving each other crazy.
s5391,TV Show,Against the Tide,,"Christopher Lee, Rui En, Desmond Tan, Zheng Geping, Zhang Zhenhuan, Paige Chua, Xu Bin, Carrie Wong",Singapore,"July 1, 2017",2014,TV-14,1 Season,"Crime TV Shows, International TV Shows, TV Dramas",A detective and a psychologist investigating a string of murders form a crime-solving team with the novelist whose work inspired the killings.
s5405,TV Show,The Truth Seekers,,"Chen Hanwei, Rebecca Lim, Desmond Tan, Yusuke Fukuchi",Singapore,"July 1, 2017",2016,TV-MA,1 Season,"Crime TV Shows, International TV Shows, TV Dramas","A veteran cop forms an agency dedicated to solving cold cases, including those related to the team members' own painful and mysterious pasts."
s5407,TV Show,Unriddle,,"Rui En, Chen Liping, Tay Ping Hui, Andie Chen, Xiang Yun, Joshua Ang, Zhou Ying",Singapore,"July 1, 2017",2012,TV-14,2 Seasons,"Crime TV Shows, International TV Shows, TV Dramas","When a hard-nosed detective reluctantly partners with an informant to solve complex cases, she uncovers links to a particularly puzzling cold case."
s5413,TV Show,Criminal Minds,,"Mandy Patinkin, Joe Mantegna, Thomas Gibson, Shemar Moore, Matthew Gray Gubler, Kirsten Vangsness, A.J. Cook, Paget Brewster, Lola Glaudini, Jennifer Love Hewitt, Jeanne Tripplehorn","United States, Canada","June 30, 2017",2017,TV-14,12 Seasons,"Crime TV Shows, TV Dramas, TV Mysteries",This intense police procedural follows a group of extraordinary FBI profilers who spend their days getting into the minds of psychopathic criminals.
s5426,TV Show,Aquarius,,"David Duchovny, Gethin Anthony, Grey Damon, Emma Dumont, Claire Holt, Michaela McManus, Brían F. O'Byrne, David Meunier, Ambyr Childers, Tara Lynne Barr, Whitney Rose Pynn, Jason Ralph",United States,"June 16, 2017",2016,TV-MA,2 Seasons,"Crime TV Shows, TV Dramas","Amid the turmoil of 1960s LA, two cops and a prominent political family are drawn into the sex- and drug-fueled web of a young Charles Manson."
s5436,TV Show,Man to Man,Chang-Min Lee,"Hae-Jin Park, Sung-woong Park, Min-jung Kim, Jung-an Chae, Jung-hoon Yeon, Hyun-sung Jang, Man-sik Jung, Shin-il Kang, Ho-jin Chun, In-ho Tae",South Korea,"June 10, 2017",2017,TV-14,1 Season,"Crime TV Shows, International TV Shows, Korean TV Shows","Disguised as a bodyguard, a special agent must complete his national secret tasks while pandering to the whims of his ill-tempered world star."
s5437,TV Show,My Little Baby,,"Ji-ho Oh, Soo-kyung Lee, Min-jae Kim, Ji-hyun Nam",South Korea,"June 10, 2017",2016,TV-PG,1 Season,"Crime TV Shows, International TV Shows, Korean TV Shows",A top detective in the violent crimes unit becomes the sole guardian of his 6-month-old niece when his sister and her husband pass away unexpectedly.
s5458,TV Show,Mind Game,,"Tay Ping Hui, Joanne Peh, Zhang Yaodong, Paige Chua, Akit Tay",Singapore,"June 1, 2017",2015,TV-14,1 Season,"Crime TV Shows, International TV Shows, TV Dramas","With the help of a cop, a psychologist and a woman who can foretell the future, a brilliant paralegal works to solve an array of perplexing mysteries."
s5480,TV Show,The Keepers,,,United States,"May 19, 2017",2017,TV-MA,1 Season,"Crime TV Shows, Docuseries, TV Mysteries",This docuseries examines the decades-old murder of Sister Catherine Cesnik and its suspected link to a priest accused of abuse.
s5515,TV Show,Mar de Plástico,,"Rodolfo Sancho, Belén López, Pedro Casablanc, Luis Fernández, Patrick Criado, Nya de la Rubia, Jesús Castro, Fernando Cayo",Spain,"April 27, 2017",2017,TV-MA,2 Seasons,"Crime TV Shows, International TV Shows, Spanish-Language TV Shows","In a town in southern Spain where racial tensions run high among the workers in its many greenhouses, a cop investigates the murder of a young woman."
s5564,TV Show,One-Punch Man,,"Makoto Furukawa, Kaito Ishikawa, Yuki Kaji, Aoi Yuki, Kazuhiro Yamaji, Kenjiro Tsuda, Minami Takayama, Tessho Genda",Japan,"March 20, 2017",2015,TV-14,1 Season,"Anime Series, Crime TV Shows, International TV Shows","The most powerful superhero in the world can kill anyone with one blow. But nothing can challenge him, so he struggles with ennui and depression."
s5659,TV Show,Sense8,,"Tuppence Middleton, Brian J. Smith, Doona Bae, Max Riemelt, Naveen Andrews, Daryl Hannah, Freema Agyeman, Terrence Mann, Adam Shapiro, Max Mauff, Alfonso Herrera, Eréndira Ibarra, Aml Ameen, Jamie Clayton, Tina Desae, Miguel Ángel Silvestre, Toby Onwumere, Joe Pantoliano",United States,"December 23, 2016",2018,TV-MA,2 Seasons,"Crime TV Shows, TV Dramas, TV Mysteries","From the creators of ""The Matrix"" and ""Babylon 5"" comes this tense series in which eight people can telepathically experience each other's lives."
s5681,TV Show,Captive,,,United Kingdom,"December 9, 2016",2016,TV-MA,1 Season,"Crime TV Shows, Docuseries","This documentary series reconstructs history's most complex, high-stakes hostage negotiations as kidnapping victims recount their terrifying ordeals."
s5716,TV Show,La Niña,,"Ana María Estupiñán, Sebastian Eslava, Juan Sebastián Aragón, Diego Vásquez, Carlos Velazquez, Marcela Benjumea, Melisa Caceres, Michelle Orozco, Alberto Cardeño, Constanza Camelo, Fernando Arévalo",Colombia,"November 18, 2016",2016,TV-MA,1 Season,"Crime TV Shows, International TV Shows, Spanish-Language TV Shows",A former Colombian guerrilla fighter faces challenges as she reintegrates into society and tries to overcome her traumatic memories.
s5717,TV Show,Paranoid,,"Indira Varma, Robert Glenister, Dino Fetscher, Neil Stuke, Christiane Paul, Lesley Sharp, Kevin Doyle",United Kingdom,"November 17, 2016",2016,TV-MA,1 Season,"British TV Shows, Crime TV Shows, International TV Shows","When a woman is brutally murdered on a playground, a group of detectives find themselves drawn into a dark conspiracy as they search for the killer."
s5723,TV Show,Case,,"Steinunn Ólína Þorsteinsdóttir, Magnús Jónsson, Þorsteinn Bachmann, Jóhanna Vigdís Arnardóttir, Birna Rún Eiríksdóttir, Elma Stefania Agustsdottir, Bergur Þór Ingólfsson, Halldóra Geirharðsdóttir, Arnar Jónsson, Davíð Freyr Þórunnarson, Björn Stefánsson, Nína Dögg Filippusdóttir, Hjortur Jóhann Jónsson",Iceland,"November 9, 2016",2015,TV-MA,1 Season,"Crime TV Shows, International TV Shows, TV Dramas",A smart lawyer whose drinking and recklessness send him on a path of self-destruction finds new purpose investigating a teenager's apparent suicide.
s5752,TV Show,DEATH NOTE,,"Kappei Yamaguchi, Alessandro Juliani, Mamoru Miyano, Brad Swaile, Ai Satou, Saffron Henderson, Akeno Watanabe, Lisa Ann Beley, Aya Hirano, Shannon Chan-Kent, Haruka Kudo, Kelly Metzger, Hideo Ishikawa, Brian Dobson, Hiroki Takahashi, Sam Vincent, Shido Nakamura, Brian Drummond, Naoya Uchida, Chris Britton",Japan,"October 15, 2016",2006,TV-14,1 Season,"Anime Series, Crime TV Shows, International TV Shows","When a Japanese high schooler comes into possession of a mystical notebook, he finds he has the power to kill anybody whose name he enters in it."
s5753,TV Show,Spotless,,"Marc-André Grondin, Denis Ménochet, Miranda Raison, Doug Allen, Liam Garrigan, Ciarán Owens, Kate Magowan, Tanya Fear, Naomi Radcliffe, Lucy Akhurst, Jemma Donovan, Niall Hayes, Brendan Coyle","United Kingdom, France","October 15, 2016",2015,TV-MA,1 Season,"Crime TV Shows, International TV Shows, TV Dramas",The law-abiding owner of a crime scene cleaning service is forced into business with a powerful mob boss thanks to his irresponsible older brother.
s5804,TV Show,Forensic Files,,Peter Thomas,United States,"September 1, 2016",2011,TV-MA,9 Seasons,"Crime TV Shows, Docuseries, Science & Nature TV",Detectives and crime lab technicians use the latest and most fascinating procedures to solve crimes in this documentary-style show.
s5807,TV Show,Witches: A Century of Murder,,Suzannah Lipscomb,United Kingdom,"September 1, 2016",2015,TV-14,1 Season,"British TV Shows, Crime TV Shows, Docuseries","Historian Suzannah Lipscomb investigates the witch hunts that plagued Britain in the 17th century, examining common myths about their origin."
s5813,TV Show,Caught on Camera,,Nick Wallis,United Kingdom,"August 15, 2016",2015,TV-MA,3 Seasons,"British TV Shows, Crime TV Shows, Docuseries","Nick Wallis presents crimes caught on CCTV, cell phones and other devices and reveals how investigators use the recordings to solve tough cases."
s5823,TV Show,Cocaine,,,United Kingdom,"August 1, 2016",2005,TV-14,1 Season,"British TV Shows, Crime TV Shows, Docuseries","Three films chronicle the cocaine trade's sweeping impact on the citizens of Peru, Brazil and Colombia, from poor farmers to powerful drug lords."
s5923,TV Show,Lilyhammer,,"Steven Van Zandt, Trond Fausa, Steinar Sagen, Robert Skjærstad, Tommy Karlsen, Fridtjov Såheim, Marian Saastad Ottesen","Norway, United States","November 21, 2014",2014,TV-MA,3 Seasons,"Crime TV Shows, TV Comedies, TV Dramas","After testifying against the Mafia, ex-gangster Frank Tagliano enters witness protection and asks to be sent to Norway."
s5941,TV Show,Breaking Bad,,"Bryan Cranston, Aaron Paul, Anna Gunn, Dean Norris, Betsy Brandt, R.J. Mitte, Bob Odenkirk, Steven Michael Quezada, Jonathan Banks, Giancarlo Esposito",United States,"August 2, 2013",2013,TV-MA,5 Seasons,"Crime TV Shows, TV Dramas, TV Thrillers",A high school chemistry teacher dying of cancer teams with a former student to secure his family's future by manufacturing and selling crystal meth.
