show_id,type,title,director,cast,country,date_added,release_year,rating,duration,listed_in,description
s3884,TV Show,The Outsiders,,"Dylan Kuo, Ady An, Lan Cheng-Lung, Michael Chang, Joelle Lu",Taiwan,"April 30, 2019",2004,TV-MA,1 Season,"Crime TV Shows, International TV Shows, Romantic TV Shows",A trio of delinquent brothers fends off neighborhood rivals until one joins a gang to gain protection for the upper-class girl he loves.
s3887,TV Show,Señora Acero,,"Blanca Soto, Litzy, Damián Alcázar, Marco Pérez, Jorge Zárate, Rossana San Juan, Andrés Palacios, Rebecca Jones, Lincoln Palomeque","Mexico, United States","April 28, 2019",2018,TV-MA,5 Seasons,"Crime TV Shows, International TV Shows, Spanish-Language TV Shows","When her drug-trafficking husband dies, an unassuming woman stakes her own claim in the business in order to care for her gravely ill son."
s3938,TV Show,Imposters,,"Inbar Lavi, Rob Heaps, Parker Young, Marianne Rendón, Stephen Bishop, Brian Benben, Katherine La Nasa",United States,"April 5, 2019",2017,TV-MA,2 Seasons,"Crime TV Shows, International TV Shows, TV Comedies","Supported by a team of fellow thieves, a con artist lures her targets into matrimony and then absconds with their fortunes in this darkly comic series."
s3941,TV Show,Quicksand,,"Hanna Ardéhn, Felix Sandman, William Spetz, Ella Rappich, David Dencik, Reuben Sallmander, Maria Sundbom, Rebecka Hemse, Arvid Sand, Helena af Sandeberg, Anna Björk",Sweden,"April 5, 2019",2019,TV-MA,1 Season,"Crime TV Shows, International TV Shows, TV Dramas","After a tragedy at a school sends shock waves through a wealthy Stockholm suburb, a seemingly well-adjusted teen finds herself on trial for murder."
s3945,TV Show,Tijuana,,"Damián Alcázar, Tamara Vallarta, Rolf Petersen, Claudette Maillé, Teté Espinoza, Iván Aragón, Martha Claudia Moreno, Edén Villavicencio, Carlos Corona, Giancarlo Ruiz, Mayra Batalla, Rodrigo Abed, Roberto Mateos, Anabel Ferreira, Roberto Sosa",Mexico,"April 5, 2019",2019,TV-MA,1 Season,"Crime TV Shows, International TV Shows, Spanish-Language TV Shows","When a prominent politician is murdered, the intrepid journalists of Frente Tijuana risk their lives to uncover the truth."
s3947,TV Show,Possessed,,"Song Sae-byeok, Go Joon-hee, Youn Jung-hoon, Jo Han-sun, Lee Won-jong, Park Gene-woo, Kwon Hyuk-hyun, Park Sang-min",South Korea,"April 4, 2019",2019,TV-MA,1 Season,"Crime TV Shows, International TV Shows, Korean TV Shows",A reluctant clairvoyant joins forces with a brusque police detective hiding a soft heart to help him solve criminal cases using her psychic abilities.
s3977,TV Show,The Eagle of El-Se'eed,,"Mohamed Ramadan, Sayed Rajab, Dorra Zarrouk, Dina Talaat, Aida Reyad",,"March 25, 2019",2018,TV-14,1 Season,"Crime TV Shows, International TV Shows, TV Action & Adventure","A police officer and a drug lord become embroiled in a cycle of revenge, each man bent on taking the other down."
s3981,TV Show,Crime Diaries: The Candidate,,"Jorge A. Jiménez, Ilse Salas, Alberto Guerra, Gustavo Sánchez Parra, Jorge Antonio Guerrero, Ari Brickman, Martín Altomaro, Hernán Del Riego, Norma Angélica, Lisa Owen, Eligio Meléndez, Marco Treviño, Pedro de Tavira Egurrola, Leonardo Alonso",Mexico,"March 22, 2019",2019,TV-MA,1 Season,"Crime TV Shows, International TV Shows, Spanish-Language TV Shows","In 1994, Mexican presidential candidate Luis Donaldo Colosio's assassination sends his dying widow racing to uncover who did it. Based on true events."
s3982,TV Show,Delhi Crime,,"Shefali Shah, Rajesh Tailang, Rasika Dugal, Adil Hussain, Vinod Sharawat, Mridul Sharma, Gopal Dutt Tiwari, Anurag Arora, Gaurav Rana, Yashaswini Dayama",India,"March 22, 2019",2019,TV-MA,1 Season,"Crime TV Shows, International TV Shows, TV Dramas","As Delhi reels in the aftermath of a gang rape, DCP Vartika Chaturvedi leads a painstaking search for the culprits. Based on the 2012 Nirbhaya case."
s4016,TV Show,The Disappearance of Madeleine McCann,,,,"March 15, 2019",2019,TV-14,1 Season,"Crime TV Shows, Docuseries","The documentary takes a detailed look at the disappearance of 3-year-old Madeleine McCann, who vanished while on holiday with her family."
s4043,TV Show,American Crime Story: The People v. O.J. Simpson,,"Cuba Gooding Jr., Sarah Paulson, John Travolta, Courtney B. Vance, Sterling K. Brown, Kenneth Choi, Christian Clemenson, Bruce Greenwood, Nathan Lane, David Schwimmer, Chris Bauer, Jordana Brewster, Selma Blair, Connie Britton",United States,"March 6, 2019",2016,TV-MA,1 Season,"Crime TV Shows, TV Dramas","This anthology series dramatizes historic criminal cases in the U.S., including the O.J. Simpson trial and Andrew Cunanan's 1997 murder spree."
s4080,TV Show,Unsolved,,"Josh Duhamel, Jimmi Simpson, Bokeem Woodbine",United States,"February 27, 2019",2018,TV-MA,1 Season,"Crime TV Shows, TV Dramas",Ride along for a dramatized version of the real-life investigations into the murders of rap icons Tupac Shakur and Biggie Smalls.
s4110,TV Show,The 43,,Paco Ignacio Taibo II,,"February 15, 2019",2019,TV-MA,1 Season,"Crime TV Shows, Docuseries, International TV Shows",This docuseries disputes the Mexican government's account of how and why 43 students from Ayotzinapa Rural Teachers' College vanished in Iguala in 2014.
s4120,TV Show,The Break,,"Yoann Blanc, Guillaume Kerbush, Anne Coesens, Jasmina Douieb, Tom Audenaert, Sam Louwyck, Catherine Salée, Jean-Henri Compère",Belgium,"February 9, 2019",2018,TV-MA,2 Seasons,"Crime TV Shows, International TV Shows, TV Dramas","A police detective mourning a painful loss moves back to his peaceful hometown, only to be drawn into a murder case that dredges up dark secrets."
s4127,TV Show,Hidden Worlds,,"Adel Imam, Salah Abdallah, Hiba Majdi, Bushra, Fathy Abdel Wehab, Rania Farid Shawki, Ahmad Wafiq",Egypt,"February 5, 2019",2018,TV-14,1 Season,"Crime TV Shows, International TV Shows, TV Dramas","While investigating an actress’s supposed suicide and her connection to the mafia, a veteran journalist discovers that corruption runs deep."
s4128,TV Show,Live,,"Jung Yu-mi, Lee Kwang-soo, Bae Seong-woo, Bae Jong-ok, Sung Dong-il",South Korea,"February 5, 2019",2018,TV-MA,1 Season,"Crime TV Shows, International TV Shows, Korean TV Shows",The police officers at South Korea's busiest patrol division toil day and night as keepers of law and peace – but the reality is far from orderly.
s4130,TV Show,Safe,,"Michael C. Hall, Amanda Abbington, Marc Warren, Hannah Arterton, Audrey Fleurot, Nigel Lindsay",United Kingdom,"February 5, 2019",2018,TV-MA,1 Season,"British TV Shows, Crime TV Shows, International TV Shows","After his teenage daughter goes missing, a widowed surgeon in an affluent neighborhood begins unearthing dark secrets about the people closest to him."
s4144,TV Show,Sparta,,"Alexander Petrov, Artyom Tkachenko, Valeria Shkirando, Marina Kaletskaya, Alisa Lozovskaya, Olga Sutulova, Fillip Gorenshtein, Olga Vinichenko, Petar Zakavitsa, Yan Gakharmanov",Russia,"February 1, 2019",2018,TV-MA,1 Season,"Crime TV Shows, International TV Shows, TV Dramas","While investigating the mysterious death of a teacher, a grizzled detective gets caught up in the world of a high-stakes virtual reality game."
s4169,TV Show,Examination of Conscience,,,Spain,"January 25, 2019",2019,TV-MA,1 Season,"Crime TV Shows, Docuseries, International TV Shows","Allegations of child sexual abuse in Spain's Catholic institutions are examined in interviews with survivors, clergy, journalists and other experts."
s4173,TV Show,Conversations with a Killer: The Ted Bundy Tapes,,,United States,"January 24, 2019",2019,TV-MA,1 Season,"Crime TV Shows, Docuseries","Present-day interviews, archival footage and audio recordings made on death row form a searing portrait of notorious serial killer Ted Bundy."
s4175,TV Show,Innocent,Seren Yüce,"Ali Atay, Haluk Bilginer, Nur Sürer, Okan Yalabık, Tülin Özen, Serkan Keskin, Bartu Küçükçağlayan, Irem Altug, Mehmet Özgür, Merve Ates, Defne Halman, Cem Zeynel Kiliç, Esra Kizildogan",Turkey,"January 23, 2019",2017,TV-MA,1 Season,"Crime TV Shows, International TV Shows, TV Dramas","In a peaceful, rustic town, a retired officer and his family are mired in a murder mystery riddled with shocking, buried secrets."
s4179,TV Show,Marvel's The Punisher,,"Jon Bernthal, Ebon Moss-Bachrach, Ben Barnes, Amber Rose Revah, Jason R. Moore, Daniel Webber, Jaime Ray Newman, Michael Nathanson, Deborah Ann Woll, Paul Schulze",United States,"January 18, 2019",2019,TV-MA,2 Seasons,"Crime TV Shows, TV Action & Adventure, TV Thrillers",A former Marine out to punish the criminals responsible for his family's murder finds himself ensnared in a military conspiracy.
s4252,TV Show,In Family We Trust,,"Songsit Roongnophakunsri, Saksit Tangtong, Kathaleeya McIntosh, Sopitnapa Choompanee, Apasiri Nitibhon, Phollawat Manuprasert, Nappon Gomarachun, Patravadi Mejudhon, Kejmanee Wattanasin, Supoj Chancharoen, Pimmara Charoenpakdee, Thanapob Leeratanakajorn, Kritsanapoom Pibulsonggram, Teeradon Supapunpinyo, Kongyingyong Chonlathorn, Lapat Ngamchaweng, Sivakorn Adulsuttikul, Paris Intarakomalyasut, Jackrin Kungwankiatichai, Vachirawich Aranthanawong, Sawanya Paisarnpayak, Kanyawee Songmuang, Pitisak Yaowananon, Chavalit Chittanant, Thaneth Warakulnukroh",Thailand,"December 29, 2018",2018,TV-MA,1 Season,"Crime TV Shows, International TV Shows, TV Dramas","When the head of the lucrative family business passes away, his will leaves the clan at extreme odds."
s4255,TV Show,Hashoter Hatov,,"Moshe Ivgy, Guy Loel, Yuval Semo, Yigal Adika, Avi Shnaidman, Vered Feldman, Liora Rivlin",Israel,"December 28, 2018",2015,TV-MA,1 Season,"Crime TV Shows, International TV Shows, TV Comedies",An honest – though overzealous – police officer strives to do good work while dealing with his bickering parents and incompetent coworkers.
s4257,TV Show,Murder Mountain,,,United States,"December 28, 2018",2018,TV-MA,1 Season,"Crime TV Shows, Docuseries","In Humboldt County, California, the big business of legal marijuana brings in visitors from around the world. Some are never seen again."
s4264,TV Show,Demon's Path,,"Wai Ai, Jim Chim Sui Man, Kwok-Pong Chan, Felix Lok, Sham Ka Ki, Elanne Kong, Kate Yeung, Ong Yi-hing, Sunny Lau",,"December 22, 2018",2018,TV-14,1 Season,"Crime TV Shows, International TV Shows, TV Dramas","To catch three criminal masterminds, a group of cops teams up with a forensic pathologist who can see a murder victim's final moments before death."
s4274,TV Show,Perfume,,"Friederike Becht, August Diehl, Wotan Wilke Möhring, Natalia Belitski, Ken Duken, Trystan Pütter, Christian Friedel, Juergen Maurer, Marc Hosemann, Susanne Wuest",Germany,"December 21, 2018",2018,TV-MA,1 Season,"Crime TV Shows, International TV Shows, TV Dramas","When a singer is found murdered, with her scent glands excised from her body, detectives probe a group of friends who attended boarding school with her."
s4306,TV Show,Inside the Real Narcos,,Jason Fox,,"December 14, 2018",2018,TV-MA,1 Season,"British TV Shows, Crime TV Shows, Docuseries","Exposing a rarely seen perspective on the drug wars, ex-Special Forces commando Jason Fox interviews dangerous traffickers and cartel members."
s4309,TV Show,The Innocent Man,,John Grisham,United States,"December 14, 2018",2018,TV-MA,1 Season,"Crime TV Shows, Docuseries","This documentary adaptation of John Grisham's only nonfiction book raises troubling questions about two murder cases in Ada, Oklahoma, in the 1980s."
s4310,TV Show,Tidelands,,"Charlotte Best, Elsa Pataky, Marco Pigossi, Aaron Jakubenko, Mattias Inwood, Dalip Sondhi, Alex Dimitriades, Richard Davies, Caroline Brazier, Peter O'Brien, Madeleine Madden",Australia,"December 14, 2018",2018,TV-MA,1 Season,"Crime TV Shows, International TV Shows, TV Dramas","Ex-con Cal McTeer's return to her hometown of Orphelin Bay blows the lid off a generations-long conspiracy of silence around murder, drugs and Sirens."
s4311,TV Show,Travelers,,"Eric McCormack, MacKenzie Porter, Nesta Cooper, Jared Paul Abrahamson, Reilly Dolman, Patrick Gilmore","Canada, United States","December 14, 2018",2018,TV-MA,3 Seasons,"Crime TV Shows, International TV Shows, TV Dramas","A federal agent tracks four people who suddenly seem to possess entirely new personalities, leading to a startling discovery about humanity's future."
s4317,TV Show,Dogs of Berlin,,"Felix Kramer, Fahri Yardim, Anna Maria Mühe, Katharina Schüttler, Alina Stiegler, Urs Rechn, Sinan Farhangmehr, Kais Setti, Mohamed Issa, Hauke Diekamp, David Bennent, Deniz Orta, Katrin Saß, Sebastian Zimmler",Germany,"December 7, 2018",2018,TV-MA,1 Season,"Crime TV Shows, International TV Shows, TV Dramas","Two cops investigate the murder of a famous Turkish-German soccer player, but one of them has underworld connections that mire the case in controversy."
s4328,TV Show,Memories of the Alhambra,,"Hyun Bin, Park Shin-hye, Park Hoon, Kim Yong-rim, Chanyeol, Lee Re, Lee Hak Joo, Lee Si-won, Kim Eui-sung",South Korea,"December 2, 2018",2018,TV-MA,1 Season,"Crime TV Shows, International TV Shows, Korean TV Shows","While looking for the cryptic creator of an innovative augmented-reality game, an investment firm executive meets a woman who runs a hostel in Spain."
s4351,TV Show,1983,,"Robert Więckiewicz, Maciej Musiał, Michalina Olszańska, Andrzej Chyra, Clive Russell, Zofia Wichłacz, Edyta Olszówka, Mateusz Kościukiewicz, Ewa Błaszczyk, Vu Le Hong, Tomasz Włosok, Krzysztof Wach","Poland, United States","November 30, 2018",2018,TV-MA,1 Season,"Crime TV Shows, International TV Shows, TV Dramas","In this dark alt-history thriller, a naïve law student and a world-weary detective uncover a conspiracy that has tyrannized Poland for decades."
s4367,TV Show,Fugitiva,,"Paz Vega, Julio Bracho, Arantza Ruiz, Luisa Rubino, Lander Otaola, Iván Pellicer, José Manuel Poga, Mercedes Sampietro, Charo López, Roberto Álamo, Raúl Medina, Melina Matthews, Pedro Mari Sánchez, Odiseo Bichir",Spain,"November 23, 2018",2018,TV-MA,1 Season,"Crime TV Shows, International TV Shows, Spanish-Language TV Shows",A domestic abuse survivor orchestrates an elaborate deception to protect her family from her powerfully wealthy husband and his vindictive enemies.
s4400,TV Show,Warrior,,"Dar Salim, Danica Curcic, Lars Ranthe, Marco Ilsø, Søren Malling, Jakob Oftebro",Denmark,"November 13, 2018",2018,TV-MA,1 Season,"Crime TV Shows, International TV Shows, TV Dramas",A war veteran plagued by guilt over his final mission teams up with his best friend's widow to infiltrate a dangerous Copenhagen biker gang.
s4407,TV Show,The Queen of Flow,,"Carolina Ramírez, Carlos Torres, Andrés Sandoval, Adriana Arango, Mabel Moreno, Luis Alfredo Velasco, Pacho Rueda, Diana Wiswell, Mariana Garzón, Kiño, Sebastián Silva, Mariana Gómez, María José Vargas, Guillermo Blanco, Juan Manuel Restrepo, Alejandro Otero, David Ojalvo",Colombia,"November 9, 2018",2018,TV-MA,1 Season,"Crime TV Shows, International TV Shows, Spanish-Language TV Shows","Seventeen years after being wrongly imprisoned, a talented songwriter seeks justice against the men who caused her downfall and killed her family."
s4410,TV Show,Transfers,,"Arieh Worthalter, Brune Renault, Toinette Laquiere, Steve Tientcheu, Pili Groyne, Patrick Descamps, Patrick Raynal, Juliette Plumecocq-Mech, Sébastien Chassagne, Alexis Loret, Aissatou Diop","France, Belgium","November 8, 2018",2017,TV-MA,1 Season,"Crime TV Shows, International TV Shows, TV Sci-Fi & Fantasy","After a boating accident, woodworker and family man Florian wakes up in the body of an officer who leads a task force against illegal body transfers."
s4411,TV Show,Damnation,,"Logan Marshall-Green, Killian Scott, Sarah Jones, Chasten Harmon, Christopher Heyerdahl, Melinda Page Hamilton, Joe Adler",United States,"November 7, 2018",2017,TV-MA,1 Season,"Crime TV Shows, TV Dramas","During the Great Depression, a stranger with a violent past poses as a preacher and rallies farmers to mount a strike in a rural Iowa community."
s4477,TV Show,Terrorism Close Calls,,,"United States, Czech Republic","October 26, 2018",2018,TV-MA,1 Season,"Crime TV Shows, Docuseries, International TV Shows",Law enforcement officials look back on attempted terrorist attacks that were thwarted in the nick of time.
s4495,TV Show,Making a Murderer,,,United States,"October 19, 2018",2018,TV-14,2 Seasons,"Crime TV Shows, Docuseries","Filmed over 10 years, this real-life thriller follows a DNA exoneree who, while exposing police corruption, becomes a suspect in a grisly new crime."
s4496,TV Show,Marvel's Daredevil,,"Charlie Cox, Deborah Ann Woll, Elden Henson, Rosario Dawson, Vincent D'Onofrio, Jon Bernthal, Elodie Yung, Scott Glenn, Stephen Rider, Vondie Curtis-Hall, Ayelet Zurer, Toby Leonard Moore, Bob Gunton",United States,"October 19, 2018",2018,TV-MA,3 Seasons,"Crime TV Shows, TV Action & Adventure","Blinded as a young boy, Matt Murdock fights injustice by day as a lawyer and by night as the Super Hero Daredevil in Hell's Kitchen, New York City."
s4505,TV Show,Rake,,"Richard Roxburgh, Matt Day, Adrienne Pickering, Russell Dykstra, Danielle Cormack, Caroline Brazier, Geoff Morrell, Kate Box, Keegan Joyce, Damien Garvey",Australia,"October 16, 2018",2018,TV-MA,5 Seasons,"Crime TV Shows, International TV Shows, TV Comedies","While Cleaver Greene is a brilliant and driven attorney, he's also an ex-druggie, a current gambling addict and loathed by many of his colleagues."
s4512,TV Show,Edgar Rice Burroughs' Tarzan and Jane,,"Marci T. House, Michael Dobson, Omari Newton, Paul Dobson, Rebecca Shoichet, Giles Panton, Kathleen Barr, Doron Bell",,"October 12, 2018",2018,TV-Y7,2 Seasons,"Crime TV Shows, Kids' TV","Saved from a plane crash and given supernatural powers, teen Tarzan joins forces with brave city girl Jane to protect his jungle home from threats."
s4521,TV Show,Ordinary Heroes,,"Giorgio Tirabassi, Marco Bocci, Cristiana Capotondi, Greta Scarano, Michela Cescon, Diane Fleri, Carlo Calderone, Claudio Gioè, Romina Mondello, Orlando Cinque, Luigi Maria Burruano, Riccardo Scamarcio, Lorenza Indovina, Ivana Lotito, Pierfrancesco Poggi, Marco Leonardi, Anna Ferruzzo, Peppino Mazzotta, Giorgio Marchesi",,"October 11, 2018",2018,TV-MA,1 Season,"Crime TV Shows, International TV Shows, TV Dramas","Get an intimate look at four engaged citizens whose courage, sense of civic duty and ultimate sacrifice helped to transform Italian society."
s4524,TV Show,Blood Pact,,"Guilherme Fontes, Ravel Cabral, Jonathan Haagensen, André Ramiro, Adriano Garib, Mel Lisboa, Cristina Lago",Brazil,"October 10, 2018",2018,TV-MA,1 Season,"Crime TV Shows, International TV Shows, TV Dramas","An ambitious TV reporter uses risky and ethically questionable methods to report on gang wars and police corruption in the Amazon port of Belém, Brazil."
s4633,TV Show,The Good Cop,,"Tony Danza, Josh Groban, Monica Barbaro, Isiah Whitlock Jr.",United States,"September 21, 2018",2018,TV-14,1 Season,"Crime TV Shows, TV Comedies, TV Dramas","When he's not solving murders, a pathologically honest detective tries to keep an eye on his crooked but kindhearted dad."
s4636,TV Show,Al Hayba,,"Taim Hasan, Nadine Nassib Njeim, Abdo Chahine, Oweiss Mkhallalati, Mona Wassef",Lebanon,"September 15, 2018",2017,TV-14,1 Season,"Crime TV Shows, International TV Shows, TV Dramas","In a village by the Lebanon-Syria border, the head of an arms-smuggling clan contends with family conflicts, power struggles and complicated love."
s4637,TV Show,American Vandal,,"Tyler Alvarez, Griffin Gluck, Jimmy Tatro, Camille Hyde, Lou Wilson, Eduardo Franco, Jessica Juarez, Camille Ramsey, Calum Worthy, G. Hannelius, Karly Rothenberg",United States,"September 14, 2018",2018,TV-MA,2 Seasons,"Crime TV Shows, TV Comedies, Teen TV Shows","A high school is rocked by an act of vandalism, but the top suspect pleads innocence and finds an ally in a filmmaker. A satirical true crime mystery."
s4639,TV Show,Ingobernable,,"Kate del Castillo, Eréndira Ibarra, Alberto Guerra, Erik Hayser, Luis Roberto Guzmán, Álvaro Guerrero, Aida López, Fernando Luján, Maxi Iglesias, Marianna Burelli, Maria del Carmen Farías, Tamara Mazarraza, Marina de Tavira, Marco Antonio Treviño, Alicia Jaziz, Harold Torres, Alessio Valentini, Diego Cadavid, Hernán Del Riego",Mexico,"September 14, 2018",2018,TV-MA,2 Seasons,"Crime TV Shows, International TV Shows, Spanish-Language TV Shows","The first lady of Mexico is a woman of conviction and ideals. But when she loses faith in her husband, she'll need all her strength to uncover the truth."
s4656,TV Show,Marvel's Iron Fist,,"Finn Jones, Jessica Henwick, David Wenham, Jessica Stroup, Tom Pelphrey",United States,"September 7, 2018",2018,TV-MA,2 Seasons,"Crime TV Shows, TV Action & Adventure, TV Dramas","Danny Rand resurfaces 15 years after being presumed dead. Now, with the power of the Iron Fist, he seeks to reclaim his past and fulfill his destiny."
s4663,TV Show,Monkey Twins,,"Phakin Khamwilaisak, Sumret Muengput, Alisa Kunkwaeng, Zozeen Panyanut Jirarottanakasem, Akarat Nimitchai, Warawut Poyim, Vithaya Pansringarm, Phutharit Prombandal, Kazu Patrick Tang",Thailand,"September 2, 2018",2018,TV-MA,1 Season,"Crime TV Shows, International TV Shows, TV Action & Adventure","Inspired by Khon dance drama and Thai martial arts, a fighter scarred by the past joins forces with a determined cop to battle an organized crime ring."
s4664,TV Show,Quantico,,"Priyanka Chopra, Josh Hopkins, Jake McLaughlin, Aunjanue Ellis, Yasmine Al Massri, Johanna Braddy, Tate Ellington, Graham Rogers, Anabelle Acosta, Russell Tovey, Blair Underwood, Pearl Thusi",United States,"September 2, 2018",2018,TV-14,3 Seasons,"Crime TV Shows, TV Dramas, TV Mysteries","When evidence in a deadly terrorist attack implicates FBI trainee Alex Parrish, she must discover which one of her classmates framed her."
s4665,TV Show,Age of Rebellion,Peter Ho,"Peter Ho, Jeanine Yang, Tammy Chen, Jason Tsou, Chang Ting-hu, Nana Lee, Nien Hsuan Wu",Taiwan,"September 1, 2018",2018,TV-MA,1 Season,"Crime TV Shows, International TV Shows, TV Dramas","At their high school, a group of unruly teens wreak havoc, face bullies and navigate turbulent lives beyond school grounds."
s4674,TV Show,Inside the Criminal Mind,,,"United States, Czech Republic","August 31, 2018",2018,TV-MA,1 Season,"Crime TV Shows, Docuseries, International TV Shows",Explore the psychological machinations and immoral behavior that define the most nefarious types of criminals.
s4679,TV Show,Undercover Law,,"Viña Machado, Juana del Río, Luna Baxter, Valeria Gálviz, Tommy Vasquez, Luis Mesa, Katherine Vélez, Juan Manuel Mendoza, Patrick Delmas, Ricardo Vesga, Toto Vega",Colombia,"August 31, 2018",2017,TV-MA,1 Season,"Crime TV Shows, International TV Shows, Spanish-Language TV Shows",Female intelligence agents infiltrate the disparate aspects of a Colombian cartel in an attempt to take down the drug lords and their associates.
s4717,TV Show,Cocaine Coast,,"Javier Rey, Tristán Ulloa, Antonio Durán 'Morris', Carlos Blanco, Manuel Lourenzo, Jana Pérez, Xosé Antonio Touriñán, Isabel Naveira, Eva Fernández, Juan Pablo Shuk",Spain,"August 3, 2018",2018,TV-MA,1 Season,"Crime TV Shows, International TV Shows, Spanish-Language TV Shows","In 1980s Galicia, Spain, a young fisherman becomes a prosperous cocaine smuggler by providing Latin American suppliers with a European entry point."
s4751,TV Show,El Chapo,,"Marco de la O, Humberto Busto, Alejandro Aguilar, Rodrigo Abed, Luis Fernando Peña, Juan Carlos Olivas, Rolf Petersen, Carlos Hernan Romo, Héctor Holten, Diego Vásquez, Teté Espinoza, Luis Rábago, Dolores Heredia, Cristina Michaus, Valentina Acosta, Juliette Pardau, Abril Schreiber","Mexico, United States","July 27, 2018",2018,TV-MA,3 Seasons,"Crime TV Shows, Spanish-Language TV Shows, TV Action & Adventure","This drama series chronicles the true story of the rise, capture and escape of notorious Mexican drug lord Joaquín ""El Chapo"" Guzmán."
s4753,TV Show,Smoking,,"Ryo Ishibashi, Nobuaki Kaneko, Tomomi Maruyama, Kaito Yoshimura",Japan,"July 27, 2018",2018,TV-MA,1 Season,"Crime TV Shows, International TV Shows, TV Action & Adventure","Seeking a greater justice, a band of homeless assassins flays their human targets and delivers the tattooed skins as proof of a contract fulfilled."
s4779,TV Show,Drug Lords,,,United States,"July 10, 2018",2018,TV-MA,2 Seasons,"Crime TV Shows, Docuseries","Witness the stories of history's most notorious kingpins, their terrifying enforcers, and the men and women who've sworn to bring them down."
s4799,TV Show,NCIS,,"Mark Harmon, Michael Weatherly, Pauley Perrette, David McCallum, Sean Murray, Cote de Pablo, Brian Dietzen, Rocky Carroll, Lauren Holly, Sasha Alexander, Joe Spano, Alan Dale, Emily Wickersham, Pancho Demmings",United States,"July 1, 2018",2017,TV-14,15 Seasons,"Crime TV Shows, TV Dramas, TV Mysteries",Follow the quirky agents of the NCIS – the Naval Criminal Investigative Service – as they track down terrorists and other high-profile criminals.
s4805,TV Show,Somewhere Between,,"Paula Patton, Devon Sawa, JR Bourne, Aria Birch, Catherine Barroll, Samantha Ferris, Imogen Tear, Daniel Bacon, Carmel Amit, Noel Johansen, Rebecca Staab",United States,"June 30, 2018",2017,TV-14,1 Season,"Crime TV Shows, TV Dramas, TV Mysteries","A local news producer is given one chance to relive a deadly week and stop a serial killer. If she fails, she'll lose her daughter forever."
s4810,TV Show,Kiss Me First,,"Tallulah Haddon, Simona Brown, Matthew Beard, Matthew Aubrey","United Kingdom, United States","June 29, 2018",2018,TV-MA,1 Season,"British TV Shows, Crime TV Shows, International TV Shows",A lonely young woman hooked on a virtual reality game befriends a party girl who leads her into a world of new thrills and dark secrets.
