show_id,type,title,director,cast,country,date_added,release_year,rating,duration,listed_in,description
s29,Movie,Dark Skies,Scott Stewart,"Keri Russell, Josh Hamilton, J.K. Simmons, Dakota Goyo, Kadan Rockett, L.J. Benet, Rich Hutchman, Myndy Crist, Annie Thurman, Jake Brennan",United States,"September 19, 2021",2013,PG-13,97 min,"Horror Movies, Sci-Fi & Fantasy","A family’s idyllic suburban life shatters when an alien force invades their home, and as they struggle to convince others of the deadly threat."
s43,Movie,Jaws 2,Jeannot Szwarc,"Roy Scheider, Lorraine Gary, Murray Hamilton, Joseph Mascolo, Jeffrey Kramer, Collin Wilcox Paxton, Ann Dusenberry, Mark Gruner, Barry Coe, Susan French",United States,"September 16, 2021",1978,PG,116 min,"Dramas, Horror Movies, Thrillers","Four years after the last deadly shark attacks, police chief Martin Brody fights to protect Amity Island from another killer great white."
s44,Movie,Jaws 3,Joe Alves,"Dennis Quaid, Bess Armstrong, Simon MacCorkindale, Louis Gossett Jr., John Putch, Lea Thompson, P.H. Moriarty, Dan Blasko, Liz Morris, Lisa Maurer",United States,"September 16, 2021",1983,PG,98 min,"Action & Adventure, Horror Movies, Thrillers","After the staff of a marine theme park try to capture a young great white shark, they discover its mother has invaded the enclosure and is out for blood."
s45,Movie,Jaws: The Revenge,Joseph Sargent,"Lorraine Gary, Lance Guest, Mario Van Peebles, Karen Young, Michael Caine, Judith Barsi, Mitchell Anderson, Lynn Whitfield",United States,"September 16, 2021",1987,PG-13,91 min,"Action & Adventure, Horror Movies, Thrillers","After another deadly shark attack, Ellen Brody has had enough of Amity Island and moves to the Caribbean – but a great white shark follows her there."
s201,Movie,Krishna Cottage,Santram Varma,"Sohail Khan, Isha Koppikar, Natassha, Rati Agnihotri, Vrajesh Hirjee, Divya Palat, Hiten Tejwani, Rajendranath Zutshi",India,"August 27, 2021",2004,TV-14,124 min,"Action & Adventure, Horror Movies, International Movies",True love is put to the test when another woman comes between a pair of star-crossed young lovers in this thriller.
s211,Movie,Ragini MMS,Pawan Kripalani,"Kainaz Motivala, Rajkummar Rao, Rajat Kaul, Janice, Shernaza, Mangala Ahire, Vinod Rawat",India,"August 27, 2021",2011,TV-MA,93 min,"Horror Movies, International Movies",A couple out to have a sensuous weekend at a house outside of Mumbai finds it rigged with surveillance cameras and occupied by an evil entity.
s212,Movie,Ragini MMS 2,Bhushan Patel,"Sunny Leone, Saahil Prem, Parvin Dabas, Sandhya Mridul, Divya Dutta, Soniya Mehra, Kainaz Motivala, Karan Mehra",India,"August 27, 2021",2014,TV-MA,113 min,"Horror Movies, International Movies",The horror continues when Ragini's video goes viral and a sleazy director decides to make a movie about the incident in the original house.
s230,Movie,The Old Ways,Christopher Alender,"Brigitte Kali Canales, Andrea Cortes, Julia Vera, Sal Lopez",United States,"August 25, 2021",2020,TV-MA,90 min,Horror Movies,"A reporter visits her birthplace in Veracruz for a story about tribal culture, only to be kidnapped by locals who believe she's demonically possessed."
s237,Movie,Boomika,Rathindran R Prasad,"Aishwarya Rajesh, Vidhu, Surya Ganapathy, Madhuri, Pavel Navageethan, Avantika Vandanapu",,"August 23, 2021",2021,TV-14,122 min,"Horror Movies, International Movies, Thrillers","Paranormal activity at a lush, abandoned property alarms a group eager to redevelop the site, but the eerie events may not be as unearthly as they think."
s238,Movie,Boomika (Hindi),Rathindran R Prasad,"Aishwarya Rajesh, Vidhu, Surya Ganapathy, Madhuri, Pavel Navageethan, Avantika Vandanapu",,"August 23, 2021",2021,TV-14,122 min,"Horror Movies, International Movies, Thrillers","Paranormal activity at a lush, abandoned property alarms a group eager to redevelop the site, but the eerie events may not be as unearthly as they think."
s239,Movie,Boomika (Malayalam),Rathindran R Prasad,"Aishwarya Rajesh, Vidhu, Surya Ganapathy, Madhuri, Pavel Navageethan, Avantika Vandanapu",,"August 23, 2021",2021,TV-14,122 min,"Horror Movies, International Movies, Thrillers","Paranormal activity at a lush, abandoned property alarms a group eager to redevelop the site, but the eerie events may not be as unearthly as they think."
s240,Movie,Boomika (Telugu),Rathindran R Prasad,"Aishwarya Rajesh, Vidhu, Surya Ganapathy, Madhuri, Pavel Navageethan, Avantika Vandanapu",,"August 23, 2021",2021,TV-14,122 min,"Horror Movies, International Movies, Thrillers","Paranormal activity at a lush, abandoned property alarms a group eager to redevelop the site, but the eerie events may not be as unearthly as they think."
s300,Movie,The Swarm,Just Philippot,"Suliane Brahim, Sofian Khammes, Marie Narbonne, Raphaël Romand, Stéphan Castang, Victor Bonnel, Christian Bouillette, Renan Prévot, Vincent Deniard",France,"August 6, 2021",2021,TV-14,102 min,"Horror Movies, Independent Movies, International Movies","A single mother breeds locusts as high-protein food, but has trouble getting them to reproduce — until she finds they have a taste for blood."
s308,Movie,Aftermath,Peter Winther,"Ashley Greene, Shawn Ashmore, Sharif Atkins, Britt Baron, Diana Hopper, Ross McCall, Jamie Kaler, Travis Coles, Susan Walters, Jason Liles",United States,"August 4, 2021",2021,TV-MA,115 min,Horror Movies,"Desperate to save their marriage, a young couple takes a deal and moves into their dream home, but disturbing events reveal the house's troubled history."
s333,Movie,Deep Blue Sea,Renny Harlin,"Thomas Jane, Saffron Burrows, Samuel L. Jackson, Jacqueline McKenzie, Michael Rapaport, Stellan Skarsgård, LL Cool J, Aida Turturro, Cristos, Daniel Rey","United States, Mexico","August 1, 2021",1999,R,105 min,"Action & Adventure, Horror Movies, Sci-Fi & Fantasy",Scientists conduct research on sharks in search of an Alzheimer's cure. But a dangerous shortcut leads to huge sharks with near-human intelligence.
s354,Movie,The Haunting in Connecticut 2: Ghosts of Georgia,Tom Elkins,"Abigail Spencer, Chad Michael Murray, Katee Sackhoff, Emily Alyn Lind, Cicely Tyson, Andrea Frankle, Brad James, Lance E. Nichols",United States,"August 1, 2021",2013,R,101 min,Horror Movies,A couple's Georgia dream home becomes a living nightmare when their daughter begins to have frightening visions from the property's terrible past.
s397,Movie,Blood Red Sky,Peter Thorwarth,"Peri Baumeister, Alexander Scheer, Kais Setti, Carl Koch, Gordon Brown, Roland Møller, Chidi Ajufo, Kai Ivo Baulitz, Graham McTavish, Dominic Purcell",,"July 23, 2021",2021,TV-MA,123 min,"Action & Adventure, Horror Movies, International Movies","When a group of terrorists hijacks an overnight transatlantic flight, a mysteriously ill woman must unleash a monstrous secret to protect her young son."
s399,Movie,Kingdom: Ashin of the North,Kim Seong-hun,"Gianna Jun, Park Byung-eun, Kim Si-a, Kim Roi-ha, Koo Kyo-hwan",,"July 23, 2021",2021,TV-MA,94 min,"Horror Movies, International Movies, Thrillers","Tragedy, betrayal and a mysterious discovery fuel a woman's vengeance for the loss of her tribe and family in this special episode of ""Kingdom."""
s442,Movie,Fear Street Part 3: 1666,Leigh Janiak,"Kiana Madeira, Ashley Zukerman, Gillian Jacobs, Olivia Scott Welch, Benjamin Flores Jr., Darrell Britt-Gibson, Sadie Sink, Emily Rudd, McCabe Slye, Julia Rehwald, Fred Hechinger, Jordana Spiro, Jordyn DiNatale",,"July 16, 2021",2021,R,114 min,"Horror Movies, LGBTQ Movies","Thrust back to 1666, Deena learns the truth about Sarah Fier. Back in 1994, the friends fight for their lives — and Shadyside’s future."
s464,Movie,A Classic Horror Story,"Roberto De Feo, Paolo Strippoli","Matilda Lutz, Francesco Russo, Peppino Mazzotta, Will Merrick, Yuliia Sobol, Alida Baldari Calabria, Cristina Donadio, Francesca Cavallin",Italy,"July 14, 2021",2021,TV-MA,95 min,"Horror Movies, International Movies","In this gruesome suspense film, strangers traveling in southern Italy become stranded in the woods, where they must fight desperately to get out alive."
s480,Movie,Fear Street Part 2: 1978,Leigh Janiak,"Sadie Sink, Emily Rudd, Ryan Simpkins, McCabe Slye, Ted Sutherland, Jordana Spiro, Gillian Jacobs, Kiana Madeira, Benjamin Flores Jr., Ashley Zukerman, Olivia Scott Welch, Chiara Aurelia, Jordyn DiNatale",,"July 9, 2021",2021,R,111 min,Horror Movies,"In the cursed town of Shadyside, a killer's murder spree terrorizes Camp Nightwing and turns a summer of fun into a gruesome fight for survival."
s551,Movie,Fear Street Part 1: 1994,Leigh Janiak,"Kiana Madeira, Olivia Scott Welch, Benjamin Flores Jr., Julia Rehwald, Fred Hechinger, Ashley Zukerman, Maya Hawke, Darrell Britt-Gibson, Jordana Spiro, Jordyn DiNatale",,"July 2, 2021",2021,R,107 min,"Horror Movies, LGBTQ Movies","After a series of brutal slayings, a teen and her friends take on an evil force that's plagued their notorious town for centuries. Welcome to Shadyside."
s557,Movie,The 8th Night,Kim Tae-hyung,"Lee Sung-min, Park Hae-joon, Kim You-jung, Nam Da-reum, Choi Jin-ho, Kim Dong-yeong, Lee Eal",South Korea,"July 2, 2021",2021,TV-14,116 min,"Horror Movies, International Movies, Thrillers","With prayer beads in one hand and an ax in the other, a monk hunts down a millennia-old spirit that's possessing humans and unleashing hell on Earth."
s558,Movie,Winchester,"Michael Spierig, Peter Spierig","Helen Mirren, Jason Clarke, Sarah Snook, Angus Sampson, Finn Scicluna-O'Prey, Laura Brent, Tyler Coppin, Eamon Farren, Bruce Spence","Australia, United States","July 2, 2021",2018,PG-13,100 min,"Horror Movies, Sci-Fi & Fantasy",The heiress to a vast firearms fortune constructs a mansion with a maze-like interior to ward off the spirits of those killed by her family's product.
s587,Movie,Pet Sematary 2,Mary Lambert,"Edward Furlong, Anthony Edwards, Clancy Brown, Jared Rushton, Darlanne Fluegel, Jason McGuire, Sarah Trigger, Lisa Waltz, Jim Peck, Len Hunt",,"July 1, 2021",1992,R,101 min,Horror Movies,"When Chase and his son, Jeff, move to a different town, Jeff befriends an outcast named Drew, and the two discover a strange Indian burial ground."
s608,Movie,The Strangers,Bryan Bertino,"Liv Tyler, Scott Speedman, Gemma Ward, Kip Weeks, Laura Margolis, Glenn Howerton, Alex Fisher, Peter Clayton-Luce",United States,"July 1, 2021",2008,R,85 min,"Horror Movies, Thrillers","A quiet stay at a remote vacation home spirals into terror for a couple when they come under attack by three masked, mysterious, murderous intruders."
s611,Movie,Underworld,Len Wiseman,"Kate Beckinsale, Scott Speedman, Michael Sheen, Shane Brolly, Bill Nighy, Erwin Leder, Sophia Myles, Robbie Gee, Wentworth Miller, Kevin Grevioux","United States, United Kingdom, Germany, Hungary","July 1, 2021",2003,R,121 min,"Action & Adventure, Horror Movies, Sci-Fi & Fantasy",A vampire warrior begins to question her mission in the ancient war between the undead and werewolves when she falls for a human under her protection.
s612,Movie,Underworld: Awakening,"Måns Mårlind, Björn Stein","Kate Beckinsale, Stephen Rea, Michael Ealy, Theo James, India Eisley, Sandrine Holt, Charles Dance, Kris Holden-Ried, Jacob Blair, Adam Greydon Reid","United States, Canada","July 1, 2021",2012,R,89 min,"Action & Adventure, Horror Movies, Sci-Fi & Fantasy","As the war between vampires and Lycans rages on, Selene awakens from a prolonged, forced cryogenic sleep to face a harrowing new enemy: humans."
s613,Movie,Underworld: Rise of the Lycans,Patrick Tatopoulos,"Michael Sheen, Bill Nighy, Rhona Mitra, Steven Mackintosh, Kevin Grevioux, David Aston, Geraldine Brophy, Leighton Cardno, Alex Carroll, Elizabeth Hawthorne, Jason Hood","United States, New Zealand","July 1, 2021",2009,R,92 min,"Action & Adventure, Horror Movies, Sci-Fi & Fantasy","Set in the year 1402, this prequel follows Lucian, the first werewolf to take human form, and chronicles the feud between the vampires and the Lycans."
s644,Movie,The Seventh Day,Justin P. Lange,"Guy Pearce, Vadhir Derbez, Stephen Lang, Brady Jenness, Chris Galust, Robin Bartlett, Heath Freeman, Keith David",United States,"June 24, 2021",2021,R,87 min,Horror Movies,An inexperienced priest teams up with a hardened exorcist to stop the demonic possession of a young boy. But darkness lies where they least expect it.
s729,Movie,The Devil Below,Bradley Parker,"Alicia Sanz, Will Patton, Jonathan Sadowski, Adan Canto, Zach Avery, Chinaza Uche, Jesse LaTourette",United States,"June 13, 2021",2021,TV-MA,89 min,Horror Movies,"When a team of researchers tries to find out what started a fire in a coal mine, they quickly discover that the disaster is anything but natural."
s741,Movie,A Haunted House 2,Michael Tiddes,"Marlon Wayans, Jaime Pressly, Essence Atkins, Affion Crockett, Hayes MacArthur, Rick Overton, Ashley Rickards, Cedric the Entertainer, Dave Sheridan, Missi Pyle, Gabriel Iglesias, Steele Stebbins",United States,"June 10, 2021",2014,R,86 min,"Comedies, Horror Movies","Grieving after a tragedy, Malcolm tries to start fresh with his new girlfriend and her kids — but supernatural shenanigans find their way back to him."
s797,Movie,Hostel: Part III,Scott Spiegel,"Kip Pardue, Brian Hallisay, John Hensley, Sarah Habel, Chris Coy, Skyler Stone, Thomas Kretschmann, Zulay Henao, Nickola Shreli, Derrick Carr",United States,"June 2, 2021",2011,R,88 min,"Cult Movies, Horror Movies","In this installment in the popular horror franchise, a bachelor party in Las Vegas turns into a hellish bloodbath for all involved."
s805,Movie,Population 436,Michelle MacLaren,"Jeremy Sisto, Fred Durst, Charlotte Sullivan, David Ames, Cory Cassidy, James Blicq, Martin Trudel, Reva Timbers, Rick Skene, Peter Outerbridge, Dana Horrox","Canada, United States","June 2, 2021",2006,R,93 min,"Horror Movies, Thrillers","A census taker sent to investigate why Rockwell Falls has had the same population, 436, for more than a century, soon wishes he hadn't taken the job."
s823,Movie,The Wind,Emma Tammi,"Caitlin Gerard, Julia Goldani Telles, Ashley Zukerman, Miles Anderson, Dylan McTee",United States,"June 2, 2021",2019,R,88 min,Horror Movies,"Isolated on a wind-ravaged 19th-century homestead, a frontierswoman begins to suspect that evil lurks in the terrifying emptiness all around her."
s837,Movie,Ghost Lab,Paween Purijitpanya,"Thanapob Leeratanakachorn, Paris Intarakomalyasut, Nuttanicha Dungwattanawanich, Suquan Bulakul, Rachanee Siralert, Chaleeda Gilbert, Nuttawut Jenmana, Alanta Potjes, Anchuleeon Buagaew, Jinjuta Rattanaburi",Thailand,"May 27, 2021",2021,TV-MA,118 min,"Horror Movies, International Movies, Thrillers","After witnessing a haunting in their hospital, two doctors become dangerously obsessed with obtaining scientific proof that ghosts exist."
s854,Movie,Army of the Dead,Zack Snyder,"Dave Bautista, Ella Purnell, Omari Hardwick, Garret Dillahunt, Ana de la Reguera, Theo Rossi, Matthias Schweighöfer, Nora Arnezeder, Hiroyuki Sanada, Tig Notaro, Raúl Castillo, Huma Qureshi, Samantha Win, Richard Cetrone, Michael Cassidy",United States,"May 21, 2021",2021,R,148 min,"Action & Adventure, Horror Movies","After a zombie outbreak in Las Vegas, a group of mercenaries takes the ultimate gamble by venturing into the quarantine zone for the greatest heist ever."
s888,Movie,The Strange House,Daniel Prochaska,"León Orlandianyi, Benno Roßkopf, Julia Koschitz, Marii Weichsler, Lars Bitterlich, Michael Pink, Inge Maux, Elfriede Schüsseleder, Michael Somma, Finn Reiter, Markus Stubeier, Luca Streussnig",Austria,"May 14, 2021",2020,TV-MA,100 min,"Horror Movies, International Movies, Thrillers","When a big-city family moves to a remote town, two young brothers and their new friends try to solve the menacing mystery that haunts their home."
s930,Movie,Dead Again in Tombstone,Roel Reiné,"Danny Trejo, Jake Busey, Elysia Rotaru, Dean McDermott, Elizabeth Lavender, Peter Skagen",,"May 1, 2021",2017,R,99 min,"Action & Adventure, Horror Movies","At the devil's bidding, a deceased outlaw returns to life bent on protecting an ancient relic from a group of soldiers — and raising all kinds of hell."
s963,Movie,The Strangers: Prey at Night,Johannes Roberts,"Bailee Madison, Martin Henderson, Emma Bellomy, Lea Enslin, Damian Maffei, Christina Hendricks, Lewis Pullman","United States, United Kingdom","April 30, 2021",2018,R,85 min,Horror Movies,Home-invasion horror comes to the trailer park when a family arrives at a mobile home community to find nobody there but a trio of masked murderers.
s965,Movie,Things Heard & Seen,"Robert Pulcini, Shari Springer Berman","Amanda Seyfried, James Norton, Natalia Dyer, Alex Neustaedter, F. Murray Abraham, Rhea Seehorn, Michael O'Keefe, Karen Allen, Jack Gore, James Urbaniak, Ana Sophia Heger",,"April 29, 2021",2021,TV-MA,121 min,"Horror Movies, Thrillers",A young woman discovers that both her husband and their new home harbor sinister secrets after they leave Manhattan for small-town life.
s997,Movie,HOMUNCULUS,Takashi Shimizu,"Go Ayano, Ryo Narita, Yukino Kishii, Anna Ishii, Seiyo Uchino",Japan,"April 22, 2021",2021,TV-MA,116 min,"Horror Movies, International Movies, Thrillers",Truth and illusion blurs when a homeless amnesiac awakens from an experimental medical procedure with the ability to see people's innermost traumas.
s1028,Movie,Crimson Peak,Guillermo del Toro,"Mia Wasikowska, Jessica Chastain, Tom Hiddleston, Charlie Hunnam, Jim Beaver, Burn Gorman, Leslie Hope, Doug Jones, Jonathan Hyde, Bruce Gray","Canada, United States, Mexico","April 16, 2021",2015,R,119 min,"Horror Movies, Romantic Movies, Sci-Fi & Fantasy","After marrying a mysterious British aristocrat, a young heiress moves into his crumbling, creepy ancestral home and finds it conceals sinister secrets."
s1042,Movie,GANTZ:O,"Keiichi Sato, Yasushi Kawamura","Daisuke Ono, M・A・O, Tomohiro Kaku, Saori Hayami, Shuichi Ikeda, Kendo Kobayashi, Razor Ramon RG, Razor Ramon HG, Masane Tsukayama, Masaya Onosaka, Kenjiro Tsuda, Teruaki Ogawa, Hisanori Yoshida, Yuki Kaji",Japan,"April 15, 2021",2016,TV-MA,96 min,"Action & Adventure, Anime Features, Horror Movies",Teams of recently deceased people who've been revived and given high-tech weapons must cooperate to defeat an army of monsters in Tokyo and Osaka.
s1088,Movie,Roohi,Hardik Mehta,"Rajkummar Rao, Varun Sharma, Janhvi Kapoor, Manav Vij, Sarita Joshi, Anuraag Arora, Alexx O'Nell, Rajesh Jais",India,"April 9, 2021",2021,TV-14,133 min,"Comedies, Horror Movies, International Movies","Hired to kidnap a bride, two bumbling pals face a wacky predicament when one falls for their abductee — and the other, for the spirit possessing her."
s1101,Movie,What Lies Below,Braden R. Duemmler,"Ema Horvath, Trey Tucker, Mena Suvari, Haskiri Velazquez, Danny Corbo, Olan Montgomery, Troy Iwata",United States,"April 4, 2021",2020,TV-MA,88 min,"Horror Movies, Thrillers","Back home at her lake house, a teenager begins to suspect that a sinister force lurks beneath the surface of her mother's too-perfect new lover."
s1119,Movie,Insidious,James Wan,"Patrick Wilson, Rose Byrne, Lin Shaye, Ty Simpkins, Barbara Hershey, Leigh Whannell, Angus Sampson, Andrew Astor, Joseph Bishara","United States, Canada","April 1, 2021",2010,PG-13,103 min,"Horror Movies, Thrillers","A family moves into a new home, where their son falls into a coma and eerie events begin to reveal something far more sinister is lurking in the house."
s1120,Movie,Into the Grizzly Maze,David Hackl,"James Marsden, Thomas Jane, Billy Bob Thornton, Piper Perabo, Scott Glenn, Michaela McManus, Adam Beach, Kelly Curran","United States, Canada","April 1, 2021",2015,R,90 min,"Action & Adventure, Horror Movies",Estranged brothers Beckett and Rowan reunite in the Alaskan wild to confront a savage grizzly bear wreaking havoc on their hometown.
s1140,Movie,The Stepfather,Nelson McCormick,"Dylan Walsh, Sela Ward, Penn Badgley, Amber Heard, Sherry Stringfield, Paige Turco, Jon Tenney, Nancy Linehan Charles, Marcuis Harris, Braeden Lemasters, Deirdre Lovejoy",United States,"April 1, 2021",2009,PG-13,102 min,"Horror Movies, Thrillers",A series of mysterious events makes a teenager suspect that his mother's new boyfriend may be a dangerous serial killer known for preying on families.
s1178,Movie,Hospital,Brody Chu,"Lin Po-Hung, Tai Bo, Jacqueline Zhu, Lei Hong, Hsu Lichi, Yoko Young, Samuel Gu, Eunice Lin",Taiwan,"March 20, 2021",2020,TV-MA,90 min,"Horror Movies, International Movies","In an abandoned hospital in Tainan, visitors seeking to communicate with their relatives' spirits are haunted by disturbing, supernatural occurrences."
s1223,Movie,The Block Island Sound,"Kevin McManus, Matthew McManus","Chris Sheffield, Michaela McManus, Neville Archambault, Ryan O'Flanagan, Matilda Lawler, Jim Cummings, Jeremy Holm, Heidi Niedermeyer, Willie C. Carpenter, Matthew Lawler",United States,"March 11, 2021",2020,TV-MA,99 min,"Horror Movies, Independent Movies","On an island, a fisherman's family faces horrors and dark truths when an ominous force begins killing the wildlife and puts their own lives in danger."
s1284,Movie,The Conjuring,James Wan,"Vera Farmiga, Patrick Wilson, Lili Taylor, Ron Livingston, Shanley Caswell, Hayley McFarland, Joey King, Mackenzie Foy, Kyla Deaver, Shannon Kook",United States,"February 21, 2021",2013,R,112 min,"Horror Movies, Thrillers","When a family starts experiencing supernatural terrors after moving into a Rhode Island farmhouse, they seek the help of a pair of noted demonologists."
s1285,Movie,The Conjuring 2,James Wan,"Patrick Wilson, Vera Farmiga, Madison Wolfe, Frances O'Connor, Lauren Esposito, Benjamin Haigh, Patrick McAuley, Simon McBurney, Maria Doyle Kennedy, Simon Delaney, Franka Potente","Canada, United States, United Kingdom","February 21, 2021",2016,R,134 min,Horror Movies,"After her daughter unwittingly releases a malevolent spirit in their house in London, a woman enlists the Warrens' help to confront the evil presence."
s1298,Movie,No Escape Room,Alex Merkin,"Jeni Ross, Mark Ghanimé, Hamza Haq, Kathyrn Davis, Dennis Andres, Brianna Barnes",United States,"February 18, 2021",2018,TV-14,85 min,Horror Movies,A lighthearted bonding opportunity takes a dark and decidedly dangerous turn when a father and daughter try out an escape room in a small town.
s1368,Movie,Hell Fest,Gregory Plotkin,"Amy Forsyth, Reign Edwards, Bex Taylor-Klaus, Tony Todd, Christian James, Matt Mercurio, Michael Tourek, Courtney Dietz, Stephen Conroy",United States,"January 31, 2021",2018,R,89 min,Horror Movies,"A serial killer picks off a group of friends, one by one, as they make their way through a hell-themed amusement park."
s1399,Movie,Death of Me,Darren Lynn Bousman,"Maggie Q, Luke Hemsworth, Alex Essoe, Ingkarat Jaraswongkosol, Kelly B. Jones, Caledonia Burr","United States, Thailand","January 16, 2021",2020,R,94 min,Horror Movies,"With no memory of the previous night, a vacationing couple uncovers a disturbing personal video that inexplicably shows one of them killing the other."
s1448,Movie,Case 39,Christian Alvart,"Renée Zellweger, Jodelle Ferland, Ian McShane, Bradley Cooper, Callum Keith Rennie, Adrian Lester, Kerry O'Malley, Cynthia Stevenson, Alexander Conti, Philip Cabrita","United States, Canada","January 1, 2021",2009,R,111 min,"Horror Movies, Thrillers",A naïve social worker brings a 10-year-old child into her home to rescue the girl from abusive parents – only to learn that she isn't what she seems.
s1482,Movie,The Rope Curse 2,Liao Shih-han,"Lee Kang-sheng, Wilson Hsu, Vera Chen, Yen Cheng-kuo, Chen Bor-jeng, Liu Kuo-shao",Taiwan,"December 30, 2020",2020,TV-MA,105 min,"Horror Movies, International Movies","After a purification ritual unravels, a conflicted Taoist priest attempts to help a lonely young psychic whose aunt is possessed by a powerful demon."
s1537,Movie,Incarnate,Brad Peyton,"Aaron Eckhart, Carice van Houten, Catalina Sandino Moreno, David Mazouz, Keir O'Donnell, Matt Nable, Emily Jackson, Paul Vincent O'Connor, Natalija Nogulich, John Pirruccello, Mark Steger, Emjay Anthony, Karolina Wydra",United States,"December 16, 2020",2016,PG-13,87 min,"Horror Movies, Thrillers",An unconventional demon hunter faces his greatest challenge when he steps inside the subconscious mind of a boy possessed by a powerful entity.
s1630,Movie,U-Turn,Derick Cabrido,"Kim Chiu, JM de Guzman, Tony Labrusca, Martin del Rosario, Kate Alejandrino, Miel Espinoza, Janella Salvador, Cris Villanueva, Almira Muhlach, Cris Villonco, Mercedes Cabral, Jerry O'Hara, Simon Ibarra, Alex Medina, Markus Paterson",Philippines,"December 1, 2020",2020,TV-MA,99 min,"Horror Movies, International Movies",A young reporter's investigation into a string of grisly suicides takes a dangerous detour when she follows the clues to a cursed stretch of road.
s1638,Movie,Don’t Listen,Ángel Gómez Hernández,"Rodolfo Sancho, Ana Fernández, Ramón Barea, Belén Fabra, Lucas Blas",Spain,"November 27, 2020",2020,TV-MA,98 min,"Horror Movies, International Movies","After a tragic turn of events at the new home he's fixing up, Daniel hears a ghostly plea for help, spurring him to seek out a famous paranormal expert."
s1649,Movie,Ghosts of War,Eric Bress,"Brenton Thwaites, Theo Rossi, Skylar Astin, Kyle Gallner, Alan Ritchson, Billy Zane, Shaun Toub",United Kingdom,"November 25, 2020",2020,R,95 min,Horror Movies,"Five, battle-worn Allied soldiers guarding a chateau previously occupied by Nazis start experiencing unexplained and terrifying supernatural horrors."
