show_id,type,title,director,cast,country,date_added,release_year,rating,duration,listed_in,description
s7217,Movie,KL Zombi,Woo Ming Jin,"Zizan Razak, Siti Saleha, Zain Hamid, Izara Aishah, Fadzli Daniel Ali, Usop Wilcha",Malaysia,"August 21, 2017",2013,TV-14,92 min,"Comedies, Horror Movies, International Movies",A field hockey-playing pizza delivery boy finds himself transformed from slacker to zombie slayer during an outbreak of the undead in Kuala Lumpur.
s7219,Movie,Knock Knock,Eli Roth,"Keanu Reeves, Lorenza Izzo, Ana de Armas, Aaron Burns, Ignacia Allamand, Dan Baily, Megan Baily, Colleen Camp, Antonio Quercia","United States, Chile, Israel","November 1, 2020",2015,R,99 min,"Horror Movies, Thrillers",A devoted husband and father on his own for the weekend has his life turned inside out after giving shelter to two young women during a storm.
s7237,Movie,Kristy,Oliver Blackburn,"Haley Bennett, Ashley Greene, Erica Ash, Lucas Till, Chris Coy, Al Vicente, Wayne Pére, Jon Arthur, Mike Seal",United States,"October 31, 2015",2013,NR,85 min,Horror Movies,"Opting to stay on campus over the Thanksgiving holiday, coed Justine and a handful of friends find their break violently disrupted by a sadistic gang."
s7261,Movie,Laddaland,Sopon Sukdapisit,"Saharat Sangkapreecha, Pok Piyatida Woramusik, Sutatta Udomsilp, Athipich Chutiwatkajornchai, Deuntem Salitul, Sahajak Boonthanakit",Thailand,"September 7, 2018",2011,TV-MA,112 min,"Horror Movies, International Movies","When a family moves into an upscale housing development, they encounter a series of paranormal events that drive them to the edge of insanity."
s7281,Movie,Lechmi,B.N. Shajeer Sha,"Parvathy Ratheesh, Biju Sopanam, Sethulekshmi Amma, Molly Angamaly",India,"August 1, 2018",2017,TV-MA,147 min,"Comedies, Horror Movies, International Movies","The spirit of a murdered woman contacts four bachelors, enlisting their help to find her killer."
s7287,Movie,Legion,Scott Stewart,"Paul Bettany, Lucas Black, Tyrese Gibson, Adrianne Palicki, Charles S. Dutton, Jon Tenney, Kevin Durand, Willa Holland, Kate Walsh, Dennis Quaid, Jeanette Miller, Cameron Harlow, Doug Jones, Josh Stamberg, Yancey Arias",United States,"November 1, 2019",2010,R,100 min,"Action & Adventure, Horror Movies, Sci-Fi & Fantasy",A motley crew of apocalypse survivors living at an abandoned truck stop never suspects that the pregnant woman among them is carrying the Messiah.
s7299,Movie,Life After Beth,Jeff Baena,"Aubrey Plaza, Dane DeHaan, John C. Reilly, Molly Shannon, Cheryl Hines, Paul Reiser, Matthew Gray Gubler, Anna Kendrick, Paul Weitz",United States,"July 21, 2018",2014,R,89 min,"Comedies, Horror Movies, Independent Movies","Following the death of his beloved girlfriend, Beth, Zach is first shattered and then overjoyed when she inexplicably comes back to life."
s7303,Movie,Lifechanger,Justin McConnell,"Lora Burke, Jack Foley, Bill Oberst Jr., Elitsa Bako, Sam James White, Rachel Vanduzer, Steve Kasan",Canada,"May 28, 2019",2018,TV-MA,84 min,"Horror Movies, Independent Movies, Thrillers","A shapeshifter has to kill, then inhabit his victims, or die. But as his need for new bodies speeds up, he finally faces down his own mortality."
s7362,Movie,Lupt,Prabhuraj,"Javed Jaffrey, Vijay Raaz, Karan Aanand, Niki Walia, Meenakshi Dixit, Rishabh Chaddha, Rishina Kandhari, Kiearra Soni",India,"April 5, 2019",2018,TV-14,110 min,"Horror Movies, International Movies, Thrillers","Haunted by disturbing visions, a workaholic takes a vacation with his family, but a detour leads them to an unsettling stranger and chilling events."
s7367,Movie,Macchli Jal Ki Rani Hai,Debaloy Dey,"Swara Bhaskar, Bhanu Uday, Murli Sharma, Deep Raj Rana, Reema Debnath, Hemant Pandey, Saurabh Dubey, Sakha Kalyani",India,"October 15, 2017",2014,TV-MA,118 min,"Horror Movies, International Movies","After relocating to a different town with her husband, a housewife begins to sense the existence of a mysterious presence in their new house."
s7371,Movie,Mad Ron's Prevues from Hell,Jim Monaco,"Nick Pawlow, Jordu Schell, Jay Kushwara, Michael Townsend Wright, Anthony Kelly, Happy Goldsplatt, Ron Roccia, Fred Pomerleau, Joe Amodei, Nicholas Kitsopoulos",United States,"November 1, 2010",1987,NR,84 min,"Cult Movies, Horror Movies","This collection cherry-picks trailers, forgotten scenes and poster art from 47 gory oldies, including Bay of Blood and The Blood Spattered Bride."
s7390,Movie,Malicious,Michael Winnick,"Bojana Novakovic, Josh Stewart, Delroy Lindo, Melissa Bolona, Yvette Yates, Luke Edwards, Jaqueline Fleming, Ben VanderMey, Presley Richardson, Joy Kate Lawson",United States,"February 1, 2019",2018,TV-MA,91 min,Horror Movies,"After receiving a strange present, a professor and his pregnant wife are plagued by tragedy and a paranormal presence that's determined to kill."
s7403,Movie,Mara,Clive Tonge,"Olga Kurylenko, Javier Botet, Mitch Eakins, Lance E. Nichols, Rosie Fellner, Mackenzie Imsand, Dandy Barrett, Craig Conway, Melissa Bolona",United Kingdom,"January 5, 2019",2017,TV-MA,99 min,"Horror Movies, Thrillers","When criminal psychologist Kate Fuller investigates a man who was seemingly murdered in his sleep by his wife, she uncovers a case like no other."
s7434,Movie,Medium,Jacek Koprowicz,"Władysław Kowalski, Michał Bajor, Jerzy Zelnik, Jerzy Stuhr, Grażyna Szapołowska, Jerzy Nowak, Ewa Dałkowska, Piotr Machalica, Zygmunt Zintel, Henryk Bista","Poland, West Germany","October 1, 2019",1985,TV-MA,90 min,"Horror Movies, International Movies, Thrillers","In 1930s Poland, a powerful psychic steers a group of strangers toward a fated convergence that ensures survival for one and annihilation for others."
s7477,Movie,Mohawk,Ted Geoghegan,"Kaniehtiio Horn, Eamon Farren, Justin Rain, Ezra Buzzington, Noah Segan, Ian Colletti, Robert Longstreet, Jon Huber, Jack Gwaltney, Sheri Foster, David La Haye",United States,"June 30, 2018",2017,TV-MA,92 min,"Action & Adventure, Horror Movies, Independent Movies","During the War of 1812, two Native Americans and their British ally are pursued into enemy territory by American soldiers thirsting for revenge."
s7528,Movie,Murder Party,Jeremy Saulnier,"Alex Barnett, Macon Blair, Paul Goldblatt, Stacy Rock, William Lacey, Beau Sia, Skei Saulnier, Chris Sharp, Bill Tangradi",United States,"September 1, 2018",2007,NR,79 min,"Comedies, Cult Movies, Horror Movies","A mild-mannered office drone plucks a Halloween party invitation off the street and suddenly finds himself the main event at a ""murder party."""
s7553,Movie,Mythily Veendum Varunnu,Sabu Varghese,"Udhay, Kiran Raj, I.M. Vijayan, Sandhanam, Shivani Bhai, Sangeetha Balan",India,"August 1, 2018",2017,TV-PG,88 min,"Horror Movies, International Movies","After losing her father, a young woman moves to the city to earn money. When she finds a job at a mysterious bungalow, her worst nightmares come true."
s7556,Movie,Nails,Dennis Bartok,"Leah McNamara, Shauna Macdonald, Steve Wall, Ross Noble, Charlotte Bradley, Richard Foster-King, Dennis Bartok, Robert O'Mahoney, Muireann D'Arcy",Ireland,"March 10, 2018",2017,TV-MA,85 min,Horror Movies,"Recently paralyzed in a devastating car accident, Dana begins to suspect a dark and sinister force may be lurking within her hospital room."
s7644,Movie,Oh My Ghost 2,Poj Arnon,"Kohtee Aramboy, Yingsak Chonglertjetsadawong, Jaturong Mokjok, Apaporn Nakornsawan, Pharanyu Rojanawuthitham, Wiradit Srimalai, Ekkachai Srivichai, Chaiwat Thongsaeng, Kachapa Toncharoen",Thailand,"July 25, 2018",2011,TV-MA,103 min,"Comedies, Horror Movies, International Movies","The spirited trio are back to take on a new ghost-busting adventure at a mens' residence, where spooky secrets lurk around every corner."
s7645,Movie,Oh My Ghost 3,Poj Arnon,"Kohtee Aramboy, Yingsak Chonglertjetsadawong, Jaturong Mokjok, Waraphat Phatsathit, Wiradit Srimalai, Ekkachai Srivichai, Varuth Waratham, Butsarin Yokpraipan",Thailand,"August 16, 2018",2012,TV-MA,103 min,"Comedies, Horror Movies, International Movies","After a body is discovered in their building, a vengeful, paranormal presence begins to affect Taew, Mod Dum and Cartoon's business."
s7646,Movie,Oh My Ghost 4,Poj Arnon,,,"July 25, 2018",2015,TV-MA,106 min,"Comedies, Horror Movies, International Movies","Ghosts wreak havoc at the old school, and a student communicates with the spirit while the team reckons with a power struggle."
s7685,Movie,Our House,Anthony Scott Burns,"Thomas Mann, Nicola Peltz, Percy Hynes White, Kate Moyer, Carlyn Burchell, John Ralston, Christine Horne, Allison Hossack, Lucius Hoyos, Marcia Bennett","Canada, United States, Germany","June 1, 2020",2018,PG-13,90 min,"Horror Movies, Thrillers","A young man invents a device he hopes will generate wireless energy, but instead, it proves to spark sinister, supernatural activity in his home."
s7688,Movie,P,Paul Spurrier,"Suangporn Jaturaphut, Opal, Dor Yodrak, Pisamai Pakdeevijit, Manthana Wannarod, Supatra Roongsawang, Narisara Sairatanee, Amy Siriya","United Kingdom, Thailand","May 31, 2019",2006,TV-MA,105 min,"Horror Movies, International Movies","An orphan girl taught magic by her sick grandma must find work in seedy Bangkok, where unsavory characters run afoul of her increasingly dark powers."
s7705,Movie,Paranormal Activity,Oren Peli,"Katie Featherston, Randy McDowell, Amber Armstrong, Mark Fredrichs, Micah Sloat, Ashley Palmer, James Piper",United States,"January 1, 2020",2007,R,86 min,"Horror Movies, Thrillers","When Katie and Micah fear their home may be haunted by a demonic presence, Micah sets up a video camera to document all the action."
s7721,Movie,Pee Mak,Banjong Pisanthanakun,"Mario Maurer, Davika Hoorne, Nattapong Chartpong, Pongsatorn Jongwilak, Wiwat Kongrasri, Kantapat Permpoonpatcharasuk, Sean Jindachot",Thailand,"September 1, 2018",2013,TV-MA,112 min,"Comedies, Horror Movies, International Movies","Mak's friends just want to protect him, but his wife Nak won't let a small thing like her own death get in the way of true love in this horror-comedy."
s7738,Movie,Phobia 2,"Banjong Pisanthanakun, Paween Purikitpanya, Songyos Sugmakanan, Parkpoom Wongpoom, Visute Poolvoralaks","Jirayu La-ongmanee, Charlie Trairat, Worrawech Danuwong, Marsha Wattanapanich, Nicole Theriault, Chumphorn Thepphithak, Gacha Plienwithi, Suteerush Channukool, Peeratchai Roompol, Nattapong Chartpong",Thailand,"September 5, 2018",2009,TV-MA,125 min,"Horror Movies, International Movies","From disfiguring punishments to festering souls, Thai horror masters present five supernatural tales of karma in this sequel to the 4bia anthology."
s7832,Movie,Rampant,Kim Sung-hoon,"Hyun Bin, Jang Dong-gun, Jo Woo-jin, Jeong Man-sik, Lee Sun-bin, Kim Eui-sung, Cho Dal-hwan, Seo Ji-hye, Kim Tae-woo, Kim Joo-hyuk",South Korea,"May 26, 2019",2018,TV-MA,122 min,"Action & Adventure, Horror Movies, International Movies","When Prince Lee Cheong returns to Joseon after his brother’s death, he finds the kingdom plagued by deadly creatures – but they’re not the only threat."
s7833,Movie,Ranbhool,Girish Joshi,"Subodh Bhave, Mohan Joshi, Vinay Apte, Uday Tikekar, Tejaswini Pandit, Saii Ranade, Daksha Mahendra, Gargi Datar",India,"March 15, 2018",2010,TV-MA,115 min,"Horror Movies, International Movies, Thrillers","Believing himself to be God's envoy, a troubled young man embarks on a killing spree as his passion for music becomes a psychotic obsession."
s7844,Movie,Red Christmas,Craig Anderson,"Dee Wallace, Geoff Morrell, Sarah Bishop, Janis McGavin, David Collins, Bjorn Stewart, Gerard O'Dwyer, Deelia Meriel, Sam Campbell, Anthony Jensen, Robert Anderson",Australia,"December 11, 2017",2016,TV-MA,81 min,Horror Movies,A family Christmas gathering at an isolated Australian estate turns into the holiday from hell after a mysterious stranger turns up at the door.
s7858,Movie,Resident Evil: Afterlife,Paul W.S. Anderson,"Milla Jovovich, Ali Larter, Kim Coates, Shawn Roberts, Sergio Peris-Mencheta, Spencer Locke, Boris Kodjoe, Wentworth Miller","Germany, France, United States, Canada, United Kingdom","January 1, 2020",2010,R,97 min,"Action & Adventure, Horror Movies, Sci-Fi & Fantasy","The Undead Apocalypse continues as super-soldier Alice finds her way to a supposed sanctuary in Los Angeles, which may just be a deadly trap."
s7872,Movie,Rise of the Zombie,"Devaki Singh, Luke Kenny","Luke Kenny, Kirti Kulhari, Ashwin Mushran, Benjamin Gilani",India,"December 15, 2017",2013,TV-MA,83 min,"Horror Movies, International Movies","A heartbroken wildlife photographer throws himself into his work, only to find himself experiencing strange transformations."
s7895,Movie,Rosemary's Baby,Roman Polanski,"Mia Farrow, John Cassavetes, Ruth Gordon, Sidney Blackmer, Maurice Evans, Ralph Bellamy, Patsy Kelly, Elisha Cook Jr., Emmaline Henry, Charles Grodin",United States,"November 1, 2019",1968,R,137 min,"Classic Movies, Horror Movies, Thrillers","A woman is thrilled to find out she's pregnant. But as her belly grows, the more certain she becomes that her unborn child is in serious danger."
s7956,Movie,Scary Movie,Keenen Ivory Wayans,"Anna Faris, Jon Abrahams, Shannon Elizabeth, Shawn Wayans, Regina Hall, Marlon Wayans, Lochlyn Munro, Cheri Oteri, Carmen Electra, Dave Sheridan, Kurt Fuller, Rick Ducommun, James Van Der Beek, Keenen Ivory Wayans, Marissa Jaret Winokur, Dan Joffre",United States,"January 1, 2020",2000,R,88 min,"Comedies, Horror Movies","The Wayans brothers spoof some of Hollywood's biggest blockbusters, including Scream, I Know What You Did Last Summer, The Matrix and American Pie."
s7957,Movie,Scary Movie 5,Malcolm D. Lee,"Simon Rex, Ashley Tisdale, Charlie Sheen, Lindsay Lohan, Gracie Whitton, Ava Kolker, Erica Ash, Lidia Porto, Katrina Bowden, Terry Crews",United States,"August 12, 2020",2013,PG-13,88 min,"Comedies, Horror Movies","Taking aim at not only the horror genre but also films like ""Black Swan"" and ""Inception,"" ""Scary Movie 5"" widens the franchise's scope of mockery."
s7962,Movie,Scream 2,Wes Craven,"Neve Campbell, David Arquette, Courteney Cox, Sarah Michelle Gellar, Jamie Kennedy, Laurie Metcalf, Elise Neal, Jerry O'Connell, Timothy Olyphant, Jada Pinkett Smith, Liev Schreiber, Lewis Arquette, Duane Martin, Rebecca Gayheart, Portia de Rossi, Omar Epps, Tori Spelling, Heather Graham, Joshua Jackson, Luke Wilson",United States,"October 1, 2019",1997,R,121 min,Horror Movies,"Gale has written a best-seller which has been turned into a film. As the movie premiere looms closer, the mysterious deaths begin again."
s7963,Movie,Scream 3,Wes Craven,"David Arquette, Neve Campbell, Courteney Cox, Patrick Dempsey, Scott Foley, Lance Henriksen, Matt Keeslar, Jenny McCarthy, Emily Mortimer, Parker Posey, Deon Richmond, Kelly Rutherford, Liev Schreiber, Patrick Warburton, Jamie Kennedy",United States,"July 1, 2019",2000,R,117 min,Horror Movies,"This installment of the tongue-in-cheek horror franchise finds Sidney Prescott once again battling a crazed killer – this time, on a movie set."
s7999,Movie,Shark Night,David R. Ellis,"Sara Paxton, Dustin Milligan, Chris Carmack, Katharine McPhee, Donal Logue, Joshua Leonard, Sinqua Walls, Chris Zylka, Alyssa Diaz, Joel David Moore",United States,"November 2, 2019",2011,PG-13,91 min,Horror Movies,A weekend of beach-house debauchery turns into a nightmare for a group of friends when they discover that the waters are infested with vicious sharks.
s8002,Movie,Shelter,"Måns Mårlind, Björn Stein","Julianne Moore, Jonathan Rhys Meyers, Jeffrey DeMunn, Frances Conroy, Nate Corddry, Brooklynn Proulx, Brian Anthony Wilson, Joyce Feurring, Steven Rishard, Charles Techman",United States,"December 29, 2017",2010,R,112 min,"Horror Movies, Thrillers",A forensic psychiatrist has to think outside the box when she takes on a patient whose multiple personalities lead to a trail of murder victims.
s8014,Movie,Shutter,"Banjong Pisanthanakun, Parkpoom Wongpoom","Ananda Everingham, Natthaweeranuch Thongmee, Achita Sikamana, Unnop Chanpaibool, Titikarn Tongprasearth, Sivagorn Muttamara, Chachchaya Chalemphol, Kachormsak Naruepatr",Thailand,"September 5, 2018",2004,TV-MA,96 min,"Horror Movies, International Movies","After killing a young girl in a hit-and-run accident, a couple is haunted by more than just the memory of their deadly choice."
s8019,Movie,Silent Hill: Revelation,M.J. Bassett,"Deborah Kara Unger, Adelaide Clemens, Sean Bean, Malcolm McDowell, Carrie-Anne Moss, Radha Mitchell, Martin Donovan, Kit Harington","Canada, France, United States","December 13, 2019",2012,R,94 min,Horror Movies,"Haunted by nightmares and her father's disappearance, Heather goes on the hunt for him – and discovers a disturbing truth about her own identity."
s8027,Movie,Sinister Circle,Dorian Fernández-Moris,"Milene Vázquez, Matías Raygada, Claudia Dammert, Marcello Rivera, Atilia Boschetti, Hernán Romero, Ismael Contreras, Pietro Sibille, Leslie Shaw",Peru,"October 1, 2019",2017,TV-MA,87 min,"Horror Movies, International Movies",A psychologist and her mute son confront evil forces at the site of a terrible tragedy involving an ancestral Ouija board and a demonic secret society.
s8028,Movie,Siren,Gregg Bishop,"Chase Williamson, Hannah Fierman, Justin Welborn, Hayes Mercure, Michael Aaron Milligan, Brittany S. Hall, Randy McDowell, Lindsey Garrett, William Mark McCullough, Patrick Wood",United States,"January 1, 2020",2016,TV-MA,83 min,Horror Movies,A groom-to-be and his pals celebrate with a debauched night out that ends with a supernatural assault by a stripper who is not what she appears to be.
s8061,Movie,Soul to Keep,"David Allensworth, Monière","Sandra Mae Frank, Aurora Heimbach, Craig Fogel, Tony Spitz, Jordan Theodore, Kate Rose Reynolds, Jessie Jordan, Derek Long, Sophia Getz, Amelia Sheeler",United States,"July 1, 2019",2019,TV-MA,94 min,"Horror Movies, Independent Movies","Two siblings invite friends to their inherited, remote country home, but the fun stops when the group summons a demonic force from an old spellbook."
s8079,Movie,St. Agatha,Darren Lynn Bousman,"Sabrina Kern, Carolyn Hennesy, Courtney Halverson, Shaun Fletcher, Lindsay Seim, Hannah Fierman, Trin Miller, Seth Michaels, Justin Miles",United States,"August 8, 2019",2018,TV-MA,103 min,"Horror Movies, Independent Movies","Unwed and pregnant, a young woman flees her abusive home in 1950s Georgia and takes refuge at a mysterious convent with a terrible secret."
s8090,Movie,Stephanie,Akiva Goldsman,"Shree Cooks, Frank Grillo, Anna Torv",United States,"September 1, 2018",2017,R,86 min,Horror Movies,"A menacing, unseen force stalks a young girl living by herself in a suburban house, where she's surrounded by reminders of her once-happy family."
s8092,Movie,Still,"Chatchai Katenut, Manussa Vorasingha, Tanwarin Sukkhapisit, Poj Arnon","Mai Charoenpura, Akara Amarttayakul, Supakson Chaimongkol, Kachapa Toncharoen, Wiradit Srimalai, Vasana Chalakorn, Ratchanont Sukpragawp, Arisara Thongborisut",Thailand,"September 14, 2018",2010,TV-MA,100 min,"Horror Movies, International Movies","A haunted hotel, a body in a water tank, a nightclub fire and a prison death comprise four horror tales taken from Thailand's newspaper headlines."
s8096,Movie,Stonehearst Asylum,Brad Anderson,"Kate Beckinsale, Jim Sturgess, David Thewlis, Brendan Gleeson, Ben Kingsley, Michael Caine, Jason Flemyng, Sophie Kennedy Clark, Sinéad Cusack, Edmund Kingsley",United States,"September 8, 2017",2014,PG-13,113 min,"Horror Movies, Thrillers","In 1899, a young doctor arrives at an asylum for an apprenticeship and becomes suspicious of his mentor's methods while falling for a female patient."
s8139,Movie,Sweeney Todd: The Demon Barber of Fleet Street,Tim Burton,"Johnny Depp, Helena Bonham Carter, Alan Rickman, Timothy Spall, Sacha Baron Cohen, Jamie Campbell Bower, Laura Michelle Kelly, Jayne Wisener, Ed Sanders","United States, United Kingdom","January 1, 2020",2007,R,116 min,"Dramas, Horror Movies, Music & Musicals","After being falsely imprisoned, a vengeful murderer covers his tracks by enlisting the help of a baker whose meat pies become the toast of London."
s8170,Movie,Terrifier,Damien Leone,"Jenna Kanell, Samantha Scaffidi, David Howard Thornton, Catherine Corcoran, Pooya Mohseni, Matt McAllister, Katie Maguire, Gino Cafarelli, Cory DuVal, Michael Leavy",United States,"September 1, 2018",2017,TV-MA,84 min,"Horror Movies, Independent Movies, Thrillers","On Halloween night, inside a dilapidated apartment building, Art the Clown stalks his victims, slicing and slaughtering in terrifying silence."
s8189,Movie,The Amityville Horror,Andrew Douglas,"Ryan Reynolds, Melissa George, Chloë Grace Moretz, Jesse James, Jimmy Bennett, Rachel Nichols, Philip Baker Hall, Isabel Conner, Brendan Donaldson, Annabel Armour",United States,"January 1, 2020",2005,R,89 min,Horror Movies,"This hair-raising remake of the 1979 horror hit depicts the ordeal of the Lutz family, whose new home has a gory past and a legacy of demons."
s8199,Movie,The Autopsy of Jane Doe,André Øvredal,"Emile Hirsch, Brian Cox, Ophelia Lovibond, Michael McElhatton, Parker Sawyers, Jane Perry, Olwen Catherine Kelly","United Kingdom, United States","December 30, 2018",2016,R,86 min,"Horror Movies, Independent Movies, Thrillers",A father-son team of small-town coroners performs an autopsy on an unidentified woman with mysterious injuries and a terrifying secret.
s8205,Movie,The Basement,"Brian M. Conley, Nathan Ives","Mischa Barton, Jackson Davis, Cayleb Long, Tracie Thoms, Bailey Anne Borders",United States,"April 9, 2019",2018,TV-MA,89 min,"Horror Movies, Thrillers","Known for tortuous role-play with victims in his basement, a twisted serial killer abducts a musician who has a deeper connection to his mind games."
s8212,Movie,The Black Room,Rolfe Kanefsky,"Natasha Henstridge, Lukas Hassel, Lin Shaye, Dominique Swain, Augie Duke, Caleb Scott, James Duval, Tiffany Shepis",United States,"August 7, 2017",2016,TV-MA,95 min,Horror Movies,A couple's new dream home morphs into a nightmare after they learn that an evil and lustful spirit resides in their basement.
s8213,Movie,The Blackcoat's Daughter,Osgood Perkins,"Emma Roberts, Kiernan Shipka, Lucy Boynton, Lauren Holly, James Remar, Greg Ellwand, Elana Krausz, Heather Tod Mitchell, Peter James Haworth, Emma Holzer","Canada, United States","May 18, 2019",2015,R,95 min,"Horror Movies, Independent Movies, Thrillers","When their parents fail to pick them up for winter break, two students stay on at an all-girls boarding school in the company of a terrible presence."
s8222,Movie,The Boy,William Brent Bell,"Jim Norton, Rupert Evans, Ben Robson, Lauren Cohan, James Russell, Jett Klyne, Diana Hardcastle","United States, Canada, China","June 1, 2020",2016,PG-13,97 min,"Horror Movies, Independent Movies, Thrillers",A nanny is hired by a couple to look after their boy. She's shocked to learn that her charge is actually a doll that the couple treats like a human.
s8233,Movie,The Bye Bye Man,Stacy Title,"Douglas Smith, Lucien Laviscount, Cressida Bonas, Michael Trucco, Doug Jones, Carrie-Anne Moss, Faye Dunaway, Jenna Kanell, Erica Tremblay, Cleo King","United States, China","April 1, 2019",2017,PG-13,96 min,"Horror Movies, Thrillers",Three college students move into an off-campus house and discover they've unwittingly unleashed a supernatural killer known as the Bye Bye Man.
s8238,Movie,The Car,Elliot Silverstein,"James Brolin, Kathleen Lloyd, John Marley, R.G. Armstrong, John Rubinstein, Elizabeth Thompson, Roy Jenson, Kim Richards, Kyle Richards",United States,"June 1, 2020",1977,PG,96 min,"Cult Movies, Horror Movies","In his small Southwestern town, sheriff Wade Parent must find out who — or what — is running people down via a mysterious, driverless black sedan."
s8243,Movie,The Charnel House,Craig Moss,"Callum Blue, Nadine Velazquez, Makenzie Moss, Erik LaRay Harvey, Danielle Lauder, Andy Favreau, Kate Linder, Neil Thackaberry, Alden Tab",United States,"February 4, 2017",2016,R,93 min,"Horror Movies, Thrillers","After an architect transforms a slaughterhouse into trendy lofts, its new inhabitants discover that the structure is haunted by its evil past."
s8257,Movie,The Craft,Andrew Fleming,"Robin Tunney, Fairuza Balk, Neve Campbell, Rachel True, Skeet Ulrich, Christine Taylor, Breckin Meyer, Nathaniel Marston, Cliff De Young, Assumpta Serna",United States,"January 1, 2020",1996,R,101 min,"Horror Movies, Thrillers","At a Catholic school, a new girl falls in with a clique of teen witches who wield their powers against anyone who crosses them, even their parents."
s8275,Movie,The Detained,Blair Hayes,"Alex Frnka, Sarah Davenport, Henry Zaga, Coy Stewart, Jennifer Robyn Jacobs, Gillian Vigman, Kevin Blake",United States,"February 15, 2019",2017,TV-14,85 min,"Horror Movies, Thrillers",Five high school students serving Saturday detention in a former corrections facility must find a way to outsmart an unseen menace out to kill them.
s8276,Movie,The Devil and Father Amorth,William Friedkin,,"Italy, United States","July 23, 2018",2017,TV-PG,69 min,"Documentaries, Horror Movies","In Rome, ""Exorcist"" director William Friedkin follows a 91-year-old priest who performs a real demonic exorcism on a woman from a small Italian town."
s8277,Movie,The Devil Inside,William Brent Bell,"Fernanda Andrade, Simon Quarterman, Evan Helmuth, Ionut Grama, Suzan Crowley, Bonnie Morgan, Brian Johnson",United States,"November 20, 2019",2012,R,84 min,"Horror Movies, Thrillers","At once spooky and grisly, this thriller follows a woman's quest to find the truth behind claims her mother killed three people during an exorcism."
