show_id,type,title,director,cast,country,date_added,release_year,rating,duration,listed_in,description
s3187,Movie,Tiffany Haddish: Black Mitzvah,Linda Mendoza,Tiffany Haddish,United States,"December 3, 2019",2019,TV-MA,56 min,Stand-Up Comedy,"On her 40th birthday, Tiffany Haddish drops a bombastic special studded with singing, dancing and raunchy reflections on her long road to womanhood."
s3221,TV Show,Lugar de Mulher,,,Brazil,"November 28, 2019",2019,TV-MA,1 Season,"International TV Shows, Stand-Up Comedy & Talk Shows, TV Comedies","Four comedians from Brazil riff on sexuality, politics, religion and motherhood – and set out to prove a woman's place is anywhere she wants it to be."
s3229,Movie,Mike Birbiglia: The New One,Seth Barrish,Mike Birbiglia,United States,"November 26, 2019",2019,TV-MA,86 min,Stand-Up Comedy,Comedian Mike Birbiglia hits Broadway with a hilarious yet profound one-man show that recounts his emotional and physical journey to parenthood.
s3233,TV Show,Zona Rosa,,"Manu NNa, Ana Julia Yeyé, Ray Contreras, Pablo Morán",Mexico,"November 26, 2019",2019,TV-MA,1 Season,"International TV Shows, Spanish-Language TV Shows, Stand-Up Comedy & Talk Shows",An assortment of talent takes the stage for a night of honest stand-up featuring four of Mexico's funniest LGBTQ comedians.
s3241,Movie,Mike Birbiglia: What I Should Have Said Was Nothing: Tales from My Secret Public Journal,,Mike Birbiglia,United States,"November 22, 2019",2008,TV-MA,56 min,Stand-Up Comedy,Mike Birbiglia performs in this live concert special that features a riotous selection of the unique insights and observations culled from his diary.
s3257,Movie,Iliza Shlesinger: Unveiled,Steve Paley,Iliza Shlesinger,United States,"November 19, 2019",2019,TV-MA,78 min,Stand-Up Comedy,"Here comes the bride, and she's got plenty to say. Newlywed Iliza Shlesinger dissects wedding traditions as she mines her nuptials for laughs."
s3261,Movie,Jeff Dunham: All Over the Map,Robb Dipple,Jeff Dunham,United States,"November 16, 2019",2014,TV-MA,84 min,Stand-Up Comedy,"America's most beloved ventriloquist hits the road, bringing along all of his most popular pals, including Achmed, Peanut and Walter."
s3286,Movie,Fadily Camara : La plus drôle de tes copines,Gautier & Leduc,Fadily Camara,France,"November 14, 2019",2019,TV-MA,54 min,Stand-Up Comedy,"Irrepressible French comedian Fadily Camara weaves jokes, vivid characters and physical comedy into a lively stand-up show at La Cigale in Paris."
s3290,Movie,Jeff Garlin: Our Man In Chicago,Christopher Storer,Jeff Garlin,United States,"November 12, 2019",2019,TV-MA,59 min,Stand-Up Comedy,"Comedian Jeff Garlin (unintentionally) celebrates his 37th year of stand-up and shares his learnings on love, loss, success and food addiction."
s3306,Movie,Seth Meyers: Lobby Baby,Neal Brennan,Seth Meyers,United States,"November 5, 2019",2019,TV-MA,61 min,Stand-Up Comedy,SNL alumnus and subversive master of late-night TV Seth Meyers comes out from behind the desk to share some lighthearted stories from his own life.
s3355,Movie,Grego Rossello: Disculpe las molestias,Juani Libonatti,Grego Rossello,Argentina,"October 31, 2019",2019,TV-MA,65 min,Stand-Up Comedy,"Argentine comedian Grego Rossello takes the stage in Buenos Aires to share his takes on modern stardom, airline dining, brotherly love and more."
s3363,Movie,Arsenio Hall: Smart & Classy,Brian Volk-Weiss,Arsenio Hall,United States,"October 29, 2019",2019,TV-MA,63 min,Stand-Up Comedy,"In his first stand-up special, Arsenio Hall discusses getting older, the changing times and culture, social issues and even bothersome baby toes."
s3364,TV Show,Shine On with Reese,,Reese Witherspoon,United States,"October 29, 2019",2018,TV-MA,1 Season,"Docuseries, Stand-Up Comedy & Talk Shows","In a talk show straight from the heart, actor and producer Reese Witherspoon visits with groundbreaking women to discuss their inspiring journeys."
s3389,Movie,Jenny Slate: Stage Fright,Gillian Robespierre,Jenny Slate,United States,"October 22, 2019",2019,TV-MA,67 min,"Documentaries, Stand-Up Comedy","Jenny Slate's first stand-up special is a mix of stage time, funny stories about adulthood and conversations with family in her childhood home."
s3420,Movie,Park Na-rae: Glamour Warning,Kim Joo-hyung,Park Na-rae,South Korea,"October 16, 2019",2019,TV-MA,63 min,Stand-Up Comedy,"Korea’s beloved comedian and favorite big sister figure talks sex, relationships and celebrity life. And she’s sassier and dirtier than ever before."
s3425,Movie,"Martin Matte: La vie, la mort...eh la la..!",Jean-François Blais,Martin Matte,Canada,"October 14, 2019",2019,TV-14,62 min,Stand-Up Comedy,"Quebecois comedy star Martin Matte serves up embarrassing personal stories, a solution for social media trolls and more in this unpredictable special."
s3442,Movie,Deon Cole: Cole Hearted,Ryan Polito,Deon Cole,United States,"October 8, 2019",2019,TV-MA,70 min,Stand-Up Comedy,"Embracing his belief that comedy is the last raw form of expression, Deon Cole explains the right time to thank Jesus and the wrong time to say ""welp."""
s3472,Movie,Nikki Glaser: Bangin’,Nicholaus Goossen,Nikki Glaser,United States,"October 1, 2019",2019,TV-MA,64 min,Stand-Up Comedy,"Nikki Glaser bares all in a blistering stand-up special about sex, sobriety and getting over her own insecurities. And she won't spare you the details."
s3479,Movie,Mo Gilligan: Momentum,Chris Howe,Mo Gilligan,United Kingdom,"September 30, 2019",2019,TV-MA,64 min,Stand-Up Comedy,"Comedian Mo Gilligan blends smooth moves and sharp humor as he riffs on humble beginnings, family dynamics and the complex art of dancing in the club."
s3496,Movie,Jeff Dunham: Beside Himself,Troy Miller,Jeff Dunham,United States,"September 24, 2019",2019,TV-MA,58 min,Stand-Up Comedy,"Jeff Dunham takes the stage in Dallas with his old pals Peanut, Walter, José Jalapeño, Bubba J and Achmed to poke fun at himself and American culture."
s3513,Movie,Sebastian Maniscalco: What's Wrong with People?,Manny Rodriguez,Sebastian Maniscalco,United States,"September 17, 2019",2012,TV-MA,76 min,Stand-Up Comedy,"With his uproarious tirade on modern behavior and decorum, the popular comic tackles the question we've all asked in this hilarious standup special."
s3529,Movie,Bill Burr: Paper Tiger,Mike Binder,Bill Burr,"United States, United Kingdom","September 10, 2019",2019,TV-MA,67 min,Stand-Up Comedy,"Bill Burr unloads on outrage culture, male feminism, cultural appropriation, robot sex and more in a blistering stand-up special shot in London."
s3560,Movie,Dave Chappelle: Sticks & Stones,Stan Lathan,Dave Chappelle,United States,"August 26, 2019",2019,TV-MA,66 min,Stand-Up Comedy,"Dave Chappelle takes on gun culture, the opioid crisis and the tidal wave of celebrity scandals in a defiant stand-up special filmed in Atlanta."
s3575,Movie,Simon Amstell: Set Free,Julia Knowles,Simon Amstell,United Kingdom,"August 20, 2019",2019,TV-MA,52 min,Stand-Up Comedy,"Honest, introspective comic Simon Amstell digs deep and delivers a uniquely vulnerable stand-up set on love, ego, intimacy and ayahuasca."
s3592,Movie,Whindersson Nunes: Adult,Diego Pignataro,Whindersson Nunes,Brazil,"August 15, 2019",2019,TV-MA,69 min,Stand-Up Comedy,Brazilian YouTube sensation Whindersson Nunes revisits his humble beginnings and much more in a series of playful stories and peculiar songs.
s3600,Movie,Colin Quinn: Red State Blue State,Robert Moresco,Colin Quinn,,"August 9, 2019",2019,TV-14,66 min,Stand-Up Comedy,Stand-up comedian Colin Quinn calls out the hypocrisies of the left and the right in this special based on his politically charged Off-Broadway show.
s3618,Movie,Theo Von: No Offense,John Asher,Theo Von,United States,"August 7, 2019",2016,TV-MA,67 min,Stand-Up Comedy,"Southern charmer Theo Von offers up a twisted take on his dating mishaps, meeting Brad Pitt, chasing down fugitive chimpanzees and more."
s3620,Movie,I'm Brent Morin,Lance Bangs,Brent Morin,United States,"August 6, 2019",2015,TV-MA,67 min,Stand-Up Comedy,"In a witty solo show, Brent Morin serves up infectious laughs on the agony of puberty, hot guy problems and the time a girl dumped him for a magician."
s3621,Movie,Jim Jefferies : BARE,Shannon Hartman,Jim Jefferies,United States,"August 6, 2019",2014,TV-MA,77 min,Stand-Up Comedy,"Nothing is sacred in this show from Australian comic Jim Jefferies, whether it’s the mother of his child, auditioning disabled actors, or gun control."
s3623,Movie,Sebastian Maniscalco: Why Would You Do That,Joe DeMaio,Sebastian Maniscalco,United States,"August 6, 2019",2016,TV-MA,63 min,Stand-Up Comedy,"Sebastian Maniscalco delivers an expressive stand-up at the legendary Beacon Theatre on Whole Foods, family nicknames and dodging obnoxious neighbors."
s3636,Movie,Whitney Cummings: Can I Touch It?,Marcus Raboy,Whitney Cummings,,"July 30, 2019",2019,TV-MA,59 min,Stand-Up Comedy,"In her fourth stand-up special, Whitney Cummings returns to her hometown of Washington, D.C., and riffs on modern feminism, technology and more."
s3646,Movie,D.L. Hughley: Contrarian,Jay Chapman,D.L. Hughley,United States,"July 21, 2019",2018,TV-MA,58 min,Stand-Up Comedy,"D.L. Hughley riffs on hot-button political issues, celebrity scandals, his mother's tough love and more in a rapid-fire stand-up show in Philadelphia."
s3647,Movie,Demetri Martin: The Overthinker,"Jay Karas, Demetri Martin",Demetri Martin,United States,"July 21, 2019",2018,TV-MA,56 min,Stand-Up Comedy,"With his signature one-liners and drawings, Demetri Martin muses on doughnut holes, dogs, sports bars, the alphabet's most aggressive letters and more."
s3654,TV Show,Comedians in Cars Getting Coffee,Jerry Seinfeld,Jerry Seinfeld,United States,"July 19, 2019",2019,TV-14,6 Seasons,"Stand-Up Comedy & Talk Shows, TV Comedies","Jerry Seinfeld's roving talk show combines coffee, laughs and vintage cars into quirky, caffeine-fueled adventures with the sharpest minds in comedy."
s3680,Movie,Aziz Ansari: RIGHT NOW,Spike Jonze,Aziz Ansari,United States,"July 9, 2019",2019,TV-MA,65 min,Stand-Up Comedy,"In a comedy special directed by Spike Jonze, Aziz Ansari shares deep personal insights and hilarious takes on wokeness, family and the social climate."
s3694,Movie,Katherine Ryan: Glitter Room,Linda Mendoza,Katherine Ryan,United States,"July 1, 2019",2019,TV-MA,66 min,Stand-Up Comedy,"Fresh from a tour, comedian Katherine Ryan shares shrewd observations about school bullies, revenge bodies and raising a very fancy child."
s3712,Movie,Daniel Sosa: Maleducado,"Alex Díaz, Marcos Bucay",Daniel Sosa,Mexico,"June 27, 2019",2019,TV-MA,55 min,Stand-Up Comedy,"In his second stand-up special, Daniel Sosa reminisces about his childhood, ponders Mexican traditions and points out a major problem with ""Coco."""
s3716,Movie,Mike Epps: Only One Mike,Kevin Bray,Mike Epps,United States,"June 25, 2019",2019,TV-MA,63 min,Stand-Up Comedy,"In a raw stand-up comedy special, Mike Epps mixes it up as he tackles sexual misconduct, special ed, aging body parts and much more."
s3734,Movie,Adam Devine: Best Time of Our Lives,Jay Karas,Adam Devine,United States,"June 18, 2019",2019,TV-MA,59 min,Stand-Up Comedy,"Frenetic comic Adam Devine talks teen awkwardness, celebrity encounters, his ""Pitch Perfect"" audition and more in a special from his hometown of Omaha."
s3759,Movie,Jo Koy: Comin' In Hot,Shannon Hartman,Jo Koy,United States,"June 12, 2019",2019,TV-MA,60 min,Stand-Up Comedy,"Comedian Jo Koy takes center stage in Hawaii and shares his candid take on cultural curiosities, filter-free fatherhood and more."
s3777,Movie,Miranda Sings Live…Your Welcome,Marcus Raboy,Colleen Ballinger,United States,"June 4, 2019",2019,TV-14,62 min,Stand-Up Comedy,"Viral video star Miranda Sings and her real-world alter ego Colleen Ballinger share the stage in a special packed with music, comedy and ""magichinry."""
s3795,TV Show,Historical Roasts,,"Jeff Ross, Bob Saget, James Adomian, Rachel Feinstein, Jerry Minor, Ayden Mayeri, Jaleel White, Natasha Leggero, Yamaneika Saunders, John Stamos, Nikki Glaser, Seth Green, Fortune Feimster, Jon Lovitz, Mindy Rickles, Gilbert Gottfried, Sasheer Zamata, Brandon T. Jackson, Ryan Phillippe, Ken Marino, Bridget Everett, John Gemberling, Leonardo Nam, Josh Homme",United States,"May 27, 2019",2019,TV-MA,1 Season,"Stand-Up Comedy & Talk Shows, TV Comedies","""Roastmaster General"" Jeff Ross and a slew of guest stars poke fun at major historical figures while also honoring their enduring impact on the world."
s3806,Movie,Wanda Sykes: Not Normal,Linda Mendoza,Wanda Sykes,United States,"May 21, 2019",2019,TV-MA,66 min,Stand-Up Comedy,"Wanda Sykes tackles politics, reality TV, racism and the secret she'd take to the grave in this rollicking, no-holds-barred stand-up special."
s3816,Movie,Saverio Raimondo: Il Satiro Parlante,Francesco Imperato,Saverio Raimondo,Italy,"May 17, 2019",2019,TV-MA,53 min,Stand-Up Comedy,"Italian comic and satirist Saverio Raimondo regales a Milan crowd with tales of online antics, awkward injuries and white-knuckle flights."
s3878,Movie,Anthony Jeselnik: Fire in the Maternity Ward,Marcus Raboy,Anthony Jeselnik,United States,"April 30, 2019",2019,TV-MA,64 min,Stand-Up Comedy,"Forging his own comedic boundaries, Anthony Jeselnik revels in getting away with saying things others can't in this stand-up special shot in New York."
s3907,Movie,Franco Escamilla: Bienvenido al mundo,Ulises Valencia,Franco Escamilla,Mexico,"April 17, 2019",2019,TV-MA,54 min,Stand-Up Comedy,"Comedian Franco Escamilla shares stories about parenting his children when they get into trouble, with reflections on gender, friendship and romance."
s3925,Movie,Francesco De Carlo: Cose di Questo Mondo,,Francesco De Carlo,Italy,"April 12, 2019",2019,TV-MA,61 min,Stand-Up Comedy,"Taking the stage in Milan, Francesco De Carlo opens up about his bad habits, religion, politics and what he's learned from traveling the world."
s3930,Movie,Liss Pereira: Reteniendo líquidos,Fernando Ayllón,Liss Pereira,Brazil,"April 10, 2019",2019,TV-14,59 min,Stand-Up Comedy,"A pregnant Liss Pereira shares hilariously uncomfortable truths about sex, love, attraction and the lies we tell in modern relationships."
s3948,Movie,Ricardo Quevedo: Los amargados somos más,Fernando Ayllón,Ricardo Quevedo,,"April 3, 2019",2019,TV-MA,59 min,Stand-Up Comedy,"From how social media can ruin relationships to the perils of buying a gift for a woman, comic Ricardo Quevedo dissects life's trials and tribulations."
s3953,Movie,Kevin Hart: Irresponsible,Leslie Small,Kevin Hart,United States,"April 2, 2019",2019,TV-MA,60 min,Stand-Up Comedy,"As a father of three on his second marriage, Kevin Hart proves that being him is indeed a tall order in a fresh special inspired by his own mistakes."
s3975,Movie,Nate Bargatze: The Tennessee Kid,Ryan Polito,Nate Bargatze,United States,"March 26, 2019",2019,TV-PG,61 min,Stand-Up Comedy,"Comic Nate Bargatze touches on air travel, cheap weddings, college football, chocolate milk and the perils of ordering coffee in this stand-up special."
s4000,Movie,Amy Schumer Growing,Amy Schumer,Amy Schumer,United States,"March 19, 2019",2019,TV-MA,61 min,Stand-Up Comedy,"Amy Schumer spills on her new marriage, personal growth, making a baby and her mom's misguided advice in a special that's both raunchy and sincere."
s4005,Movie,Edoardo Ferrario: Temi Caldi,Francesco Imperato,Edoardo Ferrario,Italy,"March 15, 2019",2019,TV-MA,65 min,Stand-Up Comedy,"Italian comedian Edoardo Ferrario riffs on life at 30 and unpacks the peculiarities of global travel, social media and people who like craft beer."
s4008,Movie,Jeff Dunham: Arguing with Myself,Manny Rodriguez,Jeff Dunham,United States,"March 15, 2019",2006,TV-MA,69 min,Stand-Up Comedy,"Playing straight man to partners half his size, ventriloquist Jeff Dunham – one of America's funniest comics – slays audiences across the country."
s4009,Movie,Jeff Dunham: Controlled Chaos,"Michael Simon, Matthew McNeil",Jeff Dunham,United States,"March 15, 2019",2011,TV-MA,97 min,Stand-Up Comedy,"Politically incorrect and often raunchy humor pepper ventriloquist Dunham's live concert performance featuring characters Walter, Achmed and Peanut."
s4010,Movie,Jeff Dunham: Minding the Monsters,Manny Rodriguez,Jeff Dunham,United States,"March 15, 2019",2012,TV-MA,80 min,Stand-Up Comedy,"Jeff Dunham returns with a haunted house full of his hysterical entourage, and each character stars in its own horror movie trailer."
s4011,Movie,Jeff Dunham's Very Special Christmas Special,Michael Simon,"Jeff Dunham, Brian Haner",United States,"March 15, 2019",2008,TV-MA,85 min,Stand-Up Comedy,"Politically incorrect, sometimes raunchy ventriloquist Jeff Dunham is joined by his irreverent cast of characters in this hilarious Christmas special."
s4026,Movie,Jimmy Carr: The Best of Ultimate Gold Greatest Hits,Brian Klein,Jimmy Carr,,"March 12, 2019",2019,TV-MA,58 min,Stand-Up Comedy,Nothing is off limits as Jimmy Carr serves up the most outrageous jokes from his stand-up career in a special that's not for the faint of heart.
s4081,Movie,Zach Galifianakis: Live at the Purple Onion,Michael Blieden,"Zach Galifianakis, Brian Unger",United States,"February 26, 2019",2006,TV-MA,61 min,Stand-Up Comedy,"The unorthodox, piano-playing stand-up star Zach Galifianakis makes a splash on the scene and serves up a healthy dose of his signature wit."
s4084,Movie,Bert Kreischer: The Machine,Ryan Polito,Bert Kreischer,United States,"February 22, 2019",2016,TV-MA,70 min,Stand-Up Comedy,"From his run-in with a grizzly bear to partying with the Russian mafia, the shirtless comic returns with laugh-out-loud tales in this stand-up special."
s4093,Movie,Kevin James: Sweat the Small Stuff,Paul Miller,Kevin James,United States,"February 20, 2019",2001,TV-PG,42 min,Stand-Up Comedy,The film and television star riffs on life's many royal pains in this hourlong special taped at New York City's Hudson Theatre in 2001.
s4116,Movie,"Ken Jeong: You Complete Me, Ho",Jon M. Chu,Ken Jeong,United States,"February 14, 2019",2019,TV-MA,62 min,Stand-Up Comedy,"In his first-ever stand-up special, Ken Jeong pays tribute to his wife and shares stories about Hollywood and how ""The Hangover"" saved his life."
s4129,Movie,"Ray Romano: Right Here, Around the Corner",Michael Showalter,Ray Romano,United States,"February 5, 2019",2019,TV-MA,59 min,Stand-Up Comedy,"Ray Romano cut his stand-up teeth at the Comedy Cellar in New York. Now, in his first comedy special in 23 years, he returns to where it all began."
s4154,Movie,"Gabriel ""Fluffy"" Iglesias: One Show Fits All",Manny Rodriguez,Gabriel Iglesias,,"January 29, 2019",2019,TV-14,91 min,Stand-Up Comedy,"Gabriel ""Fluffy"" Iglesias discusses his teenage son and encounters with Snoop Dogg, Chris Rock and Vicente Fernández in this stand-up special for 2019."
s4185,TV Show,Trigger Warning with Killer Mike,,Killer Mike,,"January 18, 2019",2019,TV-MA,1 Season,"Docuseries, Stand-Up Comedy & Talk Shows","In this funny and provocative series, rapper and activist Killer Mike puts his revolutionary ideas about achieving social change into action."
s4194,Movie,Sebastian Maniscalco: Stay Hungry,Rik Reinholdtsen,Sebastian Maniscalco,United States,"January 15, 2019",2019,TV-MA,65 min,Stand-Up Comedy,"Sebastian Maniscalco brings an acerbically unique approach to peacocks on planes, life hacks, rich in-laws and life's annoyances in this comedy special."
s4221,TV Show,COMEDIANS of the world,,"Neal Brennan, Chris D'Elia, Nicole Byer, Nick Swardson, DeAnne Smith, Ivan Decker, Dave Merheje, K. Trevor Wilson, Joel Dommett, Mae Martin, Nish Kumar, Ellie Taylor, Urzila Carlson, Joel Creasey, Nazeem Hussain, Cal Wilson, Riaad Moosa, Tumi Morake, Loyiso Gola, Loyiso Madinga, Atul Khatri, Aditi Mittal, Amit Tandon, Franco Escamilla, Hugo El Cojo Feliz, Gaby Llanas, Enissa Amani, Ilka Bessin, Kaya Yanar, Thiago Ventura, Mhel Merrer, Afonso Padilha, Shirley Souagnon, Jason Brokerss, Tania Dutel, Donel Jack'sman, Ibraheem Alkhairallah, Rawsan Hallak, Adi Khalefa, Moayad Alnefaie, Louis-José Houde, François Bellefeuille, Katherine Levac, Adib Alkhalidey, Martijn Koning, Soundos El Ahmadi, Rayen Panday",United States,"January 1, 2019",2019,TV-MA,13 Seasons,"Stand-Up Comedy & Talk Shows, TV Comedies",This global stand-up comedy series features a diverse set of comics from 13 regions bringing their perspectives on what's funny around the world.
s4223,Movie,Moshe Kasher: Live in Oakland,Jay Chapman,Moshe Kasher,United States,"January 1, 2019",2012,TV-MA,61 min,Stand-Up Comedy,Comic Moshe Kasher returns to his home turf of Oakland for this stand-up special that has him sharing uproarious stories about the people he's met.
s4229,Movie,Whitney Cummings: Money Shot,John Fortenberry,Whitney Cummings,United States,"January 1, 2019",2010,TV-MA,48 min,Stand-Up Comedy,"Comedy Central roast veteran Whitney Cummings gets the stage to herself in this debut special, which finds her riffing on a wide range of topics."
s4230,Movie,Bill Hicks: One Night Stand,John Fortenberry,Bill Hicks,United Kingdom,"December 31, 2018",1991,TV-MA,28 min,Stand-Up Comedy,"Bill Hicks remembers a wild night in 1989 and offers his views on puffing cigarettes, smoking weed, drinking, sex, commercials and music."
s4232,Movie,Bill Hicks: Relentless,Chris Bould,Bill Hicks,United Kingdom,"December 31, 2018",1992,TV-MA,61 min,Stand-Up Comedy,"In one of his most iconic performances, late comedian Bill Hicks demonstrates what made him such a singular talent and a force to be reckoned with."
s4233,Movie,Bill Hicks: Revelations,Chris Bould,Bill Hicks,United Kingdom,"December 31, 2018",1993,TV-MA,56 min,Stand-Up Comedy,"In his final recorded special, the iconoclastic comedian channels Goat Boy and tackles provocative topics like British porn, pot and the priesthood."
s4234,Movie,Bill Hicks: Sane Man,"Kevin Booth, David Johndrow",Bill Hicks,United States,"December 31, 2018",1989,TV-MA,81 min,Stand-Up Comedy,"Filmed in 1989 at a turning point in comedian Bill Hicks's career, this rare onstage performance captures him spouting off on a variety of topics."
s4235,Movie,Gina Yashere: Laughing to America,Paul M. Green,Gina Yashere,,"December 31, 2018",2013,TV-MA,68 min,Stand-Up Comedy,"British comic Gina Yashere takes the stage in San Francisco, where she shares her thoughts on everything from toilet ninjas to her troublesome name."
s4236,Movie,Gina Yashere: Skinny B*tch,,Gina Yashere,United Kingdom,"December 31, 2018",2008,TV-MA,58 min,Stand-Up Comedy,"Standup comedian and ""Daily Show"" correspondent Gina Yashere delivers a sharp set of wry observations on the environment, money and more."
s4238,Movie,Sam Kinison: Breaking the Rules,Walter C. Miller,Sam Kinison,United States,"December 31, 2018",1987,TV-MA,50 min,Stand-Up Comedy,"The one-time preacher shakes and shudders as he tears into subjects including sex, marriage, religion, drugs and famine in this HBO special."
s4239,Movie,Sam Kinison: Family Entertainment Hour,Walter C. Miller,Sam Kinison,United States,"December 31, 2018",1991,TV-MA,49 min,Stand-Up Comedy,"Comic Sam Kinison lets it rip with this performance at L.A.'s Wiltern theatre, skewering every segment of modern society from religion to television."
s4240,Movie,Sam Kinison: Live in Vegas,Walter C. Miller,Sam Kinison,United States,"December 31, 2018",1991,TV-MA,71 min,Stand-Up Comedy,Standup legend Sam Kinison is at his screaming best as he storms the stage in Sin City to get a few things off his chest.
s4245,Movie,Tim Allen: Men Are Pigs,Ellen Brown,Tim Allen,United States,"December 31, 2018",1990,TV-MA,30 min,Stand-Up Comedy,"Standup comedian Tim Allen delivers a set dedicated to ""men stuff"" like lawn care, power tools and why he grunts like an animal."
s4246,Movie,Tim Allen: ReWires America,,Tim Allen,United States,"December 31, 2018",1991,TV-MA,30 min,Stand-Up Comedy,"Standup star Tim Allen storms the stage for a set chock-full of observations about powerful cars, beautiful lawns and more of the things he loves."
s4247,Movie,Tim Minchin And The Heritage Orchestra Live,Matt Askem,"Tim Minchin, Jules Buckley",United Kingdom,"December 31, 2018",2011,TV-MA,146 min,"Music & Musicals, Stand-Up Comedy","Flanked by a full orchestra, Tim Minchin takes the Royal Albert Hall by storm with a wonderfully witty evening of satirical musical comedy."
s4248,Movie,Tim Minchin: So F**king Rock,Matt Askem,Tim Minchin,United Kingdom,"December 31, 2018",2008,TV-MA,127 min,"Music & Musicals, Stand-Up Comedy",Comedic pianist Tim Minchin performs a host of his catchy songs that touch on everything from the Middle East to the healing power of canvas bags.
s4249,Movie,Todd Glass: Stand-Up Special,Jay Chapman,Todd Glass,United States,"December 31, 2018",2012,TV-MA,46 min,Stand-Up Comedy,"Standup comedian Todd Glass gets right down to it, with sly observations on accepting directions, denying compliments and being afraid of the dark."
s4250,Movie,Tom Papa Live in New York City,Rob Zombie,Tom Papa,United States,"December 31, 2018",2011,TV-14,57 min,Stand-Up Comedy,"Comedian Tom Papa riffs on the trials of married life, fatherhood in the 21st century, domestic pets and more in his stand-up show."
s4261,TV Show,Stand Up and Away! with Brian Regan,,Brian Regan,United States,"December 24, 2018",2018,TV-PG,1 Season,"Stand-Up Comedy & Talk Shows, TV Comedies",Brian Regan blends his trademark observational stand-up with short sketches and a bit of audience interaction in this hybrid comedy series.
s4285,TV Show,Ellen DeGeneres: Relatable,"Joel Gallen, Tig Notaro",Ellen DeGeneres,United States,"December 18, 2018",2018,TV-MA,1 Season,"Stand-Up Comedy & Talk Shows, TV Comedies","In her first special since 2003, Ellen revisits her road to stardom and details the heartfelt – and hilarious – lessons she's learned along the way."
