show_id,type,title,director,cast,country,date_added,release_year,rating,duration,listed_in,description
s5128,Movie,Judd Apatow: The Return,Marcus Raboy,Judd Apatow,United States,"December 12, 2017",2017,TV-MA,70 min,Stand-Up Comedy,"Judd Apatow returns to stand-up comedy after 25 years, riffing on living with three women, amusing moments from his career and much more."
s5135,Movie,Craig Ferguson: Tickle Fight,Jay Chapman,Craig Ferguson,United States,"December 5, 2017",2017,TV-MA,67 min,Stand-Up Comedy,"Cheeky comic Craig Ferguson keeps it casual as he discusses '70s porn, Japanese toilets and his mildly crime-filled days as a talk show host."
s5162,Movie,Brian Regan: Nunchucks and Flamethrowers,Troy Miller,Brian Regan,United States,"November 21, 2017",2017,TV-PG,61 min,Stand-Up Comedy,"Brian Regan takes relatable family humor to new heights as he talks board games, underwear elastic and looking for hot dogs in all the wrong places."
s5172,Movie,DeRay Davis: How to Act Black,Marcus Raboy,DeRay Davis,United States,"November 14, 2017",2017,TV-MA,66 min,Stand-Up Comedy,"Dynamic comic DeRay Davis hits the stage like a ball of fire, nailing the finer points of living, dating and handling show business as a black man."
s5177,Movie,Mea Culpa,"Raúl Campos, Jan Suter",Alexis de Anda,Mexico,"November 10, 2017",2017,TV-MA,54 min,Stand-Up Comedy,"Raw and outspoken, comedian Alexis de Anda bares her soul about weddings, exercise, sex, gynecologists, drugs and much more in this stand-up special."
s5197,Movie,Judah Friedlander: America Is the Greatest Country in the United States,Judah Friedlander,Judah Friedlander,United States,"October 31, 2017",2017,TV-MA,84 min,Stand-Up Comedy,"Deadpan comic and self-proclaimed world champion Judah Friedlander performs over several nights in New York, explaining why America is No. 1."
s5201,TV Show,Beyond Stranger Things,,"Jim Rash, Matt Duffer, Ross Duffer, Shawn Levy, David Harbour, Finn Wolfhard, Millie Bobby Brown, Gaten Matarazzo, Caleb McLaughlin, Natalia Dyer, Charlie Heaton, Noah Schnapp, Joe Keery, Dacre Montgomery, Sadie Sink, Paul Reiser, Sean Astin, Randy Havens, Brett Gelman, Linnea Berthelsen",United States,"October 27, 2017",2017,TV-14,1 Season,"Stand-Up Comedy & Talk Shows, TV Mysteries, TV Sci-Fi & Fantasy","Secrets from the ""Stranger Things 2"" universe are revealed as cast and guests discuss the latest episodes with host Jim Rash. Caution: spoilers ahead!"
s5205,Movie,Jack Whitehall: At Large,Brian Klein,Jack Whitehall,United Kingdom,"October 24, 2017",2017,TV-MA,68 min,Stand-Up Comedy,"Comedian Jack Whitehall takes the stage to tell stories about drinking, drugs, a Google Maps van and his ongoing rivalry with Robert Pattinson."
s5214,Movie,Patton Oswalt: Annihilation,Bobcat Goldthwait,Patton Oswalt,United States,"October 17, 2017",2017,TV-MA,66 min,Stand-Up Comedy,"By turns scathing and candid, Patton Oswalt reflects on the glut of comic material in the Trump era and the dark days following a personal tragedy."
s5225,Movie,"El Especial de Alex Fernández, el Especial",Jan Suter,Alex Fernández,Mexico,"October 13, 2017",2017,TV-MA,52 min,Stand-Up Comedy,"From a Mexico City theme park, energetic stand-up Alex Fernández riffs on music, cheap toys, insecurity and other fun things about growing up."
s5231,Movie,Christina P: Mother Inferior,Jay Karas,Christina Pazsitzky,United States,"October 10, 2017",2017,TV-MA,59 min,Stand-Up Comedy,"Christina Pazsitzky hits Seattle with a biting dose of reality, telling truths about her childhood, getting older and the horrors of giving birth."
s5235,Movie,Rodney Carrington: Here Comes the Truth,Brandon Jones,Rodney Carrington,United States,"October 3, 2017",2017,TV-MA,66 min,Stand-Up Comedy,"Raunchy country comic and musician Rodney Carrington jokes and sings about life in his 40s, poking fun at sex, relationships and gaining weight."
s5262,Movie,Def Comedy Jam 25,Louis J. Horvitz,"Dave Chappelle, Steve Harvey, Cedric the Entertainer, Martin Lawrence, Tiffany Haddish, Katt Williams, Craig Robinson, D.L. Hughley, Eddie Griffin, J.B. Smoove, Joe Torry, Kid Capri, Mike Epps, Sheryl Underwood, Tracy Morgan, Deon Cole",United States,"September 26, 2017",2017,TV-MA,82 min,Stand-Up Comedy,"In this special live event, giants of stand-up come together to commemorate the 25th anniversary of Russell Simmons's groundbreaking ""Def Comedy Jam."""
s5269,Movie,Jerry Before Seinfeld,Michael Bonfiglio,Jerry Seinfeld,United States,"September 19, 2017",2017,TV-14,62 min,Stand-Up Comedy,"Jerry Seinfeld returns to the club that gave him his start in the 1970s, mixing iconic jokes with stories from his childhood and early days in comedy."
s5277,Movie,Jeff Dunham: Relative Disaster,Michael Simon,Jeff Dunham,United States,"September 12, 2017",2017,TV-MA,71 min,Stand-Up Comedy,Ventriloquist Jeff Dunham brings his rude and slightly demented posse of puppets to Ireland for a gleeful skewering of family and politics.
s5280,Movie,Fabrizio Copano: Solo pienso en mi,"Rodrigo Toro, Francisco Schultz",Fabrizio Copano,Chile,"September 8, 2017",2017,TV-MA,60 min,Stand-Up Comedy,"Fabrizio Copano takes audience participation to the next level in this stand-up set while reflecting on sperm banks, family WhatsApp groups and more."
s5282,Movie,Joaquín Reyes: Una y no más,José Miguel Contreras,Joaquín Reyes,,"September 8, 2017",2017,TV-MA,78 min,Stand-Up Comedy,"Comedian and celebrity impersonator Joaquín Reyes decides to be his zesty self for a night of stories about buses, bathroom habits, royalty and more."
s5284,Movie,Marc Maron: Too Real,Lynn Shelton,Marc Maron,United States,"September 5, 2017",2017,TV-MA,70 min,Stand-Up Comedy,"Battle-scarred stand-up comedian Marc Maron unleashes a storm of ideas about meditation, mortality, documentary films and our weird modern world."
s5316,Movie,Ryan Hamilton: Happy Face,Marcus Raboy,Ryan Hamilton,United States,"August 29, 2017",2017,TV-14,57 min,Stand-Up Comedy,"Small-town import Ryan Hamilton charms New York with folksy comic observations on big-city life, hot-air ballooning and going to Disney World alone."
s5320,Movie,Lynne Koplitz: Hormonal Beast,Marcus Raboy,Lynne Koplitz,United States,"August 22, 2017",2017,TV-MA,51 min,Stand-Up Comedy,"Unabashed comedian Lynne Koplitz offers a woman's take on being crazy, the benefits of childlessness and the three things all men really want."
s5326,Movie,Brad Paisley's Comedy Rodeo,Jay Chapman,"Brad Paisley, Nate Bargatze, John Heffron, Jon Reep, Sarah Tiana, Mike E. Winfield",United States,"August 15, 2017",2017,TV-MA,63 min,"Music & Musicals, Stand-Up Comedy","Country music star Brad Paisley hosts a night of music and laughs with comics Nate Bargatze, John Heffron, Jon Reep, Sarah Tiana and Mike E. Winfield."
s5327,Movie,Colin Quinn: Unconstitutional,Jay Chapman,Colin Quinn,United States,"August 15, 2017",2015,TV-MA,56 min,Stand-Up Comedy,New York comedian Colin Quinn writes and stars in this live one-man stage show that dissects and deconstructs U.S. constitutional history.
s5343,Movie,Alan Saldaña: Mi vida de pobre,"Raúl Campos, Jan Suter",Alan Saldaña,Mexico,"August 4, 2017",2017,TV-MA,54 min,Stand-Up Comedy,Mexican comic Alan Saldaña has fun with everything from the pressure of sitting in an exit row to maxing out his credit card in this stand-up special.
s5358,Movie,Maz Jobrani: Immigrant,Maz Jobrani,Maz Jobrani,,"August 1, 2017",2017,TV-14,67 min,Stand-Up Comedy,"Iranian American comic Maz Jobrani lights up the Kennedy Center with riffs on immigrant life in the Trump era, modern parenting pitfalls and more."
s5370,Movie,Joe Mande’s Award-Winning Comedy Special,Daniel Gray Longino,Joe Mande,United States,"July 25, 2017",2017,TV-MA,67 min,Stand-Up Comedy,"Stand-up comic Joe Mande aims for critical adulation with this special that covers dating shows, ""Shark Tank,"" Jewish summer camp and much more."
s5372,Movie,Aditi Mittal: Things They Wouldn't Let Me Say,Fazila Allana,Aditi Mittal,India,"July 18, 2017",2017,TV-MA,63 min,Stand-Up Comedy,"Trailblazing comic Aditi Mittal mixes topical stand-up with frank talk about being single, wearing thongs and the awkwardness of Indian movie ratings."
s5373,TV Show,Ari Shaffir: Double Negative,Eric Abrams,Ari Shaffir,United States,"July 18, 2017",2017,TV-MA,1 Season,Stand-Up Comedy & Talk Shows,"Wry yet thoughtful, comedian Ari Shaffir brings his edgy humor to two fast-paced stand-up specials about children and adulthood."
s5379,Movie,D.L. Hughley: Clear,Jay Chapman,D.L. Hughley,United States,"July 13, 2017",2014,TV-MA,59 min,Stand-Up Comedy,"In this 2014 standup special filmed in San Francisco, comedic genius D.L. Hughley entertains with his hilarious take on current affairs and more."
s5380,Movie,Tom Segura: Completely Normal,Jay Chapman,Tom Segura,United States,"July 13, 2017",2014,TV-MA,74 min,Stand-Up Comedy,Levelheaded stand-up Tom Segura shares offhand appraisals on hotels and opens up about his hobbies and digestive ailments in this comedy special.
s5395,Movie,Hans Teeuwen: Real Rancour,Doesjka van Hoogdalem,Hans Teeuwen,Netherlands,"July 1, 2017",2018,TV-MA,86 min,Stand-Up Comedy,"Comedian Hans Teeuwen rebels against political correctness, proclaims himself Britain's moral leader and takes on Donald Trump."
s5417,Movie,Chris D'Elia: Man on Fire,Bill D'Elia,Chris D'Elia,United States,"June 27, 2017",2017,TV-MA,66 min,Stand-Up Comedy,"Unbridled comic Chris D'Elia reconsiders his approach to major life events like marriage, not having kids and buying pants for your friends."
s5425,Movie,Rory Scovel Tries Stand-Up for the First Time,Scott Moran,Rory Scovel,United States,"June 20, 2017",2017,TV-MA,66 min,Stand-Up Comedy,"Comedian Rory Scovel storms the stage in Atlanta, where he shares unfocused thoughts about things that mystify him, relationships and the ""Thong Song."""
s5431,Movie,Marco Luque: Tamo Junto,Caio Cobra,Marco Luque,Brazil,"June 15, 2017",2017,TV-MA,73 min,Stand-Up Comedy,"Eclectic character comedian Marco Luque plays himself in this stand-up special about relationships, regional differences and his own love of movies."
s5433,Movie,"Oh, Hello On Broadway",Michael John Warren,"Nick Kroll, John Mulaney",United States,"June 13, 2017",2017,TV-MA,102 min,Stand-Up Comedy,"Two delusional geriatrics reveal curious pasts, share a love of tuna and welcome a surprise guest in this filming of the popular Broadway comedy show."
s5460,TV Show,Off Camera,,Sam Jones,United States,"June 1, 2017",2015,TV-MA,3 Seasons,Stand-Up Comedy & Talk Shows,"Photographer, writer and director Sam Jones sets his famous guests at ease with his freewheeling, insightful celebrity interviews without agendas."
s5469,Movie,Sarah Silverman A Speck of Dust,Liam Lynch,Sarah Silverman,United States,"May 30, 2017",2017,TV-MA,71 min,Stand-Up Comedy,"In her first comedy special post-health scare, Sarah Silverman shares a mix of fun facts, sad truths and yeah-she-just-went-there moments."
s5476,Movie,Hasan Minhaj: Homecoming King,Christopher Storer,Hasan Minhaj,,"May 23, 2017",2017,TV-MA,73 min,Stand-Up Comedy,"Comic Hasan Minhaj of ""The Daily Show"" shares personal stories about racism, immigrant parents, prom night horrors and more in this stand-up special."
s5481,Movie,Tracy Morgan: Staying Alive,Ryan Polito,Tracy Morgan,United States,"May 16, 2017",2017,TV-MA,59 min,Stand-Up Comedy,"In his first special since his serious car accident, Tracy Morgan cracks jokes about life in a coma, his second marriage and his family's dark side."
s5493,Movie,"Norm Macdonald: Hitler's Dog, Gossip & Trickery",Liz Plonka,Norm MacDonald,United States,"May 9, 2017",2017,TV-MA,61 min,Stand-Up Comedy,"In this new stand-up special, Norm Macdonald delivers sly, deadpan observations from an older – and perhaps even wiser – point of view."
s5496,Movie,Simplemente Manu NNa,"Jan Suter, Raúl Campos",Manu NNa,Mexico,"May 5, 2017",2017,TV-MA,72 min,Stand-Up Comedy,Eclectic stand-up comic Manu NNa relays everyday tales about the struggles of being gay in Mexico and shares his love of telenovelas and mezcal.
s5498,Movie,Maria Bamford: Old Baby,Jessica Yu,Maria Bamford,United States,"May 2, 2017",2017,TV-MA,64 min,Stand-Up Comedy,"Maria Bamford performs a rapid-fire, playful stand-up set for crowds at park benches, bowling alleys and LA theaters in this roving comedy special."
s5519,Movie,Vir Das: Abroad Understanding,Marcus Raboy,Vir Das,United States,"April 25, 2017",2017,TV-MA,66 min,Stand-Up Comedy,"Comedian Vir Das tackles nationalism, globalism, good food and bad politics in two cleverly crosscut performances in New York and New Delhi."
s5526,Movie,Lucas Brothers: On Drugs,Jay Chapman,"Keith Lucas, Kenny Lucas",United States,"April 18, 2017",2017,TV-MA,50 min,Stand-Up Comedy,"Deadpan twin comics Keith and Kenny Lucas take the stage in Brooklyn with a set that touches on drugs, race, Deion Sanders, teachers and O.J. Simpson."
s5536,Movie,Kevin Hart: What Now?,Leslie Small,"Kevin Hart, Don Cheadle, Halle Berry, Ed Helms, David Meunier",United States,"April 11, 2017",2016,R,96 min,Stand-Up Comedy,"Frenetic comic Kevin Hart hits Philadelphia and dishes on suburban wildlife, jean shorts and the fine art of getting even with a 7-year-old."
s5554,Movie,Bridget Christie: Stand Up for Her,,Bridget Christie,United Kingdom,"March 31, 2017",2016,TV-MA,51 min,Stand-Up Comedy,"Performing stand-up for a packed house in London's Hoxton Hall, comedian Bridget Christie dives into the politics of gender, sex and equality."
s5558,Movie,Jo Koy: Live from Seattle,Shannon Hartman,Jo Koy,United States,"March 28, 2017",2017,TV-MA,63 min,Stand-Up Comedy,"Between raising a teenage boy and growing up with a Filipino mother, stand-up comic Jo Koy has been through a lot. He's here to tell you all about it."
s5560,Movie,Felipe Neto: My Life Makes No Sense,Diego Pignataro,Felipe Neto,Brazil,"March 24, 2017",2017,TV-MA,91 min,Stand-Up Comedy,"YouTube sensation Felipe Neto brings the stories from his autobiographical book ""Não Faz Sentido!"" to the stage in this comedy special."
s5563,TV Show,Dave Chappelle,Stan Lathan,Dave Chappelle,United States,"March 21, 2017",2017,TV-MA,1 Season,"Stand-Up Comedy & Talk Shows, TV Comedies","Comedy icon Dave Chappelle makes his triumphant return to the screen with a pair of blistering, fresh stand-up specials."
s5577,Movie,Jim Norton: Mouthful of Shame,Shannon Hartman,Jim Norton,United States,"March 14, 2017",2017,TV-MA,62 min,Stand-Up Comedy,"In this unrestricted jaunt through a gleefully filthy mind, comic Jim Norton offers a personal perspective on romance, desire and sexual proclivities."
s5583,Movie,Amy Schumer: The Leather Special,Amy Schumer,Amy Schumer,United States,"March 7, 2017",2017,TV-MA,57 min,Stand-Up Comedy,"Comic sensation Amy Schumer riffs on sex, dating and the absurdities of fame in a bold and uncensored stand-up set at Denver's Bellco Theater."
s5587,Movie,Mike Birbiglia: Thank God for Jokes,"Seth Barrish, Mike Birbiglia",Mike Birbiglia,United States,"February 28, 2017",2017,TV-MA,71 min,Stand-Up Comedy,"Comedian Mike Birbiglia takes the stage in Brooklyn and hits on hard truths about puppets, late people and the very real dangers of being funny."
s5595,Movie,Trevor Noah: Afraid of the Dark,David Paul Meyer,Trevor Noah,United States,"February 21, 2017",2017,TV-14,67 min,Stand-Up Comedy,"The ""Daily Show"" host ponders the perils of naming countries, how traffic lights turn New Yorkers invincible and why you shouldn't drink in Scotland."
s5608,Movie,Katherine Ryan: In Trouble,Colin Dench,Katherine Ryan,United Kingdom,"February 14, 2017",2017,TV-MA,64 min,Stand-Up Comedy,"Stand-up comic Katherine Ryan reminisces about unusual relationships, life in the hometown she hates and the time she enraged an entire nation."
s5612,Movie,Grillo vs Grillo,,Beppe Grillo,Italy,"February 10, 2017",2017,TV-MA,96 min,Stand-Up Comedy,"Outspoken comedian Beppe Grillo reminisces about his long career, including the triumphs and controversies that fueled his rise in Italian politics."
s5615,Movie,Daniel Sosa: Sosafado,"Raúl Campos, Jan Suter",Daniel Sosa,Mexico,"February 3, 2017",2017,TV-MA,78 min,Stand-Up Comedy,"Comedian Daniel Sosa inhabits various characters, including a Tupperware dealer, a thirsty priest and a Trojan horse soldier in this stand-up special."
s5623,Movie,Bill Burr: Walk Your Way Out,Jay Karas,Bill Burr,United States,"January 31, 2017",2017,TV-MA,78 min,Stand-Up Comedy,"No-nonsense comic Bill Burr takes the stage in Nashville and riffs on fast food, overpopulation, dictators and gorilla sign language."
s5628,Movie,Cristela Alonzo: Lower Classy,Marcus Raboy,Cristela Alonzo,United States,"January 24, 2017",2017,TV-MA,67 min,Stand-Up Comedy,"The irrepressible Alonzo skewers Latino stereotypes, pricey luxuries and her mother's tough-love parenting in a night of sly and infectious comedy."
s5629,Movie,Gad Gone Wild,Mario Rouleau,Gad Elmaleh,France,"January 23, 2017",2017,TV-MA,57 min,Stand-Up Comedy,French comic Gad Elmaleh regales a Montreal crowd with tales of awkward mix-ups and baffling customs he's encountered since moving to the U.S.
s5632,Movie,Neal Brennan: 3 Mics,Neal Brennan,Neal Brennan,United States,"January 17, 2017",2017,TV-MA,66 min,Stand-Up Comedy,"Wicked one-liners and soul-baring confessions converge in this uniquely intimate stand-up special from ""Chappelle's Show"" co-creator Neal Brennan."
s5640,Movie,Jim Gaffigan: Cinco,Jeannie Gaffigan,Jim Gaffigan,United States,"January 10, 2017",2017,TV-14,74 min,Stand-Up Comedy,America's king of clean comedy delivers wickedly funny jokes in his fifth hour-long special.
s5647,Movie,Jen Kirkman: Just Keep Livin’?,Lance Bangs,Jen Kirkman,United States,"January 3, 2017",2017,TV-MA,69 min,Stand-Up Comedy,"Incisive comic Jen Kirkman gets real about women's bodies, the value of alone time and an Italian private tour guide who may have been a ghost."
s5658,Movie,Garfunkel and Oates: Trying to be Special,"Riki Lindhome, Jeremy Konner","Riki Lindhome, Kate Micucci, Anthony Jeselnik, Steve Agee",United States,"December 23, 2016",2016,TV-MA,62 min,"Music & Musicals, Stand-Up Comedy",Garfunkel and Oates put on a surprise-filled show in Seattle in hopes of raising enough money to make their own comedy special.
s5661,Movie,Gabriel lglesias: I’m Sorry For What I Said When I Was Hungry,Manny Rodriguez,Gabriel Iglesias,United States,"December 20, 2016",2016,TV-14,88 min,Stand-Up Comedy,"Hawaiian-shirt enthusiast Gabriel ""Fluffy"" Iglesias finds the laughs in racist gift baskets, Prius-driving cops and all-female taco trucks."
s5679,Movie,Ricardo O'Farrill: Abrazo navideño,"Raúl Campos, Jan Suter","Ricardo O'Farrill, Carlos Ballarta, Sofía Niño de Rivera, Chumel Torres, Marissa ""Chabe"" Lozano",Mexico,"December 12, 2016",2016,TV-MA,31 min,Stand-Up Comedy,"The expressive Ricardo O'Farrill uses his astute comedic sensibilities to tease Christmas traditions, and not even Santa Claus escapes unscathed."
s5690,Movie,Reggie Watts: Spatial,Benjamin Dickinson,Reggie Watts,United States,"December 6, 2016",2016,TV-MA,62 min,"Music & Musicals, Stand-Up Comedy","The comic innovator delivers a surreal set blending experimental songs, jokes about grits, guns and drugs, and other improvised comedy adventures."
s5705,Movie,Richard Pryor: Live in Concert,Jeff Margolis,Richard Pryor,United States,"December 1, 2016",1979,TV-MA,79 min,Stand-Up Comedy,"Richard Pryor's classic 1979 concert film has him discussing a wide range of topics, including race, the police and his favorite target – himself."
s5709,Movie,Michael Che Matters,Oz Rodriguez,Michael Che,United States,"November 25, 2016",2016,TV-MA,61 min,Stand-Up Comedy,"""SNL"" star Michael Che takes on hot-button topics like inequality, homophobia and gentrification in this stand-up set filmed live in Brooklyn."
s5712,Movie,Carlos Ballarta: El amor es de putos,"Jan Suter, Raúl Campos Delgado",Carlos Ballarta,Mexico,"November 21, 2016",2016,TV-MA,67 min,Stand-Up Comedy,"Carlos Ballarta mocks daily life in Mexico, including public transit, the education system and the corn seller who betrays your confidence."
s5713,Movie,Donald Glover: Weirdo,"Shannon Hartman, Michelle Caputo",Donald Glover,United States,"November 19, 2016",2012,TV-MA,65 min,Stand-Up Comedy,"Fearlessly funny stand-up comic and sitcom star Donald Glover puts on a live show in New York, confessing his love for Cocoa Puffs and Toys ""R"" Us."
s5714,Movie,Colin Quinn: The New York Story,Jerry Seinfeld,Colin Quinn,United States,"November 18, 2016",2016,TV-MA,62 min,Stand-Up Comedy,"The ""SNL"" veteran performs his off-Broadway show about the history of New York and the people who shape its personality. Directed by Jerry Seinfeld."
s5718,Movie,Dieter Nuhr: Nuhr in Berlin,Volker Weicker,Dieter Nuhr,Germany,"November 15, 2016",2016,TV-MA,69 min,Stand-Up Comedy,"The cerebral and popular German cabaret comic expounds his theories on gender norms, primal instincts and a decidedly gastrointestinal Big Bang."
s5722,Movie,Kathleen Madigan: Bothering Jesus,Lorene Machado,Kathleen Madigan,United States,"November 10, 2016",2016,TV-MA,71 min,Stand-Up Comedy,"The Irish American comic riffs on everything from growing up in Missouri, signing up her parents to be Uber drivers and anything to do with bacon."
s5725,Movie,"Dana Carvey: Straight White Male, 60",Marcus Raboy,Dana Carvey,United States,"November 4, 2016",2016,TV-MA,64 min,Stand-Up Comedy,Emmy-winning comedian Dana Carvey blends pitch-perfect takes on big personalities with so-true-it-hurts stories from his life as a dad of millennials.
s5746,Movie,Joe Rogan: Triggered,Anthony Giordano,Joe Rogan,United States,"October 21, 2016",2016,TV-MA,64 min,Stand-Up Comedy,"Unleashing his inquisitive, intense comedic style, Rogan explores everything from raising kids and Santa Claus to pot gummies and talking to dolphins."
s5759,Movie,Russell Peters: Almost Famous,Dave Higby,Russell Peters,United States,"October 7, 2016",2016,TV-MA,73 min,Stand-Up Comedy,"The comic comes home to Toronto to sound off on cultural quirks, kids' furniture and bathroom visits, reveling in all things ridiculously human."
s5785,Movie,Iliza Shlesinger: Confirmed Kills,Bobcat Goldthwait,Iliza Shlesinger,United States,"September 23, 2016",2016,TV-MA,78 min,Stand-Up Comedy,"The stand-up sensation tackles TV's ""Shark Tank,"" what it means to be a woman and how to deal with the lawless party goblin that lives in us all."
s5787,Movie,"Karol Modzelewski, Łukasz „Lotek” Lodkowski No Offense",,"Karol Modzelewski, Łukasz ""Lotek” Lodkowski",,"September 19, 2016",2016,TV-MA,65 min,Stand-Up Comedy,"Charismatic comedy pals Karol Modzelewski and Łukasz ""Lotek"" Lodkowski bring their mischievous brand of humor to Warsaw's Klub Hybrydy."
s5788,Movie,"Katarzyna Piasecka, Rafał Pacześ Seriously Funny",,"Katarzyna Piasecka, Rafał Pacześ",,"September 19, 2016",2016,TV-MA,65 min,Stand-Up Comedy,Polish comedians Rafał Pacześ and Katarzyna Piasecka hit the stage at Warsaw's Klub Hybrydy for a night of funny anecdotes and sly jokes.
s5789,Movie,"Mariusz Kałamaga, Karol Kopiec, Wiolka Walaszczyk Hilarious Trio",,"Mariusz Kałamaga, Karol Kopiec, Wiolka Walaszczyk",,"September 19, 2016",2016,TV-MA,69 min,Stand-Up Comedy,"Comedians Mariusz Kałamaga, Karol Kopiec and Wiolka Walaszczyk deliver an eclectic and energetic stand-up show at Klub Hybrydy in Warsaw."
s5790,Movie,"Rafał Banaś, Michał Leja Laugh out Loud",,"Rafał Banaś, Michał Leja",,"September 19, 2016",2016,TV-MA,64 min,Stand-Up Comedy,Young Polish comedians Rafał Banaś and Michał Leja present a high-energy stand-up show at Warsaw's Klub Hybrydy.
s5791,Movie,The Best of Rafał Rutkowski Olka Szczęśniak,,"Rafał Rutkowski, Olka Szczęśniak",,"September 19, 2016",2016,TV-MA,63 min,Stand-Up Comedy,"""Recipe for Life"" star Rafał Rutkowski and Comedy Lab's Olka Szczęśniak serve up humorous impressions and wry wit at Warsaw's Klub Hybrydy."
s5792,Movie,"Tomasz Jachimek, Jacek Stramik Laugh at Live",,"Tomasz Jachimek, Jacek Stramik",,"September 19, 2016",2016,TV-MA,63 min,Stand-Up Comedy,"Writer, actor and satirist Tomasz Jachimek teams up with comedian Jacek Stramik for a night of subversive stand-up at Klub Hybrydy in Warsaw."
s5794,Movie,Cedric the Entertainer: Live from the Ville,Troy Miller,Cedric the Entertainer,United States,"September 16, 2016",2016,TV-MA,60 min,Stand-Up Comedy,"Donning his signature suit and fedora, the dapper comic offers a unique spin on getting old, the presidential election and ""Honky Tonk Badonkadonk."""
s5799,Movie,Jandino: Whatever it Takes,,Jandino Asporaat,United Kingdom,"September 9, 2016",2016,TV-MA,94 min,Stand-Up Comedy,"Jandino Asporaat riffs on the challenges of raising kids and serenades the audience with a rousing rendition of ""Sex on Fire"" in his comedy show."
s5809,Movie,Jeff Foxworthy and Larry the Cable Guy: We’ve Been Thinking...,Jay Karas,"Jeff Foxworthy, Larry the Cable Guy",United States,"August 26, 2016",2016,TV-14,75 min,Stand-Up Comedy,Grammy-nominated comedians Jeff Foxworthy and Larry the Cable Guy bring their distinctive brand of humor to a packed crowd in Minneapolis.
s5816,Movie,Jim Gaffigan: Beyond the Pale,Michael Drumm,Jim Gaffigan,United States,"August 11, 2016",2005,TV-14,72 min,Stand-Up Comedy,"Comedian Jim Gaffigan cuts loose on a variety of topics, including Hot Pockets, holidays, Catholicism and his favorite activity: doing nothing."
s5817,Movie,Jim Gaffigan: King Baby,Troy Miller,Jim Gaffigan,United States,"August 11, 2016",2009,TV-PG,71 min,Stand-Up Comedy,"Jim Gaffigan offers up his take on bacon, bowling and other weighty topics in this stand-up performance filmed live in Austin on his 2008 comedy tour."
