show_id,type,title,director,cast,country,date_added,release_year,rating,duration,listed_in,description
s279,Movie,Lokillo: Nothing's the Same,Julián Gaviria,Lokillo Florez,Colombia,"August 12, 2021",2021,TV-MA,64 min,Stand-Up Comedy,"Through songs and puns, comedian Lokillo Florez hilariously reviews how Latin Americans have adjusted to a new world where no-hugging policies prevail."
s360,Movie,The Original Kings of Comedy,Spike Lee,"Steve Harvey, D.L. Hughley, Cedric the Entertainer, Bernie Mac",United States,"August 1, 2021",2000,R,111 min,Stand-Up Comedy,"Comedians Steve Harvey, Cedric the Entertainer, D.L. Hughley and Bernie Mac hit the stage in an iconic stand-up concert directed by Spike Lee."
s389,TV Show,Plastic Cup Boyz: Laughing My Mask Off!,"Royale Watkins, Rich Schlansker","Joey Wells, Will 'Spank' Horton, Na'im Lynn",,"July 27, 2021",2021,TV-MA,1 Season,"Stand-Up Comedy & Talk Shows, TV Comedies",Comedy collective The Plastic Cup Boyz pour out the punchlines in Atlanta during a trio of raw and lively stand-up specials.
s401,TV Show,Revelations: The Masters of the Universe: Revelation Aftershow,,"Kevin Smith, Tiffany Smith, Robert David, Sarah Michelle Gellar, Chris Wood, Liam Cunningham, Alan Oppenheimer, Lena Headey, Kevin Conroy, Henry Rollins, Jason Mewes, Stephen Root, Mark Hamill",,"July 23, 2021",2021,TV-PG,1 Season,"Anime Series, Stand-Up Comedy & Talk Shows",Take a behind-the-scenes look at “Masters of the Universe: Revelation” as showrunner Kevin Smith and others interview the cast about their iconic roles.
s476,Movie,The Stand-Up,Daniel Růžička,"Iva Pazderková, Lukáš Pavlásek, Daniel Čech, Petr Cerha, Ondřej Havlík, Radek Petráš, Zbyněk Vičar, Pavel Tomeš, Nela Berg",,"July 10, 2021",2019,TV-MA,93 min,Stand-Up Comedy,Members of the comedy group Na Stojáka take the stage and the mic by storm for a special night of stand-up comedy.
s485,Movie,Lee Su-geun: The Sense Coach,Kim Joo-hyung,Lee Su-geun,,"July 9, 2021",2021,TV-G,46 min,Stand-Up Comedy,"Lee Su-geun's rise to Korean comedy stardom went hand in hand with his mastery over picking up social cues. Now, he's ready to share his know-hows."
s512,TV Show,Chelsea,,,United States,"July 6, 2021",2017,TV-MA,2 Seasons,"Stand-Up Comedy & Talk Shows, TV Comedies","It's not her first talk show, but it is a first of its kind. Ideas, people and places that fascinate her, all in her unique style."
s745,TV Show,Locombianos,,"Freddy Beltrán, Pamela Ospina, Diego Camargo, Catalina Guzmán",Colombia,"June 10, 2021",2021,TV-MA,1 Season,"International TV Shows, Spanish-Language TV Shows, Stand-Up Comedy & Talk Shows",Four of Colombia's funniest and bawdiest comedians perform before a post-quarantine audience hungry for their stories.
s767,Movie,Alan Saldaña: Locked Up,Alex Díaz,Alan Saldaña,Mexico,"June 3, 2021",2021,TV-MA,49 min,Stand-Up Comedy,"Mexican comedian Alan Saldaña is back, poking gentle fun at himself and parceling advice, especially about how to stay married and how to be parents."
s827,Movie,Bo Burnham: Inside,Bo Burnham,Bo Burnham,United States,"May 30, 2021",2021,TV-MA,88 min,Stand-Up Comedy,"A new comedy special shot and performed by Bo Burnham, alone, over the course of the past year."
s839,Movie,Soy Rada: Serendipity,Pablo Faro,Agustín Aristarán,Argentina,"May 27, 2021",2021,TV-MA,70 min,Stand-Up Comedy,"The delightful Argentine comic Agustín Aristarán (aka Soy Rada) is back, this time putting the spotlight on family and parenting, magic and music."
s1033,TV Show,Love Naggers,,"Seo Jang-hoon, Kim Sook, Han Hye-jin, Kwak Jung-eun, Ju Wu-jae",South Korea,"April 16, 2021",2021,TV-14,1 Season,"International TV Shows, Stand-Up Comedy & Talk Shows","From the quirky to the scandalous, any relationship is fair game for a panel of love experts who comb over text messages and revel in reenactments."
s1173,Movie,Loyiso Gola: Unlearning,Kagiso Lediga,Loyiso Gola,South Africa,"March 23, 2021",2021,TV-MA,60 min,Stand-Up Comedy,"South African comedian Loyiso Gola serves up filter-free humor as he riffs about race, identity, politics, and a school prank gone embarrassingly wrong!"
s1174,TV Show,Men on a Mission,Jung-ah Im,"Ho-dong Kang, Soo-geun Lee, Sang-min Lee, Young-chul Kim, Jang-hoon Seo, Hee-chul Kim, Kyung-hoon Min",South Korea,"March 23, 2021",2021,TV-14,6 Seasons,"International TV Shows, Korean TV Shows, Stand-Up Comedy & Talk Shows","Male celebs play make-believe as high schoolers, welcoming star transfer students every week and engaging in battles of witty humor and slapstick."
s1190,Movie,Nate Bargatze: The Greatest Average American,Troy Miller,Nate Bargatze,United States,"March 18, 2021",2021,TV-G,60 min,Stand-Up Comedy,"Nate Bargatze touches on Zoom comedy shows, losing his phone, hotel breakfast fails, animal caddies, new math and much more in this special."
s1192,Movie,The Fluffy Movie,"Manny Rodriguez, Jay Lavender",Gabriel Iglesias,United States,"March 18, 2021",2014,PG-13,101 min,Stand-Up Comedy,"Comedian Gabriel Iglesias takes the stage in San Jose, California, for a stand-up performance featuring wild stories and even wilder impersonations."
s1199,Movie,RebellComedy: Straight Outta the Zoo,Ladislaus Kiraly,"Khalid Bounouar, Alain Frei, Babak Ghassim, Benaissa Lamroubal, Salim Samatou, Hany Siam, Ususmango, DJ Wati",Germany,"March 16, 2021",2021,TV-MA,74 min,Stand-Up Comedy,"The comics of RebellComedy take the stage and tackle mistaken identities, geriatric influencers, our flawed perceptions of animals and more."
s1250,Movie,Blanche Gardin: The All-Nighter,"Xavier Maingon, Marc-Antoine Hélard",Blanche Gardin,,"March 1, 2021",2021,TV-MA,96 min,Stand-Up Comedy,"With self-deprecating humor, French comic Blanche Gardin offers stream-of-consciousness observations on environmentalism, gender relations and herself."
s1279,Movie,Brian Regan: On the Rocks,Troy Miller,Brian Regan,United States,"February 23, 2021",2021,TV-G,58 min,Stand-Up Comedy,"Brian Regan tackles the big issues weighing on him, including aging, time, obsessive behavior, backpacks on airplanes, ungrateful horses and raisins."
s1316,Movie,Hate by Dani Rovira,Mario Briongos,Dani Rovira,Spain,"February 12, 2021",2021,TV-MA,83 min,Stand-Up Comedy,"From his hometown of Málaga, Dani Rovira reflects on human beings’ nonsensical hatred in this hilarious and unfiltered comedy special."
s1337,Movie,Blanche Gardin: I talk to myself,Maïa Sandoz,Blanche Gardin,France,"February 5, 2021",2017,TV-MA,88 min,Stand-Up Comedy,"Touching on bulimia, death and cat sodomy, this French actress and comedian is keen to push the envelope in a one-woman show with understated flair."
s1353,TV Show,Tiffany Haddish Presents: They Ready,,"Tracey Ashley, Flame Monroe, Aida Rodriguez, Marlo Williams, April Macie, Chaunté Wayans, Tiffany Haddish",United States,"February 2, 2021",2021,TV-MA,2 Seasons,"Stand-Up Comedy & Talk Shows, TV Comedies","Hand-picked by Tiffany Haddish, six diverse comedians showcase their raw humor in a series of specials oozing with energy."
s1419,Movie,Chris Rock Total Blackout: The Tamborine Extended Cut,Chris Rock,Chris Rock,,"January 12, 2021",2021,TV-MA,98 min,Stand-Up Comedy,"In this extended cut of his 2018 special, Chris Rock takes the stage for a special filled with searing observations on fatherhood, infidelity and politics."
s1451,Movie,Eddie Murphy: Raw,Robert Townsend,Eddie Murphy,United States,"January 1, 2021",1987,R,90 min,Stand-Up Comedy,"This stand-up comedy classic features Eddie Murphy live in a provocative series of impressions, observations and remembrances of his childhood."
s1472,Movie,Best of Stand-Up 2020,,"Jerry Seinfeld, Leslie Jones, Taylor Tomlinson, Tom Segura, Jack Whitehall, Michelle Buteau, Bert Kreischer, Jo Koy, Donnell Rawlings, Jim Jefferies, Nikki Glaser, George Lopez, Sam Jay, Marc Maron, Kevin Hart, Michael McIntyre, Fortune Feimster, Eric André, Jim Norton, Felipe Esparza, Hannah Gadsby, Patton Oswalt, Vir Das, Robert Kelly, Urzila Carlson, Tom Papa, Kanan Gill, Ms. Pat, Rob Schneider, Adrienne Iapalucci, Kenny Sebastian, Thomas Middleditch, Ben Schwartz",,"December 31, 2020",2020,TV-MA,77 min,Stand-Up Comedy,"From Jerry Seinfeld to Leslie Jones, Kevin Hart to Hannah Gadsby, laugh along with the funniest bits from Netflix's 2020 stand-up comedy specials."
s1503,Movie,London Hughes: To Catch a D*ck,Kristian Mercado,London Hughes,United States,"December 22, 2020",2020,TV-MA,68 min,Stand-Up Comedy,Bawdy comedian and television presenter London Hughes revisits her past in this acclaimed breakout special filled with unfiltered tales and wild stories.
s1513,Movie,Rhys Nicholson Live at the Athenaeum,Thomas Toby Parkinson,Rhys Nicholson,United Kingdom,"December 20, 2020",2020,TV-MA,66 min,Stand-Up Comedy,"Rhys Nicholson flexes his biting humor as he discusses horse tranquilizers, angry letters from viewers, and more in this stand-up special."
s1531,TV Show,Schulz Saves America,Alexx Media,Andrew Schulz,United States,"December 17, 2020",2020,TV-MA,1 Season,"Stand-Up Comedy & Talk Shows, TV Comedies",Comedian Andrew Schulz takes on the year's most divisive topics in this fearlessly unfiltered and irreverent four-part special.
s1543,Movie,Vir Das: Outside In - The Lockdown Special,Vir Das,Vir Das,India,"December 16, 2020",2020,TV-MA,50 min,Stand-Up Comedy,Stage banter takes on a different — deeper — meaning as the comedian performs online shows to homebound viewers worldwide from his Mumbai residence.
s1605,Movie,Ari Eldjárn: Pardon My Icelandic,August Jakobsson,Ari Eldjárn,Iceland,"December 2, 2020",2020,TV-MA,54 min,Stand-Up Comedy,"In this English-language special, Icelandic comedian Ari Eldjárn pokes fun at Nordic rivalries, Hollywood's take on Thor, the whims of toddlers and more."
s1608,Movie,Hazel Brugger: Tropical,,Hazel Brugger,Germany,"December 2, 2020",2020,TV-MA,58 min,Stand-Up Comedy,"In this stand-up special, comedian Hazel Brugger offers her breezy takes on unruly geese, chatty gynecologists, German bank loans and more."
s1646,Movie,Larry the Cable Guy: Remain Seated,Brian Volk-Weiss,Larry the Cable Guy,United States,"November 26, 2020",2020,TV-14,68 min,Stand-Up Comedy,"With his signature call to ""Git-R-Done,"" Larry muses on swampy weather, late-night shopping at Walmart and other raunchy tales of life in rural America."
s1687,Movie,Kevin Hart: Zero F**ks Given,Leslie Small,Kevin Hart,United States,"November 17, 2020",2020,TV-MA,70 min,Stand-Up Comedy,"Kevin Hart serves up laughs and brick oven pizza from the comfort of his home, and dishes on male group chats, sex after 40 and life with COVID-19."
s1743,Movie,Felix Lobrecht: Hype,Jan-Peter Horns,Felix Lobrecht,Germany,"November 3, 2020",2020,TV-MA,60 min,Stand-Up Comedy,"Felix Lobrecht aims his dark humor at overly polite culture, weird laughter, the sheer awkwardness of a walking baby and more in this stand-up special."
s1814,TV Show,My Next Guest Needs No Introduction With David Letterman,,"President Barack Obama, George Clooney, Malala Yousafzai, Jay-Z, Tina Fey, Howard Stern, David Letterman",United States,"October 21, 2020",2020,TV-MA,3 Seasons,Stand-Up Comedy & Talk Shows,TV legend David Letterman teams up with fascinating global figures for in-depth interviews and curiosity-fueled excursions in this monthly talk show.
s1936,Movie,Michelle Buteau: Welcome to Buteaupia,Page Hurwitz,Michelle Buteau,United States,"September 29, 2020",2020,TV-MA,59 min,Stand-Up Comedy,"Scene-stealing queen Michelle Buteau dazzles with real talk on relationships, parenthood, cultural differences and the government workers who adore her."
s1993,Movie,Dr Jason Leong Hashtag Blessed,Kubhaer T. Jethwani,Jason Leong,,"September 16, 2020",2018,TV-MA,69 min,Stand-Up Comedy,"In this stand-up special, former doctor Jason Leong gives his diagnoses on the nonsense of traditional healers, business-class show-offs and more."
s2001,Movie,Michael McIntyre: Showman,Chris Howe,Michael McIntyre,United Kingdom,"September 15, 2020",2020,TV-MA,63 min,Stand-Up Comedy,"Charming comic Michael McIntyre talks family, technology, sharks, accents and the time he confused himself for a world leader in this stand-up special."
s2015,Movie,Wonho Chung: Live in New York,Shaun Mir,Wonho Chung,,"September 11, 2020",2014,TV-14,69 min,Stand-Up Comedy,"At the Comic Strip's first Arabic stand-up show, Wonho Chung ratchets up the laughs by tackling unique names, life in Jordan, accents and more."
s2051,Movie,Afonso Padilha: Classless,"Junior Carelli, Rudge Campos",Afonso Padilha,Brazil,"September 3, 2020",2020,TV-MA,63 min,Stand-Up Comedy,Brazilian comedian Afonso Padilha dives into his humble beginnings and digs out hilarious stories about his childhood in this very personal set.
s2069,TV Show,Felipe Esparza: Bad Decisions,,Felipe Esparza,United States,"September 1, 2020",2020,TV-MA,1 Season,"Stand-Up Comedy & Talk Shows, TV Comedies","Two live performances, one in English and one in Spanish. No matter the language, Felipe Esparza is muy muy."
s2144,Movie,"Rob Schneider: Asian Momma, Mexican Kids",Tyler Spindel,Rob Schneider,United States,"August 11, 2020",2020,TV-MA,44 min,Stand-Up Comedy,"Former ""Saturday Night Live"" star Rob Schneider returns to the stage and shares his take on life, love and dinosaur dreams in this stand-up special."
s2170,Movie,Sam Jay: 3 In The Morning,Kristian Mercado,Sam Jay,United States,"August 4, 2020",2020,TV-MA,64 min,Stand-Up Comedy,"Comedian and ""Saturday Night Live"" writer Sam Jay serves up fresh takes on relationships, travel nightmares, the audacity of white people and more."
s2183,Movie,Tumi or not Tumi,Mfanelo Ngoma,Tumi Morake,,"August 1, 2020",2020,TV-MA,72 min,Stand-Up Comedy,"Tumi Morake dishes out hot takes and fiery commentary about the concept of identity, politics, family life, weaves, and more in this stand-up special."
s2222,Movie,Jack Whitehall: I'm Only Joking,"Dave Skinner, Freddie Waters",Jack Whitehall,United Kingdom,"July 21, 2020",2020,TV-MA,58 min,Stand-Up Comedy,"Jack Whitehall hits the stage with hilarious tales about happy couples, life in hotels, human stupidity and his well-traveled father."
s2243,Movie,Urzila Carlson: Overqualified Loser,Hayden Guppy,Urzila Carlson,Australia,"July 14, 2020",2020,TV-MA,62 min,Stand-Up Comedy,"Stand-up comedian Urzila Carlson keeps the crowd roaring with her thoughts on recasting ""The Biggest Loser,"" sex tape regrets and boxed wine hangovers."
s2262,Movie,Jim Jefferies: Intolerant,Scott Zabielski,Jim Jefferies,,"July 7, 2020",2020,TV-MA,67 min,Stand-Up Comedy,"Between scenes from an excruciating date, Jim Jefferies digs into generational differences, his own bad habits and the shifting boundaries in comedy."
s2303,Movie,Thiago Ventura: POKAS,"Fabio Ock, Joana Mazzucchelli",Thiago Ventura,Brazil,"July 2, 2020",2020,TV-MA,82 min,Stand-Up Comedy,"In a rollicking special, Thiago Ventura jokes about life in the hood, social issues and more, explaining how actions speak louder than words."
s2322,Movie,George Lopez: We'll Do It For Half,Troy Miller,George Lopez,United States,"June 30, 2020",2020,TV-MA,52 min,Stand-Up Comedy,"Comedian George Lopez tackles the future and the past of Latinx culture in America, touching on immigration, his tough relatives, aging and much more."
s2346,Movie,Eric Andre: Legalize Everything,Eric Notarnicola,Eric André,United States,"June 23, 2020",2020,TV-MA,52 min,Stand-Up Comedy,"Eric Andre takes the stage in New Orleans and tackles flawed fast-food icons, the wonders of autofill and the bizarre choice for the ""Cops"" theme song."
s2397,TV Show,Frank Elstner: Just One Last Question,,"Klaas Heufer-Umlauf, Joko Winterscheidt, Lena Meyer-Landrut, Charlotte Roche, Daniel Brühl, Frank Elstner",Germany,"June 12, 2020",2020,TV-MA,1 Season,"International TV Shows, Stand-Up Comedy & Talk Shows","In his farewell show, legendary German host Frank Elstner digs deep and savors his discussions with stars such as Daniel Brühl and Lena Meyer-Landrut."
s2398,Movie,Jo Koy: In His Elements,Michael McKay,"Jo Koy, Andrew Lopez, Joey Guila, Andrew Orolfo",United States,"June 12, 2020",2020,TV-MA,55 min,Stand-Up Comedy,"Jo Koy brings the laughs and beats to Manila, spotlighting local culture in a one-of-a-kind show featuring Filipino American comedians, DJs and B-boys."
s2459,Movie,Kenny Sebastian: The Most Interesting Person in the Room,Angshuman Ghosh,Kenny Sebastian,India,"May 29, 2020",2020,TV-MA,68 min,Stand-Up Comedy,"Fusing his musical and stand-up chops, Kenny Sebastian gets analytical about frumpy footwear, flightless birds and his fear of not being funny enough."
s2469,Movie,Hannah Gadsby: Douglas,Madeleine Parry,Hannah Gadsby,Australia,"May 26, 2020",2020,TV-MA,73 min,Stand-Up Comedy,"Hannah Gadsby returns for her second special and digs deep into the complexities of popularity, identity and her most unusual dog park encounter."
s2508,TV Show,Patton Oswalt: I Love Everything,Marcus Raboy,"Patton Oswalt, Bob Rubin",United States,"May 19, 2020",2020,TV-MA,1 Season,"Stand-Up Comedy & Talk Shows, TV Comedies",Turning 50. Finding love again. Buying a house. Experiencing existential dread at Denny's. Life comes at Patton Oswalt fast in this stand-up special.
s2516,TV Show,Patriot Act with Hasan Minhaj,,Hasan Minhaj,United States,"May 17, 2020",2020,TV-MA,6 Seasons,"Stand-Up Comedy & Talk Shows, TV Comedies","Every Sunday, Hasan Minhaj brings an incisive and nuanced perspective to global news, politics and culture in his unique comedy series."
s2562,Movie,Jerry Seinfeld: 23 Hours To Kill,Joe DeMaio,Jerry Seinfeld,United States,"May 5, 2020",2020,TV-PG,61 min,Stand-Up Comedy,"Jerry Seinfeld takes the stage in New York and tackles talking vs. texting, bad buffets vs. so-called ""great"" restaurants and the magic of Pop Tarts."
s2572,Movie,Mike Birbiglia: My Girlfriend's Boyfriend,Seth Barrish,Mike Birbiglia,United States,"May 2, 2020",2013,TV-14,76 min,Stand-Up Comedy,"On this painfully honest but hilarious journey, Birbiglia struggles to find reason in an area where it may be impossible to find: love."
s2645,Movie,"Yours Sincerely, Kanan Gill",Neville Shah,Kanan Gill,India,"April 24, 2020",2020,TV-MA,72 min,Stand-Up Comedy,"Revisiting life goals set in a letter written as a teen to his future self, comedian Kanan Gill reports back on if he's lived up to his own expectations."
s2676,TV Show,Fary : Hexagone,"Adrien Lagier, Ousmane Ly",Fary,France,"April 16, 2020",2020,TV-MA,2 Seasons,"International TV Shows, Stand-Up Comedy & Talk Shows, TV Comedies","French comedy phenom Fary puts a playful spin on questions of identity, culture and more in the first half of an epic two-part stand-up special."
s2680,Movie,Maurício Meirelles: Generating Chaos,Diego Pignataro,Maurício Meirelles,Brazil,"April 16, 2020",2020,TV-MA,63 min,Stand-Up Comedy,"Comedian Maurício Meirelles explores his chaotic mind with scathingly funny views on family, prejudices, turtles and more in this stand-up special."
s2687,Movie,Chris D'Elia: No Pain,Matt D'Elia,Chris D'Elia,United States,"April 14, 2020",2020,TV-MA,55 min,Stand-Up Comedy,Chris D'Elia takes the stage in Minneapolis to offer his thoughts on everything from self-censorship to problematic dolphins to lame mutant powers.
s2703,Movie,Tiffany Haddish: She Ready! From the Hood To Hollywood!,Chris Robinson,Tiffany Haddish,United States,"April 7, 2020",2017,TV-MA,66 min,Stand-Up Comedy,Comedic breakout Tiffany Haddish delivers a riotous stand-up ripe with the unpretentious and filthy tales of her meteoric rise to stardom.
s2720,Movie,David Batra: Elefanten i rummet,"David Batra, Jon Rudberg",David Batra,Sweden,"April 1, 2020",2020,TV-MA,77 min,Stand-Up Comedy,Swedish comedian David Batra gets personal as he playfully details the perks and pitfalls of being married to a recently resigned political leader.
s2754,Movie,Dave Chappelle: The Kennedy Center Mark Twain Prize for American Humor,,,United States,"March 31, 2020",2020,TV-MA,85 min,Stand-Up Comedy,"Dave Chappelle is awarded the prestigious Mark Twain Prize for American Humor in a star-studded ceremony from the Kennedy Center in Washington, D.C."
s2766,TV Show,Ladies Up,,"Prashasti Singh, Kaneez Surka, Niveditha Prakasam, Supriya Joshi",India,"March 27, 2020",2019,TV-MA,1 Season,"International TV Shows, Stand-Up Comedy & Talk Shows, TV Comedies","Rising India-based comics Prashasti Singh, Kaneez Surka, Supriya Joshi and Niveditha Prakasam bring no-holds-barred humor to this stand-up series."
s2783,Movie,Tom Segura: Ball Hog,Rami Hachache,Tom Segura,United States,"March 24, 2020",2020,TV-MA,70 min,Stand-Up Comedy,"Tom Segura scores laughs with uncomfortably candid stories about mothers, fathers, following your dreams — and other things you'd rather not think about."
s2807,Movie,Bert Kreischer: Hey Big Boy,Jeff Tomsic,Bert Kreischer,United States,"March 17, 2020",2020,TV-MA,62 min,Stand-Up Comedy,"Ever the stand-up party animal, comic Bert Kreischer riffs on parenting and family life, being a gun and pet owner, his dad discovering pot, and more."
s2830,Movie,Marc Maron: End Times Fun,Lynn Shelton,Marc Maron,United States,"March 10, 2020",2020,TV-MA,71 min,Stand-Up Comedy,"Marc Maron wades through a swamp of vitamin hustlers, evangelicals and grown male nerd children, culminating in a gleefully filthy end-times fantasy."
s2850,Movie,Taylor Tomlinson: Quarter-Life Crisis,Marcus Raboy,Taylor Tomlinson,United States,"March 3, 2020",2020,TV-MA,61 min,Stand-Up Comedy,"She's halfway through her 20s — and she's over it. Too old to party, too young to settle down, comedian Taylor Tomlinson takes aim at her life choices."
s2854,Movie,Fat Ballerina - David A. Arnold,Milton Horowitz,David A. Arnold,United States,"March 2, 2020",2020,TV-MA,61 min,Stand-Up Comedy,"Finally comfortable in his skin, seasoned comic David A. Arnold shares his talent for doing nothing, how he's petty and why divorce saves marriages."
s2870,Movie,Amit Tandon: Family Tandoncies,,Amit Tandon,India,"February 28, 2020",2019,TV-14,72 min,Stand-Up Comedy,"From the death of romance in marriage to the injustices of modern-day parenting, Amit Tandon shares wisdom and wisecracks as a battle-scarred family guy."
s2887,Movie,Pete Davidson: Alive From New York,Jason Orley,Pete Davidson,United States,"February 25, 2020",2020,TV-MA,50 min,Stand-Up Comedy,"Comedian and ""SNL"" star Pete Davidson drops a candid and intimate stand-up special shot live in New York City."
s2953,Movie,Tom Papa: You're Doing Great!,Gregory Jacobs,Tom Papa,United States,"February 4, 2020",2020,TV-14,60 min,Stand-Up Comedy,"Comedian Tom Papa takes on body image issues, social media, pets, Staten Island, the ""old days"" and more in a special from his home state of New Jersey."
s2979,Movie,Kevin Hart: I'm a Grown Little Man,Shannon Hartman,Kevin Hart,United States,"January 30, 2020",2009,TV-MA,62 min,Stand-Up Comedy,"Stand-up comedy star Kevin Hart delivers his unique perspective on work, race, family and friends with this laugh-riot comedy show."
s2988,Movie,Vir Das: For India,"Vir Das, Ajay Bhuyan",Vir Das,India,"January 26, 2020",2020,TV-MA,76 min,Stand-Up Comedy,"From the Vedas to Vasco da Gama to vacuous Bollywood plotlines, comedian Vir Das celebrates the history of India with his one-of-a-kind perspective."
s2997,Movie,Alex Fernández: The Best Comedian in the World,Alex Díaz,Alex Fernández,Mexico,"January 23, 2020",2020,TV-MA,51 min,Stand-Up Comedy,Comic Alex Fernández performs his familiar autobiographical stories but goes a little deeper this time with a tender tale about one of his six siblings.
s3004,Movie,Fortune Feimster: Sweet & Salty,Krysia Plonka,Fortune Feimster,United States,"January 21, 2020",2020,TV-MA,61 min,Stand-Up Comedy,"Actor, comedian and writer Fortune Feimster takes the stage and riffs on her southern roots, sexual awakenings, showbiz career and more."
s3028,Movie,Leslie Jones: Time Machine,"David Benioff, D.B. Weiss",Leslie Jones,United States,"January 14, 2020",2020,TV-MA,66 min,Stand-Up Comedy,"From trying to seduce Prince to battling sleep apnea, Leslie Jones traces her evolution as an adult in a joyfully raw and outrageous stand-up special."
s3062,Movie,Jeff Dunham: Unhinged in Hollywood,Michael Simon,Jeff Dunham,United States,"January 1, 2020",2015,TV-MA,71 min,Stand-Up Comedy,Unfiltered ventriloquist Jeff Dunham brings his ragtag crew of puppet pals to Hollywood for big laughs about celebrity culture and California living.
s3087,TV Show,The Degenerates,,"Big Jay Oakerson, Brad Williams, Yamaneika Saunders, Liza  Treyger, Joey Diaz, Christina Pazsitzky",,"December 31, 2019",2019,TV-MA,2 Seasons,"Stand-Up Comedy & Talk Shows, TV Comedies",Six stand-ups explore the coarse and salacious side of comedy in this series of half-hour specials. For mature audiences.
s3124,Movie,Ronny Chieng: Asian Comedian Destroys America!,Sebastian DiNatale,Ronny Chieng,United States,"December 17, 2019",2019,TV-MA,63 min,Stand-Up Comedy,"Ronny Chieng (""The Daily Show,"" ""Crazy Rich Asians"") takes center stage in this stand-up special and riffs on modern American life and more."
s3158,Movie,Jack Whitehall: Christmas with My Father,Richard van't Riet,"Jack Whitehall, Michael Whitehall, Hugh Bonneville, Graham Norton, Layton Williams, Andrew Lloyd Webber, Tim Rice, Tan France, Antoni Porowski, Jonathan Van Ness",United Kingdom,"December 12, 2019",2019,TV-MA,65 min,Stand-Up Comedy,"Jack Whitehall invites his notoriously stuffy father onstage in London's West End for a Christmas comedy extravaganza, complete with celebrity guests."
s3161,Movie,Michelle Wolf: Joke Show,Lance Bangs,Michelle Wolf,United States,"December 10, 2019",2019,TV-MA,60 min,Stand-Up Comedy,"Comedian Michelle Wolf takes on outrage culture, massages, childbirth, feminism and much more (like otters) in a stand-up special from New York City."
