show_id,type,title,director,cast,country,date_added,release_year,rating,duration,listed_in,description
s4315,Movie,Vir Das: Losing It,Marcus Raboy,Vir Das,United States,"December 11, 2018",2018,TV-MA,68 min,Stand-Up Comedy,"The world's got a lot of problems, but Vir Das has a lot of answers as he discusses travel, religion, his childhood and more in this stand-up special."
s4326,Movie,RUSSELL BRAND: RE:BIRTH,Chris Howe,Russell Brand,,"December 4, 2018",2018,TV-MA,63 min,Stand-Up Comedy,Russell Brand gets loquacious in London as he ruminates on the state of the world and marvels over how his life changed the moment he became a father.
s4363,TV Show,Bumping Mics with Jeff Ross & Dave Attell,,"Jeff Ross, Dave Attell",United States,"November 27, 2018",2018,TV-MA,1 Season,"Stand-Up Comedy & Talk Shows, TV Comedies","When Jeff Ross and Dave Attell take the stage, no one is safe. With the help of special guests, they're packing a lot of laughs into one epic weekend."
s4378,Movie,Trevor Noah: Son of Patricia,David Paul Meyer,Trevor Noah,United States,"November 20, 2018",2018,TV-MA,64 min,Stand-Up Comedy,"""Daily Show"" host Trevor Noah touches on tacos, runaway snakes, camping, racism immunity and lessons he learned from his mother in this comedy special."
s4413,Movie,John Leguizamo's Latin History for Morons,,John Leguizamo,United States,"November 5, 2018",2018,TV-MA,90 min,Stand-Up Comedy,"In this one-man Broadway show, John Leguizamo finds humor and heartbreak as he traces 3,000 years of Latin history in an effort to help his bullied son."
s4436,Movie,"Edmilson Filho: Notas, Comedy about Relationships",Halder Gomes,Edmilson Filho,Brazil,"November 1, 2018",2017,TV-MA,80 min,Stand-Up Comedy,"Brazilian comedian Edmilson Filho walks his audience through the stages of a modern relationship, playing up the differences between men and women."
s4448,Movie,Katt Williams: The Pimp Chronicles: Pt. 1,Gary Binkow,"Katt Williams, Anthony Anderson",United States,"November 1, 2018",2006,TV-MA,45 min,Stand-Up Comedy,"In this 2006 show, comic Katt Williams uses his edgy style and personal experiences to paint a sassy, hilarious portrait of life in black America."
s4451,Movie,Marc Maron: Thinky Pain,Lance Bangs,Marc Maron,United States,"November 1, 2018",2013,TV-MA,95 min,Stand-Up Comedy,"Alternative comic Marc Maron is back on stage in New York to talk Chinese food, drug abuse, sex in hotel rooms and life with his girlfriend."
s4461,Movie,Sommore: The Reign Continues,Kevin Layne,Sommore,United States,"November 1, 2018",2015,TV-MA,93 min,Stand-Up Comedy,"Self-proclaimed ""Queen of Comedy"" Sommore storms the stage to deliver a riotous stand-up performance in Charlotte, North Carolina."
s4483,Movie,ADAM SANDLER 100% FRESH,Steve Brill,Adam Sandler,United States,"October 23, 2018",2018,TV-MA,74 min,Stand-Up Comedy,"From ""Heroes"" to ""Ice Cream Ladies"" – Adam Sandler's comedy special hits you with new songs and jokes in an unexpected, groundbreaking way."
s4486,TV Show,The Hollywood Masters,,,United States,"October 23, 2018",2017,TV-MA,3 Seasons,Stand-Up Comedy & Talk Shows,"Top Hollywood stars and directors open up about their dreams, struggles and lifelong obsessions in interviews filmed in front of a live audience."
s4506,Movie,"Ron White: If You Quit Listening, I'll Shut Up",Tom Forrest,Ron White,United States,"October 16, 2018",2018,TV-MA,63 min,Stand-Up Comedy,"Ron “Tater Salad” White dishes out his signature brand of cynicism, riffing on sex, celebrity and the sinister habits of wild geese."
s4526,Movie,Mo Amer: The Vagabond,Stan Lathan,Mo Amer,United States,"October 9, 2018",2018,TV-MA,57 min,Stand-Up Comedy,"Arab-American comedian Mo Amer recounts his life as a refugee comic, from traveling with the name Mohammed to his long path to citizenship."
s4542,Movie,Joe Rogan: Strange Times,Anthony Giordano,Joe Rogan,,"October 2, 2018",2018,TV-MA,64 min,Stand-Up Comedy,"Outspoken as ever, comedian Joe Rogan takes on current culture, pro wrestling, pot laws, cats, vegans and more in a stand-up special shot in Boston."
s4632,Movie,Rafinha Bastos: Ultimatum,,Rafinha Bastos,Brazil,"September 21, 2018",2018,TV-MA,63 min,Stand-Up Comedy,"An off-color joke nearly cost him everything. Brazilian comic Rafinha Bastos talks about that and much more, from his divorce to finding love again."
s4640,TV Show,Norm Macdonald Has a Show,,,United States,"September 14, 2018",2018,TV-MA,1 Season,"Stand-Up Comedy & Talk Shows, TV Comedies",Comedian Norm Macdonald hosts his celebrity friends for casual conversations that range from silly to serious and take many unexpected turns.
s4648,TV Show,Daniel Sloss: Live Shows,,Daniel Sloss,United States,"September 11, 2018",2018,TV-MA,1 Season,"Stand-Up Comedy & Talk Shows, TV Comedies","Comedian Daniel Sloss is ready to find the funny in some very dark topics, from the deeply personal to the truly irreverent."
s4675,TV Show,The Comedy Lineup,,"Michelle Buteau, Ian Karmel, Taylor Tomlinson, Sam Jay, Phil Wang, Sabrina Jalees, Jak Knight, Tim Dillon",United States,"August 31, 2018",2018,TV-MA,2 Seasons,"Stand-Up Comedy & Talk Shows, TV Comedies",A diverse group of up-and-coming comedians perform 15-minute sets in this stand-up comedy showcase series.
s4684,Movie,Maria Bamford: The Special Special Special,Jordan Brady,"Maria Bamford, Wayne Federman, Jackie Kashian",United States,"August 25, 2018",2012,TV-MA,50 min,Stand-Up Comedy,"Spend an evening with gleeful, oh-so-awkward Maria Bamford via her cozy, shot-at-home comedy special, which has a two-person audience: her parents."
s4685,Movie,Bert Kreischer: Secret Time,Todd Biermann,Bert Kreischer,,"August 24, 2018",2018,TV-MA,57 min,Stand-Up Comedy,Shirtless comic Bert Kreischer relays personal secrets and stories about being a cool – if not always responsible – dad in this stand-up special.
s4700,Movie,Yoo Byung Jae: Discomfort Zone,Y. Joon Chung,Yoo Byung Jae,South Korea,"August 17, 2018",2018,TV-MA,54 min,Stand-Up Comedy,Daring comedian Yoo Byung-jae connects criticism he's received from the general public to some of the most touchy issues in current Korean society.
s4750,Movie,Coco y Raulito: Carrusel de ternura,"Raúl Campos, Jan Suter","Coco Celis, Raúl Meneses",Mexico,"July 27, 2018",2018,TV-MA,57 min,Stand-Up Comedy,"A study in contrasts, comedy partners and good friends Coco Celis and Raúl Meneses alternate separate stand-up sets for double the laughs."
s4757,Movie,Iliza Shlesinger: Elder Millennial,Steve Paley,Iliza Shlesinger,United States,"July 24, 2018",2018,TV-MA,72 min,Stand-Up Comedy,"Newly engaged comic Iliza Shlesinger dives into undeniable truths about life at age 35, the insanity of the road traveled and what's to come."
s4772,TV Show,The Joel McHale Show with Joel McHale,,Joel McHale,United States,"July 15, 2018",2018,TV-MA,2 Seasons,"Stand-Up Comedy & Talk Shows, TV Comedies","Trending news, pop culture, social media, original sketches and more come together in host Joel McHale's new weekly comedy commentary show."
s4775,Movie,Jim Jefferies: This Is Me Now,Scott Zabielski,Jim Jefferies,United States,"July 13, 2018",2018,TV-MA,71 min,Stand-Up Comedy,"The gleefully irreverent Jefferies skewers ""grabby"" celebrities, political hypocrisy and his own ill-advised career moves in a brash stand-up special."
s4782,Movie,Luciano Mellera: Infantiloide,"Raúl Campos, Jan Suter",Luciano Mellera,Argentina,"July 6, 2018",2018,TV-14,66 min,Stand-Up Comedy,Argentina's Luciano Mellera emphasizes the humorous and fantastical aspects of childhood through comedic impersonations and insights on daily life.
s4786,Movie,Sommore: Chandelier Status,Kevin Layne,Sommore,United States,"July 4, 2018",2013,TV-MA,77 min,Stand-Up Comedy,"Luminous funnywoman Sommore wows Miami with her unique take on body modification, Internet sex, the world of celebrities and more."
s4787,Movie,Felipe Esparza: They're Not Going to Laugh at You,Scott L. Montoya,Felipe Esparza,United States,"July 3, 2018",2012,TV-MA,58 min,Stand-Up Comedy,"""Last Comic Standing"" winner Felipe Esparza runs riot in his first comedy special with his wry comments on life as a wild man from East Los Angeles."
s4788,Movie,Joan Rivers: Don't Start with Me,Scott L. Montoya,Joan Rivers,United States,"July 3, 2018",2012,TV-MA,69 min,Stand-Up Comedy,"At 78, Joan Rivers has no interest in slowing down, and no one's immune from her caustic barbs in this stand-up special."
s4789,Movie,Katt Williams: Kattpacalypse,Marcus Raboy,Katt Williams,United States,"July 3, 2018",2012,TV-MA,61 min,Stand-Up Comedy,"Urban comic Katt Williams ushers in Kattpacalypse, exploding with more energy than an atomic bomb and riffing on everything from Doomsday to Obama."
s4792,Movie,Bo Burnham: what.,"Bo Burnham, Christopher Storer",Bo Burnham,United States,"July 1, 2018",2013,TV-MA,60 min,Stand-Up Comedy,Left brain and right brain duke it out – and ultimately belt out a melody – in stand-up comedian Bo Burnham's quick and clever one-man show.
s4804,Movie,Bill Burr: You People Are All the Same,Jay Karas,Bill Burr,United States,"June 30, 2018",2012,TV-MA,69 min,Stand-Up Comedy,"Funnyman Bill Burr takes the stage to uncork a profanity-laced, incisive routine that pokes fun at plastic surgery, reality TV, gold diggers and more."
s4809,Movie,Jani Dueñas: Grandes fracasos de ayer y hoy,"Raúl Campos, Jan Suter",Jani Dueñas,Chile,"June 29, 2018",2018,TV-MA,77 min,Stand-Up Comedy,"Chilean comedian and personality Jani Dueñas pours out her feelings on issues that are all too universal, from aging to dieting to sex."
s4815,Movie,W. Kamau Bell: Private School Negro,Shannon Hartman,W. Kamau Bell,United States,"June 26, 2018",2018,TV-MA,66 min,Stand-Up Comedy,"Comedian W. Kamau Bell muses on parenting in the Trump era, ""free speech"" dustups, woke children's TV and his fear of going off the grid."
s4824,Movie,Hannah Gadsby: Nanette,"Madeleine Parry, Jon Olb",Hannah Gadsby,Australia,"June 19, 2018",2018,TV-MA,70 min,Stand-Up Comedy,"Australian comic Hannah Gadsby reshapes standard stand-up by pairing punchlines with personal revelations on gender, sexuality and childhood turmoil."
s4836,Movie,Franco Escamilla: Por la anécdota,Ulises Valencia,Franco Escamilla,Mexico,"June 8, 2018",2018,TV-MA,66 min,Stand-Up Comedy,Mexican stand-up comedian Franco Escamilla draws his jokes from real-life experiences – and he's willing to do anything for new material.
s4847,TV Show,The Break with Michelle Wolf,,,United States,"May 27, 2018",2018,TV-MA,1 Season,"Stand-Up Comedy & Talk Shows, TV Comedies",Nobody's safe as Michelle Wolf unapologetically takes aim in this weekly topical show that blends sketches with live comedy and in-studio guests.
s4850,Movie,Fernando Sanjiao: Hombre,"Raúl Campos, Jan Suter",Fernando Sanjiao,Argentina,"May 25, 2018",2018,TV-MA,63 min,Stand-Up Comedy,Argentine actor and comedian Fernando Sanjiao uses humor and impersonations to explore the concepts of masculinity and fatherhood in modern times.
s4852,Movie,Steve Martin and Martin Short: An Evening You Will Forget for the Rest of Your Life,Marcus Raboy,"Steve Martin, Martin Short",United States,"May 25, 2018",2018,TV-14,74 min,Stand-Up Comedy,"Longtime pals and showbiz icons Steve Martin and Martin Short share countless quips, catchy tunes and hilarious stories about their lives in comedy."
s4855,Movie,Tig Notaro Happy To Be Here,Tig Notaro,Tig Notaro,United States,"May 22, 2018",2018,TV-14,58 min,Stand-Up Comedy,"Comedian Tig Notaro unleashes her inner prankster in a playful stand-up special packed with funny anecdotes, parenting confessions and more."
s4859,Movie,Katt Williams: American Hustle (The Movie),Brit McAdams,"Katt Williams, Da Brat, Snoop Dogg, Tamala Jones, Jeremy Piven, Ludacris, Melanie Comarcho, Red Grant, Alphonso Mcauley, Damaine Radcliff, Taran Killam",United States,"May 17, 2018",2007,TV-MA,89 min,Stand-Up Comedy,"An aspiring actor leaves Hollywood and takes to the road to do stand-up after he's cast in a series of increasingly stereotypical ""black"" roles."
s4864,Movie,Ali Wong: Hard Knock Wife,Jay Karas,Ali Wong,United States,"May 13, 2018",2018,TV-MA,64 min,Stand-Up Comedy,"Two years after the hit ""Baby Cobra,"" Ali Wong is back with another baby bump – and a torrent of hilarious truths about marriage and motherhood."
s4866,TV Show,Bill Nye Saves the World,,"Bill Nye, Karlie Kloss, Derek Muller, Emily Calandrelli, Nazeem Hussain, Joanna Hausmann",United States,"May 11, 2018",2018,TV-14,3 Seasons,Stand-Up Comedy & Talk Shows,Emmy-winning host Bill Nye brings experts and famous guests to his lab for a talk show exploring scientific issues that touch our lives.
s4867,Movie,Carlos Ballarta: Furia Ñera,"Raúl Campos, Jan Suter",Carlos Ballarta,Mexico,"May 11, 2018",2018,TV-MA,63 min,Stand-Up Comedy,Mexican comic Carlos Ballarta mocks himself and points out the absurdities of parenthood and how he uses his wife's pregnancies to avoid commitments.
s4871,Movie,Hari Kondabolu: Warn Your Relatives,Bobcat Goldthwait,Hari Kondabolu,United States,"May 8, 2018",2018,TV-MA,67 min,Stand-Up Comedy,"Hari Kondabolu breaks down identity politics, celebrity encounters, his mango obsession and more in an unpredictable stand-up comedy special."
s4875,TV Show,A Little Help with Carol Burnett,,"Carol Burnett, Russell Peters, Mark Cuban, Taraji P. Henson, Brittany Snow, Wanda Sykes, Derek Hough, Billy Eichner, Lisa Kudrow, Candace Cameron Bure, DJ Khaled, Tony Hale, Julie Bowen",United States,"May 4, 2018",2018,TV-G,1 Season,"Stand-Up Comedy & Talk Shows, TV Comedies","Comedy icon Carol Burnett returns to TV with a panel of clever kids, who help adults and celebrity guests solve their problems with brutal honesty."
s4877,Movie,Dany Boon: Des Hauts De France,Isabelle Nanty,Dany Boon,France,"May 4, 2018",2018,TV-MA,113 min,Stand-Up Comedy,"In an eclectic one-man show, French superstar Dany Boon reflects on his homeland, his first comedy gig and the challenges of parenting hostile teens."
s4891,Movie,John Mulaney: Kid Gorgeous at Radio City,Alex Timbers,John Mulaney,United States,"May 1, 2018",2018,TV-MA,65 min,Stand-Up Comedy,"John Mulaney relays stories from his childhood and “SNL,” eviscerates the value of college and laments getting older in this electric comedy special."
s4901,TV Show,Spiritual House,,"Hiroyuki Ehara, Miki Sumiyoshi, Sato Kondo, Kazuhiro Kiyohara, Noriko Sakai, Moe Oshikiri, Homare Sawa, Mariko Hayashi",,"May 1, 2018",2017,TV-PG,1 Season,"International TV Shows, Stand-Up Comedy & Talk Shows","Psychic Hiroyuki Ehara leads various celebrities through spiritual consultations, probing into their issues and spotlighting their accomplishments."
s4916,Movie,Enissa Amani: Ehrenwort,Max Amini,Enissa Amani,Germany,"April 26, 2018",2018,TV-MA,66 min,Stand-Up Comedy,"Live from Hamburg, Iranian-German comedian Enissa Amani shares her take on German engineering, tax deductions and online fan-mail etiquette."
s4920,Movie,Kevin James: Never Don't Give Up,Andy Fickman,Kevin James,United States,"April 24, 2018",2018,TV-PG,62 min,Stand-Up Comedy,"Kevin James makes his long-awaited return to stand-up in this family-friendly special, dishing on fatherhood, fans, his disdain for allergies and more."
s4927,TV Show,The Honeymoon Stand Up Special,,"Natasha Leggero, Moshe Kasher",United States,"April 17, 2018",2018,TV-MA,1 Season,"Stand-Up Comedy & Talk Shows, TV Comedies","Impending parenthood does funny things to Natasha Leggero and Moshe Kasher, who dissect family, relationships and more in a trio of stand-up specials."
s4933,Movie,Greg Davies: You Magnificent Beast,Peter Orton,Greg Davies,United Kingdom,"April 10, 2018",2018,TV-MA,66 min,Stand-Up Comedy,"British comedian Greg Davies revisits terrifying dates, manscaping disasters, his father's pranks and more in a savagely funny stand-up special."
s4939,Movie,Seth Rogen's Hilarity for Charity,Ryan Polito,"Seth Rogen, Ike Barinholtz, Michael Che, Sacha Baron Cohen, Jeff Goldblum, Tiffany Haddish, Chris Hardwick, Nick Kroll, John Mulaney, Kumail Nanjiani, Chelsea Peretti, Craig Robinson & The Nasty Delicious, Lauren Miller Rogen, Justin Roiland, Sarah Silverman, Michelle Wolf",United States,"April 6, 2018",2018,TV-MA,70 min,Stand-Up Comedy,"Seth Rogen and friends combine stand-up, sketches and music for an outrageous comedy special that could only come from the mind of Seth."
s4941,Movie,Todo lo que sería Lucas Lauriente,"Raúl Campos, Jan Suter",Lucas Lauriente,Argentina,"April 6, 2018",2018,TV-MA,78 min,Stand-Up Comedy,"In his stand-up set, Argentine comic Lucas Lauriente animatedly rattles off reflections on different generations and begs kids to stop saying ""goals."""
s4945,Movie,Fary Is the New Black,Kader Aoun,Fary,France,"April 3, 2018",2018,TV-MA,75 min,Stand-Up Comedy,"Armed with sly wit, a fresh outlook and plenty of style, French comedy star Fary veers from dating to stereotypes and beyond in this exclusive special."
s4951,Movie,John Mulaney: New in Town,Ryan Polito,John Mulaney,United States,"April 1, 2018",2012,TV-MA,60 min,Stand-Up Comedy,"Stand-up comedian John Mulaney tackles such red-hot topics as quicksand, Motown singers and an elderly man he once met in a bathroom."
s4963,Movie,Sofía Niño de Rivera: Selección Natural,"Raúl Campos, Jan Suter",Sofía Niño de Rivera,Mexico,"March 30, 2018",2018,TV-MA,62 min,Stand-Up Comedy,"Mexico's Sofía Niño de Rivera brings her dark humor to the stage with jokes about marriage traps, sexually attractive leopards and funny funerals."
s4969,TV Show,James Acaster: Repertoire,Dan Lucchesi,James Acaster,United Kingdom,"March 27, 2018",2018,TV-14,1 Season,"British TV Shows, International TV Shows, Stand-Up Comedy & Talk Shows","Offbeat comic James Acaster covers the strange, the mundane and everything in between in this collection of four wide-ranging stand-up specials."
s4977,TV Show,The Standups,,"Nate Bargatze, Fortune Feimster, Deon Cole, Nikki Glaser, Beth Stelling, Dan Soder",United States,"March 20, 2018",2018,TV-MA,2 Seasons,"Stand-Up Comedy & Talk Shows, TV Comedies","Comedy's freshest voices take the stage in LA for six half-hour specials packed with sly jokes, hilarious anecdotes and awkward confessions."
s4982,Movie,Yoo Byung Jae: Too Much Information,Yoo Byung-jae,Yoo Byung-jae,,"March 16, 2018",2018,TV-MA,63 min,Stand-Up Comedy,"""Saturday Night Live Korea"" writer-turned-comedian Yoo Byung-jae lays bare his childhood memories and philosophy on sex in his first stand-up venture."
s4990,Movie,Ricky Gervais: Humanity,John L. Spencer,Ricky Gervais,United Kingdom,"March 13, 2018",2018,TV-MA,79 min,Stand-Up Comedy,"In his first special in seven years, Ricky Gervais slings his trademark snark at celebrity, mortality and a society that takes everything personally."
s4999,Movie,Gad Elmaleh: American Dream,Michael Simon,Gad Elmaleh,United States,"March 6, 2018",2018,TV-14,58 min,Stand-Up Comedy,"In his first English-language special, comedian Gad Elmaleh gleefully digs into America's food obsessions, dating culture, slang and more."
s5002,Movie,Malena Pichot: Estupidez compleja,"Raúl Campos, Jan Suter",Malena Pichot,Argentina,"March 2, 2018",2018,TV-MA,51 min,Stand-Up Comedy,"An Argentine comedian espouses the values of feminism, speaking on topics like sex, language, abortion and why it's OK to let a man buy you dinner."
s5003,Movie,Natalia Valdebenito: El especial,"Raúl Campos, Jan Suter",Natalia Valdebenito,Chile,"March 2, 2018",2018,TV-MA,69 min,Stand-Up Comedy,"A Chilean comedian fuses activism with irreverence for a stand-up set filled with jokes about misogyny, reproductive rights and respecting women."
s5006,Movie,Adel Karam: Live from Beirut,,Adel Karam,United States,"March 1, 2018",2018,TV-MA,59 min,Stand-Up Comedy,"From Casino du Liban, Lebanese actor and comedian Adel Karam delivers earthy punchlines on kissing norms, colonoscopies and a porn star named Rocco."
s5025,Movie,Marlon Wayans: Woke-ish,Marcus Raboy,Marlon Wayans,United States,"February 27, 2018",2018,TV-MA,67 min,Stand-Up Comedy,"Rollicking, outrageous and audacious, Marlon Wayans gets raw on racism, age-appropriate rap rhymes, gay rights, raising kids and even the Kardashians."
s5035,Movie,Agustín Aristarán: Soy Rada,Mariano Baez,Agustín Aristarán,Argentina,"February 16, 2018",2018,TV-MA,60 min,Stand-Up Comedy,"Argentine comedian Agustín ""Radagast"" Aristarán adds doses of magic, music and acting to his high-energy stand-up routine."
s5040,Movie,Chris Rock: Tamborine,Bo Burnham,Chris Rock,United States,"February 14, 2018",2018,TV-MA,65 min,Stand-Up Comedy,"Chris Rock takes the stage in Brooklyn for a comedy special filled with searing observations on fatherhood, infidelity and American politics."
s5046,Movie,Fred Armisen: Standup For Drummers,Lance Bangs,Fred Armisen,,"February 6, 2018",2018,TV-PG,65 min,"Music & Musicals, Stand-Up Comedy","For an audience of drummers, comedian Fred Armisen shares and demonstrates his thoughts on musical genres, drummer quirks, regional accents and more."
s5050,Movie,Kavin Jay: Everybody Calm Down!,Michael McKay,Kavin Jay,,"February 2, 2018",2018,TV-MA,53 min,Stand-Up Comedy,"On a mission to defy stereotypes, Malaysian stand-up comedian Kavin Jay shares stories about growing up in the VHS era with his Singapore audience."
s5057,Movie,Jerry Seinfeld: I'm Telling You for the Last Time,Marty Callner,Jerry Seinfeld,United States,"January 30, 2018",1998,TV-14,69 min,Stand-Up Comedy,"Months after his classic TV sitcom ends, the legendary comic returns to his stand-up roots to deliver his best jokes on a sold-out international tour."
s5061,Movie,Fakkah Fuzz: Almost Banned,Michael McKay,Fakkah Fuzz,Singapore,"January 26, 2018",2018,TV-MA,61 min,Stand-Up Comedy,Stand-up comic Fakkah Fuzz mines cross-cultural humor from the experience of growing up as an outspoken Malay man in Singapore.
s5062,Movie,Mau Nieto: Viviendo sobrio… desde el bar,,Mau Nieto,Mexico,"January 26, 2018",2018,TV-MA,57 min,Stand-Up Comedy,"Performing at a bar, Mexican stand-up comedian Mau Nieto dishes on his modest upbringing, his failed relationships and his attempts to stay sober."
s5063,Movie,Sebastián Marcelo Wainraich,"Raúl Campos, Jan Suter",Sebastián Marcelo Wainraich,Argentina,"January 26, 2018",2018,TV-MA,49 min,Stand-Up Comedy,"Argentine comedian Sebastián Wainraich highlights the comedy in everyday life, from minibars to reasons why funerals are better than weddings."
s5067,Movie,Ricardo Quevedo: Hay gente así,"Raúl Campos, Jan Suter",Ricardo Quevedo,Colombia,"January 24, 2018",2018,TV-MA,59 min,Stand-Up Comedy,"Droll comic Ricardo Quevedo hits Bogotá with a set that touches on embarrassing misunderstandings, sex talk, the thrill of being scared and more."
s5068,Movie,Todd Glass: Act Happy,Scott Moran,Todd Glass,United States,"January 23, 2018",2018,TV-MA,63 min,Stand-Up Comedy,Try to keep up as comedian Todd Glass delivers rapid-fire stand-up that bounces from his heart attack to his coming out to how to eat a Kit Kat.
s5072,Movie,Harith Iskander: I Told You So,Michael McKay,Harith Iskander,United States,"January 19, 2018",2018,TV-14,62 min,Stand-Up Comedy,"Malaysian stand-up comedy icon Harith Iskander takes the stage in Kuala Lumpur to talk about Singapore, a past girlfriend, Rick Astley and more."
s5077,Movie,Arango y Sanint: Ríase el show,"Raúl Campos, Jan Suter","Julián Arango, Antonio Sanint",Colombia,"January 17, 2018",2018,TV-MA,62 min,Stand-Up Comedy,"Colombian stand-up comedians Antonio Sanint and Julián Arango impersonate an Argentine visitor and a cabbie, and a pair of dirty old men at the opera."
s5079,Movie,Katt Williams: Great America,,Katt Williams,United States,"January 16, 2018",2018,TV-MA,60 min,Stand-Up Comedy,"The King of underground comedy delivers unflinching riffs on the American political climate, racial tensions, sex and his disdain for roast beef."
s5087,Movie,Tom Segura: Disgraceful,Jay Karas,Tom Segura,United States,"January 12, 2018",2018,TV-MA,71 min,Stand-Up Comedy,"Tom Segura gives voice to the sordid thoughts you'd never say out loud, with blunt musings on porn, parking lot power struggles, parenthood and more."
s5088,Movie,Alejandro Riaño: Especial de stand up,,Alejandro Riaño,Colombia,"January 10, 2018",2018,TV-MA,60 min,Stand-Up Comedy,"Colombian comedian Alejandro Riaño discusses the perks of dating a she-wolf, styles of dancing, the quirks of Bogotá men and soccer game announcers."
s5101,TV Show,Dave Chappelle: Equanimity & The Bird Revelation,Stan Lathan,Dave Chappelle,United States,"December 31, 2017",2017,TV-MA,1 Season,"Stand-Up Comedy & Talk Shows, TV Comedies","Comedy titan Dave Chappelle caps a wild year with two stand-up specials packed with scorching new material, self-reflection and tough love."
s5109,Movie,Todd Barry: Spicy Honey,Jay Chapman,Todd Barry,United States,"December 26, 2017",2017,TV-MA,61 min,Stand-Up Comedy,"With bone-dry wit, stand-up comic Todd Barry dissects texting emergencies, Hitler's taste in wine, pricey soap, cheap pizza and much more."
s5118,Movie,Russell Howard: Recalibrate,Peter Orton,Russell Howard,United Kingdom,"December 19, 2017",2017,TV-MA,69 min,Stand-Up Comedy,"Self-deprecating comic Russell Howard plows ahead through politics, porn, social media and his own shortcomings. Yet he somehow keeps it positive."
s5121,TV Show,Cheuk Wan-Chi: Two Night Stand,,Cheuk Wan Chi,,"December 15, 2017",2015,TV-MA,1 Season,"International TV Shows, Stand-Up Comedy & Talk Shows, TV Comedies",Writer and stand-up comedian Cheuk Wan-chi cracks wise at the follies of single womanhood and takes on politics in Hong Kong with nuance and flair.
